ASX Code,Date,Price sens.,Headline
FSF,18/11/2024  8:04 am,Â,FSF 2024 Annual Meeting materials  42  pages  6.0MB
NAB,18/11/2024  8:00 am,Â,NAB acknowledges ASIC proceedings  1  page  94.5KB
A2M,18/11/2024  7:31 am,Â,"Appointment of new independent NED, Lain Jager  2  pages  172.5KB"
CEN,18/11/2024  7:31 am,Â,CFO promoted to Chief Development & Major Projects Officer  1  page  84.0KB
FPR,18/11/2024  7:31 am,,FY24 Results Investor Presentation  35  pages  3.1MB
FPR,18/11/2024  7:30 am,,FY24 Results Media Release  5  pages  273.4KB
FPR,18/11/2024  7:30 am,,Appendix 4E and FY24 Financial Report  97  pages  3.6MB
