ASX Code,Date,Price sens.,Headline
AAJ,06/03/2024  8:27 AM,,Drilling Intersects High-Grade REE at Salmon Gums Project  15  pages  996.3KB
TA1,06/03/2024  8:27 AM,,Transurban prices EUR1.0b issuance in the Eurobond Market  2  pages  193.9KB
BSL,06/03/2024  8:27 AM,,Update - Notification of buy-back - BSL  6  pages  18.5KB
BDX,06/03/2024  8:25 AM,,Appointment of Strategic CEO to Lead Commercial Launch  2  pages  233.4KB
XAM,06/03/2024  8:24 AM,,Kharmagtai Oxide Material Recovery Results  35  pages  2.5MB
MTS,06/03/2024  8:23 AM,,Completion of Share Purchase Plan  2  pages  690.5KB
TCL,06/03/2024  8:20 AM,,Transurban prices EUR1.0b issuance in the Eurobond Market  1  page  66.2KB
BEX,06/03/2024  8:20 AM,,BEX Retail Entitlement Offer Opens  100  pages  6.5MB
SFZ,06/03/2024  8:20 AM,,mFund - Monthly Redemption Report - SFZ20  1  page  116.4KB
AMP,06/03/2024  8:20 AM,,Update - Notification of buy-back - AMP  6  pages  18.5KB
HLI,06/03/2024  8:20 AM,,Update - Notification of buy-back - HLI  6  pages  18.4KB
GOZ,06/03/2024  8:20 AM,,Ross Lees appointed as CEO and Managing Director of GOZ  4  pages  283.1KB
RHT,06/03/2024  8:20 AM,,Change of Share Registry Details  2  pages  259.8KB
OPT,06/03/2024  8:19 AM,,Opthea to Participate in Leerink Global Biopharma Conference  1  page  107.5KB
SFZ,06/03/2024  8:19 AM,,mFund - Monthly Redemption Report - SFZ19  1  page  116.4KB
GBE,06/03/2024  8:19 AM,,Retirement of CEO and Appointment of CEO Designate  4  pages  257.7KB
CR1,06/03/2024  8:19 AM,,SPA-AO Applications Accepted For Helium and Associated Gas  7  pages  950.4KB
DTR,06/03/2024  8:19 AM,,Notice of General Meeting/Proxy Form  31  pages  515.4KB
GTN,06/03/2024  8:19 AM,,Update - Notification of buy-back - GTN  6  pages  18.5KB
C7A,06/03/2024  8:19 AM,,Notice of Extraordinary General Meeting/Proxy Form  63  pages  2.8MB
ART,06/03/2024  8:19 AM,,Application for quotation of securities - ART  8  pages  24.3KB
SHV,06/03/2024  8:19 AM,,Ceasing to be a substantial holder  3  pages  208.3KB
TLX,06/03/2024  8:19 AM,,"Telix Notice of General Meeting, Proxy Form and Online Guide  40  pages  5.3MB"
TAL,06/03/2024  8:19 AM,,Change in substantial holding  3  pages  194.4KB
NEC,06/03/2024  8:19 AM,,Update - Notification of buy-back - NEC  6  pages  18.3KB
OFX,06/03/2024  8:19 AM,,Update - Notification of buy-back - OFX  6  pages  18.3KB
SGM,06/03/2024  8:19 AM,,Change of Director's Interest Notice  2  pages  232.0KB
TAL,06/03/2024  8:19 AM,,Change of Director's Interest Notice - GR  3  pages  188.0KB
ILU,06/03/2024  8:19 AM,,Change in substantial holding  16  pages  1.3MB
TAL,06/03/2024  8:19 AM,,Change of Director's Interest Notice - RC  3  pages  261.6KB
RIO,06/03/2024  8:18 AM,,Shareholdings of KMP/PDMR  2  pages  106.8KB
THR,06/03/2024  8:18 AM,,"Structural Controls on Copper Mineralisation, Alford East  12  pages  1.2MB"
PUR,06/03/2024  8:18 AM,,Drill Hole 1 Commences at RGS Lithium Project  4  pages  684.4KB
ZMI,06/03/2024  8:18 AM,,ZMI Acquires Lithium Exploration Project in Manitoba Canada  27  pages  5.5MB
ATH,06/03/2024  8:18 AM,,Change in substantial holding  5  pages  1.6MB
NEM,06/03/2024  8:18 AM,,8K as filed - Pricing of Notes Offering  7  pages  2.2MB
WC1,06/03/2024  8:18 AM,,High Grade Scandium at Salazar  28  pages  1.9MB
RDN,06/03/2024  8:18 AM,,Heritage survey secured for Andover South Project  5  pages  621.8KB
M2R,06/03/2024  8:18 AM,,Strong EM Conductors Identified at Mt Vernon Project  8  pages  1.6MB
LML,06/03/2024  8:18 AM,,New Graphite exploration targets increase size of KG Proj  14  pages  2.1MB
SQ2,06/03/2024  8:18 AM,,NOTICE OF PROPOSED SALE OF SECURITIES  6  pages  209.6KB
JHX,06/03/2024  8:17 AM,,Update - Notification of buy-back - JHX  6  pages  18.6KB
AMN,06/03/2024  8:17 AM,,West Arunta Exploration Update  10  pages  555.8KB
HVY,06/03/2024  8:17 AM,,Extension of Share Purchase Plan  3  pages  479.2KB
FMG,06/03/2024  8:17 AM,,Notification of cessation of securities - FMG  4  pages  14.7KB
VRX,06/03/2024  8:17 AM,,Arrowsmith North Updated BFS  19  pages  1.5MB
AMN,06/03/2024  8:17 AM,,Extension of Share Purchase Plan Closing Date  2  pages  259.1KB
GTE,06/03/2024  8:17 AM,,Resources Rising Stars Investor and Oval Video Presentation  16  pages  9.7MB
RUL,06/03/2024  8:17 AM,,Notification of cessation of securities - RUL  4  pages  14.9KB
RUL,06/03/2024  8:17 AM,,Update - Notification of buy-back - RUL  6  pages  18.6KB
AZI,06/03/2024  8:16 AM,,Gorno Project Exploration Licence Renewal & Funding  3  pages  241.3KB
SEC,06/03/2024  8:16 AM,,Net Tangible Asset Backing  1  page  131.1KB
IMD,06/03/2024  8:16 AM,,Becoming a substantial holder from MS  82  pages  5.6MB
AZS,06/03/2024  8:16 AM,,Becoming a substantial holder  2  pages  1.1MB
VUK,06/03/2024  8:16 AM,,Director / PDMR Shareholding  2  pages  101.8KB
BCI,06/03/2024  8:16 AM,,Change in substantial holding  4  pages  191.9KB
AFZ,06/03/2024  8:15 AM,,mFund - Distribution - AFZ16  1  page  91.0KB
ATM,06/03/2024  8:15 AM,,ANTAM Target to Optimize the Production and Sales in 2024  2  pages  555.5KB
SNZ,06/03/2024  7:31 AM,,Application for quotation of securities - SNZ  6  pages  19.1KB
VGL,06/03/2024  7:31 AM,,Ongoing Disclosure Notice  1  page  219.3KB
SNZ,06/03/2024  7:30 AM,,Notice of Allotment of Securities  2  pages  129.8KB
SM1,06/03/2024  7:30 AM,,Synlait HY24 results date and conference call details  1  page  279.9KB
SKT,06/03/2024  7:30 AM,,Notification of cessation of securities - SKT  4  pages  14.8KB
SKT,06/03/2024  7:30 AM,,Update - Notification of buy-back - SKT  6  pages  18.6KB
IKE,06/03/2024  7:30 AM,,IKE Secures Another Significant Multi-Year Subscription Deal  2  pages  473.8KB
AN3,06/03/2024  7:30 AM,,ANZ sells 16.5% of shareholding in AmBank  1  page  226.2KB
ANZ,06/03/2024  7:30 AM,,ANZ sells 16.5% of shareholding in AmBank  1  page  226.2KB
