ASX Code,Date,Price sens.,Headline
QIP,01/05/2024  8:10 AM,,Update On Adamantem Indicative Proposal  1  page  296.5KB
FSF,01/05/2024  7:57 AM,,Monthly Allotment / Redemption Notice  1  page  169.9KB
EDV,01/05/2024  7:51 AM,,WOW: Woolworths Group agrees to sell 5.0% of Endeavour Group  2  pages  157.5KB
WOW,01/05/2024  7:51 AM,,Woolworths Group agrees to sell 5.0% of Endeavour Group  2  pages  157.5KB
SMP,01/05/2024  7:45 AM,,Date of Release of FY24 Annual Results  1  page  56.7KB
SM1,01/05/2024  7:32 AM,,Synlait announces changes to Board of Directors  2  pages  347.6KB
SKT,01/05/2024  7:31 AM,,Notification of cessation of securities - SKT  4  pages  14.8KB
SKT,01/05/2024  7:31 AM,,Update - Notification of buy-back - SKT  6  pages  18.6KB
PEB,01/05/2024  7:31 AM,,Pacific Edge Full Year Result to be Announced 21 May 2024  2  pages  149.6KB
RBD,01/05/2024  7:31 AM,,Q1 Sales Announcement  4  pages  291.4KB
AFP,01/05/2024  7:31 AM,,AFT Licenses Maxigesic IV in Brazil  2  pages  123.4KB
