ASX Code,Date,Price sens.,Headline
VCD,06/05/2025  7:45 am,,March 2025 quarterly update  5  pages  458.4KB
VCX,06/05/2025  7:40 am,,March 2025 quarterly update  5  pages  458.4KB
NZM,06/05/2025  7:31 am,,Director nominations and proposed Board composition update  3  pages  200.0KB
SNZ,06/05/2025  7:30 am,Â,Summerset Considers Retail Bond Offer  2  pages  791.4KB
SKC,06/05/2025  7:30 am,,Updated FY25 Full Year Earnings Guidance  2  pages  353.1KB
SGH,06/05/2025  7:30 am,Â,Macquarie Conference Reference Material  9  pages  2.6MB
HCW,06/05/2025  7:30 am,,HMC: Macquarie Conference Presentation  31  pages  1.8MB
HMC,06/05/2025  7:30 am,,Macquarie Conference Presentation  31  pages  1.8MB
