ASX Code,Date,Price sens.,Headline
MCE,14/01/2025  11:27 am,,Matrix Receives new $7m Riser Buoyancy Order  2  pages  192.8KB
SXG,14/01/2025  11:27 am,,Southern Cross Gold - Court approves Scheme of Arrangement  1  page  159.6KB
AHI,14/01/2025  11:19 am,Â,2024 Annual Report Update  2  pages  163.5KB
MQG,14/01/2025  11:14 am,Â,Notification of cessation of securities - MQG  4  pages  15.0KB
REZ,14/01/2025  11:13 am,,Pause in Trading  1  page  116.6KB
MQG,14/01/2025  11:13 am,Â,Notification regarding unquoted securities - MQG  5  pages  17.0KB
MQG,14/01/2025  11:13 am,Â,Notification regarding unquoted securities - MQG  6  pages  19.3KB
SGR,14/01/2025  11:11 am,Â,Change in substantial holding  3  pages  897.4KB
IVX,14/01/2025  11:05 am,Â,Notification regarding unquoted securities - IVX  7  pages  21.3KB
NGS,14/01/2025  11:04 am,Â,Change of Local Agent  1  page  124.2KB
AVA,14/01/2025  11:04 am,Â,Change of Director's Interest Notice - Maginnis  2  pages  243.5KB
OCC,14/01/2025  11:03 am,Â,Option Terms and Conditions  3  pages  269.5KB
GLE,14/01/2025  11:02 am,Â,Change of Registered Office  1  page  105.0KB
MRQ,14/01/2025  11:00 am,,MRG HMS - Corridor Central Mining Licence Granted  5  pages  748.4KB
OCC,14/01/2025  10:59 am,Â,Proposed issue of securities - OCC  5  pages  18.5KB
QAL,14/01/2025  10:57 am,Â,Qualitas 2025 Half Year Results Briefing and Key Dates  2  pages  355.1KB
AVA,14/01/2025  10:53 am,Â,Application for quotation of securities - AVA  6  pages  18.7KB
SWT,14/01/2025  10:53 am,Â,Investment Update 31 December 2024  2  pages  141.7KB
MCG,14/01/2025  10:51 am,Â,Quarterly Fund Update - December 2024  8  pages  2.4MB
CIA,14/01/2025  10:50 am,Â,Notification of cessation of securities - CIA  7  pages  22.7KB
AMD,14/01/2025  10:49 am,,Arrow accelerates Scoping Study on DSO operation at Niagara  16  pages  1.1MB
AVA,14/01/2025  10:48 am,Â,Notification of cessation of securities - AVA  4  pages  14.7KB
MCG,14/01/2025  10:48 am,Â,Monthly Fund Update - December 2024  2  pages  86.4KB
MCC,14/01/2025  10:47 am,Â,Quarterly Fund Update - December 2024  10  pages  2.4MB
USL,14/01/2025  10:47 am,Â,Diamond drilling commences at Cerro Leon  5  pages  767.4KB
MCC,14/01/2025  10:46 am,Â,Monthly Fund Update - December 2024  2  pages  82.2KB
MAE,14/01/2025  10:46 am,Â,Quarterly Fund Update - December 2024  8  pages  1.7MB
MAE,14/01/2025  10:45 am,Â,Monthly Fund Update - December 2024  2  pages  65.5KB
FGR,14/01/2025  10:44 am,,Pause in Trading  1  page  118.1KB
MXR,14/01/2025  10:41 am,Â,Cleansing Notice  1  page  61.7KB
KCC,14/01/2025  10:40 am,,OB1: Drilling Results for Bronze Fox Copper-Gold Project  23  pages  1.1MB
OB1,14/01/2025  10:40 am,,Drilling Results for Bronze Fox Copper-Gold Project  23  pages  1.1MB
BDT,14/01/2025  10:39 am,Â,Change of Director's Interest Notice - D Miall  2  pages  275.6KB
MXR,14/01/2025  10:36 am,Â,Application for quotation of securities - MXR  7  pages  20.5KB
NEM,14/01/2025  10:33 am,Â,NEM Announces Q4 and YE 2024 Earnings Conference Call  2  pages  61.5KB
ADX,14/01/2025  10:29 am,,Operation Update-Welchau Testing Affected by Court Decision  4  pages  349.5KB
RG8,14/01/2025  10:28 am,Â,December 2024 Monthly Performance Report  2  pages  276.7KB
TNE,14/01/2025  10:28 am,Â,Notice of Annual General Meeting/Proxy Form  18  pages  2.5MB
TGF,14/01/2025  10:27 am,Â,December 2024 - NTA Statement  4  pages  800.9KB
BB1,14/01/2025  10:25 am,Â,Change of Director's Interest Notice  3  pages  712.9KB
CCO,14/01/2025  10:21 am,Â,Notice under s708A(5)(e) of the Corporations Act 2001  2  pages  249.3KB
BB1,14/01/2025  10:20 am,Â,Change of Director's Interest Notice  3  pages  1.2MB
GEM,14/01/2025  10:19 am,Â,Commencement of Chief Financial Officer  1  page  157.8KB
CCO,14/01/2025  10:18 am,Â,Application for quotation of securities - CCO  6  pages  18.2KB
CXM,14/01/2025  10:16 am,,Announcement of Entitlement Offer  6  pages  288.7KB
EM2,14/01/2025  10:14 am,,Age Dating Results Enhance Prospectivity at Silver Mountain  15  pages  1.0MB
AFL,14/01/2025  10:13 am,Â,Change in Registered Office  1  page  192.0KB
CXM,14/01/2025  10:11 am,Â,Proposed issue of securities - CXM  7  pages  26.0KB
ANO,14/01/2025  10:11 am,Â,Change of Director's Interest Notice - Lev Mizikovsky  3  pages  301.4KB
MSB,14/01/2025  10:09 am,Â,Proposed issue of securities - MSB  5  pages  17.2KB
MSB,14/01/2025  10:09 am,,MESOBLAST RAISES NEW CAPITAL FOR RYONCIL COMMERCIAL LAUNCH  2  pages  245.0KB
NVX,14/01/2025  10:07 am,Â,Notification of cessation of securities - NVX  4  pages  14.8KB
LRT,14/01/2025  10:07 am,Â,LRT NAV Estimate - 10 January 2025  1  page  137.0KB
QRI,14/01/2025  10:05 am,Â,Distribution Announcement  3  pages  359.8KB
EQR,14/01/2025  10:02 am,,Changes in Leadership Team in line with Growth Strategy  2  pages  339.7KB
VG1,14/01/2025  10:02 am,Â,December 2024 Monthly Performance Report  2  pages  242.2KB
VTI,14/01/2025  9:59 am,Â,Results of Special Meeting of Stockholders  1  page  205.1KB
AS2,14/01/2025  9:58 am,Â,Application for quotation of securities - AS2  6  pages  19.0KB
QRI,14/01/2025  9:58 am,Â,Update - Dividend/Distribution - QRI  5  pages  18.4KB
CSL,14/01/2025  9:56 am,Â,Notification of cessation of securities - CSL  4  pages  14.6KB
STN,14/01/2025  9:56 am,,Quarterly Activities and Cashflow Report  20  pages  3.8MB
PIC,14/01/2025  9:54 am,Â,PIC Monthly Investment Update - December 2024  5  pages  434.5KB
AS2,14/01/2025  9:54 am,Â,Application for quotation of securities - AS2  6  pages  18.9KB
MI6,14/01/2025  9:54 am,Â,Presentation - Acquisition of Bullabulling Gold Project  19  pages  4.5MB
PEN,14/01/2025  9:52 am,Â,Company Presentation - January 2025  18  pages  2.0MB
BVS,14/01/2025  9:52 am,Â,Change in substantial shareholding from AEF  4  pages  348.7KB
AEF,14/01/2025  9:52 am,Â,Change in substantial shareholding for BVS  4  pages  348.7KB
HPG,14/01/2025  9:51 am,Â,Notification of cessation of securities - HPG  4  pages  14.6KB
EDE,14/01/2025  9:51 am,Â,Sale of Georgia USA Property Update  1  page  771.2KB
MFG,14/01/2025  9:51 am,Â,Appointment of Interim Chief Financial Officer  1  page  154.3KB
GVF,14/01/2025  9:50 am,Â,Investment Update and NTA Value as at 31 December 2024  3  pages  264.9KB
PEN,14/01/2025  9:48 am,,Lance Project Update and Conference Call  3  pages  199.3KB
LMG,14/01/2025  9:45 am,,Response to ASX Price Query  4  pages  1.0MB
AAL,14/01/2025  9:44 am,Â,Notification of cessation of securities - AAL  4  pages  14.8KB
TNC,14/01/2025  9:41 am,Â,True North Copper Reinstated on ASX  3  pages  2.1MB
ALI,14/01/2025  9:41 am,Â,Weekly NTA estimate - Fri 10.1.25  1  page  2.1MB
NVQ,14/01/2025  9:41 am,,"NVQ Onboards GRR, Tokenises Glycol & Amines Processing  2  pages  136.4KB"
LRS,14/01/2025  9:39 am,Â,Notice of Second Court Hearing  2  pages  200.9KB
TVN,14/01/2025  9:39 am,,Ultra High-Grade Fluorite assays returned at Sandover  12  pages  1.1MB
EIQ,14/01/2025  9:39 am,Â,Commencement of Chief Executive Officer  2  pages  143.2KB
JBH,14/01/2025  9:39 am,Â,Notification regarding unquoted securities - JBH  6  pages  18.5KB
OZM,14/01/2025  9:38 am,,Drilling Commences at New Target - Mulgabbie North Gold Proj  5  pages  1.1MB
EBO,14/01/2025  9:37 am,Â,NZX Capital Change Notice  2  pages  171.5KB
G50,14/01/2025  9:36 am,,"RC DRILLING HAS COMMENCED AT WHITE CAPS, NEVADA  5  pages  347.5KB"
GHM,14/01/2025  9:35 am,Â,Notification of Cessation of Securities  4  pages  384.5KB
NWF,14/01/2025  9:34 am,Â,Extension of Unsecured Bond  1  page  103.0KB
SGR,14/01/2025  9:33 am,Â,Notification of change in substantial holding - JPMorgan  1  page  128.4KB
REP,14/01/2025  9:31 am,Â,Update - Notification of buy-back - REP  6  pages  18.3KB
MI6,14/01/2025  9:31 am,Â,Bullabulling Acquisition - Investor Call and Webcast  1  page  164.3KB
COB,14/01/2025  9:30 am,Â,Promissory Note Amendment and Cleansing Notice  1  page  160.7KB
MI6,14/01/2025  9:30 am,,Acquisition of Bullabulling Gold Project  33  pages  2.1MB
IG6,14/01/2025  9:30 am,,Trading Halt  2  pages  542.9KB
NTD,14/01/2025  9:29 am,Â,Appointment and Resignation of Company Secretary  1  page  129.5KB
EBO,14/01/2025  9:27 am,Â,Application for quotation of securities - EBO  7  pages  20.1KB
WMA,14/01/2025  9:27 am,Â,December 2024 Investment Update  4  pages  679.6KB
LNU,14/01/2025  9:25 am,,Linius Appoints New Chief Executive Officer  4  pages  242.9KB
COB,14/01/2025  9:24 am,Â,Application for quotation of securities - COB  6  pages  19.2KB
MEC,14/01/2025  9:24 am,Â,Update - Notification of buy-back - MEC  6  pages  18.4KB
EVG,14/01/2025  9:24 am,Â,Update - Proposed issue of securities - EVG  9  pages  28.1KB
SRT,14/01/2025  9:23 am,Â,Net Tangible Asset Backing  2  pages  833.6KB
NEC,14/01/2025  9:20 am,Â,Initial Director's Interest Notice - Peter Tonagh  2  pages  248.5KB
OSX,14/01/2025  9:20 am,Â,Osteopore added to Singapore Ministry of Health subsidy list  4  pages  394.6KB
HFR,14/01/2025  9:19 am,,Yankuang Energy Receives FIRB Approval  3  pages  362.2KB
NOR,14/01/2025  9:19 am,Â,Notification regarding unquoted securities - NOR  5  pages  16.9KB
GBR,14/01/2025  9:19 am,Â,New targets confirmed with AC drilling at Whiteheads  12  pages  1.4MB
NPM,14/01/2025  9:18 am,Â,Lakes Blue PEP 169 Sale Second and Final Payment Received  1  page  112.0KB
HUM,14/01/2025  9:17 am,Â,Change of Company Secretary  1  page  100.0KB
AMC,14/01/2025  9:17 am,,Form 425  7  pages  591.6KB
WQG,14/01/2025  9:17 am,Â,Weekly NTA 10 January 2025  1  page  215.9KB
HAS,14/01/2025  9:16 am,Â,Application for quotation of securities - HAS  6  pages  18.3KB
CDD,14/01/2025  9:16 am,,Update on voluntary delisting from the ASX  1  page  150.3KB
RHY,14/01/2025  9:16 am,,About the Genetype Acquisition  11  pages  926.5KB
WLD,14/01/2025  9:15 am,,Sale of Ocean Drover for USD50M  3  pages  158.5KB
PE1,14/01/2025  9:13 am,Â,Update - Notification of buy-back - PE1  6  pages  18.2KB
AGE,14/01/2025  9:13 am,,Retention Lease Approved - Samphire Field Recovery Trial  6  pages  771.9KB
BRG,14/01/2025  9:12 am,Â,Notice of FY25 First Half Result and Conference Call  1  page  243.1KB
PGF,14/01/2025  9:10 am,Â,Monthly Report - 31 December 2024  2  pages  426.5KB
CND,14/01/2025  9:09 am,,Trading Halt  2  pages  561.2KB
NC6,14/01/2025  9:08 am,Â,Update - Proposed issue of securities - NC6  14  pages  45.0KB
A4N,14/01/2025  9:08 am,,Significant Acceleration in Semiconductor Sector Demand  4  pages  670.9KB
NVU,14/01/2025  9:07 am,Â,Notification of cessation of securities - NVU  4  pages  14.9KB
CTW,14/01/2025  9:06 am,Â,CitiFirst MINIs Cash Amounts for Stop Loss Event 13 Jan 25  1  page  85.6KB
IPL,14/01/2025  9:04 am,Â,Update - Notification of buy-back - IPL  6  pages  18.4KB
NAN,14/01/2025  9:03 am,Â,Appointment of Non-Executive Director and Appendix 3X  3  pages  311.5KB
VIT,14/01/2025  9:00 am,,Update regarding TGA proceedings  3  pages  262.6KB
KBC,14/01/2025  9:00 am,Â,Replacement Notice of General Meeting/Proxy Form  9  pages  1.0MB
CTW,14/01/2025  8:59 am,Â,CitiFirst MINIs Stop Loss Event trigger 13 Jan 25 Update  1  page  89.2KB
CXZ,14/01/2025  8:58 am,Â,Update - Notification of buy-back - CXZ  6  pages  18.6KB
BXN,14/01/2025  8:57 am,,Addendum to Presentation dated 18 November 2024  2  pages  201.7KB
MSV,14/01/2025  8:56 am,Â,Update - Notification of buy-back - MSV  6  pages  18.2KB
NVA,14/01/2025  8:56 am,Â,January 2025 Corporate Update Presentation  37  pages  8.2MB
NHC,14/01/2025  8:54 am,Â,New Acland Stage 3 Update  1  page  355.2KB
CTE,14/01/2025  8:53 am,Â,Cryosite Launches Investor Hub  2  pages  238.5KB
AT1,14/01/2025  8:52 am,,Atomo Secures Long Term Agreement with Newfoundland  2  pages  192.6KB
LNW,14/01/2025  8:49 am,Â,"Fourth Quarter & Full Year 2024 Results on February 25, 2025  2  pages  328.7KB"
DTM,14/01/2025  8:48 am,Â,Drilling Recommences at Triumph Project  7  pages  1.3MB
AMC,14/01/2025  8:45 am,,Form S-4  342  pages  4.5MB
CAR,14/01/2025  8:43 am,,Exit of Tyres business and Group outlook reiteration  2  pages  115.7KB
CSC,14/01/2025  8:42 am,Â,Capstone Copper Announces Appointment of Rick Coleman  1  page  171.8KB
ILT,14/01/2025  8:41 am,,Drilling continues to return wide high-grade intersections  30  pages  3.3MB
EBO,14/01/2025  8:40 am,Â,Advance Notice - Interim Results  1  page  154.4KB
LIN,14/01/2025  8:39 am,Â,Corporate and Project Update  5  pages  457.2KB
TTT,14/01/2025  8:35 am,Â,Titomic establishes U.S. Senior Advisory Group  2  pages  198.1KB
LSF,14/01/2025  8:32 am,Â,Net Tangible Asset Backing  1  page  104.0KB
PPE,14/01/2025  8:32 am,Â,Notification of cessation of securities - PPE  4  pages  14.7KB
ANZ,14/01/2025  8:30 am,Â,Update - Notification of buy-back - ANZ  6  pages  18.4KB
WBC,14/01/2025  8:29 am,Â,Update - Notification of buy-back - WBC  6  pages  18.3KB
URF,14/01/2025  8:28 am,Â,Update - Notification of buy-back - URF  6  pages  18.5KB
RG8,14/01/2025  8:28 am,Â,Update - Notification of buy-back - RG8  6  pages  18.4KB
CCG,14/01/2025  8:28 am,Â,Change of Director's Interest Notice ROH JM CB  9  pages  344.3KB
NVA,14/01/2025  8:26 am,Â,Stibium Gold-Antimony Drill Targets Identified - Amended  20  pages  1.6MB
FRG,14/01/2025  8:25 am,Â,Quarterly Correlation Report - December 2024  1  page  129.1KB
VG1,14/01/2025  8:24 am,Â,Update - Notification of buy-back - VG1  6  pages  18.4KB
ALA,14/01/2025  8:24 am,Â,Notice Under Section 708A  2  pages  184.8KB
GEM,14/01/2025  8:23 am,Â,Update - Notification of buy-back - GEM  6  pages  18.2KB
NMR,14/01/2025  8:22 am,Â,NMR ramps up refurbishment at Blackjack Processing Facility  5  pages  970.1KB
CCX,14/01/2025  8:22 am,,H1 Trading Update  3  pages  214.1KB
NSX,14/01/2025  8:22 am,,Funding update  1  page  177.0KB
NAB,14/01/2025  8:22 am,Â,Notification of cessation of securities - NAB  4  pages  14.7KB
RWC,14/01/2025  8:22 am,Â,FY2025 Half Year Results Announcement Date and Webcast  1  page  617.3KB
NRM,14/01/2025  8:22 am,Â,NRMBS Trust 2016-1 (NRM) - (December) Investor Report  11  pages  125.4KB
NAB,14/01/2025  8:22 am,Â,Update - Notification of buy-back - NAB  6  pages  18.4KB
CEL,14/01/2025  8:22 am,Â,Change in substantial holding  6  pages  931.9KB
RMC,14/01/2025  8:22 am,Â,Update - Notification of buy-back - RMC  6  pages  18.2KB
MEU,14/01/2025  8:22 am,,Outstanding Heavy Mineral concentrations at Muckanippie  19  pages  2.0MB
WEB,14/01/2025  8:22 am,Â,Update - Notification of buy-back - WEB  6  pages  18.4KB
AWJ,14/01/2025  8:22 am,,"Jeffreys Find Stage Two Sales Exceed 14,800 Ounces  4  pages  401.7KB"
ALI,14/01/2025  8:22 am,Â,Monthly NTA & Investment Update - 31 December 2024  2  pages  1.1MB
EVG,14/01/2025  8:22 am,Â,Extension to Rights Issue Closing Date  2  pages  161.7KB
NEC,14/01/2025  8:21 am,Â,Appointment of Director  1  page  186.8KB
BMM,14/01/2025  8:21 am,Â,Future Minerals Forum Conference Presentation  19  pages  3.8MB
SUM,14/01/2025  8:21 am,Â,Summit Investor Webinar Presentation Deck  15  pages  2.9MB
CC5,14/01/2025  8:21 am,Â,Notification of cessation of securities - CC5  4  pages  15.0KB
SS1,14/01/2025  8:21 am,,Exceptional extensional intercept of 102m at 111g/t AgEq  22  pages  1.9MB
TFL,14/01/2025  8:21 am,,Quarterly Activities/Appendix 4C Cash Flow Report  9  pages  391.9KB
I88,14/01/2025  8:21 am,Â,Change in substantial holding  2  pages  262.6KB
ION,14/01/2025  8:21 am,Â,Notice of General Meeting/Proxy Form  27  pages  814.5KB
ATM,14/01/2025  8:21 am,Â,ANTAM Officially Enter JIIPE  1  page  244.7KB
ALA,14/01/2025  8:21 am,Â,Application for quotation of securities - ALA  6  pages  18.3KB
ARD,14/01/2025  8:21 am,,Further Gold Mineralisation Located at Trunkey Creek Project  15  pages  2.8MB
DUI,14/01/2025  8:21 am,Â,Weekly NTA - 10 January 2025  1  page  51.6KB
ORD,14/01/2025  8:21 am,,High-Grade Gold in First Diamond Drill Program at Barimaia  19  pages  2.2MB
AUI,14/01/2025  8:21 am,Â,Weekly NTA - 10 January 2025  1  page  51.6KB
NVA,14/01/2025  8:21 am,Â,Application for quotation of securities - NVA  6  pages  19.9KB
FPR,14/01/2025  8:20 am,Â,Update - Notification of buy-back - FPR  6  pages  18.3KB
NVA,14/01/2025  8:20 am,Â,Cleansing Statement  2  pages  117.3KB
MML,14/01/2025  8:20 am,Â,Change in substantial holding  3  pages  188.7KB
GQG,14/01/2025  8:20 am,Â,Notification of cessation of securities - GQG  4  pages  14.9KB
GQG,14/01/2025  8:20 am,Â,Notification regarding unquoted securities - GQG  6  pages  18.9KB
GQG,14/01/2025  8:20 am,Â,Application for quotation of securities - GQG  7  pages  21.6KB
CYL,14/01/2025  8:20 am,,Trident Gold Project update  6  pages  564.0KB
BRX,14/01/2025  8:19 am,Â,Notification regarding unquoted securities - BRX  6  pages  19.0KB
IMD,14/01/2025  8:19 am,Â,Notification of cessation of securities - IMD  4  pages  14.6KB
FWD,14/01/2025  8:19 am,Â,Update - Notification of buy-back - FWD  6  pages  18.4KB
MAU,14/01/2025  8:19 am,,Quarterly Activities/Appendix 5B Cash Flow Report  29  pages  5.4MB
MAU,14/01/2025  8:19 am,,Quarterly Activities/Appendix 5B Cash Flow Report  5  pages  281.3KB
KGD,14/01/2025  8:18 am,Â,Dispatch of Entitlement Offer Documents  4  pages  616.5KB
BCM,14/01/2025  8:18 am,,Updated Mineral Resource Estimate for Ema  34  pages  2.7MB
BSN,14/01/2025  8:18 am,,Scandinavian Exploration and Uranium Policy Update  5  pages  2.5MB
PVT,14/01/2025  8:18 am,Â,Investor Presentation - January 2025  28  pages  3.5MB
VHM,14/01/2025  8:18 am,Â,R&D Tax Refund of $1.591 Million Received  1  page  199.7KB
JNO,14/01/2025  8:18 am,Â,Investor Presentation  26  pages  6.9MB
A8G,14/01/2025  8:18 am,Â,"$118,000 R&D Tax Refund Received  1  page  225.7KB"
EMC,14/01/2025  8:16 am,,Research & Development Cash Refund  3  pages  220.4KB
WC1,14/01/2025  8:15 am,Â,Details of Auditor Appointment/Resignation  1  page  105.5KB
NC6,14/01/2025  8:15 am,,Entitlement Issue Prospectus  40  pages  567.2KB
MGX,14/01/2025  8:15 am,Â,Update - Notification of buy-back - MGX  6  pages  18.1KB
OPT,14/01/2025  8:15 am,,Opthea's Corporate Presentation - Jan 2025  33  pages  2.1MB
LEG,14/01/2025  8:14 am,,R&D Cash Refund of $1.77M Received  1  page  154.5KB
AIA,14/01/2025  7:30 am,Â,AIA - Key investor dates for 2025  1  page  121.7KB
