ASX Code,Date,Price sens.,Headline
VG1,11/09/2023  9:11 AM,,Weekly NTA Update  1  page  88.7KB
AUE,11/09/2023  9:11 AM,,Drilling to Commence at Ryans Find  19  pages  925.7KB
LTR,11/09/2023  9:11 AM,,Albemarle indicative proposal - due diligence to commence  2  pages  196.7KB
TIE,11/09/2023  9:11 AM,,Retraction of ASX Release  1  page  169.3KB
RYD,11/09/2023  9:10 AM,,August - Net Tangible Asset Backing  1  page  323.4KB
CNI,11/09/2023  9:10 AM,,$500m New Institutional Industrial Mandate  2  pages  150.5KB
TOU,11/09/2023  9:10 AM,,Lesedi 4 and 6 drilling successfully completed  2  pages  284.5KB
STM,11/09/2023  9:09 AM,,El Palmar 2nd hole confirms T3 strongly mineralised porphyry  17  pages  4.8MB
EBR,11/09/2023  9:09 AM,,EBR Appoints Gary Doherty as CFO  2  pages  236.1KB
LKY,11/09/2023  9:08 AM,,Ceasing to be a substantial holder  2  pages  226.3KB
ASO,11/09/2023  9:08 AM,,Edleston Nickel Project Scoping Study Met Testwork Commences  2  pages  150.6KB
MGF,11/09/2023  9:08 AM,,Daily share buy-back notice  2  pages  379.6KB
WGX,11/09/2023  9:07 AM,,2023 Precious Metals Summit Presentation  30  pages  8.6MB
RYD,11/09/2023  9:06 AM,,Update - Notification of buy-back - RYD  6  pages  27.7KB
JPM,11/09/2023  9:06 AM,,mFund - Monthly Redemption Report - JPM01 - JPM10  1  page  366.5KB
OCN,11/09/2023  9:05 AM,,Proposed issue of securities - OCN  7  pages  32.9KB
JPM,11/09/2023  9:05 AM,,mFund - Net Asset Value - JPM01 - JPM10  1  page  363.9KB
AEF,11/09/2023  9:04 AM,,Change in Substantial Shareholding for SOM  4  pages  153.8KB
SOM,11/09/2023  9:04 AM,,Change in Substantial Shareholding from AEF  4  pages  153.8KB
SES,11/09/2023  9:03 AM,,Notification regarding unquoted securities - SES  7  pages  30.4KB
GMD,11/09/2023  9:03 AM,,North American Presentation - Introducing Genesis  20  pages  2.7MB
TOE,11/09/2023  9:02 AM,,Proposed issue of securities - TOE  7  pages  33.6KB
TOE,11/09/2023  9:02 AM,,Successful A$4.5 Million Placement  3  pages  282.1KB
RF1,11/09/2023  9:02 AM,,Update - Notification of buy-back - RF1  6  pages  27.8KB
CHZ,11/09/2023  9:02 AM,,Change of Director's Interest Notices x 5  20  pages  1.4MB
JPM,11/09/2023  9:02 AM,,mFund - Units on Issue - JPM01 - JPM10  1  page  430.3KB
TBN,11/09/2023  9:02 AM,,Beetaloo Basin Site Tour Presentation  34  pages  6.7MB
VG1,11/09/2023  9:01 AM,,Update - Notification of buy-back - VG1  6  pages  27.8KB
OCN,11/09/2023  9:01 AM,,Appointment of Chief Executive Officer  3  pages  300.3KB
NTI,11/09/2023  9:00 AM,,Upcoming Clinician Briefing  3  pages  172.2KB
ERD,11/09/2023  9:00 AM,,EROAD completes Placement and Institutional Offer  2  pages  114.4KB
RG8,11/09/2023  9:00 AM,,Update - Notification of buy-back - RG8  6  pages  27.8KB
AWJ,11/09/2023  8:58 AM,,Second Gold Milling Campaign Commenced  2  pages  343.5KB
RF1,11/09/2023  8:58 AM,,Weekly Estimate NTA for 08.09.2023  1  page  122.1KB
M2M,11/09/2023  8:58 AM,,Lithium Exploration Targets Defined at Mt Feldtmann  8  pages  7.6MB
SKY,11/09/2023  8:58 AM,,Date of 2023 AGM & Closing Date for Director Nominations  1  page  554.6KB
PGF,11/09/2023  8:57 AM,,Net Tangible Asset Backing - 8 September 2023  1  page  171.3KB
EQE,11/09/2023  8:55 AM,,Cancel - Proposed issue of securities - EQE  5  pages  27.8KB
EQE,11/09/2023  8:54 AM,,Close of the Prospectus Offer  1  page  384.9KB
SGQ,11/09/2023  8:53 AM,,Exploration Commences at Woolgangie  9  pages  1.8MB
SYR,11/09/2023  8:51 AM,,Interim Financial Statements - Half-year ended 30 June 2023  28  pages  1.4MB
KGN,11/09/2023  8:51 AM,,Update - Notification of buy-back - KGN  6  pages  28.2KB
RNE,11/09/2023  8:49 AM,,ReNu Energy welcomes Tasmanian green hydrogen policy  2  pages  287.6KB
CHZ,11/09/2023  8:49 AM,,Cleansing notice  1  page  253.5KB
ALU,11/09/2023  8:49 AM,,Notification of cessation of securities - ALU  4  pages  23.7KB
BYE,11/09/2023  8:49 AM,,SM58 G6 Well Update  2  pages  259.0KB
CYG,11/09/2023  8:48 AM,,Change of Alt Directors Interest Notice - Edmon Odza  3  pages  306.2KB
RVS,11/09/2023  8:48 AM,,Revasum Secures Further Funding  2  pages  121.5KB
FBM,11/09/2023  8:48 AM,,Managing Director and CEO Appointment  2  pages  183.9KB
RCW,11/09/2023  8:47 AM,,Annual General Meeting Date and Director Nominations  1  page  101.9KB
BLG,11/09/2023  8:47 AM,,BluGlass appoints new full-time CFO to support growth  2  pages  191.9KB
CPO,11/09/2023  8:45 AM,,High priority El Quillay North target defined  18  pages  3.8MB
CHZ,11/09/2023  8:44 AM,,Becoming a substantial holder  2  pages  267.6KB
PPS,11/09/2023  8:44 AM,,Update - Notification of buy-back - PPS  6  pages  27.9KB
CYG,11/09/2023  8:43 AM,,Change of Directors Interest Notice - Alex White  2  pages  303.0KB
NWM,11/09/2023  8:42 AM,,Change of Director's Interest Notice x 5  19  pages  42.6KB
LSF,11/09/2023  8:42 AM,,Net Tangible Asset Backing  1  page  219.4KB
CHZ,11/09/2023  8:40 AM,,Application for quotation of securities - CHZ  15  pages  54.6KB
OCT,11/09/2023  8:40 AM,,Proposed issue of securities - OCT  5  pages  27.4KB
CKF,11/09/2023  8:40 AM,,Initial Director Interest Notice - Clark  3  pages  259.0KB
NWM,11/09/2023  8:39 AM,,Notification of cessation of securities - NWM  5  pages  26.9KB
OCT,11/09/2023  8:37 AM,,Octava Secures 100% of Talga Lithium Project in the Pilbara  4  pages  657.3KB
IMU,11/09/2023  8:37 AM,,Imugene Receives Positive Feedback From FDA  3  pages  184.8KB
NAB,11/09/2023  8:34 AM,,Notification of cessation of securities - NAB  4  pages  23.9KB
A1M,11/09/2023  8:33 AM,,Change of Director's Interest Notice  3  pages  207.3KB
OPH,11/09/2023  8:32 AM,,Weekly NTA 08.09.2023  1  page  176.8KB
RDG,11/09/2023  8:32 AM,,80.8Mt Mineral Resource Increase for Lucky Bay Garnet Mine  92  pages  4.3MB
GTG,11/09/2023  8:31 AM,,geneType Granted Approval for 3 New Diseases in Australia  2  pages  142.0KB
3PL,11/09/2023  8:28 AM,,Update - Notification of buy-back - 3PL  6  pages  28.1KB
PVL,11/09/2023  8:27 AM,,Change of Director's Interest Notice  2  pages  303.7KB
G50,11/09/2023  8:25 AM,,Notice of Annual General Meeting/Proxy Form  35  pages  1.0MB
PNN,11/09/2023  8:25 AM,,Summit Nanotech Completes Incahuasi Salar JV Due Diligence  3  pages  551.5KB
CRR,11/09/2023  8:25 AM,,Multiple thick lithium intercepts continue at Mavis Lake  13  pages  758.9KB
NAB,11/09/2023  8:23 AM,,Update - Notification of buy-back - NAB  6  pages  27.7KB
GMD,11/09/2023  8:23 AM,,High grade drill results at Gwalia  6  pages  1.3MB
1AI,11/09/2023  8:23 AM,,MOU with UNSW to develop AI Platform  2  pages  193.1KB
RUL,11/09/2023  8:23 AM,,Notification of cessation of securities - RUL  4  pages  23.9KB
IEC,11/09/2023  8:23 AM,,Lithium Exploration Commences at Yalgarra Project  10  pages  1.6MB
EGG,11/09/2023  8:23 AM,,Update - Notification of buy-back - EGG  6  pages  28.0KB
DTL,11/09/2023  8:23 AM,,DTL Chair Appointment/Resignation  2  pages  176.4KB
RUL,11/09/2023  8:23 AM,,Update - Notification of buy-back - RUL  6  pages  28.1KB
BKI,11/09/2023  8:23 AM,,Cleansing Notice  1  page  101.9KB
TOP,11/09/2023  8:23 AM,,Update - Notification of buy-back - TOP  6  pages  28.0KB
MYG,11/09/2023  8:22 AM,,Mayfield secures significant new orders  1  page  168.4KB
QML,11/09/2023  8:22 AM,,Drilling to Commence at the VT04 Anomaly  8  pages  2.2MB
TPW,11/09/2023  8:22 AM,,Update - Notification of buy-back - TPW  6  pages  27.6KB
TEK,11/09/2023  8:22 AM,,Update - Notification of buy-back - TEK  6  pages  28.0KB
NGY,11/09/2023  8:22 AM,,Approval for additional exploration period for Muralim PSC  2  pages  181.0KB
ANN,11/09/2023  8:22 AM,,Change of Director's Interest Notice - D Goodin  2  pages  604.8KB
CAA,11/09/2023  8:22 AM,,Daily share buy-back notice - Appendix 3E  2  pages  230.4KB
QHL,11/09/2023  8:22 AM,,Company Secretary Appointment/Resignation  1  page  166.1KB
CPU,11/09/2023  8:22 AM,,Update - Dividend/Distribution - CPU  5  pages  29.0KB
NEC,11/09/2023  8:21 AM,,Update - Notification of buy-back - NEC  6  pages  27.8KB
AAJ,11/09/2023  8:21 AM,,Next Phase of Drilling Commences at Salmon Gums Gold Project  5  pages  472.3KB
WGX,11/09/2023  8:21 AM,,2023 Resource and Reserves Statement  29  pages  3.7MB
ANN,11/09/2023  8:21 AM,,Update - Notification of buy-back - ANN  6  pages  27.9KB
WC8,11/09/2023  8:21 AM,,Initial Director's Interest Notice  2  pages  257.9KB
HLI,11/09/2023  8:21 AM,,Update - Notification of buy-back - HLI  6  pages  27.8KB
ASP,11/09/2023  8:21 AM,,Aspermont launches SCOUT  1  page  603.5KB
OLY,11/09/2023  8:21 AM,,Aeromagnetic Survey Commenced at Walloway  7  pages  1.2MB
IXR,11/09/2023  8:21 AM,,Ministerial Support for Makuutu Mining Licence Application  3  pages  153.9KB
KFM,11/09/2023  8:20 AM,,Multiple Lithium-Bearing Pegmatites Mapped at Chalby Chalby  12  pages  1.7MB
DYL,11/09/2023  8:20 AM,,Tumas Resource Expansion and Infill Drill Program Completed  17  pages  1.2MB
FPC,11/09/2023  8:20 AM,,Notice of Annual General Meeting/Proxy Form  7  pages  1.4MB
GBE,11/09/2023  8:20 AM,,Appendix 3Y - Bo Tan  2  pages  229.6KB
GBE,11/09/2023  8:20 AM,,Appendix 3Y - Alice Wong  2  pages  229.1KB
DC2,11/09/2023  8:20 AM,,Proposed change of Company name  2  pages  221.2KB
LVH,11/09/2023  8:20 AM,,Issue of Shares on Conversion of Rights  12  pages  1.6MB
FPC,11/09/2023  8:19 AM,,Update - Notification of buy-back - FPC  6  pages  27.8KB
SWM,11/09/2023  8:19 AM,,Update - Notification of buy-back - SWM  6  pages  27.8KB
CAV,11/09/2023  8:19 AM,,RC drilling completed at high-grade Kookynie Gold Project  5  pages  949.1KB
WSR,11/09/2023  8:19 AM,,Former Northern Star Resources Exploration Manager Appointed  2  pages  390.2KB
CGS,11/09/2023  8:19 AM,,Update - Notification of buy-back - CGS  6  pages  27.8KB
LM8,11/09/2023  8:18 AM,,Silver Lake Hanging Wall Update  25  pages  2.0MB
RON,11/09/2023  8:18 AM,,Field activities Commence - Hornby Lake Lithium Project  4  pages  1.1MB
NXL,11/09/2023  8:18 AM,,Appendix 4G and Corporate Governance Statement  29  pages  927.8KB
NXL,11/09/2023  8:18 AM,,Annual Report to Shareholders  128  pages  7.7MB
TGH,11/09/2023  8:18 AM,,Becoming a substantial holder from TEK  5  pages  224.9KB
TEK,11/09/2023  8:18 AM,,Becoming a substantial holder for TGH  5  pages  224.9KB
SXE,11/09/2023  8:18 AM,,Investor Presentation - Investor Roadshow  25  pages  2.3MB
DY6,11/09/2023  8:18 AM,,Identifies Potential For Widespread REE Mineralisation  19  pages  2.4MB
CAI,11/09/2023  8:18 AM,,Blue Spec project fully permitted to commence mining  2  pages  200.3KB
PMT,11/09/2023  8:18 AM,,Patriot Files NI43-101 Technical Report on the CV5 MRE  3  pages  333.0KB
MYX,11/09/2023  8:18 AM,,Update - Notification of buy-back - MYX  6  pages  27.7KB
EDE,11/09/2023  8:17 AM,,Eden Upgrades Sales Forecast Pushes for Positive Cashflow  4  pages  309.5KB
EDE,11/09/2023  8:17 AM,,Annual Report with Appendix 4G and Corp Gov Stmt  76  pages  11.2MB
TOP,11/09/2023  8:17 AM,,Net Tangible Asset Backing August 2023 with commentary  4  pages  254.2KB
PPC,11/09/2023  8:17 AM,,Daily share buy-back notice  2  pages  123.8KB
NWS,11/09/2023  8:17 AM,,Appendix 3C  4  pages  75.7KB
NWS,11/09/2023  8:17 AM,,Appendix 3C  4  pages  75.7KB
NWS,11/09/2023  8:16 AM,,Notification of cessation of securities - NWS  4  pages  23.7KB
NWS,11/09/2023  8:16 AM,,Notification of cessation of securities - NWS  4  pages  23.7KB
LBT,11/09/2023  8:16 AM,,Application for quotation of securities - LBT  6  pages  27.8KB
CHN,11/09/2023  8:16 AM,,Change in substantial holding  19  pages  1.3MB
CSS,11/09/2023  8:16 AM,,Notification regarding unquoted securities - CSS  6  pages  28.8KB
TLC,11/09/2023  8:16 AM,,TAH: Tax treatment resolved for various licences  1  page  53.7KB
TAH,11/09/2023  8:16 AM,,Tax treatment resolved for various licences  1  page  53.7KB
KZA,11/09/2023  8:16 AM,,Change in substantial holding  5  pages  1.6MB
IEL,11/09/2023  8:16 AM,,Change in substantial holding  4  pages  152.4KB
BKI,11/09/2023  8:16 AM,,Proposed issue of securities - BKI  5  pages  27.2KB
ZER,11/09/2023  8:15 AM,,Daily share buy-back notice - Appendix 3E  2  pages  323.5KB
PV1,11/09/2023  8:15 AM,,London Roadshow September 2023  28  pages  7.6MB
NXM,11/09/2023  8:15 AM,,Corporate Presentation - New World Metals Investment Series  24  pages  4.5MB
SCD,11/09/2023  8:15 AM,,Director Appointment/Resignation  4  pages  122.4KB
SGM,11/09/2023  8:15 AM,,Update on Market Conditions  2  pages  122.0KB
AAC,11/09/2023  8:15 AM,,Change in substantial holding  6  pages  310.8KB
STW,11/09/2023  8:14 AM,,Daily Fund Update  9  pages  180.6KB
LDX,11/09/2023  8:14 AM,,Ceasing to be a substantial holder  2  pages  353.8KB
SLF,11/09/2023  8:14 AM,,Daily Fund Update  4  pages  77.6KB
BSL,11/09/2023  8:14 AM,,Update - Notification of buy-back - BSL  6  pages  27.9KB
SFY,11/09/2023  8:14 AM,,Daily Fund Update  4  pages  79.4KB
HM1,11/09/2023  8:14 AM,,Weekly NTA Estimate  1  page  99.4KB
IPD,11/09/2023  8:14 AM,,Shareholder Conference Call  2  pages  318.5KB
KOB,11/09/2023  8:14 AM,,Lithium-Bearing Pegmatites Discovered at Whitlock Project  10  pages  1.7MB
DVP,11/09/2023  8:13 AM,,ANX: Whim Creek Heap Leach Scoping Study  156  pages  8.6MB
ANX,11/09/2023  8:13 AM,,Whim Creek Heap Leach Scoping Study  156  pages  8.6MB
CVN,11/09/2023  8:13 AM,,Minimum Holding Buy-Back  8  pages  657.7KB
CY5,11/09/2023  8:13 AM,,Change in substantial holding  2  pages  272.0KB
ATM,11/09/2023  8:13 AM,,ANTAM Receives Alpha Southeast Asia Award 2023  1  page  55.8KB
PEB,11/09/2023  8:05 AM,,Pacific Edge Releases Submissions on Medicare LCD  61  pages  9.8MB
ATA,11/09/2023  8:01 AM,,CNW: Cirrus enters binding scheme with Atturra  139  pages  2.1MB
CNW,11/09/2023  8:01 AM,,Cirrus enters binding scheme with Atturra  139  pages  2.1MB
CNW,11/09/2023  7:59 AM,,ATA: Acquisition of Cirrus Networks Holdings - Presentation  16  pages  2.6MB
ATA,11/09/2023  7:59 AM,,Acquisition of Cirrus Networks Holdings - Presentation  16  pages  2.6MB
CNW,11/09/2023  7:45 AM,,ATA:Atturra to acquire Cirrus Networks via Scheme of Arrange  139  pages  2.1MB
ATA,11/09/2023  7:45 AM,,Atturra to acquire Cirrus Networks via Scheme of Arrangement  139  pages  2.1MB
