ASX Code,Date,Price sens.,Headline
IKE,22/12/2023  7:31 AM,,IKE Secures NZ$3.7M Five-Year Deal from Major U.S. Utility  2  pages  113.1KB
HMY,22/12/2023  7:31 AM,,Notification of cessation of securities - HMY  4  pages  256.5KB
AFP,22/12/2023  7:31 AM,,AFT broadens R&D pipeline with new product candidate  2  pages  122.1KB
A2M,22/12/2023  7:30 AM,,Response to Synlait market update announcement  2  pages  218.5KB
SM1,22/12/2023  7:30 AM,,A2M: Response to Synlait market update announcement  2  pages  218.5KB
SM1,22/12/2023  7:30 AM,,Market Update  2  pages  217.3KB
MOV,22/12/2023  7:30 AM,,MOVE 1H24 Trading Update  2  pages  140.7KB
WTN,22/12/2023  7:30 AM,,Notice of Extraordinary General Meeting/Proxy Form  37  pages  2.1MB
