ASX Code,Date,Price sens.,Headline
ZEU,09/09/2025  8:23 am,,Casablanca Geophysics Highlights Antimony Targets at Depth  12  pages  803.9KB
GMD,09/09/2025  8:23 am,,Approval received for Stage One at Tower Hill  3  pages  425.2KB
I88,09/09/2025  8:23 am,,Commencement of Maiden Field Program at Reynolds Lake  6  pages  1.4MB
AWJ,09/09/2025  8:22 am,,Completion of Purchase of Munda Related Assets  2  pages  246.2KB
WIN,09/09/2025  8:22 am,Â,AWJ: Completion of Purchase of Munda Related Assets  2  pages  246.2KB
AUC,09/09/2025  8:22 am,Â,Investor Presentation Precious Metals Summit Beaver Creek  22  pages  4.8MB
LCY,09/09/2025  8:22 am,,Mt Celia Update  4  pages  884.0KB
LM8,09/09/2025  8:22 am,,High Grade Gold at Hustler & Defiance West EIS Update  32  pages  4.2MB
EMD,09/09/2025  8:22 am,Â,Loyalty Options Prospectus  42  pages  775.7KB
BC8,09/09/2025  8:21 am,,Paulsens West and Big Sarah Showing Promise  13  pages  5.2MB
GUM,09/09/2025  8:21 am,Â,Investor Presentation  28  pages  1.8MB
M2R,09/09/2025  8:21 am,,Bangemall VTEM Survey Outlines Multiple Large Conductors  10  pages  1.3MB
FMR,09/09/2025  8:21 am,Â,Investor Presentation  20  pages  2.2MB
WCE,09/09/2025  8:21 am,Â,Initial Director's Interest Notice (MJB)  2  pages  145.4KB
WCE,09/09/2025  8:20 am,Â,Appointment of Non-Executive Director  2  pages  485.9KB
AWJ,09/09/2025  8:20 am,Â,WIN: WIN Finalises Sale of Non-Core Assets  5  pages  370.3KB
WIN,09/09/2025  8:20 am,Â,WIN Finalises Sale of Non-Core Assets  5  pages  370.3KB
GRX,09/09/2025  8:20 am,,Aeromag Results Identify Primary Copper Source at Tannenberg  13  pages  1.4MB
LEX,09/09/2025  8:20 am,,Lucky Strike Gold Deposit Advances Towards Operations  11  pages  1.7MB
CIW,09/09/2025  8:19 am,Â,Change in substantial holding for STG  3  pages  394.0KB
STG,09/09/2025  8:19 am,Â,Change in substantial holding from CIW  3  pages  394.0KB
AZY,09/09/2025  8:19 am,Â,Beaver Creek Precious Metals Summit Conference Presentation  54  pages  5.3MB
NWS,09/09/2025  8:19 am,,SEC Form 8-K  9  pages  353.7KB
NWS,09/09/2025  8:18 am,,Preliminary Prospectus Supplement  64  pages  398.2KB
NWS,09/09/2025  8:18 am,,Press Release - Launch of Offering  3  pages  280.7KB
NWS,09/09/2025  8:18 am,,Press Release - Trust Resolution  4  pages  306.1KB
NGY,09/09/2025  8:18 am,Â,NGY secures Gas Allocation approval for early gas sales  2  pages  693.2KB
PH2,09/09/2025  8:18 am,Â,Proposed issue of securities - PH2  5  pages  17.1KB
SKC,09/09/2025  8:00 am,,Amended - SkyCity Completes Retail Entitlement Offer  2  pages  174.1KB
VGL,09/09/2025  7:41 am,Â,SPH Notice - Regal Funds Management  4  pages  207.8KB
GTK,09/09/2025  7:33 am,Â,Ceasing to be a substantial holder  3  pages  250.8KB
AN3,09/09/2025  7:31 am,,ANZ announces changes to better focus on priorities  1  page  332.2KB
ANZ,09/09/2025  7:31 am,,ANZ announces changes to better focus on priorities  1  page  332.2KB
HMY,09/09/2025  7:31 am,Â,Update - Notification of buy-back - HMY  6  pages  18.3KB
OCA,09/09/2025  7:31 am,Â,Resignation of Chief Legal Officer  1  page  121.3KB
SKC,09/09/2025  7:30 am,,SkyCity Completes Retail Entitlement Offer  2  pages  400.9KB
AIA,09/09/2025  7:30 am,Â,AIA - Annual Meeting and Nomination of Directors  1  page  162.3KB
NEU,09/09/2025  7:30 am,Â,Neuren partners with Hope for HIE to support NNZ-2591  2  pages  161.3KB
NZK,09/09/2025  7:30 am,,NZK confirms acquisition of a commercial site in Blenheim  1  page  125.6KB
