ASX Code,Date,Price sens.,Headline
WBC,26/05/2025  7:31 am,Â,"Westpac appoints Chief Data, Digital and AI Officer  1  page  158.8KB"
CNU,26/05/2025  7:30 am,Â,Chorus launches Capital Notes offer  50  pages  6.3MB
TRA,26/05/2025  7:30 am,Â,Dividend/Distribution - TRA  5  pages  20.0KB
TRA,26/05/2025  7:30 am,,FY25 Results Presentation  53  pages  3.7MB
TRA,26/05/2025  7:30 am,,Turners FY25 result caps off a decade of sustainable growth  19  pages  794.0KB
ERD,26/05/2025  7:30 am,,"Delivering on strategy with sustainable, profitable growth  108  pages  12.1MB"
