ASX Code,Date,Price sens.,Headline
SKC,28/09/2023  7:31 AM,,APPOINTMENT OF NON-EXECUTIVE DIRECTOR TO SKYCITY BOARD  2  pages  263.4KB
GNE,28/09/2023  7:31 AM,,Genesis Energy - Executive Team Changes  1  page  155.6KB
SPK,28/09/2023  7:31 AM,,Notice of on-market share buyback  2  pages  146.8KB
CNU,28/09/2023  7:30 AM,,Notice of on-market share buyback  2  pages  83.4KB
CNU,28/09/2023  7:30 AM,,Ongoing Disclosure Notice - Miriam Dean  2  pages  124.9KB
TWR,28/09/2023  7:30 AM,,Successful placement of FY24 reinsurance programme  2  pages  126.2KB
