ASX Code,Date,Price sens.,Headline
GNE,13/08/2024  7:32 AM,,Genesis secures additional gas for Huntly Power Station  2  pages  159.8KB
CEN,13/08/2024  7:31 AM,,Contact secures gas from Methanex  1  page  79.0KB
TRA,13/08/2024  7:31 AM,,Turners Invests in Quashed Online Insurance Platform  1  page  112.3KB
SM1,13/08/2024  7:31 AM,,Appointment of Chief Financial Officer  1  page  416.1KB
JHX,13/08/2024  7:30 AM,,Q1 FY25 Consolidated Financial Statements  16  pages  185.5KB
JHX,13/08/2024  7:30 AM,,Q1 FY25 Management Presentation  24  pages  2.7MB
JHX,13/08/2024  7:30 AM,,Q1 FY25 Management Analysis  14  pages  252.3KB
JHX,13/08/2024  7:30 AM,,Q1 FY25 Earnings Release  6  pages  93.6KB
JHX,13/08/2024  7:30 AM,,Q1 FY25 Earnings  1  page  40.1KB
