ASX Code,Date,Price sens.,Headline
DOW,16/03/2026  7:38 am,Â,Update - Notification of buy-back - DOW  6  pages  18.2KB
BGP,16/03/2026  7:32 am,Â,Disclosure Notices filed with NZX  4  pages  315.9KB
HGH,16/03/2026  7:32 am,Â,Update - Dividend/Distribution - HGH  5  pages  20.2KB
HGH,16/03/2026  7:32 am,Â,HGH announces DRP strike price and AUD FX rate for dividend  3  pages  323.9KB
KMD,16/03/2026  7:31 am,Â,KMD Brands Clarification regarding media speculation  1  page  212.9KB
SNZ,16/03/2026  7:31 am,Â,Notice of Allotment of Options  2  pages  193.8KB
MCY,16/03/2026  7:30 am,Â,Mercury considers Green Bond offer  2  pages  193.7KB
AIA,16/03/2026  7:30 am,Â,February 2026 Monthly traffic update  1  page  163.9KB
MEZ,16/03/2026  7:30 am,,Meridian Energy monthly operating report for February 2026  14  pages  551.8KB
