ASX Code,Date,Price sens.,Headline
3DA,21/01/2026  8:47 am,Â,Non-Deal Roadshow Investor Presentation  29  pages  3.1MB
VUL,21/01/2026  8:46 am,,Successful production testing of first new Lionheart well  15  pages  488.4KB
AMI,21/01/2026  8:44 am,,Quarterly Update and Outlook - December 2025  17  pages  5.6MB
AVR,21/01/2026  8:43 am,,Trading Halt  2  pages  309.4KB
PPM,21/01/2026  8:42 am,Â,Invitation - 2025 Full Year Results Briefing  1  page  216.4KB
EDU,21/01/2026  8:38 am,Â,National Code Amendments to Education Agent Commissions  2  pages  201.2KB
AVR,21/01/2026  8:37 am,,Proposed $US200m Offering & Medtronic Strategic Investment  3  pages  188.3KB
AMI,21/01/2026  8:36 am,,Quarterly Activities Report - December 2025  18  pages  1.1MB
LYC,21/01/2026  8:35 am,,Quarterly Activities Report  6  pages  314.0KB
QFE,21/01/2026  8:32 am,Â,QuickFee Q2 FY26 business update presentation  22  pages  497.0KB
GAL,21/01/2026  8:28 am,,Quarterly Cash Flow Report December 2025  5  pages  226.2KB
LMS,21/01/2026  8:28 am,,Silver Valley Reconnaissance Complete  22  pages  3.4MB
DXB,21/01/2026  8:28 am,Â,Appointment of CFO/Company Secretary  3  pages  272.9KB
AUZ,21/01/2026  8:27 am,,"First assays reveal strong, broad gold mineralisation  21  pages  2.2MB"
GAL,21/01/2026  8:27 am,,Quarterly Activities Report December 2025  14  pages  4.0MB
CRN,21/01/2026  8:27 am,Â,Investor Call Details-Q4 FY2025 Report  1  page  113.9KB
AUA,21/01/2026  8:26 am,,Q2 FY26 Quarterly Activities Report & Appendix 4C  13  pages  970.7KB
LSF,21/01/2026  8:26 am,Â,Net Tangible Asset Backing  1  page  130.5KB
HAW,21/01/2026  8:26 am,,Anglo Saxon Gold Project Updated Mineral Resource Estimate  48  pages  4.6MB
EVN,21/01/2026  8:25 am,,December 2025 Quarterly Report  14  pages  794.7KB
IBC,21/01/2026  8:25 am,Â,Update - Notification of buy-back - IBC  6  pages  18.4KB
RIO,21/01/2026  8:25 am,,Rio Tinto releases fourth quarter production results  34  pages  251.0KB
AW1,21/01/2026  8:25 am,,Storm Copper MRE Continues to Grow  75  pages  9.4MB
VHM,21/01/2026  8:25 am,,Quarterly Activities/Appendix 5B Cash Flow Report  11  pages  508.3KB
FLT,21/01/2026  8:25 am,Â,Update - Notification of buy-back - FLT  6  pages  18.4KB
AVM,21/01/2026  8:25 am,,New High Grade Gold Zone Discovered Near Happy Valley  15  pages  1.6MB
DNL,21/01/2026  8:24 am,Â,Update - Notification of buy-back - DNL  6  pages  18.4KB
PC2,21/01/2026  8:24 am,,High Grade Drill Results and Extensive Visible Gold  23  pages  2.3MB
SFR,21/01/2026  8:24 am,Â,Change in substantial holding  43  pages  9.8MB
QFE,21/01/2026  8:24 am,,QuickFee Q2 FY26 Business Update  12  pages  392.7KB
BMM,21/01/2026  8:24 am,,High-Grade REE Results at Desert Star  17  pages  2.4MB
NES,21/01/2026  8:24 am,,Drilling Contractor Appointed for Approved PoW at Yarri  3  pages  468.7KB
SVY,21/01/2026  8:24 am,,Drilling Strengthens Potential of Large GoldSilver Discovery  46  pages  9.0MB
AA2,21/01/2026  8:24 am,,Drilling Results from Main and South Zones at Tavsan Mine  32  pages  3.2MB
GA8,21/01/2026  8:23 am,,"High-Grade Confirmed at Woodpecker, Whistler and Niagara W  15  pages  1.3MB"
FRE,21/01/2026  8:23 am,,Nasodine Throat Spray Product Launch in Singapore  3  pages  230.1KB
LAM,21/01/2026  8:23 am,Â,Laramide to abandon Kazakhstan greenfield uranium effort  4  pages  494.2KB
DA9,21/01/2026  8:23 am,Â,DA9 Investor Report - January 2026  31  pages  3.2MB
ARV,21/01/2026  8:23 am,Â,Diamond Drilling Recommences at Titan East Gold Discovery  5  pages  1.0MB
BRU,21/01/2026  8:23 am,Â,Role of Canning Basin in WA Energy Security  2  pages  156.9KB
VAU,21/01/2026  8:23 am,,Quarterly Activities Report  19  pages  1.5MB
NMG,21/01/2026  8:22 am,,December Quarter Update  2  pages  889.4KB
DA8,21/01/2026  8:22 am,Â,DA8 Investor Report - January 2026  31  pages  3.2MB
10X,21/01/2026  8:22 am,,Exceptional Results Up to 5.42 g/t Au & 256 g/t Ag Peak View  33  pages  4.6MB
WIN,21/01/2026  8:22 am,,Radio Gold Project Exploration Results  21  pages  2.3MB
KFM,21/01/2026  8:22 am,,Quarterly Activities/Appendix 5B Cash Flow Report  21  pages  1.7MB
NVA,21/01/2026  8:22 am,,Higher-Grade Starter Pit Potential at Korbel Gold Deposit  19  pages  2.7MB
RAG,21/01/2026  8:22 am,,IP Defines Targets at Harnas Gold Project  12  pages  1.2MB
EMC,21/01/2026  8:22 am,,AEA Funding to Fast-Track Mt Edon Critical Mineral Project  7  pages  329.1KB
BRX,21/01/2026  8:22 am,,First Drill Hole Completed At Toro Central  16  pages  1.2MB
3DP,21/01/2026  8:21 am,,Quarterly Activities/Appendix 4C Cash Flow Report  22  pages  7.5MB
WIA,21/01/2026  8:21 am,,Quarterly Activities and Cashflow Report - 31 December 2025  11  pages  573.1KB
MAG,21/01/2026  8:21 am,Â,Appointment of Chief Technical Adviser  1  page  290.9KB
GEM,21/01/2026  8:21 am,Â,Update - Notification of buy-back - GEM  6  pages  18.2KB
EL8,21/01/2026  8:21 am,,Quarterly Activities/Appendix 5B Cash Flow Report  34  pages  5.9MB
ORD,21/01/2026  8:21 am,,Shallow High-Grade Gold at Barimaia McNabs East Prospect  21  pages  6.0MB
BPH,21/01/2026  8:21 am,Â,Application for quotation of securities - BPH  6  pages  18.4KB
SXE,21/01/2026  8:20 am,Â,HY26 Results Webcast Details  1  page  162.0KB
GTE,21/01/2026  8:20 am,,Oval Drilling to test core of potentially large Cu Au system  7  pages  1.8MB
KGD,21/01/2026  8:20 am,Â,Change in substantial holding from FRS  3  pages  276.5KB
FRS,21/01/2026  8:20 am,Â,Change in substantial holding for KGD  3  pages  276.5KB
TLM,21/01/2026  8:20 am,,Quarterly Activities/Appendix 5B Cash Flow Report  18  pages  1.4MB
STW,21/01/2026  8:20 am,Â,Daily Fund Update  9  pages  182.7KB
SLF,21/01/2026  8:20 am,Â,Daily Fund Update  4  pages  130.4KB
SFY,21/01/2026  8:20 am,Â,Daily Fund Update  4  pages  79.9KB
MCY,21/01/2026  7:30 am,,Quarterly Operational Update  6  pages  409.4KB
MEZ,21/01/2026  7:30 am,,Meridian Energy monthly operating report for December 2025  15  pages  523.5KB
