ASX Code,Date,Price sens.,Headline
HAV,15/04/2024  12:36 PM,,Becoming a substantial holder for KOB  2  pages  46.6KB
KOB,15/04/2024  12:36 PM,,Becoming a substantial holder from HAV  2  pages  46.6KB
QVE,15/04/2024  12:27 PM,,Weekly Net Tangible Asset Backing  2  pages  643.4KB
AO1,15/04/2024  12:24 PM,,Change of Auditor  1  page  163.6KB
GCI,15/04/2024  12:23 PM,,Net Tangible Asset Backing  1  page  254.4KB
TNY,15/04/2024  12:18 PM,,Notification to Optionholders  2  pages  126.6KB
GNE,15/04/2024  12:15 PM,,D&O Ongoing Disclosure Notice  5  pages  283.0KB
LFG,15/04/2024  12:15 PM,,Notification of cessation of securities - LFG  14  pages  42.8KB
TGF,15/04/2024  12:11 PM,,Estimated Weekly NTA as of 12 April 2024  1  page  192.6KB
PCI,15/04/2024  12:09 PM,,Daily Net Tangible Asset Statement  1  page  403.2KB
HM1,15/04/2024  11:58 AM,,Update - Dividend/Distribution - HM1  5  pages  19.3KB
BRE,15/04/2024  11:53 AM,,Date of AGM and closing date for director nominations  1  page  99.1KB
A2M,15/04/2024  11:52 AM,,Notification of cessation of securities - A2M  4  pages  14.7KB
PVT,15/04/2024  11:52 AM,,Change of Directors' Interest Notices  9  pages  413.4KB
RDM,15/04/2024  11:49 AM,,Application for quotation of securities - RDM  6  pages  18.2KB
PVT,15/04/2024  11:48 AM,,Notification of cessation of securities - PVT  4  pages  15.0KB
PYC,15/04/2024  11:44 AM,,Update - Application for quotation of securities - PYC  6  pages  18.4KB
TNY,15/04/2024  11:43 AM,,Proposed issue of securities - TNY  5  pages  19.5KB
TNY,15/04/2024  11:42 AM,,Proposed issue of securities - TNY  9  pages  31.6KB
QRI,15/04/2024  11:42 AM,,Application for quotation of securities - QRI  6  pages  17.7KB
TNY,15/04/2024  11:39 AM,,Investor Presentation  52  pages  11.1MB
TNY,15/04/2024  11:37 AM,,Accelerated Non-Renounceable Entitlement Offer Prospectus  71  pages  689.3KB
TNY,15/04/2024  11:36 AM,,Launch of Accelerated Non-Renounceable Entitlement Offer  7  pages  164.7KB
ICI,15/04/2024  11:30 AM,,Change in substantial holding from FFG  2  pages  39.5KB
FFG,15/04/2024  11:30 AM,,Change in substantial holding for ICI  2  pages  39.5KB
OSX,15/04/2024  11:29 AM,,Response to ASX Query Letter  5  pages  1.0MB
IML,15/04/2024  11:28 AM,,IMLC Update - March 2024  3  pages  391.9KB
LYL,15/04/2024  11:27 AM,,Reko Diq Early Works Construction Engineering Services  2  pages  115.9KB
RAD,15/04/2024  11:26 AM,,Results of Extraordinary General Meeting  2  pages  129.8KB
BEN,15/04/2024  11:26 AM,,Application for quotation of securities - BEN  8  pages  25.4KB
RR1,15/04/2024  11:26 AM,,Top 20 - RR1OA  2  pages  70.9KB
ICI,15/04/2024  11:25 AM,,Change of Director's Interest Notice  2  pages  237.1KB
MSI,15/04/2024  11:25 AM,,Annual Report to shareholders  52  pages  2.3MB
BEN,15/04/2024  11:24 AM,,Notification of cessation of securities - BEN  4  pages  15.5KB
NRZ,15/04/2024  11:23 AM,,Reinstatement to Official Quotation  1  page  427.0KB
NRZ,15/04/2024  11:23 AM,,Clarification Request  2  pages  155.9KB
OPT,15/04/2024  11:19 AM,,Notification regarding unquoted securities - OPT  6  pages  18.3KB
MSI,15/04/2024  11:18 AM,,Notice of Annual General Meeting/Proxy Form  8  pages  245.6KB
PL8,15/04/2024  11:18 AM,,Dividend/Distribution - PL8  4  pages  15.5KB
RR1,15/04/2024  11:17 AM,,Application for quotation of securities - RR1  6  pages  19.8KB
PL8,15/04/2024  11:17 AM,,Dividend Details  2  pages  213.1KB
ZLD,15/04/2024  11:16 AM,,"Zelira receives $919,000 R&D Tax Incentive Scheme Refund  2  pages  1.6MB"
LSF,15/04/2024  11:02 AM,,Change of Director's Interest Notice - RL  3  pages  1.1MB
LSF,15/04/2024  11:01 AM,,Change of Director's Interest Notice - ML  3  pages  1.1MB
SEC,15/04/2024  11:01 AM,,Correction to dividend payment date  3  pages  272.8KB
FOR,15/04/2024  11:00 AM,,Delisting webinar presentation  17  pages  1.1MB
KPG,15/04/2024  10:59 AM,,Kelly Partners - Barcelona Quality Shareholders  39  pages  3.3MB
LU7,15/04/2024  10:58 AM,,Results of Share Purchase Plan  2  pages  334.3KB
ENV,15/04/2024  10:57 AM,,Options and cleansing prospectus  29  pages  349.9KB
FFG,15/04/2024  10:56 AM,,Change of Director's Interest Notice  2  pages  250.8KB
FFG,15/04/2024  10:56 AM,,Change of Director's Interest Notice  2  pages  248.5KB
OPT,15/04/2024  10:54 AM,,Notification regarding unquoted securities - OPT  7  pages  21.1KB
ZIP,15/04/2024  10:54 AM,,Notification of cessation of securities - ZIP  5  pages  18.1KB
HPG,15/04/2024  10:44 AM,,Notification of cessation of securities - HPG  4  pages  14.7KB
ATH,15/04/2024  10:40 AM,,Application for quotation of securities - ATH  6  pages  18.5KB
IMC,15/04/2024  10:34 AM,,Immuron to host Live Virtual Event  3  pages  318.1KB
TOP,15/04/2024  10:25 AM,,Change in substantial holding for SXL  6  pages  334.8KB
SXL,15/04/2024  10:25 AM,,Change in substantial holding from TOP  6  pages  334.8KB
BKI,15/04/2024  10:22 AM,,BKI 12 April 2024 Weekly NTA  1  page  447.4KB
AVR,15/04/2024  10:19 AM,,Corporate Governance Statement and Appendix 4G  20  pages  959.7KB
KIN,15/04/2024  10:14 AM,,Proposed issue of securities - KIN  5  pages  17.9KB
NHE,15/04/2024  10:12 AM,,Registry engagement for capital raising  3  pages  294.2KB
AVR,15/04/2024  10:12 AM,,Annual Report to shareholders  96  pages  7.5MB
DTM,15/04/2024  10:10 AM,,Proposed issue of securities - DTM  5  pages  18.0KB
W2V,15/04/2024  10:10 AM,,Notification of cessation of securities - W2V  6  pages  19.1KB
DTM,15/04/2024  10:10 AM,,Share Placement  1  page  287.3KB
ELD,15/04/2024  10:09 AM,,Elders Limited 2023 Modern Slavery Statement  22  pages  5.3MB
MDI,15/04/2024  10:05 AM,,Application for quotation of securities - MDI  6  pages  18.2KB
NWF,15/04/2024  10:05 AM,,Change of Company Secretary  1  page  100.5KB
IXR,15/04/2024  10:04 AM,,STRONG PARTNER INTEREST IN IONICTECH-PLANT FULL FOR 18 MNTHS  4  pages  259.9KB
CU6,15/04/2024  10:02 AM,,Cleaning Notice  1  page  609.9KB
ION,15/04/2024  10:02 AM,,Notification regarding unquoted securities - ION  6  pages  18.3KB
PNX,15/04/2024  10:01 AM,,Cleansing Notice - Mt Porter Completion  1  page  134.6KB
EP1,15/04/2024  10:01 AM,,Notification regarding unquoted securities - EP1  13  pages  36.7KB
TNY,15/04/2024  10:01 AM,,Trading Halt  2  pages  611.2KB
STK,15/04/2024  10:01 AM,,Suspension from Quotation  2  pages  164.9KB
CUV,15/04/2024  10:01 AM,,Change to executive management  2  pages  68.5KB
MNB,15/04/2024  10:01 AM,,Reinstatement to Official Quotation  1  page  425.0KB
MNB,15/04/2024  10:01 AM,,US$14m Loan Facility Approved & Firm Bids for Placement  7  pages  150.6KB
PNX,15/04/2024  9:59 AM,,Application for quotation of securities - PNX  6  pages  18.3KB
EMP,15/04/2024  9:59 AM,,Proposed JV Gold Mining Leases  3  pages  3.7MB
SCG,15/04/2024  9:58 AM,,Westfield Bondi  1  page  43.5KB
CU6,15/04/2024  9:58 AM,,Application for quotation of securities - CU6  10  pages  26.9KB
KIN,15/04/2024  9:58 AM,,Kin And PNX Merge to Create Exceptional Platform for Growth  110  pages  12.0MB
ADO,15/04/2024  9:57 AM,,Cleansing Notice under section 708A  2  pages  221.6KB
GDF,15/04/2024  9:56 AM,,GDF AMIT Fund Payment Notice  1  page  129.7KB
SMI,15/04/2024  9:56 AM,,Application for quotation of securities - SMI  6  pages  18.3KB
TIG,15/04/2024  9:56 AM,,Reinstatement to Quotation  1  page  89.9KB
OPN,15/04/2024  9:56 AM,,Expiry of Unquoted Options  1  page  140.7KB
TIG,15/04/2024  9:56 AM,,Proposed Sale of Russian Operations  5  pages  213.9KB
TIG,15/04/2024  9:56 AM,,Declaratory relief decision  1  page  206.7KB
NME,15/04/2024  9:55 AM,,Trading Halt  2  pages  453.0KB
SEC,15/04/2024  9:54 AM,,Dividend/Distribution - SEC  5  pages  18.9KB
LNU,15/04/2024  9:54 AM,,Proposed issue of securities - LNU  5  pages  18.4KB
ADO,15/04/2024  9:54 AM,,Application for quotation of securities - ADO  6  pages  18.8KB
LNU,15/04/2024  9:54 AM,,"Linius raises $600,000  3  pages  226.4KB"
PNX,15/04/2024  9:53 AM,,Kin Mining and PNX Metals Merger  110  pages  12.0MB
SEC,15/04/2024  9:53 AM,,Quarterly fully franked dividend of 3.0 cents per share  2  pages  201.4KB
TNY,15/04/2024  9:52 AM,,Pause in Trading  1  page  120.2KB
RFX,15/04/2024  9:50 AM,,Proposed issue of securities - RFX  8  pages  28.8KB
GLN,15/04/2024  9:50 AM,,Trading Halt  2  pages  230.1KB
GOR,15/04/2024  9:50 AM,,Response to Media Speculation  1  page  214.4KB
GGE,15/04/2024  9:49 AM,,Deeper Stacked Helium Pay Adds Scale to Red Helium Project  6  pages  835.4KB
RMI,15/04/2024  9:48 AM,,Trading Halt  2  pages  220.0KB
ADR,15/04/2024  9:48 AM,,US FDA clearance of Hailie for AstraZeneca inhalers  2  pages  144.1KB
ASM,15/04/2024  9:45 AM,,Trading Halt  2  pages  243.3KB
TDO,15/04/2024  9:44 AM,,WA-527-P Sauropod 3D Environmental Plan Approved  4  pages  6.1MB
NWS,15/04/2024  9:44 AM,,Appendix 3C  4  pages  75.7KB
HRN,15/04/2024  9:43 AM,,Change of Director's Interest Notice  2  pages  271.3KB
NWS,15/04/2024  9:43 AM,,Appendix 3C  4  pages  75.7KB
NTI,15/04/2024  9:43 AM,,Trading Halt  2  pages  148.6KB
MRZ,15/04/2024  9:42 AM,,Canadian Lithium Update  5  pages  921.2KB
VMC,15/04/2024  9:40 AM,,Youanmi New Lithium Anomaly Penny East  6  pages  2.4MB
LPE,15/04/2024  9:40 AM,,Termination of Employment of CEO  1  page  93.3KB
AR3,15/04/2024  9:39 AM,,AR3 Moves to Increase Tenure for Overland Uranium Project  4  pages  364.1KB
BCN,15/04/2024  9:39 AM,,Jaurdi Gold Project March Quarter Production Update  3  pages  814.6KB
EEG,15/04/2024  9:39 AM,,Trading Halt  3  pages  710.9KB
WSR,15/04/2024  9:38 AM,,Trading Halt  2  pages  666.8KB
EOS,15/04/2024  9:38 AM,,EOS Diversifies Revenue Base with New Contracts ($24m)  2  pages  135.1KB
NFL,15/04/2024  9:37 AM,,Trading Halt  2  pages  191.5KB
RFX,15/04/2024  9:36 AM,,Redflow Strategy Update  35  pages  3.2MB
FOR,15/04/2024  9:36 AM,,Indicative NAV COB 12 April 2024  1  page  163.4KB
IRE,15/04/2024  9:33 AM,,Iress completes sale of Platform business to Praemium  1  page  251.2KB
LKE,15/04/2024  9:32 AM,,Reminder of Closing Date for Share Purchase Plan  3  pages  195.4KB
CXL,15/04/2024  9:32 AM,,Change of Director's Interest Notice  3  pages  253.1KB
E33,15/04/2024  9:29 AM,,Appointment of Chief Financial Officer  1  page  203.7KB
BUR,15/04/2024  9:29 AM,,Trading Halt  2  pages  687.3KB
FAR,15/04/2024  9:28 AM,,Final Director's Interest Notice  2  pages  228.6KB
CU6,15/04/2024  9:26 AM,,Ceasing to be a substantial holder - Taylor  2  pages  250.9KB
MNB,15/04/2024  9:26 AM,,Proposed issue of securities - MNB  9  pages  31.2KB
EEG,15/04/2024  9:25 AM,,Pause in Trading  1  page  117.1KB
REA,15/04/2024  9:25 AM,,Change of Director's Interest Notice  3  pages  284.1KB
OAK,15/04/2024  9:24 AM,,Proposed issue of securities - OAK  6  pages  21.2KB
OAK,15/04/2024  9:24 AM,,Share and Option Subscription Agreement  4  pages  271.9KB
LCY,15/04/2024  9:24 AM,,HAW: Mt Bevan Other Minerals Joint Venture Commences Drill.  2  pages  353.7KB
HAW,15/04/2024  9:24 AM,,Mt Bevan Other Minerals Joint Venture Commences Drilling  2  pages  353.7KB
OZM,15/04/2024  9:24 AM,,First Drill Hole Started in Brazil  18  pages  2.2MB
CU6,15/04/2024  9:23 AM,,Change in substantial holding - Cabbit Pty Ltd  2  pages  439.9KB
ECT,15/04/2024  9:23 AM,,Change in substantial holding  2  pages  154.4KB
FRA,15/04/2024  9:23 AM,,Product Disclosure Statement Announcement  45  pages  861.1KB
FNR,15/04/2024  9:21 AM,,Becoming a substantial holder  2  pages  150.2KB
FRG,15/04/2024  9:20 AM,,Product Disclosure Statement Announcement  43  pages  826.9KB
BTN,15/04/2024  9:20 AM,,Cleansing Notice  2  pages  102.1KB
ECT,15/04/2024  9:20 AM,,HydroMOR Patent Granted - India  4  pages  3.9MB
REA,15/04/2024  9:19 AM,,Notification regarding unquoted securities - REA  6  pages  17.9KB
SVM,15/04/2024  9:19 AM,,Sustainable Farming on Target to Triple Crop Yield  3  pages  989.9KB
RF1,15/04/2024  9:19 AM,,Weekly Estimate NTA for 12.4.2024  1  page  121.7KB
CTW,15/04/2024  9:18 AM,,CitiFirst MINIs Cash Amounts for Stop Loss Event 12 Apr 24  1  page  84.5KB
CTW,15/04/2024  9:16 AM,,CitiFirst MINIs Stop Loss Event trigger date 12 Apr 2024  1  page  87.1KB
ASO,15/04/2024  9:16 AM,,Indicated Nickel Tonnage Increased by 44% at Bardwell  48  pages  2.0MB
REA,15/04/2024  9:16 AM,,Notification of cessation of securities - REA  4  pages  14.7KB
RF1,15/04/2024  9:15 AM,,Update - Notification of buy-back - RF1  6  pages  18.3KB
KSL,15/04/2024  9:15 AM,,Application for quotation of securities - KSL  6  pages  17.7KB
DLM,15/04/2024  9:15 AM,,Date of AGM  1  page  107.9KB
AON,15/04/2024  9:15 AM,,Priority Drill Targets Confirmed at Salanie  13  pages  2.2MB
MEC,15/04/2024  9:14 AM,,Update - Notification of buy-back - MEC  6  pages  18.5KB
KKC,15/04/2024  9:14 AM,,Net Tangible Asset Backing  2  pages  184.3KB
FG1,15/04/2024  9:14 AM,,Investor Webinar  2  pages  320.3KB
DYL,15/04/2024  9:14 AM,,Application for quotation of securities - DYL  6  pages  18.3KB
DYL,15/04/2024  9:13 AM,,Share Purchase Plan Results  2  pages  509.5KB
KKC,15/04/2024  9:13 AM,,Monthly Net Tangible Asset Backing 31 March 2024  1  page  82.5KB
URF,15/04/2024  9:12 AM,,Update - Notification of buy-back - URF  6  pages  18.3KB
NWS,15/04/2024  9:12 AM,,Notification of cessation of securities - NWS  4  pages  14.6KB
EEG,15/04/2024  9:12 AM,,Completion of USA Asset Sale  1  page  205.9KB
NWS,15/04/2024  9:11 AM,,Notification of cessation of securities - NWS  4  pages  14.6KB
TOK,15/04/2024  9:11 AM,,Corporate Presentation  18  pages  2.4MB
WQG,15/04/2024  9:09 AM,,Update - Notification of buy-back - WQG  6  pages  18.3KB
CLA,15/04/2024  9:09 AM,,Proposed issue of securities - CLA  7  pages  25.9KB
RFX,15/04/2024  9:09 AM,,Prospectus - Entitlement Offer with Attaching Options  54  pages  535.9KB
AKO,15/04/2024  9:08 AM,,Trading Halt  2  pages  203.9KB
RFX,15/04/2024  9:08 AM,,Redflow undertakes capital raising  5  pages  144.0KB
PCG,15/04/2024  9:08 AM,,Monthly Funds Under Management- 31 March 2024  1  page  94.9KB
DVL,15/04/2024  9:06 AM,,Final Director's Interest Notice  2  pages  231.6KB
A3D,15/04/2024  9:06 AM,,MCP Prototyping and IP Update  3  pages  180.1KB
IRD,15/04/2024  9:06 AM,,Amp Energy Strategic Framework Agreement Update  1  page  235.6KB
ADX,15/04/2024  9:05 AM,,Investor Presentation - with Welchau-1 Data Review  36  pages  6.6MB
PGF,15/04/2024  9:05 AM,,Net Tangible Asset Backing - 12 April 2024  1  page  174.1KB
ACW,15/04/2024  9:05 AM,,First patient treated in ACW XanaMIA ph 2b Alzheimers trial  3  pages  252.9KB
DUI,15/04/2024  9:04 AM,,Update - Notification of buy-back - DUI  6  pages  18.5KB
SVW,15/04/2024  9:04 AM,,Acceptance Facility Notice  2  pages  245.8KB
BLD,15/04/2024  9:04 AM,,SVW: Acceptance Facility Notice  2  pages  245.8KB
OCC,15/04/2024  9:03 AM,,Orthocell receives $3.05m R&D tax incentive refund  2  pages  213.5KB
RG8,15/04/2024  9:03 AM,,Weekly NTA Update  1  page  27.3KB
FOS,15/04/2024  9:02 AM,,Profit Guidance  1  page  61.8KB
OCL,15/04/2024  9:02 AM,,Update - Notification of buy-back - OCL  6  pages  18.3KB
VG1,15/04/2024  9:02 AM,,Weekly NTA Update  1  page  86.1KB
TRS,15/04/2024  9:02 AM,,Change of Director's Interest Notice - Steven Fisher  2  pages  223.1KB
IPX,15/04/2024  9:02 AM,,IperionX and United Stars partner for Titanium Manufacturing  4  pages  330.3KB
SXG,15/04/2024  9:01 AM,,SXG April 2024 Investor Presentation  26  pages  5.1MB
DRO,15/04/2024  9:01 AM,,April 2024 Investor Presentation  27  pages  11.5MB
RAD,15/04/2024  9:01 AM,,Presentation to Extraordinary General Meeting  8  pages  678.9KB
NXT,15/04/2024  9:00 AM,,Successful Completion of Institutional Entitlement Offer  4  pages  181.0KB
4DS,15/04/2024  9:00 AM,,Peter Himes Appointed to Chief Strategic Officer  1  page  170.2KB
BLD,15/04/2024  8:59 AM,,Notification of cessation of securities - BLD  4  pages  14.7KB
BLD,15/04/2024  8:59 AM,,Chief Financial Officer Change  1  page  47.8KB
RIM,15/04/2024  8:59 AM,,Compelling Cobalt Copper and REE targets at Broken Hill  20  pages  2.6MB
WOT,15/04/2024  8:59 AM,,Update - Notification of buy-back - WOT  6  pages  18.4KB
CYG,15/04/2024  8:59 AM,,Coventry Investor Presentation  41  pages  3.0MB
BGD,15/04/2024  8:58 AM,,"SPP Update - Strong Demand, Early Applications Encouraged  2  pages  200.2KB"
INR,15/04/2024  8:58 AM,,Ioneer's Rhyolite Ridge Project Moves Toward Construction  9  pages  1.3MB
CYG,15/04/2024  8:58 AM,,Coventry Launch announcement  5  pages  267.1KB
ODE,15/04/2024  8:57 AM,,Roll-Front Uranium Potential at Relief Well  12  pages  1.6MB
SGR,15/04/2024  8:56 AM,,NSW Inquiry - Commencement of hearings  1  page  125.9KB
QOR,15/04/2024  8:55 AM,,Quarterly Activities/Appendix 4C Cash Flow Report  28  pages  3.2MB
FND,15/04/2024  8:55 AM,,FINDI Granted White Label ATM Licence  2  pages  200.6KB
ASN,15/04/2024  8:55 AM,,Successful Completion of Green River Sample Demo Plant  10  pages  522.7KB
HM1,15/04/2024  8:53 AM,,Weekly NTA Estimate  1  page  72.3KB
SXG,15/04/2024  8:53 AM,,Further High-Grade Infill hits continue to build confidence  40  pages  2.9MB
JMS,15/04/2024  8:53 AM,,Inaugural Sustainability Report  43  pages  10.3MB
LSF,15/04/2024  8:52 AM,,Net Tangible Asset Backing  1  page  219.4KB
RCT,15/04/2024  8:52 AM,,Notice of Annual General Meeting/Proxy Form  7  pages  670.8KB
FRG,15/04/2024  8:52 AM,,Admission and Commencement of Trading - FRGG  2  pages  120.6KB
FRA,15/04/2024  8:52 AM,,Admission and Commencement of Trading - FRAR  2  pages  479.8KB
HUM,15/04/2024  8:51 AM,,Update - Notification of buy-back - HUM  6  pages  18.3KB
AMS,15/04/2024  8:51 AM,,Change of Director's Interest Notice  2  pages  236.7KB
CUS,15/04/2024  8:51 AM,,Copper Search Quarterly Activities and Cashflow Report  16  pages  9.4MB
SRX,15/04/2024  8:51 AM,,Sierra Rutile Sembehun Project DFS Presentation  19  pages  1.4MB
AMS,15/04/2024  8:51 AM,,Notification regarding unquoted securities - AMS  6  pages  19.0KB
BTN,15/04/2024  8:50 AM,,Proposed issue of securities - BTN  7  pages  25.5KB
AMS,15/04/2024  8:50 AM,,Proposed issue of securities - AMS  5  pages  19.1KB
TSO,15/04/2024  8:50 AM,,Compelling La Brea Target Area Defined  13  pages  1.5MB
AMS,15/04/2024  8:50 AM,,Proposed issue of securities - AMS  14  pages  44.3KB
AQX,15/04/2024  8:50 AM,,Change in substantial holding  3  pages  176.9KB
MKR,15/04/2024  8:50 AM,,Manuka Resources Corporate Presentation  22  pages  2.0MB
AUN,15/04/2024  8:49 AM,,First Pass Drilling on New Targets Completed  5  pages  2.0MB
AMS,15/04/2024  8:49 AM,,AMS Investor Presentation  38  pages  4.2MB
CUF,15/04/2024  8:49 AM,,Notification of cessation of securities - CUF  4  pages  14.8KB
SLM,15/04/2024  8:49 AM,,Unaudited Financial Statements - 29 February 2024  27  pages  765.2KB
RR1,15/04/2024  8:49 AM,,Rights Issue & Shortfall  2  pages  736.8KB
BTN,15/04/2024  8:48 AM,,Capital Raising Entitlement Offer  5  pages  147.7KB
SLM,15/04/2024  8:47 AM,,MD&A - 29 February 2024  14  pages  476.5KB
PPS,15/04/2024  8:46 AM,,Completion of OneVue Acquisition  1  page  102.0KB
OPH,15/04/2024  8:46 AM,,Weekly NTA 12.04.2024  1  page  138.8KB
PMC,15/04/2024  8:44 AM,,Update - Notification of buy-back - PMC  6  pages  18.5KB
M4M,15/04/2024  8:43 AM,,Macro Determines Not to Acquire Aurora Lithium Project  3  pages  348.8KB
1AE,15/04/2024  8:43 AM,,M4M: Macro Determines Not to Acquire Aurora Lithium Project  3  pages  348.8KB
AMD,15/04/2024  8:43 AM,,Quarterly Activities and Cashflow Report  18  pages  1.9MB
MX1,15/04/2024  8:41 AM,,Trading Halt  2  pages  302.7KB
88E,15/04/2024  8:39 AM,,Hickory-1 Flow Test - Second Light Oil Discovery  7  pages  920.8KB
AHI,15/04/2024  8:38 AM,,AHI and Pharmak Direct Extend Master Services Agreement  4  pages  257.8KB
CLA,15/04/2024  8:38 AM,,Result of UK Placing  3  pages  265.5KB
DEM,15/04/2024  8:37 AM,,Investor presentation  11  pages  18.4MB
SGP,15/04/2024  8:37 AM,,Notification of cessation of securities - SGP  4  pages  14.8KB
TIE,15/04/2024  8:37 AM,,Supplementary Bidder's Statement  7  pages  626.5KB
MIL,15/04/2024  8:37 AM,,Notice regarding Second Court Hearing  1  page  131.7KB
IEC,15/04/2024  8:36 AM,,Outstanding Rock Assays Upgrade Lithium Prospectivity  14  pages  1.4MB
NPM,15/04/2024  8:36 AM,,"New Peak to acquire Canadian Uranium, Rare Earths Project  8  pages  3.2MB"
IMU,15/04/2024  8:36 AM,,Bile Tract Cancer Study Opens after MAST High Dose Clearance  4  pages  237.2KB
DRO,15/04/2024  8:36 AM,,Quarterly Activities/Appendix 4C Cash Flow Report  9  pages  901.2KB
VGL,15/04/2024  8:36 AM,,Application for quotation of securities - VGL  7  pages  23.0KB
EMR,15/04/2024  8:36 AM,,Fifth Supplementary Bidder's Statement  2  pages  104.5KB
DVL,15/04/2024  8:36 AM,,Non-executive Director resignation  2  pages  154.9KB
RG8,15/04/2024  8:35 AM,,Update - Notification of buy-back - RG8  6  pages  18.7KB
VG1,15/04/2024  8:35 AM,,Update - Notification of buy-back - VG1  6  pages  18.8KB
CEH,15/04/2024  8:35 AM,,Update - Notification of buy-back - CEH  6  pages  18.3KB
EGG,15/04/2024  8:35 AM,,Cancellation of Share Appreciation Rights  1  page  51.8KB
EGG,15/04/2024  8:34 AM,,Notification of cessation of securities - EGG  4  pages  14.7KB
DMP,15/04/2024  8:34 AM,,Strategy Day Video and Transcript  1  page  113.3KB
HZN,15/04/2024  8:34 AM,,2024 Infill Drilling Program in Block 22/12 Beibu Gulf China  2  pages  415.5KB
PLL,15/04/2024  8:34 AM,,Carolina Lithium State Mining Permit  2  pages  334.6KB
CAA,15/04/2024  8:34 AM,,Update - Notification of buy-back - CAA  6  pages  18.2KB
SB2,15/04/2024  8:34 AM,,Update - Notification of buy-back - SB2  6  pages  18.3KB
KBC,15/04/2024  8:34 AM,,Change in substantial holding for YOW  2  pages  258.9KB
YOW,15/04/2024  8:34 AM,,Change in substantial holding from KBC  2  pages  258.9KB
ACW,15/04/2024  8:34 AM,,Notification of cessation of securities - ACW  4  pages  14.8KB
RUL,15/04/2024  8:34 AM,,Notification of cessation of securities - RUL  4  pages  14.9KB
QAN,15/04/2024  8:33 AM,,Update - Notification of buy-back - QAN  6  pages  18.6KB
RUL,15/04/2024  8:33 AM,,Update - Notification of buy-back - RUL  6  pages  18.6KB
NEC,15/04/2024  8:33 AM,,Update - Notification of buy-back - NEC  6  pages  18.3KB
CPU,15/04/2024  8:33 AM,,Update - Notification of buy-back - CPU  6  pages  18.4KB
NME,15/04/2024  8:33 AM,,IR1: Sale of Kookynie Gold Project  2  pages  201.4KB
IR1,15/04/2024  8:33 AM,,Sale of Kookynie Gold Project  2  pages  201.4KB
GUE,15/04/2024  8:33 AM,,Preparation for Commencement of Drilling at Tallahassee  5  pages  786.0KB
PDI,15/04/2024  8:32 AM,,Bankan Pre-Feasibility Study Presentation  47  pages  8.8MB
TMB,15/04/2024  8:32 AM,,Drilling commences at Mogumber  5  pages  998.5KB
TLG,15/04/2024  8:32 AM,,Vittangi Anode Project FEED study delivers strong results  3  pages  99.6KB
HCH,15/04/2024  8:32 AM,,Hot Chili Submits Second Maritime Application  5  pages  778.8KB
BOT,15/04/2024  8:32 AM,,Botanix Included in the All Ordinaries Index  2  pages  208.2KB
IAG,15/04/2024  8:32 AM,,Update - Notification of buy-back - IAG  6  pages  18.3KB
1AE,15/04/2024  8:31 AM,,Quarterly Activities/Appendix 5B Cash Flow Report  16  pages  903.6KB
SGP,15/04/2024  8:31 AM,,Notification regarding unquoted securities - SGP  5  pages  16.8KB
ANN,15/04/2024  8:31 AM,,Share Purchase Plan  20  pages  641.6KB
1AE,15/04/2024  8:31 AM,,Termination of Lithium Rights Divestment  1  page  188.2KB
M4M,15/04/2024  8:31 AM,,1AE: Termination of Lithium Rights Divestment  1  page  188.2KB
RGT,15/04/2024  8:31 AM,,Argent BioPharma Appoints Dr Shlomo Sadoun to Advisory Board  2  pages  165.1KB
MTM,15/04/2024  8:31 AM,,Board and Management Restructure  3  pages  263.4KB
TIE,15/04/2024  8:31 AM,,Notice that defeating conditions to takeover bid freed  3  pages  444.8KB
AT1,15/04/2024  8:31 AM,,AT1 secures significant order for HIV self-tests  1  page  145.0KB
AI1,15/04/2024  8:31 AM,,Investor presentation April 2024  13  pages  4.2MB
BWP,15/04/2024  8:31 AM,,Application for quotation of securities - BWP  5  pages  16.7KB
FBM,15/04/2024  8:31 AM,,Outstanding Maiden Mineral Resource at Nevada Li Project  30  pages  1.8MB
SOV,15/04/2024  8:31 AM,,Completion of Retail Entitlement Offer  3  pages  42.1KB
LCY,15/04/2024  8:30 AM,,Mt Bevan Other Minerals Joint Venture Commences Drilling  3  pages  362.7KB
HAW,15/04/2024  8:30 AM,,LCY:Mt Bevan Other Minerals Joint Venture Commences Drilling  3  pages  362.7KB
MCM,15/04/2024  8:30 AM,,Change in substantial holding  8  pages  282.1KB
EGG,15/04/2024  8:30 AM,,Update - Notification of buy-back - EGG  6  pages  18.5KB
FDR,15/04/2024  8:30 AM,,Corporate presentation  25  pages  10.5MB
CGS,15/04/2024  8:30 AM,,Update - Notification of buy-back - CGS  6  pages  18.2KB
PDI,15/04/2024  8:30 AM,,PFS Delivers Attractive Financials & 3.05MOZ Ore Reserve  120  pages  7.5MB
HE8,15/04/2024  8:30 AM,,Board Change  3  pages  374.0KB
TRS,15/04/2024  8:30 AM,,Update - Notification of buy-back - TRS  6  pages  18.3KB
BC8,15/04/2024  8:30 AM,,Paulsens Refurbishment Progress - April 2024  11  pages  3.5MB
AR3,15/04/2024  8:29 AM,,Update - Proposed issue of securities - AR3  5  pages  17.6KB
GNP,15/04/2024  8:29 AM,,Profit Guidance  1  page  386.3KB
SNG,15/04/2024  8:28 AM,,Outstanding Gold and Antimony assays from Auld Creek Project  28  pages  3.5MB
ILU,15/04/2024  8:28 AM,,Notification regarding unquoted securities - ILU  9  pages  26.7KB
M4M,15/04/2024  8:28 AM,,Notice of General Meeting/Proxy Form  43  pages  1.1MB
ILU,15/04/2024  8:28 AM,,Notification regarding unquoted securities - ILU  6  pages  18.3KB
VGL,15/04/2024  8:28 AM,,VGL - Capital Change Notice  3  pages  150.2KB
SRX,15/04/2024  8:28 AM,,Supplementary Target's Statement  13  pages  441.5KB
ILU,15/04/2024  8:28 AM,,Notification of cessation of securities - ILU  4  pages  14.8KB
MKR,15/04/2024  8:28 AM,,Mineral Resource Update - Mt Boppy Gold Project  22  pages  2.3MB
ILU,15/04/2024  8:27 AM,,Notification of cessation of securities - ILU  4  pages  14.7KB
1AG,15/04/2024  8:27 AM,,Carbon Conscious Investments Limited Update  44  pages  784.4KB
