ASX Code,Date,Price sens.,Headline
AFP,31/05/2024  7:47 AM,,Annual Meeting and Closing Date for Director Nominations  1  page  128.7KB
CNU,31/05/2024  7:31 AM,,Chorus submits 2023 fibre regulatory report  15  pages  790.3KB
IKE,31/05/2024  7:31 AM,,ikeGPS FY24 Performance and FY25 Outlook Presentation  33  pages  12.1MB
CEN,31/05/2024  7:31 AM,,NZAS to stay for the long term  2  pages  81.7KB
MCY,31/05/2024  7:31 AM,,NZAS and Mercury sign long-term agreement  2  pages  172.4KB
SM1,31/05/2024  7:31 AM,,Synlait forecast milk price update  1  page  416.9KB
NZM,31/05/2024  7:31 AM,,Ongoing Disclosure Notice  3  pages  413.3KB
NZM,31/05/2024  7:30 AM,,Ongoing Disclosure Notice  3  pages  413.3KB
IFT,31/05/2024  7:30 AM,,Infratil Infrastructure Bond Exchange Offer opens  18  pages  2.5MB
NZM,31/05/2024  7:30 AM,,Issue of Performance Rights  2  pages  117.9KB
SKT,31/05/2024  7:30 AM,,Notification of cessation of securities - SKT  4  pages  14.8KB
SKT,31/05/2024  7:30 AM,,Update - Notification of buy-back - SKT  6  pages  18.6KB
