ASX Code,Date,Price sens.,Headline
CEN,21/10/2024  7:38 am,Â,Application for quotation of securities - CEN  6  pages  19.3KB
TWR,21/10/2024  7:32 am,,IRD approval received for proposed share buyback  1  page  84.4KB
AFP,21/10/2024  7:31 am,Â,AFT enters late-stage R&D agreement for a novel injectable  2  pages  121.4KB
GNE,21/10/2024  7:31 am,,FY25 Q1 Performance Report  16  pages  1.1MB
SM1,21/10/2024  7:30 am,,CEO resignation  1  page  52.4KB
MEZ,21/10/2024  7:30 am,Â,Corporate Governance Presentation  18  pages  2.2MB
