ASX Code,Date,Price sens.,Headline
EL8,10/06/2025  8:33 am,Â,Presentation - Developing our strategic uranium assets  22  pages  5.2MB
OBM,10/06/2025  8:33 am,,"Strong New Drill Results at Riverina, Waihi & Little Gem  59  pages  2.4MB"
SVM,10/06/2025  8:33 am,,Leading Japanese Titanium Producer Validates Kasiya Rutile  5  pages  584.8KB
EL8,10/06/2025  8:33 am,,Thick uranium mineralisation intersected at Marenica  15  pages  1.9MB
RXR,10/06/2025  8:33 am,Â,Proposed issue of securities - RXR  5  pages  17.4KB
MHM,10/06/2025  8:33 am,,Mt Solitary Gold Exploration Target  25  pages  2.7MB
NEU,10/06/2025  8:33 am,Â,Update - Notification of buy-back - NEU  6  pages  18.1KB
SER,10/06/2025  8:33 am,,AGC: New Acquisition to Give Belt-Scale Control of South Cob  4  pages  569.6KB
AGC,10/06/2025  8:33 am,,New Acquisition to Give Belt-Scale Control of South Cobar  4  pages  569.6KB
MEK,10/06/2025  8:32 am,,Further Shallow Oxide Gold in Extension Drilling  16  pages  1.3MB
FBM,10/06/2025  8:32 am,Â,Notification of cessation of securities - FBM  4  pages  14.8KB
SPR,10/06/2025  8:32 am,Â,Becoming a substantial holder  72  pages  8.1MB
HCH,10/06/2025  8:32 am,,Huasco Water Corporate Presentation  33  pages  6.5MB
CGF,10/06/2025  8:32 am,Â,Becoming a substantial holder  49  pages  5.4MB
AUN,10/06/2025  8:32 am,,KGD: High Grade Gold Drill Intercepts Continue - Mt Palmer  16  pages  2.8MB
KGD,10/06/2025  8:32 am,,High Grade Gold Drill Intercepts Continue - Mt Palmer  16  pages  2.8MB
HRZ,10/06/2025  8:32 am,Â,Notice of General Meeting/Proxy Form  27  pages  692.0KB
GFL,10/06/2025  8:32 am,Â,Monthly NTA - May 2025  1  page  220.1KB
WC8,10/06/2025  8:31 am,Â,Notification of cessation of securities - WC8  4  pages  14.9KB
MEZ,10/06/2025  8:31 am,Â,Meridian Energy Limited (MEL050) - Maturity  2  pages  209.0KB
ANO,10/06/2025  8:31 am,,Expected $2.7 Million Profit Turnaround  2  pages  193.0KB
ERM,10/06/2025  8:31 am,,White Devil Scoping Study Update  20  pages  1.6MB
CZN,10/06/2025  8:31 am,Â,Change of Director's Interest Notice  3  pages  157.9KB
RDG,10/06/2025  8:31 am,Â,Notification of cessation of securities - RDG  4  pages  14.8KB
RDG,10/06/2025  8:31 am,Â,Expiry of Unquoted Options  1  page  153.8KB
PNR,10/06/2025  8:30 am,Â,Notice under section 708A(5)(e) of the Corporations Act 2001  1  page  63.1KB
PNR,10/06/2025  8:30 am,Â,Application for quotation of securities - PNR  6  pages  18.2KB
BRU,10/06/2025  8:30 am,Â,Change of Director's Interest Notice x 3  6  pages  333.2KB
NWS,10/06/2025  8:30 am,Â,Notification of cessation of securities - NWS  4  pages  14.6KB
NWS,10/06/2025  8:30 am,Â,Notification of cessation of securities - NWS  4  pages  14.6KB
BRU,10/06/2025  8:29 am,Â,Notification regarding unquoted securities - BRU  7  pages  21.4KB
PLL,10/06/2025  8:29 am,Â,Statement of CDIs on issue - PLL  3  pages  13.4KB
BRU,10/06/2025  8:29 am,Â,Issue of Director Options  1  page  117.3KB
GPR,10/06/2025  8:29 am,,High-Grade Auger Sampling Results Extend Surface Gold Zones  21  pages  4.1MB
MTS,10/06/2025  8:29 am,,Further strengthening of Hardware pillar / Earnings update  3  pages  216.3KB
RXR,10/06/2025  8:29 am,Â,Becoming a substantial holder  4  pages  530.3KB
CWY,10/06/2025  8:29 am,Â,Becoming a substantial holder  6  pages  1.1MB
VVA,10/06/2025  8:29 am,Â,Update - Notification of buy-back - VVA  6  pages  18.2KB
JAL,10/06/2025  8:28 am,Â,Application for quotation of securities - JAL  6  pages  18.5KB
PRX,10/06/2025  8:28 am,,Part Underwritten Entitlement Offer to Raise approx. $6.35M  4  pages  195.1KB
AFL,10/06/2025  8:28 am,Â,Notification regarding unquoted securities - AFL  6  pages  18.8KB
RUL,10/06/2025  8:28 am,Â,Notification of cessation of securities - RUL  4  pages  14.8KB
LEX,10/06/2025  8:28 am,,Major Milestone as LEX Secures First Toll Milling Agreement  7  pages  1.0MB
RUL,10/06/2025  8:28 am,Â,Update - Notification of buy-back - RUL  6  pages  18.5KB
ATA,10/06/2025  8:28 am,Â,Update - Notification of buy-back - ATA  6  pages  18.2KB
PRU,10/06/2025  8:28 am,Â,Change to Senior Management Team  1  page  265.6KB
JGH,10/06/2025  8:28 am,,Jade Brings First Gas Production Wells Online  7  pages  702.1KB
LM8,10/06/2025  8:28 am,,More Shallow Gold Recorded in Surface Sampling and Drilling  35  pages  4.6MB
GDM,10/06/2025  8:28 am,Â,GDM Awarded Grant to Test Banshee Antimony-Gold Target  4  pages  855.9KB
CTT,10/06/2025  8:27 am,Â,Becoming a substantial holder  17  pages  1.4MB
NXT,10/06/2025  8:27 am,,Contracted Utilisation & Forward Order Book Update  2  pages  141.2KB
VRL,10/06/2025  8:27 am,Â,Notification regarding unquoted securities - VRL  5  pages  16.7KB
IMD,10/06/2025  8:27 am,Â,IMDEX Refinancing Facilities Announcement  2  pages  820.3KB
ORI,10/06/2025  8:27 am,Â,Update - Notification of buy-back - ORI  6  pages  18.4KB
WOR,10/06/2025  8:27 am,Â,Update - Notification of buy-back - WOR  6  pages  18.2KB
FPC,10/06/2025  8:27 am,Â,Update - Notification of buy-back - FPC  6  pages  18.2KB
SBM,10/06/2025  8:27 am,Â,Becoming a substantial holder for GPR  25  pages  680.7KB
GPR,10/06/2025  8:27 am,Â,Becoming a substantial holder from SBM  25  pages  680.7KB
TMS,10/06/2025  8:26 am,Â,Change in substantial holding  3  pages  171.3KB
CAA,10/06/2025  8:26 am,Â,Update - Notification of buy-back - CAA  6  pages  18.2KB
HM1,10/06/2025  8:26 am,Â,Weekly NTA Estimate  1  page  684.4KB
SRR,10/06/2025  8:26 am,Â,Statement of CDIs on issue - SRR  3  pages  13.3KB
MYX,10/06/2025  8:26 am,Â,Becoming a substantial holder from MUFG  87  pages  411.7KB
HZR,10/06/2025  8:25 am,Â,HZR Partners with PSRI to Accelerate Commercialisation  2  pages  311.5KB
TOP,10/06/2025  8:25 am,Â,Update - Notification of buy-back - TOP  6  pages  18.5KB
CBA,10/06/2025  8:25 am,Â,CBA completes sale of shareholding in Bank of Hangzhou  1  page  140.3KB
NH3,10/06/2025  8:25 am,,"NH3, Pilbara Ports & Oceania Sign Joint Development Agt  4  pages  217.0KB"
ICE,10/06/2025  8:25 am,Â,Proposed issue of securities - ICE  5  pages  18.6KB
AVH,10/06/2025  8:25 am,Â,AVH Highlights RECELL Study Showing Shorter Hospital Stay  2  pages  182.6KB
LSF,10/06/2025  8:25 am,Â,Net Tangible Asset Backing  1  page  102.9KB
ICE,10/06/2025  8:25 am,,SoftBank partnership  7  pages  235.9KB
VRS,10/06/2025  8:22 am,Â,Update - Notification of buy-back - VRS  6  pages  18.4KB
XYZ,10/06/2025  8:21 am,Â,Notice of Proposed Sale of Securities  3  pages  212.6KB
RAG,10/06/2025  8:21 am,Â,Change in substantial holding for HTM  2  pages  293.7KB
HTM,10/06/2025  8:21 am,Â,Change in substantial holding from RAG  2  pages  293.7KB
RMD,10/06/2025  8:21 am,Â,Statement of Changes in Beneficial Ownership  2  pages  12.1KB
INA,10/06/2025  8:20 am,Â,Becoming a substantial holder  12  pages  1.3MB
URW,10/06/2025  8:18 am,Â,URW SE - Exercise of PSO - S MONTCOUQUIOL  3  pages  129.2KB
VPG,10/06/2025  8:18 am,Â,Annual Report to shareholders  248  pages  24.3MB
FRA,10/06/2025  8:18 am,Â,"Applications, Redemptions, Units on Issue and OTC 31.05.2025  2  pages  455.7KB"
CNJ,10/06/2025  8:18 am,Â,Half Year Accounts  26  pages  1.6MB
EOS,10/06/2025  8:17 am,Â,Notification regarding unquoted securities - EOS  8  pages  24.6KB
ECH,10/06/2025  7:31 am,Â,COMPLETES ACQUISITION OF AMADEUS BASIN EXPLORATION PERMIT EP  2  pages  536.6KB
FPH,10/06/2025  7:30 am,Â,Notification of closing date for Director nominations  1  page  88.8KB
GNE,10/06/2025  7:30 am,Â,Genesis streamlines its retail business to accelerate Gen35  2  pages  67.4KB
MCY,10/06/2025  7:30 am,Â,Investor Day 2025  82  pages  11.0MB
WBC,10/06/2025  7:30 am,Â,Appointment of Philippa Greenwood to the Westpac Board  1  page  265.4KB
