ASX Code,Date,Price sens.,Headline
VVA,10/02/2025  8:29 am,Â,Update - Notification of buy-back - VVA  6  pages  18.2KB
PLY,10/02/2025  8:29 am,Â,2K & Firaxis Games Announce Civilization VII - VR  3  pages  344.1KB
SIQ,10/02/2025  8:29 am,,Monash Health appoints Smartgroup  1  page  68.4KB
JAN,10/02/2025  8:29 am,Â,Board Update  3  pages  134.7KB
JAN,10/02/2025  8:28 am,,1H25 Investor Presentation  20  pages  2.1MB
JAN,10/02/2025  8:28 am,,1H25 Unaudited Results & Investor Update  3  pages  179.5KB
NAB,10/02/2025  8:28 am,Â,Notification of cessation of securities - NAB  4  pages  14.7KB
NWS,10/02/2025  8:28 am,Â,Notification of cessation of securities - NWS  4  pages  14.6KB
MSV,10/02/2025  8:28 am,Â,Update - Notification of buy-back - MSV  6  pages  18.2KB
NWS,10/02/2025  8:28 am,Â,Notification of cessation of securities - NWS  4  pages  14.6KB
GLA,10/02/2025  8:28 am,,Amended Appendix 5B quarterly cashflow report  5  pages  352.2KB
NAB,10/02/2025  8:28 am,Â,Update - Notification of buy-back - NAB  6  pages  18.4KB
VFY,10/02/2025  8:27 am,Â,Application for quotation of securities - VFY  5  pages  16.7KB
ENV,10/02/2025  8:27 am,,CODA CENTRAL ASSAYS ON ROUTE TO LABS WITH PRIORITY STATUS  25  pages  2.9MB
RG8,10/02/2025  8:27 am,Â,Update - Notification of buy-back - RG8  6  pages  18.4KB
VEN,10/02/2025  8:27 am,Â,Initial Director's Interest Notice  2  pages  205.6KB
ING,10/02/2025  8:27 am,Â,Biosecurity update  1  page  185.8KB
VG1,10/02/2025  8:27 am,Â,Update - Notification of buy-back - VG1  6  pages  18.4KB
MEU,10/02/2025  8:27 am,,Heavy Mineral Titanium Discovery - Drilling extended to west  13  pages  2.2MB
BTR,10/02/2025  8:27 am,,High-Grades up to 65g/t Au at Second Fortune Gold Mine  17  pages  1.5MB
PLS,10/02/2025  8:26 am,,Business and Earnings Update  4  pages  716.4KB
KGL,10/02/2025  8:26 am,,KGL Jervois Project Feasibility Study Update 2025  193  pages  12.8MB
SRR,10/02/2025  8:26 am,,Sarama - Geochemistry Program Underway at Cosmo Gold Project  22  pages  1.5MB
BDG,10/02/2025  8:26 am,Â,Strategic Investment Project Application Salave Gold  3  pages  490.0KB
JBH,10/02/2025  8:26 am,Â,Dividend/Distribution - JBH  4  pages  16.7KB
AZ9,10/02/2025  8:26 am,Â,Investor Presentation  21  pages  3.5MB
ARV,10/02/2025  8:26 am,Â,Pilbara Gold Drilling Commences  3  pages  417.7KB
JAV,10/02/2025  8:26 am,,High grade gold and copper delivered at Coogee  26  pages  1.9MB
LIN,10/02/2025  8:26 am,Â,Lindian Board Changes To Accerlate Project Delivery  3  pages  238.5KB
MOH,10/02/2025  8:25 am,,Sale of Empress Springs  4  pages  146.5KB
LIN,10/02/2025  8:25 am,Â,Initial Director's Interest Notice - Komur  2  pages  204.9KB
SUM,10/02/2025  8:25 am,,Appointment of Experienced Mining Executive as CEO  4  pages  715.8KB
LIN,10/02/2025  8:25 am,Â,Final Director's Interest Notice - Steele  2  pages  191.4KB
GUE,10/02/2025  8:25 am,Â,GUE strengthens Board through appointment of H Schumann  3  pages  419.4KB
PEK,10/02/2025  8:25 am,Â,Change of Director's Interest Notice  3  pages  233.1KB
VR1,10/02/2025  8:24 am,,Vection Achieves Dell Titanium Partner Status  3  pages  274.2KB
CPN,10/02/2025  8:24 am,,Drilling Underway at the Bygoo Tin Project  4  pages  1.8MB
HRZ,10/02/2025  8:24 am,,Australia's Newest Gold Producer Presentation  30  pages  7.8MB
FME,10/02/2025  8:24 am,Â,Notification of cessation of securities - FME  4  pages  14.8KB
GG8,10/02/2025  8:24 am,,New Gold Lode Emerges North of Comet Vale's Sovereign  14  pages  1.1MB
ALB,10/02/2025  8:24 am,,New Priority Gold Targets Identified at Yandal West  26  pages  1.7MB
TZN,10/02/2025  8:24 am,,Bird in Hand Gold Project - Terramin Lodges Appeal  2  pages  222.3KB
RMX,10/02/2025  8:23 am,Â,Change of Director's Interest Notice  2  pages  281.2KB
RMX,10/02/2025  8:23 am,Â,Notification of cessation of securities - RMX  4  pages  14.8KB
RRL,10/02/2025  8:23 am,Â,Bell Potter Unearthed Conference Presentation  32  pages  7.6MB
PLC,10/02/2025  8:23 am,,Encouraging Gold Samples Identified at Abbotts North  16  pages  1.8MB
RGL,10/02/2025  8:23 am,,RGL Identifies Significant Gold Potential at Tambourah  4  pages  649.9KB
FRB,10/02/2025  8:23 am,,FRB SIGNS NON-BINDING MOU WITH ERAMET FOR MANGANESE ORE  5  pages  323.4KB
MMI,10/02/2025  8:23 am,Â,Investor Presentation  15  pages  4.0MB
BGL,10/02/2025  8:22 am,Â,Updated corporate presentation  26  pages  7.2MB
PNR,10/02/2025  8:22 am,Â,East Coast Roadshow Presentation  26  pages  3.8MB
CAR,10/02/2025  8:22 am,,FY25 Half Year Results Presentation  38  pages  4.9MB
CAR,10/02/2025  8:22 am,,FY25 Half Year Media Release  6  pages  206.6KB
CAR,10/02/2025  8:22 am,Â,Dividend/Distribution - CAR  5  pages  18.5KB
CAR,10/02/2025  8:22 am,,Appendix 4D and FY25 Half Year Report  29  pages  1.5MB
SW1,10/02/2025  8:22 am,Â,Notification of cessation of securities - SW1  4  pages  14.8KB
SP3,10/02/2025  8:22 am,Â,Notification of cessation of securities - SP3  4  pages  14.8KB
WC8,10/02/2025  8:22 am,,WILDCAT ADVANCES PFS FOR TABBA TABBA LITHIUM PROJECT  12  pages  1.1MB
MHM,10/02/2025  8:21 am,,Positive Soil Sample Results  16  pages  2.2MB
MAU,10/02/2025  8:21 am,Â,Change of Director's Interest Notice - Lim  3  pages  265.9KB
JBH,10/02/2025  8:21 am,,Appendix 4D and Financial Report - 2025 Half Year  23  pages  926.1KB
SFR,10/02/2025  8:21 am,Â,December 2024 Half Year Financial Results Advisory  1  page  110.7KB
FPC,10/02/2025  8:21 am,Â,Update - Notification of buy-back - FPC  6  pages  18.2KB
RMD,10/02/2025  8:21 am,Â,Form 144 - Notice of Proposed Sale of Securities  2  pages  111.1KB
IIS,10/02/2025  8:21 am,Â,Secondary issue of new units  1  page  153.7KB
AD8,10/02/2025  8:21 am,Â,Becoming a substantial holder  38  pages  1.8MB
MIN,10/02/2025  8:20 am,Â,Ceasing to be a substantial holder  35  pages  1.8MB
STW,10/02/2025  8:20 am,Â,Daily Fund Update  9  pages  180.4KB
SLF,10/02/2025  8:20 am,Â,Daily Fund Update  4  pages  77.1KB
SFY,10/02/2025  8:20 am,Â,Daily Fund Update  4  pages  79.3KB
ANZ,10/02/2025  8:13 am,Â,Update - Notification of buy-back - ANZ  6  pages  18.4KB
WBC,10/02/2025  8:00 am,Â,Appointment of Non-executive Directors to the Westpac Board  2  pages  162.5KB
ANN,10/02/2025  7:47 am,Â,Dividend/Distribution - ANN  5  pages  18.9KB
ANN,10/02/2025  7:47 am,,Ansell HY FY25 Results Presentation  33  pages  4.6MB
ANN,10/02/2025  7:47 am,,Ansell HY FY25 Results Announcement  6  pages  303.9KB
ANN,10/02/2025  7:47 am,,Ansell HY FY25 Report & Accounts (Appendix 4D)  29  pages  3.2MB
MEZ,10/02/2025  7:30 am,Â,Ruakaka Solar Farm gains planning consent  2  pages  109.2KB
SM1,10/02/2025  7:30 am,Â,Synlait HY25 results date and conference call details  1  page  67.2KB
