ASX Code,Date,Price sens.,Headline
CCX,09/07/2024  8:24 AM,,Successful Completion of the Sale of Avenue  1  page  110.2KB
SKO,09/07/2024  8:22 AM,,Capital Change Notice  2  pages  88.3KB
NAB,09/07/2024  8:18 AM,,Update - Notification of buy-back - NAB  6  pages  18.4KB
OAR,09/07/2024  8:17 AM,,GBA Capital - Brazilian Resources Conference Presentation  27  pages  5.9MB
TL1,09/07/2024  8:16 AM,,Telstra Announces Mobile Pricing Update  2  pages  176.5KB
TLS,09/07/2024  8:16 AM,,Telstra Announces Mobile Pricing Update  2  pages  176.5KB
PVL,09/07/2024  8:16 AM,,ACCI Investment  3  pages  190.2KB
IPX,09/07/2024  8:16 AM,,Change of Director's Interest Notice x2  4  pages  462.5KB
CPU,09/07/2024  8:16 AM,,Update - Notification of buy-back - CPU  6  pages  18.4KB
IPX,09/07/2024  8:16 AM,,Notice under Section 708A  1  page  137.0KB
SPR,09/07/2024  8:16 AM,,Never Never and Pepper deliver exceptional assays  17  pages  1.8MB
PPS,09/07/2024  8:16 AM,,Notification of cessation of securities - PPS  4  pages  14.9KB
CTQ,09/07/2024  8:16 AM,,CEO Resignation  3  pages  186.7KB
IPX,09/07/2024  8:15 AM,,Application for quotation of securities - IPX  8  pages  20.7KB
IPX,09/07/2024  8:15 AM,,Application for quotation of securities - IPX  8  pages  20.7KB
RUL,09/07/2024  8:15 AM,,Notification of cessation of securities - RUL  4  pages  14.9KB
5EA,09/07/2024  8:15 AM,,5EA - Appendix 3Y (x1)  3  pages  150.6KB
RUL,09/07/2024  8:15 AM,,Update - Notification of buy-back - RUL  6  pages  18.6KB
EXR,09/07/2024  8:15 AM,,Webinar Presentation  23  pages  2.8MB
FPR,09/07/2024  8:15 AM,,Update - Notification of buy-back - FPR  6  pages  18.5KB
SQ2,09/07/2024  8:15 AM,,NOTICE OF PROPOSED SALE OF SECURITIES  3  pages  110.3KB
TSK,09/07/2024  8:14 AM,,Becoming a substantial holder  3  pages  520.6KB
RNT,09/07/2024  8:14 AM,,Update - Proposed issue of securities - RNT  7  pages  26.1KB
RNT,09/07/2024  8:14 AM,,Rights Issue Offer Closing Date Extended  2  pages  366.4KB
MEU,09/07/2024  8:13 AM,,Drilling program update  5  pages  1.3MB
SUN,09/07/2024  8:13 AM,,ANZ: Proclamation of Queensland legislation  1  page  97.6KB
ANZ,09/07/2024  8:13 AM,,Proclamation of Queensland legislation  1  page  97.6KB
AN3,09/07/2024  8:13 AM,,Proclamation of Queensland legislation  1  page  97.6KB
SB2,09/07/2024  8:13 AM,,Change in substantial holding  3  pages  403.1KB
STX,09/07/2024  8:12 AM,,West Erregulla receives EPA Approval  1  page  97.2KB
ALI,09/07/2024  8:12 AM,,Weekly NTA estimate - Fri 5.7.24  1  page  239.1KB
VG1,09/07/2024  8:12 AM,,Update - Notification of buy-back - VG1  6  pages  18.8KB
IPX,09/07/2024  8:12 AM,,Change in substantial holding  4  pages  581.5KB
LSF,09/07/2024  8:11 AM,,Net Tangible Asset Backing  1  page  219.9KB
MAU,09/07/2024  8:11 AM,,Investor Presentation  33  pages  2.1MB
EM2,09/07/2024  8:11 AM,,Copper Porphyry-Style Targets Confirmed at Silver Mountain  16  pages  2.2MB
WGX,09/07/2024  8:11 AM,,ISS Recommends Karora Shareholders Vote For Merger  3  pages  138.5KB
TTT,09/07/2024  8:10 AM,,Notice Under Section 708A (5) Of The Corporations Act  1  page  58.4KB
TTT,09/07/2024  8:10 AM,,Application for quotation of securities - TTT  6  pages  19.1KB
GNP,09/07/2024  8:10 AM,,Genus Awarded Long Term Western Power Maintenance Works  2  pages  370.0KB
TRM,09/07/2024  8:10 AM,,Change of Director's Interest Notice - EE Smith  3  pages  87.8KB
NTL,09/07/2024  7:33 AM,,NTL Rights Issue Ineligible Shareholder Notice  1  page  180.4KB
NTL,09/07/2024  7:32 AM,,NTL Rights Offer  16  pages  4.5MB
AFP,09/07/2024  7:30 AM,,AFT agrees distribution for Crystaderm in China  2  pages  122.0KB
CNU,09/07/2024  7:30 AM,,Chorus full year results date  1  page  135.5KB
CNU,09/07/2024  7:30 AM,,Q4 FY24 Connections Update  14  pages  566.8KB
MOV,09/07/2024  7:30 AM,,SPH Notice - NAOS  2  pages  198.2KB
SKO,09/07/2024  7:30 AM,,Notification regarding unquoted securities - SKO  6  pages  20.0KB
