ASX Code,Date,Price sens.,Headline
CPM,20/07/2026  8:26 am,Â,Completion of Pyramid Gold Project Acquisition  6  pages  600.7KB
A1M,20/07/2026  8:26 am,Â,CPM: Completion of Pyramid Gold Project Acquisition  6  pages  600.7KB
DNL,20/07/2026  8:26 am,Â,Update - Notification of buy-back - DNL  6  pages  18.4KB
SHV,20/07/2026  8:26 am,Â,Update - Notification of buy-back - SHV  6  pages  18.5KB
SXE,20/07/2026  8:26 am,Â,FY26 Results Webcast Details  1  page  164.1KB
FPR,20/07/2026  8:26 am,Â,Update - Notification of buy-back - FPR  6  pages  18.3KB
MDI,20/07/2026  8:26 am,Â,MDI Strengthens Serbian Leadership Team  5  pages  555.0KB
QBE,20/07/2026  8:26 am,,A$ Subordinated Notes Redemption  3  pages  324.8KB
CTP,20/07/2026  8:26 am,Â,CFO Resignation  2  pages  242.7KB
FHE,20/07/2026  8:25 am,,Monford appointed as fixed-price EPC contractor  2  pages  237.7KB
BCI,20/07/2026  8:25 am,,June 2026 Quarterly Update  30  pages  16.9MB
DOW,20/07/2026  8:25 am,Â,Ceasing to be a substantial holder  15  pages  971.3KB
PRN,20/07/2026  8:25 am,,Contract extension and sale of equipment agreed at Iduapriem  1  page  327.2KB
BCI,20/07/2026  8:25 am,,June 2026 Quarterly Activities Report  10  pages  1.2MB
MHM,20/07/2026  8:25 am,,Drill Contract Awarded for Mt Solitary Phase 3 Program  6  pages  1.4MB
MGX,20/07/2026  8:25 am,Â,MGX Noosa Mining Investor Conference Presentation  16  pages  3.5MB
MGX,20/07/2026  8:24 am,,Quarterly Activities Report  8  pages  803.8KB
BGL,20/07/2026  8:24 am,Â,Change of Registered Address  1  page  281.7KB
DRE,20/07/2026  8:24 am,,12 Mineralised Corridors Identified and Growing  19  pages  2.6MB
MRT,20/07/2026  8:24 am,,Early Works Commence at Black Swan Processing Hub  5  pages  375.2KB
GNG,20/07/2026  8:24 am,,MRT: Early Works Commence at Black Swan Processing Hub  5  pages  375.2KB
GMN,20/07/2026  8:24 am,,Strong Metallurgical Test Results from Capivara  27  pages  2.3MB
LEL,20/07/2026  8:24 am,,Airborne Geophysical Surveys Completed at Capricorn Project  6  pages  1.1MB
FLT,20/07/2026  8:24 am,Â,Update - Notification of buy-back - FLT  6  pages  18.4KB
OLY,20/07/2026  8:24 am,,Acquisition of High-Grade Silver Project in Silver Valley  24  pages  2.8MB
NWS,20/07/2026  8:24 am,Â,Notification of cessation of securities - NWS  4  pages  14.6KB
NWS,20/07/2026  8:23 am,Â,Notification of cessation of securities - NWS  4  pages  14.6KB
OLY,20/07/2026  8:23 am,,Raven/Sawtooth Acquisition Clarification and Retraction  9  pages  701.0KB
VYS,20/07/2026  8:23 am,,Investor Update July 2026  26  pages  3.6MB
BHD,20/07/2026  8:23 am,,Litigation Update  1  page  23.2KB
CRR,20/07/2026  8:23 am,Â,Technical Thermal Management Adviser Appointed  5  pages  384.6KB
WJL,20/07/2026  8:23 am,Â,Update - Notification of buy-back - WJL  6  pages  18.3KB
PBH,20/07/2026  8:23 am,Â,Appendix 4G  14  pages  417.4KB
LNQ,20/07/2026  8:23 am,,Appointment of Chief Executive Officer  1  page  151.2KB
WYX,20/07/2026  8:22 am,Â,Share Purchase Plan Offer Open  1  page  167.4KB
WYX,20/07/2026  8:22 am,Â,Update - Proposed issue of securities - WYX  7  pages  24.1KB
NES,20/07/2026  8:22 am,,High-Grade Gold and Bonanza Silver Results at Orleans Mine  13  pages  920.1KB
CUF,20/07/2026  8:22 am,Â,Change in substantial holding from EUR  3  pages  221.4KB
EUR,20/07/2026  8:22 am,Â,Change in substantial holding for CUF  3  pages  221.4KB
CLA,20/07/2026  8:22 am,,MMCI OLSA update  2  pages  171.5KB
STH,20/07/2026  8:22 am,Â,Update - Notification of buy-back - STH  6  pages  18.4KB
SBM,20/07/2026  8:22 am,,Q4 FY26 Preliminary Update  2  pages  181.0KB
UWC,20/07/2026  8:21 am,Â,Update - Notification of buy-back - UWC  6  pages  18.3KB
CGR,20/07/2026  8:21 am,Â,Drilling Commences at Christmas Well Leonora Project  4  pages  699.0KB
GLL,20/07/2026  8:21 am,,"Zydeco-1 on track, delivering strong gas shows  9  pages  1.4MB"
DYL,20/07/2026  8:21 am,,Tumas Civil and Concrete Construction Contracts Awarded  3  pages  244.3KB
AAI,20/07/2026  8:21 am,Â,Rule 425 Filing  5  pages  169.1KB
XYZ,20/07/2026  8:21 am,Â,Notice of Proposed Sale of Securities  5  pages  246.0KB
ATM,20/07/2026  8:20 am,,ANTAM Distributes Dividends of Rp5.04 Trillion  1  page  539.4KB
CKF,20/07/2026  8:20 am,Â,Becoming a substantial holder  2  pages  242.1KB
BST,20/07/2026  8:20 am,,Boresight Leases New Facility to Scale U.S. Manufacturing  4  pages  602.5KB
BAP,20/07/2026  8:20 am,Â,Becoming a substantial holder  29  pages  2.4MB
STW,20/07/2026  8:20 am,Â,Daily Fund Update  9  pages  182.7KB
SLF,20/07/2026  8:20 am,Â,Daily Fund Update  4  pages  77.1KB
SFY,20/07/2026  8:20 am,Â,Daily Fund Update  4  pages  79.9KB
A2M,20/07/2026  7:31 am,Â,FY26 Results Announcement Date and Webcast Notification  1  page  100.2KB
TRA,20/07/2026  7:30 am,Â,Update - Dividend/Distribution - TRA  5  pages  19.9KB
TRA,20/07/2026  7:30 am,Â,Dividend Reinvestment Plan Strike Price  1  page  248.5KB
VGL,20/07/2026  7:30 am,Â,Director Appointment/Resignation  1  page  118.5KB
FBU,20/07/2026  7:30 am,,"Fletcher Building, Govt to secure NZ cement manufacturing  3  pages  176.4KB"
IFT,20/07/2026  7:30 am,Â,Infratil Limited's Notice of Meeting and Proxy Form  27  pages  8.5MB
