ASX Code,Date,Price sens.,Headline
VIT,08/11/2023  8:48 AM,,Cortexa update - product landed  4  pages  233.5KB
PMC,08/11/2023  8:46 AM,,Update - Notification of buy-back - PMC  6  pages  28.0KB
MMA,08/11/2023  8:46 AM,,"Wide, Shallow High-Grade Intercepts at Maronan  36  pages  3.9MB"
ODA,08/11/2023  8:46 AM,,New SaaS Transport Management Contract  2  pages  282.4KB
KLR,08/11/2023  8:45 AM,,Notice of Annual General Meeting/Proxy Form  4  pages  779.4KB
JMS,08/11/2023  8:45 AM,,Strategy Update - EV Batteries  9  pages  2.1MB
MYX,08/11/2023  8:43 AM,,Update - Notification of buy-back - MYX  6  pages  27.7KB
ALG,08/11/2023  8:43 AM,,2023 AGM Addresses  8  pages  320.0KB
MFD,08/11/2023  8:42 AM,,Final Director's Interest Notice  2  pages  502.4KB
MFD,08/11/2023  8:42 AM,,Director Appointment  1  page  192.2KB
HLI,08/11/2023  8:42 AM,,Update - Notification of buy-back - HLI  6  pages  27.9KB
RCE,08/11/2023  8:41 AM,,AGM Presentation  21  pages  1.9MB
ALG,08/11/2023  8:40 AM,,2023 AGM Presentation  14  pages  4.9MB
EGG,08/11/2023  8:37 AM,,Update - Notification of buy-back - EGG  6  pages  28.0KB
RAD,08/11/2023  8:37 AM,,Entitlement Offer Documents  46  pages  5.6MB
G50,08/11/2023  8:35 AM,,Change of Director's Interest Notice - Foulis  2  pages  296.6KB
G50,08/11/2023  8:34 AM,,Change of Director's Interest Notice -Reynolds  3  pages  317.6KB
G50,08/11/2023  8:34 AM,,Change of Directors Interest Notice - Wallace  3  pages  284.0KB
GAL,08/11/2023  8:34 AM,,Geophysical IP Surveying Underway at Norseman  5  pages  1.7MB
ALG,08/11/2023  8:31 AM,,Update - Notification of buy-back - ALG  6  pages  27.8KB
TRS,08/11/2023  8:31 AM,,Update - Notification of buy-back - TRS  6  pages  27.8KB
WBC,08/11/2023  8:31 AM,,Westpac tenders external audit services  1  page  149.1KB
G50,08/11/2023  8:29 AM,,Application for quotation of securities - G50  7  pages  30.9KB
PNN,08/11/2023  8:28 AM,,Notification regarding unquoted securities - PNN  6  pages  29.1KB
HFR,08/11/2023  8:26 AM,,Updated Muga Feasibility Study  32  pages  2.8MB
SKF,08/11/2023  8:25 AM,,Chief Executive Officer Appointment  3  pages  1.1MB
RG8,08/11/2023  8:25 AM,,Update - Notification of buy-back - RG8  6  pages  27.8KB
QAN,08/11/2023  8:25 AM,,Final Director's Interest Notice  2  pages  157.4KB
WDS,08/11/2023  8:25 AM,,Investor Briefing Day 2023  87  pages  8.0MB
QAN,08/11/2023  8:25 AM,,Update - Notification of buy-back - QAN  6  pages  28.1KB
DEV,08/11/2023  8:25 AM,,Significant Uranium Intercepts at U40  18  pages  2.3MB
BOL,08/11/2023  8:25 AM,,Change of Director's Interest Notice  2  pages  730.0KB
CAA,08/11/2023  8:25 AM,,Update - Notification of buy-back - CAA  6  pages  27.7KB
SWM,08/11/2023  8:24 AM,,Update - Notification of buy-back - SWM  6  pages  27.9KB
BOL,08/11/2023  8:24 AM,,Update - Notification of buy-back - BOL  6  pages  27.7KB
ARG,08/11/2023  8:24 AM,,Monthly NTA & Investment Update - 31 October 2023  2  pages  3.3MB
MCP,08/11/2023  8:24 AM,,Ceasing to be a substantial holder  4  pages  178.4KB
DMG,08/11/2023  8:24 AM,,Corporate Governance Statement  11  pages  607.2KB
RDX,08/11/2023  8:24 AM,,2023 AGM Presentation  24  pages  1.4MB
MRC,08/11/2023  8:24 AM,,Change in substantial holding  6  pages  242.8KB
BTI,08/11/2023  8:23 AM,,Net Tangible Asset Backing  7  pages  1.2MB
WIA,08/11/2023  8:23 AM,,Exploration update  10  pages  900.4KB
HMD,08/11/2023  8:23 AM,,Resignation of CEO & MD and appointment new CFO  2  pages  117.0KB
KZA,08/11/2023  8:23 AM,,Change in substantial holding  5  pages  1.6MB
ANN,08/11/2023  8:23 AM,,Update - Notification of buy-back - ANN  6  pages  27.9KB
WGX,08/11/2023  8:23 AM,,Change in substantial holding  8  pages  277.5KB
JBY,08/11/2023  8:22 AM,,James Bay increases La Grande Project area by 70%  11  pages  1.3MB
DAL,08/11/2023  8:22 AM,,Goodbody Prospect Bolstered & New Gold Targets  18  pages  2.2MB
BML,08/11/2023  8:22 AM,,Significant Intercepts at Sorby Hills  19  pages  1.3MB
DRE,08/11/2023  8:22 AM,,Further Ni-Cu-Co-3PGE Assays & Drilling to Recommence  14  pages  1.7MB
DHG,08/11/2023  8:22 AM,,Chair's Address to Shareholders  31  pages  4.3MB
LOM,08/11/2023  8:22 AM,,Lulo Unearths 235 Carat Diamond - Second Largest to Date  4  pages  329.0KB
BTE,08/11/2023  8:22 AM,,Change of Director's Interest Notice - WGM  3  pages  261.4KB
WA1,08/11/2023  8:21 AM,,West Arunta Project - Luni Assay Results  16  pages  1.9MB
ICI,08/11/2023  8:21 AM,,Becoming a substantial holder  3  pages  1.2MB
ZER,08/11/2023  8:21 AM,,Daily share buy-back notice - Appendix 3E  2  pages  323.9KB
VG1,08/11/2023  8:21 AM,,Update - Notification of buy-back - VG1  6  pages  27.8KB
DEV,08/11/2023  8:21 AM,,Results of Entitlement Offer  1  page  164.0KB
SIX,08/11/2023  8:20 AM,,New Automotive Supercharger Systems Released  3  pages  8.5MB
GSM,08/11/2023  8:19 AM,,Pegmatite Dykes Identified at Paynes Find  10  pages  632.8KB
PWN,08/11/2023  8:19 AM,,Partnership to Advance Strategic Opportunities  6  pages  1.1MB
HLX,08/11/2023  8:19 AM,,Bijoux Copper Drilling Starts  6  pages  1.1MB
ORR,08/11/2023  8:19 AM,,Despatch of Scheme Booklet  6  pages  377.4KB
YRL,08/11/2023  8:18 AM,,RC Drilling to Commence at Oblique Prospect - Yandal Belt  8  pages  1.2MB
PLL,08/11/2023  8:18 AM,,Piedmont Lithium Reports Third Quarter 2023 Results  11  pages  829.0KB
PRN,08/11/2023  8:18 AM,,Update - Notification of buy-back - PRN  6  pages  28.0KB
TWE,08/11/2023  8:18 AM,,Retail Entitlement Offer - Letter to ineligible shareholders  6  pages  418.8KB
DY6,08/11/2023  8:18 AM,,Machinga Licence Area Substantially Increased  2  pages  519.6KB
RRR,08/11/2023  8:18 AM,,Scale of Copper System Potential Emerging at Osprey  17  pages  1.7MB
TWE,08/11/2023  8:18 AM,,Retail Entitlement Offer- Retail Booklet and Opening Letter  80  pages  5.6MB
EL8,08/11/2023  8:17 AM,,Koppies Resource up 136% to 48 Mlb  78  pages  4.0MB
PGH,08/11/2023  8:17 AM,,Supplementary Bidder's Statement  2  pages  304.3KB
PGM,08/11/2023  8:17 AM,,Drilling confirms large-scale gold system at Hermes Prospect  19  pages  4.5MB
SEC,08/11/2023  8:17 AM,,Net Tangible Asset Backing  1  page  150.6KB
GPR,08/11/2023  8:17 AM,,Highly Experienced Mining Executives Appointed to Board  2  pages  267.1KB
GPR,08/11/2023  8:17 AM,,Work Program Advances and De-risks Woodlark Project  4  pages  590.5KB
MZZ,08/11/2023  8:16 AM,,Proposed issue of securities - MZZ  6  pages  29.5KB
GTE,08/11/2023  8:16 AM,,Proof of Concept Drilling Returns High-Grade Gold Results  17  pages  4.3MB
LLO,08/11/2023  8:16 AM,,Notice of Annual General Meeting  49  pages  572.0KB
MCP,08/11/2023  8:16 AM,,Ceasing to be a substantial holder  6  pages  136.5KB
EMH,08/11/2023  8:16 AM,,Statement of CDIs on issue - EMH  4  pages  23.2KB
JHX,08/11/2023  8:07 AM,,Q2 FY24 Results Pack  71  pages  5.7MB
JHX,08/11/2023  8:06 AM,,Q2 FY24 Results Announcement  1  page  1.9MB
SKT,08/11/2023  7:44 AM,,Sky Annual Meeting - Address and Presentation  44  pages  9.6MB
CNU,08/11/2023  7:30 AM,,Chorus annual shareholders' meeting  49  pages  5.3MB
SPK,08/11/2023  7:30 AM,,Notice of on-market share buyback  2  pages  146.8KB
VSL,08/11/2023  7:30 AM,,Chair's Address to Shareholders  38  pages  8.9MB
VNT,08/11/2023  7:30 AM,,Ceasing to be a substantial holder  54  pages  3.2MB
CNU,08/11/2023  7:30 AM,,Overview of Chorus expenditure proposal  18  pages  1.1MB
SKT,08/11/2023  7:30 AM,,Sky Board terminates NBIO discussions  1  page  374.8KB
