ASX Code,Date,Price sens.,Headline
IFT,15/09/2023  7:43 AM,,Capital Change Notice - Allotment of Infrastructure Bonds  2  pages  137.5KB
CWY,15/09/2023  7:32 AM,,Appointment of Chairman and Committee Changes  1  page  267.0KB
CNU,15/09/2023  7:31 AM,,Notice of on-market share buyback  2  pages  83.9KB
CEN,15/09/2023  7:31 AM,,Update - Dividend/Distribution - CEN  6  pages  32.2KB
MOV,15/09/2023  7:30 AM,,Disclosure Notice - Chris Dunphy  3  pages  125.6KB
MEZ,15/09/2023  7:30 AM,,Meridian and Contact extend conditions precedent  1  page  74.3KB
MEZ,15/09/2023  7:30 AM,,Meridian Energy monthly operating report for August 2023  14  pages  455.7KB
FPH,15/09/2023  7:30 AM,,FPH provides Investor Event presentation  119  pages  13.5MB
