ASX Code,Date,Price sens.,Headline
WC8,13/01/2025  12:58 pm,Â,Change of Director's Interest Notice - JE  3  pages  187.8KB
WC8,13/01/2025  12:50 pm,Â,Cleansing Statement  1  page  295.7KB
KTG,13/01/2025  12:47 pm,Â,Consolidation/Split - KTG  5  pages  18.7KB
WC8,13/01/2025  12:46 pm,Â,Application for quotation of securities - WC8  7  pages  21.2KB
AUQ,13/01/2025  12:44 pm,Â,Diamond Drilling Program Commenced at Al Wash-hi Mine  4  pages  556.0KB
MOT,13/01/2025  12:34 pm,Â,Daily Fund Update  1  page  609.6KB
PCI,13/01/2025  12:32 pm,Â,Daily Net Tangible Asset Statement  1  page  453.7KB
NXT,13/01/2025  12:18 pm,Â,Notification regarding unquoted securities - NXT  5  pages  16.7KB
DJW,13/01/2025  12:04 pm,Â,Weekly Estimated NTA as at 10 January 2025  1  page  271.9KB
AMH,13/01/2025  12:03 pm,Â,Weekly Estimated NTA as at 10 January 2025  1  page  203.2KB
MDR,13/01/2025  12:00 pm,Â,Application for quotation of securities - MDR  6  pages  18.6KB
TGF,13/01/2025  11:59 am,Â,Estimated Weekly NTA as of 10 January 2025  1  page  195.0KB
TRI,13/01/2025  11:58 am,Â,Proposed issue of securities - TRI  5  pages  17.1KB
PPT,13/01/2025  11:57 am,Â,Notification of cessation of securities - PPT  4  pages  14.7KB
HXL,13/01/2025  11:43 am,Â,Notification of cessation of securities - HXL  4  pages  14.8KB
CXL,13/01/2025  11:31 am,Â,Update - Proposed issue of securities - CXL  6  pages  20.0KB
IPD,13/01/2025  11:27 am,Â,Notification of cessation of securities - IPD  4  pages  15.3KB
TOT,13/01/2025  11:20 am,Â,Notice of Meeting  16  pages  1.4MB
C7A,13/01/2025  11:18 am,Â,Update - Proposed issue of securities - C7A  9  pages  29.6KB
EBG,13/01/2025  11:11 am,,Second Supplementary Target's Statement  7  pages  877.3KB
OML,13/01/2025  11:03 am,Â,Notification of cessation of securities - OML  4  pages  14.6KB
BCB,13/01/2025  10:48 am,Â,Final Director's Interest Notice  2  pages  185.3KB
NXL,13/01/2025  10:44 am,Â,Notification regarding unquoted securities - NXL  5  pages  16.7KB
A4N,13/01/2025  10:44 am,Â,Change of Director's Interest Notice  4  pages  282.9KB
TVN,13/01/2025  10:43 am,,Trading Halt  2  pages  561.2KB
THL,13/01/2025  10:36 am,Â,Notification of cessation of securities - THL  4  pages  14.7KB
TVN,13/01/2025  10:36 am,,Pause in Trading  1  page  114.8KB
SIX,13/01/2025  10:32 am,Â,Application for quotation of securities - SIX  6  pages  18.4KB
NXL,13/01/2025  10:23 am,Â,Notification regarding unquoted securities - NXL  7  pages  20.0KB
GQG,13/01/2025  10:22 am,Â,Date of Annual General Meeting  1  page  143.7KB
CTD,13/01/2025  10:21 am,Â,Notification of cessation of securities - CTD  4  pages  14.7KB
SFX,13/01/2025  10:20 am,Â,Change of Registered Office Address  2  pages  139.7KB
CTD,13/01/2025  10:17 am,Â,Notification regarding unquoted securities - CTD  5  pages  16.8KB
HNG,13/01/2025  10:15 am,,Non-Binding proposal to Acquire Assets of HCF for scrip  3  pages  246.7KB
HCF,13/01/2025  10:15 am,,HNG: Non-Binding proposal to Acquire Assets of HCF for scrip  3  pages  246.7KB
ELD,13/01/2025  10:14 am,Â,Change of Director's Interest Notice - I Wilton  3  pages  251.5KB
THL,13/01/2025  10:13 am,Â,Capital Change Notice  1  page  116.8KB
REP,13/01/2025  10:13 am,Â,Update - Notification of buy-back - REP  6  pages  18.3KB
ORP,13/01/2025  10:10 am,Â,Notice of Extraordinary General Meeting and Proxy Form  14  pages  496.1KB
ANO,13/01/2025  10:09 am,Â,Change of Director's Interest Notice - Lev Mizikovsky  3  pages  301.4KB
HCF,13/01/2025  10:07 am,,HCF receives non-binding proposal for investment portfolio  1  page  113.9KB
HNG,13/01/2025  10:07 am,,HCF: Receives non-binding proposal for investment portfolio  1  page  113.9KB
TOK,13/01/2025  10:04 am,Â,Ceasing to be a substantial holder  2  pages  413.8KB
BKI,13/01/2025  10:02 am,Â,BKI 10 January 2025 Weekly NTA  1  page  447.7KB
NVX,13/01/2025  10:02 am,Â,Application for quotation of securities - NVX  6  pages  18.4KB
CML,13/01/2025  10:00 am,Â,Becoming a substantial holder  3  pages  240.0KB
NZS,13/01/2025  9:59 am,,Response to ASX Aware Query Letter  5  pages  848.8KB
BCB,13/01/2025  9:55 am,Â,Resignation of Non-Executive Director  2  pages  269.7KB
TMK,13/01/2025  9:54 am,,GAS FLOWS COMMENCE FROM NEW WELLS  3  pages  437.1KB
COB,13/01/2025  9:51 am,Â,Investor Presentation  8  pages  2.3MB
JBH,13/01/2025  9:51 am,Â,Notification of cessation of securities - JBH  4  pages  14.7KB
PTX,13/01/2025  9:47 am,Â,Notification of cessation of securities - PTX  4  pages  14.8KB
VRC,13/01/2025  9:45 am,,Trading Halt  2  pages  570.5KB
SKM,13/01/2025  9:44 am,,Favourable Geology Confirmed at Narongo Prospect  12  pages  830.4KB
JBH,13/01/2025  9:44 am,Â,Notification regarding unquoted securities - JBH  9  pages  28.0KB
CPV,13/01/2025  9:44 am,Â,ClearVue Expands MENA Footprint Through Dune Trading in UAE  3  pages  548.8KB
SKY,13/01/2025  9:43 am,Â,Investor Hub Launch  1  page  244.2KB
LVE,13/01/2025  9:43 am,,Quarterly Update and Appendix 4C  8  pages  469.9KB
MGT,13/01/2025  9:42 am,Â,Proposed issue of securities - MGT  7  pages  25.4KB
VEA,13/01/2025  9:42 am,,Geelong Refinery update  2  pages  170.6KB
E25,13/01/2025  9:41 am,,Butcherbird Expansion Project Mining Proposal Approved  2  pages  869.6KB
CXL,13/01/2025  9:40 am,Â,Calix announces SPP extension  2  pages  346.6KB
AHI,13/01/2025  9:40 am,Â,AHI solutions to list on Microsoft ISV Marketplace  3  pages  260.6KB
FG1,13/01/2025  9:39 am,,"Flynn Expands Key Gold Targets at Golden Ridge, NE Tasmania  27  pages  3.6MB"
POL,13/01/2025  9:38 am,Â,Appointment of Executive Director Exploration  2  pages  238.2KB
NPM,13/01/2025  9:37 am,Â,Treuer Range Exploration Preparations  11  pages  4.1MB
BTE,13/01/2025  9:37 am,Â,Bridging Southern Africa's Gas Cliff  4  pages  360.7KB
W2V,13/01/2025  9:37 am,,Reinstatement to Quotation  1  page  111.5KB
W2V,13/01/2025  9:37 am,Â,Proposed issue of securities - W2V  5  pages  18.1KB
W2V,13/01/2025  9:36 am,,Way2VAT undertakes A$1.3 million convertible notes raising  5  pages  397.3KB
BSA,13/01/2025  9:36 am,Â,Application for quotation of securities - BSA  6  pages  18.3KB
CHW,13/01/2025  9:36 am,,GEOCHEM TESTING OF ANOMALIES HIGHLIGHT PRESENCE OF Nb and RE  21  pages  2.2MB
AVL,13/01/2025  9:35 am,,AVL Secures EPA Approval for Gabanintha Vanadium Project  5  pages  4.5MB
MGT,13/01/2025  9:35 am,Â,Proposed issue of securities - MGT  6  pages  22.5KB
AVR,13/01/2025  9:35 am,Â,Daily Stabilisation Activity Report - 10 January 2025  1  page  317.7KB
PMV,13/01/2025  9:34 am,,Premier Retail 1H25 Trading Update  2  pages  202.0KB
RDN,13/01/2025  9:34 am,,Final assay results from Andover South Maiden Drill Program  21  pages  1.8MB
OCL,13/01/2025  9:33 am,Â,Application for quotation of securities - OCL  6  pages  18.4KB
SEN,13/01/2025  9:32 am,Â,Completion of Exercise of Options  2  pages  93.0KB
AFI,13/01/2025  9:32 am,Â,Weekly Estimated NTA as at 10 January 2025  1  page  178.7KB
NPM,13/01/2025  9:32 am,Â,Change of Director's Interest Notice  2  pages  246.7KB
CMD,13/01/2025  9:31 am,Â,Proposed issue of securities - CMD  5  pages  17.7KB
CMD,13/01/2025  9:31 am,,Placement to raise $1.0m  1  page  217.4KB
OB1,13/01/2025  9:30 am,,Divestment of Mt Venn Project  4  pages  279.3KB
SRR,13/01/2025  9:30 am,Â,OB1: Divestment of Mt Venn Project  4  pages  279.3KB
IMR,13/01/2025  9:30 am,Â,Notification regarding unquoted securities - IMR  6  pages  18.5KB
SYR,13/01/2025  9:30 am,,Syrah awarded US$165 million US IRA tax credit  2  pages  164.2KB
KKC,13/01/2025  9:29 am,Â,Net Tangible Asset Backing  2  pages  185.9KB
MIR,13/01/2025  9:29 am,Â,Weekly Estimated NTA as at 10 January 2025  1  page  147.2KB
MYR,13/01/2025  9:28 am,,Trading Update  2  pages  193.4KB
SEN,13/01/2025  9:28 am,Â,Application for quotation of securities - SEN  6  pages  18.2KB
UNT,13/01/2025  9:27 am,,Partial Divestment in AudioStack and Renewal of APH Alliance  5  pages  3.1MB
BPP,13/01/2025  9:27 am,Â,Restructure of Bank Facilities  2  pages  259.3KB
SEN,13/01/2025  9:26 am,Â,Application for quotation of securities - SEN  6  pages  18.2KB
3DP,13/01/2025  9:25 am,,US$2 million Contract Extension from US Department of Energy  2  pages  2.3MB
TNC,13/01/2025  9:25 am,,Reinstatement to Quotation  1  page  422.7KB
TNC,13/01/2025  9:25 am,Â,Paul Cronin appointed Non-Executive Chairman  3  pages  1.8MB
TNC,13/01/2025  9:25 am,Â,Change of Director's Interest Notice B Jones  3  pages  196.9KB
TNC,13/01/2025  9:25 am,Â,Shareholder Distribution Schedule  1  page  68.7KB
TNC,13/01/2025  9:25 am,Â,Top 20 Shareholders  2  pages  73.4KB
TNC,13/01/2025  9:25 am,,Statement of Confirmations  13  pages  1.9MB
LDX,13/01/2025  9:25 am,Â,Lumos Partners with MedPro for Sales of FebriDx in the US  3  pages  321.8KB
RF1,13/01/2025  9:24 am,Â,Weekly Estimate NTA for 10.01.2025  1  page  151.4KB
SNC,13/01/2025  9:24 am,Â,Net Tangible Assets as at 31 December 2024  3  pages  218.0KB
CYP,13/01/2025  9:24 am,Â,Cynata to Present at Biotech Showcase  32  pages  13.7MB
NWH,13/01/2025  9:21 am,Â,Chief Financial Officer Resignation  1  page  210.5KB
MEC,13/01/2025  9:18 am,Â,Update - Notification of buy-back - MEC  6  pages  18.4KB
AAU,13/01/2025  9:17 am,,Summary of Pre-Feasibility Study for Nueva Sabana Mine  187  pages  11.7MB
VR1,13/01/2025  9:17 am,,EU XR Distribution and Nanotech Partnership  3  pages  279.7KB
GBR,13/01/2025  9:17 am,,Trading Halt  2  pages  561.8KB
SB2,13/01/2025  9:15 am,Â,Daily share buy-back notice  2  pages  217.5KB
RLT,13/01/2025  9:15 am,,Announcement regarding share price volatility  2  pages  135.3KB
PL3,13/01/2025  9:15 am,Â,Change of Director's Interest Notice - P Thomas  4  pages  225.7KB
FBR,13/01/2025  9:15 am,,FBR receives A$6.3 million R&D Tax Incentive Cash Rebate  1  page  127.5KB
ACW,13/01/2025  9:14 am,Â,ACW presents at Sachs Neuro & WHO grants INN emestedastat  39  pages  2.0MB
PE1,13/01/2025  9:14 am,Â,NAV 31 December 2024  1  page  172.3KB
LIT,13/01/2025  9:14 am,,Next steps agreed for LieNA commercialisation pathway  2  pages  228.7KB
MIN,13/01/2025  9:14 am,,LIT: Next steps agreed for LieNA commercialisation pathway  2  pages  228.7KB
TVL,13/01/2025  9:13 am,Â,Net Tangible Asset Backing - December 2024  3  pages  408.5KB
CNI,13/01/2025  9:13 am,Â,UBS upsizes commitment to Centuria Bass warehouse facility  2  pages  188.2KB
OCL,13/01/2025  9:12 am,Â,Application for quotation of securities - OCL  6  pages  18.3KB
IVZ,13/01/2025  9:12 am,,Cabora Bassa Basin SG 4571 Licence extended  3  pages  548.8KB
PL3,13/01/2025  9:12 am,Â,Notification of cessation of securities - PL3  4  pages  14.8KB
NVX,13/01/2025  9:11 am,Â,Additional Information on Conditional Commitment from US DOE  3  pages  110.5KB
FLG,13/01/2025  9:09 am,Â,FLG Corporate Presentation  28  pages  7.1MB
PHO,13/01/2025  9:09 am,,Sekarna Phosphate Project Formally Granted  9  pages  10.5MB
4DX,13/01/2025  9:09 am,,US DoD to conduct paid CT VQ pilot ahead of FDA submission  2  pages  226.9KB
RZI,13/01/2025  9:09 am,Â,Raiz Strengthens Board With Two New Non-Executive Directors  2  pages  221.4KB
TTT,13/01/2025  9:09 am,Â,Leadership Appointments - Titomic USA  2  pages  196.6KB
NWS,13/01/2025  9:08 am,Â,Appendix 3C  4  pages  75.7KB
RG8,13/01/2025  9:08 am,Â,Weekly NTA Update  1  page  27.5KB
PEB,13/01/2025  9:08 am,,Novitas finalizes non-coverage determination  22  pages  2.1MB
ETM,13/01/2025  9:08 am,Â,Julie Bishop and Partners Appointed as a Strategic Advisor  2  pages  250.4KB
TTT,13/01/2025  9:07 am,,Titomic CEO Jim Simpson appointed as Managing Director  4  pages  215.0KB
MBH,13/01/2025  9:07 am,Â,MBH Appoints Non-Executive Director  1  page  134.9KB
NWS,13/01/2025  9:07 am,Â,Appendix 3C  4  pages  75.7KB
ZIP,13/01/2025  9:06 am,Â,Zip FY25 Financial Reporting Calendar  2  pages  75.6KB
RG8,13/01/2025  9:05 am,Â,Update - Notification of buy-back - RG8  6  pages  18.4KB
AKO,13/01/2025  9:05 am,Â,Project to Benefit from National Highway & Port Developments  4  pages  672.6KB
MKL,13/01/2025  9:04 am,Â,Change in substantial holding  5  pages  235.7KB
ELD,13/01/2025  9:04 am,Â,Change of Director's Interest Notice - J Lloyd  2  pages  245.8KB
OPH,13/01/2025  9:03 am,Â,Weekly NTA 10.01.2025  1  page  166.5KB
VG1,13/01/2025  9:02 am,Â,Weekly NTA Update  1  page  27.0KB
QML,13/01/2025  9:02 am,,Further High-Grade Copper Results from Develin Creek  19  pages  1.7MB
JRV,13/01/2025  9:00 am,,Continuation of Suspension from Quotation  1  page  94.8KB
VG1,13/01/2025  8:59 am,Â,Update - Notification of buy-back - VG1  6  pages  18.4KB
AKN,13/01/2025  8:59 am,,Saudi Arabia Joint Venture Update  2  pages  236.4KB
RMI,13/01/2025  8:59 am,,AKN: Saudi Arabia Joint Venture Update  2  pages  236.4KB
SMI,13/01/2025  8:58 am,Â,Application for quotation of securities - SMI  6  pages  18.3KB
AMP,13/01/2025  8:58 am,Â,Financial calendar key dates 2025  1  page  150.4KB
3DA,13/01/2025  8:58 am,Â,Notification of cessation of securities - 3DA  5  pages  17.0KB
C7A,13/01/2025  8:58 am,Â,Rights Issue Update - Closing Date Extended  1  page  203.5KB
BGD,13/01/2025  8:58 am,,Barton Gold Receives $2.4 Million Cash R&D Tax Refund  2  pages  203.1KB
NAB,13/01/2025  8:56 am,Â,Notification of cessation of securities - NAB  4  pages  14.7KB
PGF,13/01/2025  8:56 am,Â,Net Tangible Asset Backing - 10 January 2025  1  page  184.5KB
HE8,13/01/2025  8:55 am,,Helios Energy Engages W.D. Von Gonten Engineering  2  pages  190.6KB
GNC,13/01/2025  8:51 am,Â,Notice of Annual General Meeting/Proxy Form  19  pages  644.9KB
LKO,13/01/2025  8:49 am,,PEP 169 Sale - second and final payment of $3.5m received  2  pages  241.7KB
MSV,13/01/2025  8:48 am,Â,Update - Notification of buy-back - MSV  6  pages  18.2KB
NVA,13/01/2025  8:48 am,,Stibium Gold-Antimony Resource Drill Targets Identified  18  pages  992.3KB
NEM,13/01/2025  8:48 am,Â,144 as filed - Peter Toth  2  pages  519.9KB
NEM,13/01/2025  8:47 am,Â,144 as filed - Natascha Viljoen  2  pages  512.5KB
AZ9,13/01/2025  8:47 am,,High Grade Massive Sulphide Intercepts Confirmed at Oval  20  pages  2.4MB
NEM,13/01/2025  8:47 am,Â,144 as filed - Bruce Brook  2  pages  465.3KB
1AD,13/01/2025  8:45 am,Â,Notification regarding unquoted securities - 1AD  6  pages  18.8KB
KBC,13/01/2025  8:45 am,Â,"IGNORE WAA INVALID documents, refer to updated NOM from KBC  13  pages  992.4KB"
URF,13/01/2025  8:43 am,Â,Update - Notification of buy-back - URF  6  pages  18.5KB
GRV,13/01/2025  8:43 am,,Greenvale Acquires Advanced High Grade Oasis Uranium Project  31  pages  1.5MB
WIA,13/01/2025  8:43 am,,Drilling Update and Activities Ramp Up For 2025  18  pages  2.1MB
ALL,13/01/2025  8:40 am,Â,Update - Notification of buy-back - ALL  6  pages  18.3KB
NCC,13/01/2025  8:40 am,Â,NTA & Portfolio Update - December 2024  3  pages  613.0KB
GRV,13/01/2025  8:39 am,,Greenvale to Commence Test Program 6 on the Alpha Project  2  pages  236.2KB
NAC,13/01/2025  8:39 am,Â,NTA & Portfolio Update - December 2024  3  pages  1.3MB
NSC,13/01/2025  8:38 am,Â,NTA & Portfolio Update - December 2024  3  pages  652.1KB
FPR,13/01/2025  8:38 am,Â,Update - Notification of buy-back - FPR  6  pages  18.4KB
IFL,13/01/2025  8:36 am,,IFL Receives Revised Indicative Non-Binding Proposal  1  page  123.8KB
JHG,13/01/2025  8:35 am,,Distribution Announcement  2  pages  232.7KB
JEG,13/01/2025  8:35 am,,Distribution Announcement  2  pages  232.7KB
KBC,13/01/2025  8:35 am,Â,Supplementary Notice of General Meeting/Proxy Form  4  pages  593.1KB
FRS,13/01/2025  8:35 am,,Ada Ann drilling results confirm gold mineralisation  37  pages  4.3MB
SGP,13/01/2025  8:32 am,Â,Notification of cessation of securities - SGP  4  pages  14.7KB
TLX,13/01/2025  8:32 am,Â,Proposed issue of securities - TLX  6  pages  22.3KB
HM1,13/01/2025  8:31 am,Â,Weekly NTA Estimate  1  page  111.5KB
SGP,13/01/2025  8:31 am,Â,Notification regarding unquoted securities - SGP  6  pages  18.6KB
MCO,13/01/2025  8:29 am,,Q2 FY25 Sales Update  5  pages  148.9KB
AMD,13/01/2025  8:29 am,,Niagara Resource Estimation Underway  48  pages  4.9MB
IBC,13/01/2025  8:28 am,Â,Update - Notification of buy-back - IBC  6  pages  18.3KB
AKN,13/01/2025  8:27 am,,RMI: granted option to acquire JV interests in Saudi Arabia  13  pages  1.1MB
RMI,13/01/2025  8:27 am,,RMI granted option to acquire JV interests in Saudi Arabia  13  pages  1.1MB
NAB,13/01/2025  8:27 am,Â,Update - Notification of buy-back - NAB  6  pages  18.4KB
TLX,13/01/2025  8:25 am,,Presentation to Accompany Biologics Platform Acquisition  14  pages  1.0MB
TLX,13/01/2025  8:24 am,,TLX to Acquire Next-Gen Therapeutics and Biologics Platform  5  pages  238.3KB
APW,13/01/2025  8:24 am,,Leasing Update  1  page  114.6KB
NWS,13/01/2025  8:24 am,Â,Notification of cessation of securities - NWS  4  pages  14.6KB
NWS,13/01/2025  8:24 am,Â,Notification of cessation of securities - NWS  4  pages  14.6KB
DMG,13/01/2025  8:24 am,Â,Final Director's Interest Notice  3  pages  212.9KB
DMG,13/01/2025  8:24 am,Â,Initial Director's Interest Notice  2  pages  210.3KB
WEB,13/01/2025  8:24 am,Â,Update - Notification of buy-back - WEB  6  pages  18.4KB
TOP,13/01/2025  8:24 am,Â,Update - Notification of buy-back - TOP  6  pages  18.5KB
LSF,13/01/2025  8:23 am,Â,Net Tangible Asset Backing  1  page  103.9KB
MGT,13/01/2025  8:23 am,,Magnetite Mines secures up to $7M funding  4  pages  335.0KB
EQN,13/01/2025  8:23 am,,"High-Grade Titanium, 61.2m at 11.9% TiO2 at Mata da Corda  47  pages  5.7MB"
SBM,13/01/2025  8:23 am,,Q2 Preliminary Update  2  pages  153.2KB
SBM,13/01/2025  8:23 am,,Simberi Oxide Discovery and Drilling Update  15  pages  5.6MB
OB1,13/01/2025  8:23 am,Â,SRR: SRR Consolidates Position in West Australian Goldfields  4  pages  630.1KB
SRR,13/01/2025  8:23 am,,Sarama Consolidates Position in West Australian Goldfields  4  pages  630.1KB
WA1,13/01/2025  8:23 am,,West Arunta Project - Luni Assay Results  16  pages  1.6MB
LM8,13/01/2025  8:23 am,,Success at Guiding Star Opens Up Foster Gold Belt  28  pages  2.8MB
FWD,13/01/2025  8:23 am,Â,Update - Notification of buy-back - FWD  6  pages  18.4KB
HTM,13/01/2025  8:23 am,,Appointment of Chief Executive Officer  3  pages  156.1KB
HMG,13/01/2025  8:22 am,,New Zone of Gold Mineralisation at Jazz  12  pages  1.7MB
KTG,13/01/2025  8:22 am,,Notice of General Meeting  228  pages  6.3MB
DEG,13/01/2025  8:22 am,,Further outstanding infill drill results at Brolga  24  pages  2.0MB
GBR,13/01/2025  8:22 am,,High-grade intersections extend Mulga Bill  12  pages  1.9MB
LMS,13/01/2025  8:22 am,,Major Mineral System Potential Confirmed at Oonagalabi  24  pages  1.8MB
NFM,13/01/2025  8:22 am,,Harts Range Boasts High Grade Niobium  27  pages  2.4MB
VVA,13/01/2025  8:22 am,Â,Update - Notification of buy-back - VVA  6  pages  18.2KB
AGY,13/01/2025  8:22 am,,Updated Dynamic Modelling Works Produce Outstanding Results  14  pages  713.7KB
VUL,13/01/2025  8:22 am,,Production of battery quality lithium hydroxide monohydrate  2  pages  144.6KB
VHM,13/01/2025  8:22 am,Â,Change of Director's Interest Notices x 2  4  pages  337.5KB
PRU,13/01/2025  8:21 am,Â,Update - Notification of buy-back - PRU  6  pages  18.2KB
GMN,13/01/2025  8:21 am,Â,New Stream Samples add to the Lithium Potential - Juremel  20  pages  1.8MB
RMD,13/01/2025  8:21 am,Â,Add Form 4  2  pages  12.1KB
SGA,13/01/2025  8:21 am,Â,Experienced Graphite Sales & Marketing Executive Appointed  4  pages  715.7KB
WBC,13/01/2025  8:21 am,Â,Update - Notification of buy-back - WBC  6  pages  18.3KB
S2R,13/01/2025  8:21 am,,S2 STARTS 2025 WITH EXPLORATION ON MULTIPLE FRONTS  17  pages  3.4MB
RFF,13/01/2025  8:21 am,Â,Ceasing to be a substantial holder  6  pages  207.7KB
AAR,13/01/2025  8:21 am,,Quarterly Activities & Cashflow Report  32  pages  6.1MB
ARV,13/01/2025  8:21 am,Â,Final Director's Interest Notice  2  pages  162.8KB
BEN,13/01/2025  8:21 am,Â,Ceasing to be a substantial holder  18  pages  1.1MB
ALK,13/01/2025  8:20 am,,Quarterly Activities Report  11  pages  4.3MB
GNC,13/01/2025  8:20 am,Â,Change in substantial holding  18  pages  383.9KB
YRL,13/01/2025  8:20 am,,Siona Results & RC Drilling Commences for 2025  20  pages  2.4MB
PDN,13/01/2025  8:20 am,Â,Becoming a substantial holder  5  pages  273.3KB
ADX,13/01/2025  8:20 am,Â,Notification of cessation of securities - ADX  5  pages  16.7KB
SPR,13/01/2025  8:20 am,,Quarterly Activities Report and Appendix 5B  24  pages  4.3MB
VLS,13/01/2025  8:20 am,Â,Update - Notification of buy-back - VLS  6  pages  18.2KB
CVL,13/01/2025  8:20 am,,Update on HoA for Ownership Transfer of Luerssen Australia  2  pages  209.5KB
RHI,13/01/2025  8:20 am,,Exploration drill results expand Gold & Base Metal targets  14  pages  3.6MB
ANZ,13/01/2025  8:20 am,Â,Update - Notification of buy-back - ANZ  6  pages  18.4KB
AMC,13/01/2025  8:20 am,Â,Form 425  4  pages  321.0KB
CY5,13/01/2025  8:19 am,Â,Becoming a substantial holder  4  pages  257.3KB
CMM,13/01/2025  8:19 am,Â,Becoming a substantial holder from MUFG  76  pages  493.3KB
FRW,13/01/2025  7:47 am,Â,Release Date for Half Year Results  1  page  186.2KB
THL,13/01/2025  7:30 am,Â,FY25 Interim Results Release Date - 25 February 2025  1  page  201.7KB
AFP,13/01/2025  7:30 am,Â,NEW YEAR LETTER TO INVESTORS  7  pages  231.1KB
TRU,13/01/2025  7:30 am,Â,TruScreen Invited to Present at WHO AI Collaboration Meeting  17  pages  776.2KB
