ASX Code,Date,Price sens.,Headline
BHD,20/03/2024  3:28 PM,,Appendix 3Y  3  pages  238.8KB
DHO,20/03/2024  3:27 PM,,Estimated Distribution March 2024  2  pages  131.5KB
NGL,20/03/2024  3:27 PM,,Notification regarding unquoted securities - NGL  9  pages  24.5KB
SXG,20/03/2024  3:26 PM,,Issue of Shares and Section 708A Notice  1  page  170.0KB
SGR,20/03/2024  3:24 PM,,Notification of change in substantial shareholding (update)  1  page  126.0KB
CXU,20/03/2024  3:23 PM,,Melrose - Drilling identifies nickel in weathered zone  51  pages  2.4MB
NGL,20/03/2024  3:19 PM,,Notification regarding unquoted securities - NGL  8  pages  22.2KB
NGL,20/03/2024  3:18 PM,,Notification of cessation of securities - NGL  5  pages  16.6KB
MCY,20/03/2024  3:18 PM,,Update - Dividend/Distribution - MCY  6  pages  22.9KB
SXG,20/03/2024  3:18 PM,,Application for quotation of securities - SXG  6  pages  18.4KB
M4M,20/03/2024  3:00 PM,,Becoming a substantial holder  2  pages  476.9KB
SDF,20/03/2024  2:58 PM,,Ceasing to be a substantial holder  2  pages  261.6KB
IMD,20/03/2024  2:57 PM,,Change of Director's Interest Notice  3  pages  415.2KB
VTX,20/03/2024  2:57 PM,,Update - Proposed issue of securities - VTX  8  pages  28.0KB
GBE,20/03/2024  2:56 PM,,Notification regarding unquoted securities - GBE  6  pages  18.7KB
VHT,20/03/2024  2:54 PM,,Supplementary Target's Statement  2  pages  174.9KB
WAT,20/03/2024  2:53 PM,,Notification regarding unquoted securities - WAT  7  pages  21.4KB
SDF,20/03/2024  2:53 PM,,Becoming a substantial holder  2  pages  276.8KB
NBI,20/03/2024  2:46 PM,,Daily NTA for 19.03.2024  1  page  128.7KB
PAR,20/03/2024  2:45 PM,,PAR to present at NWR Healthcare Conference  2  pages  100.0KB
DYL,20/03/2024  2:45 PM,,Notification of cessation of securities - DYL  4  pages  14.8KB
DYL,20/03/2024  2:44 PM,,Notification regarding unquoted securities - DYL  6  pages  18.2KB
RHK,20/03/2024  2:44 PM,,Presentation - Global Iron Ore & Steel Forecast Conference  16  pages  4.0MB
DYL,20/03/2024  2:43 PM,,Application for quotation of securities - DYL  6  pages  18.5KB
DYL,20/03/2024  2:42 PM,,Issue of Securities  1  page  95.2KB
PPS,20/03/2024  2:41 PM,,Executive Leadership Team Changes  1  page  234.7KB
PPS,20/03/2024  2:40 PM,,Resignation of Company Secretary  1  page  234.7KB
4DX,20/03/2024  2:33 PM,,Notification regarding unquoted securities - 4DX  11  pages  31.0KB
TSL,20/03/2024  2:18 PM,,Application for quotation of securities - TSL  7  pages  22.7KB
TSL,20/03/2024  2:17 PM,,TSLOA - Top 20 Holders and Distribution Schedule  3  pages  58.9KB
AS1,20/03/2024  2:15 PM,,Cleansing Notice  2  pages  181.5KB
WML,20/03/2024  2:08 PM,,Drilling Commenced at Wyloo Dome  4  pages  640.7KB
RXM,20/03/2024  2:06 PM,,Application for quotation of securities - RXM  6  pages  18.9KB
RXM,20/03/2024  2:04 PM,,Issue of Securities  1  page  622.0KB
RLT,20/03/2024  2:03 PM,,Completion of Conditions of Investment  2  pages  103.8KB
SGR,20/03/2024  2:02 PM,,Update on reforms to Queensland casino regulatory framework  1  page  130.8KB
X64,20/03/2024  1:58 PM,,Restructuring Framework Agreement Executed  6  pages  484.2KB
PFE,20/03/2024  1:53 PM,,Notice Under Section 708A  1  page  121.1KB
BMR,20/03/2024  1:50 PM,,Dittmer Project Funding Complete  6  pages  782.5KB
PFE,20/03/2024  1:49 PM,,Application for quotation of securities - PFE  6  pages  19.1KB
LOT,20/03/2024  1:47 PM,,Change in substantial holding from MQG  43  pages  228.6KB
MQG,20/03/2024  1:47 PM,,Change in substantial holding for LOT  43  pages  228.6KB
IRX,20/03/2024  1:45 PM,,Shareholder Town Hall Webinar Slides  18  pages  7.4MB
MAA,20/03/2024  1:39 PM,,Half Year Ended 31 December 2023 Interim report  18  pages  567.6KB
MTS,20/03/2024  1:37 PM,,Notification of cessation of securities - MTS  4  pages  14.7KB
LBL,20/03/2024  1:35 PM,,Change in substantial holding  3  pages  139.1KB
COL,20/03/2024  1:35 PM,,Update - Dividend/Distribution - COL  6  pages  22.8KB
AS1,20/03/2024  1:26 PM,,Application for quotation of securities - AS1  6  pages  18.3KB
SBM,20/03/2024  1:24 PM,,Becoming a substantial holder  3  pages  223.2KB
PSL,20/03/2024  1:18 PM,,Initial Director's Interest Notice  2  pages  172.8KB
WBC,20/03/2024  1:15 PM,,Notification of cessation of securities - WBC  5  pages  16.8KB
THL,20/03/2024  1:14 PM,,Capital Change Notice  2  pages  185.6KB
PLL,20/03/2024  1:11 PM,,Initial Director's Interest Notice  2  pages  222.5KB
CEH,20/03/2024  1:10 PM,,Update - Notification of buy-back - CEH  6  pages  18.3KB
SGR,20/03/2024  1:03 PM,,Change in substantial holding  2  pages  2.0MB
GTG,20/03/2024  12:57 PM,,Results of Extraordinary General Meeting  2  pages  177.6KB
MOT,20/03/2024  12:52 PM,,Daily Fund Update  1  page  180.7KB
PSL,20/03/2024  12:51 PM,,Board Changes  1  page  179.4KB
MXT,20/03/2024  12:39 PM,,Daily Fund Update  1  page  197.7KB
NGL,20/03/2024  12:37 PM,,Director Interest Notices  13  pages  519.6KB
PCI,20/03/2024  12:31 PM,,Daily Net Tangible Asset Statement  1  page  224.4KB
NGL,20/03/2024  12:30 PM,,Vesting of Restricted Stock Units  1  page  107.9KB
PCL,20/03/2024  12:26 PM,,Investor Webinar Presentation  11  pages  7.1MB
LRV,20/03/2024  12:25 PM,,USD$8M Funding Package for Hillgrove  5  pages  501.1KB
LVE,20/03/2024  12:23 PM,,Appendix 3Y - Michael Ye  2  pages  161.0KB
ACW,20/03/2024  12:20 PM,,Notification of buy-back - ACW  5  pages  15.0KB
AEE,20/03/2024  12:16 PM,,Application for quotation of securities - AEE  6  pages  18.2KB
CTD,20/03/2024  12:10 PM,,Change of Director's Interest Notice - E Crouch  2  pages  235.6KB
GUE,20/03/2024  11:57 AM,,Webinar Presentation  22  pages  1.9MB
WES,20/03/2024  11:56 AM,,Update - Dividend/Distribution - WES  6  pages  23.2KB
GCI,20/03/2024  11:55 AM,,Net Tangible Asset Backing  1  page  253.0KB
NCC,20/03/2024  11:52 AM,,Application for quotation of securities - NCC  6  pages  18.2KB
WES,20/03/2024  11:50 AM,,Dividend Investment Plan allocation price  1  page  51.4KB
CLV,20/03/2024  11:46 AM,,Becoming a substantial holder  2  pages  356.7KB
IXC,20/03/2024  11:46 AM,,ATO Class Ruling Return of Capital  9  pages  396.1KB
BKI,20/03/2024  11:42 AM,,Change of Director's Interest Notice  2  pages  133.2KB
CIW,20/03/2024  11:41 AM,,Change of Director's Interest Notice JA  2  pages  267.1KB
AF2,20/03/2024  11:41 AM,,Notice of Redemption - Call Option  1  page  93.3KB
AIQ,20/03/2024  11:37 AM,,AIQ NTA Factsheet February 2024  4  pages  217.2KB
BCI,20/03/2024  11:35 AM,,Notice Under Section 708a(5)(E)  1  page  144.0KB
ASE,20/03/2024  11:34 AM,,Investor Presentation - Governor Broome Mineral Sands  21  pages  4.3MB
C29,20/03/2024  11:31 AM,,Investor Presentation (Amended)  26  pages  2.1MB
BCI,20/03/2024  11:30 AM,,Application for quotation of securities - BCI  6  pages  18.5KB
RCT,20/03/2024  11:25 AM,,Appendix 3X - Abigail Cheadle  2  pages  147.8KB
RCT,20/03/2024  11:24 AM,,Appendix 3X - Steven Lake  2  pages  148.6KB
QRI,20/03/2024  11:23 AM,,Estimated NTA as at 18.03.2024  1  page  127.2KB
CTW,20/03/2024  11:23 AM,,CitiFirst NHC Instalment MINIs Dividend  1  page  100.8KB
DXB,20/03/2024  11:23 AM,,Application for quotation of securities - DXB  6  pages  18.4KB
TRU,20/03/2024  11:20 AM,,Appendix 2A  22  pages  597.4KB
ANV,20/03/2024  11:20 AM,,Next Interest Payment Date  1  page  68.7KB
DXB,20/03/2024  11:18 AM,,Application for quotation of securities - DXB  6  pages  18.4KB
EXL,20/03/2024  11:14 AM,,Results of Fully Underwritten Rights Issue Offer  2  pages  170.7KB
PCK,20/03/2024  11:12 AM,,Notice under Section 708A(5)(e) of the Corporation Act 2001  1  page  197.9KB
TOY,20/03/2024  11:12 AM,,Placement Prospectus  37  pages  879.1KB
TOY,20/03/2024  11:11 AM,,Proposed issue of securities - TOY  5  pages  17.5KB
TOY,20/03/2024  11:11 AM,,RIOT Art and Craft Acquisition and $5.1M Funding Secured  8  pages  1.1MB
EQR,20/03/2024  11:08 AM,,Investor Update NWR Sydney Resources Lunch 2024  22  pages  7.0MB
PCK,20/03/2024  11:06 AM,,Application for quotation of securities - PCK  6  pages  18.3KB
SRX,20/03/2024  11:05 AM,,Unsolicited Takeover Offer - Take No Action  1  page  145.0KB
AUI,20/03/2024  11:00 AM,,Change of Director's Interest Notice - C Goode  2  pages  234.4KB
AUI,20/03/2024  11:00 AM,,Change of Director's Interest Notice - F Grimwade  2  pages  232.4KB
DUI,20/03/2024  10:58 AM,,Change of Director's Interest Notice  2  pages  234.6KB
GBZ,20/03/2024  10:57 AM,,Becoming a substantial holder  3  pages  445.9KB
TCF,20/03/2024  10:55 AM,,Dividend/Distribution - TCF  4  pages  16.4KB
TOT,20/03/2024  10:53 AM,,Dividend/Distribution - TOT  5  pages  19.5KB
RR1,20/03/2024  10:38 AM,,Application for quotation of securities - RR1  6  pages  18.4KB
EM2,20/03/2024  10:36 AM,,Entitlement Offer Closes Raising $4.18 million  3  pages  336.9KB
GBZ,20/03/2024  10:33 AM,,Ceasing to be a substantial holder  3  pages  1.4MB
MRI,20/03/2024  10:31 AM,,Application for quotation of securities - MRI  7  pages  20.8KB
OSL,20/03/2024  10:28 AM,,Investor Presentation  32  pages  2.8MB
OSL,20/03/2024  10:20 AM,,Proposed issue of securities - OSL  9  pages  31.8KB
OSL,20/03/2024  10:20 AM,,Proposed issue of securities - OSL  6  pages  22.6KB
OSL,20/03/2024  10:20 AM,,Proposed issue of securities - OSL  5  pages  17.8KB
STK,20/03/2024  10:20 AM,,Application for quotation of securities - STK  6  pages  18.3KB
OSL,20/03/2024  10:20 AM,,Placement and Entitlement Offer to raise up to $7.1 million  5  pages  245.7KB
CUE,20/03/2024  10:10 AM,,Application for quotation of securities - CUE  6  pages  19.0KB
LVH,20/03/2024  10:10 AM,,Change of Director's Interest Notice  3  pages  324.5KB
MKL,20/03/2024  10:08 AM,,Reinstatement to quotation  1  page  89.7KB
MKL,20/03/2024  10:08 AM,,Completion of Institutional Component of Entitlement Offer  5  pages  278.7KB
TAH,20/03/2024  10:06 AM,,Application for quotation of securities - TAH  6  pages  17.8KB
CUE,20/03/2024  10:06 AM,,Section 708A Cleansing Statement  1  page  52.1KB
C29,20/03/2024  10:05 AM,,Initial Director's Interest Notice  2  pages  171.4KB
C29,20/03/2024  10:04 AM,,Final Director's Interest Notice  2  pages  221.3KB
G1A,20/03/2024  10:04 AM,,Corporate and Abra Operations Update  4  pages  499.3KB
C29,20/03/2024  10:00 AM,,Investor Presentation  26  pages  3.6MB
CCX,20/03/2024  10:00 AM,,Change of Director's Interest Notice  3  pages  236.0KB
C29,20/03/2024  9:56 AM,,Reinstatement to Quotation  1  page  417.4KB
C29,20/03/2024  9:56 AM,,Proposed issue of securities - C29  7  pages  24.0KB
GBE,20/03/2024  9:56 AM,,Metallurgical results on chlorination test work - correction  17  pages  1.1MB
C29,20/03/2024  9:56 AM,,C29 Acquires Transformative High-Grade Uranium Project  21  pages  1.4MB
WGX,20/03/2024  9:56 AM,,Corporate Presentation - Swiss Mining Institute  26  pages  6.2MB
EXL,20/03/2024  9:54 AM,,Notice of Extraordinary General Meeting  16  pages  565.2KB
A3D,20/03/2024  9:53 AM,,Defence Engagement Update  3  pages  234.0KB
ORP,20/03/2024  9:53 AM,,Investor Presentation  14  pages  2.4MB
DXB,20/03/2024  9:52 AM,,Cleansing Notice  1  page  395.8KB
UNT,20/03/2024  9:52 AM,,Closure of Entitlement Offer  2  pages  136.8KB
NVU,20/03/2024  9:52 AM,,GRANT OF COURT ORDERS  5  pages  348.6KB
NUF,20/03/2024  9:51 AM,,Change in substantial holding  7  pages  321.2KB
SRX,20/03/2024  9:51 AM,,Bidder's Statement  40  pages  891.8KB
MIN,20/03/2024  9:51 AM,,LRD: Strategic Partnership as MinRes Farms into Horse Rocks  7  pages  550.6KB
EQR,20/03/2024  9:51 AM,,Equipment received for doubling of thoroughput capacity  3  pages  11.7MB
LRD,20/03/2024  9:51 AM,,Strategic Partnership as MinRes Farms into Horse Rocks  7  pages  550.6KB
VMM,20/03/2024  9:50 AM,,80% Average Ionic Recoveries from First Colossus Hole  15  pages  1.2MB
SRX,20/03/2024  9:50 AM,,Takeover bid by PRM Services LLC  3  pages  219.5KB
SRX,20/03/2024  9:48 AM,,Change in substantial holding  4  pages  299.8KB
CAI,20/03/2024  9:48 AM,,Request for Voluntary Suspension Extension  1  page  148.8KB
HRN,20/03/2024  9:47 AM,,Gum Creek Scoping Study Addendum  75  pages  6.6MB
RSG,20/03/2024  9:46 AM,,Ceasing to be a substantial holder  2  pages  243.5KB
KCN,20/03/2024  9:46 AM,,Ceasing to be a substantial holder  2  pages  247.2KB
MSB,20/03/2024  9:46 AM,,Change in substantial holding  4  pages  1.4MB
EVN,20/03/2024  9:45 AM,,Change in substantial holding  13  pages  372.7KB
NOV,20/03/2024  9:44 AM,,Application for quotation of securities - NOV  9  pages  24.5KB
DXB,20/03/2024  9:44 AM,,Application for quotation of securities - DXB  6  pages  18.3KB
EMR,20/03/2024  9:44 AM,,Change in substantial holding  9  pages  350.5KB
MSV,20/03/2024  9:44 AM,,Update - Notification of buy-back - MSV  6  pages  18.3KB
BP8,20/03/2024  9:44 AM,,120-Day Business Development Plan  3  pages  194.4KB
GL1,20/03/2024  9:44 AM,,Final Results Received from 2023 Manna Drilling Program  20  pages  2.3MB
TG6,20/03/2024  9:43 AM,,Lake Johnston soil results define lithium drill targets  16  pages  1.8MB
BLD,20/03/2024  9:42 AM,,SVW: Acceptance Facility Notice  2  pages  245.2KB
SVW,20/03/2024  9:42 AM,,Acceptance Facility Notice  2  pages  245.2KB
MLX,20/03/2024  9:42 AM,,Annual General Meeting Information  1  page  191.9KB
LIO,20/03/2024  9:42 AM,,Development Approval Obtained for Brisbane Hydrogen Hub  4  pages  668.2KB
5GG,20/03/2024  9:41 AM,,Trading Halt  2  pages  539.8KB
PV1,20/03/2024  9:41 AM,,Presentation - NWR Resources Lunch March 2024  24  pages  5.2MB
WGX,20/03/2024  9:41 AM,,Becoming a substantial holder  8  pages  337.4KB
NSB,20/03/2024  9:39 AM,,NSB Receives A$2.2M Research & Development Tax Refund  1  page  421.0KB
ADR,20/03/2024  9:38 AM,,First Patient Enrolled in Major e-health Clinical Study  3  pages  153.1KB
OIL,20/03/2024  9:38 AM,,Optiscan receives R&D Tax Incentive Rebate  2  pages  115.7KB
FOR,20/03/2024  9:38 AM,,Indicative NAV COB 19 March 2024  1  page  163.3KB
MSB,20/03/2024  9:37 AM,,Proposed issue of securities - MSB  5  pages  17.2KB
SPR,20/03/2024  9:34 AM,,More strong drill hits across key prospects  21  pages  2.2MB
NWS,20/03/2024  9:34 AM,,Appendix 3C  4  pages  75.7KB
NEM,20/03/2024  9:34 AM,,Form 3 as filed for Peter Wexler  2  pages  860.3KB
AVW,20/03/2024  9:33 AM,,ASSAY UPDATE FROM PUOLALAKI NI-CU-CO PROJECT  11  pages  689.9KB
NWS,20/03/2024  9:33 AM,,Appendix 3C  4  pages  85.5KB
SER,20/03/2024  9:33 AM,,West Koonenberry Polymetallic Copper-Nickel project  3  pages  3.1MB
BDM,20/03/2024  9:31 AM,,Annual General Meeting Date and Director Nominations  1  page  137.9KB
AS2,20/03/2024  9:31 AM,,Trading Halt  3  pages  632.0KB
MLX,20/03/2024  9:30 AM,,Update - Notification of buy-back - MLX  6  pages  18.1KB
BOQ,20/03/2024  9:27 AM,,Dividend/Distribution - BOQPG  5  pages  18.7KB
MLX,20/03/2024  9:26 AM,,Update - Notification of buy-back - MLX  5  pages  15.7KB
RAG,20/03/2024  9:25 AM,,Geophysics Define HREE Targets over 4.5km Strike  10  pages  2.0MB
GDF,20/03/2024  9:25 AM,,Update - Notification of buy-back - GDF  6  pages  18.7KB
RF1,20/03/2024  9:24 AM,,Update - Notification of buy-back - RF1  6  pages  18.3KB
NRX,20/03/2024  9:23 AM,,Notice Under Section 708A  1  page  63.7KB
DTR,20/03/2024  9:23 AM,,Amended - USGS MP & Colosseum zircons are Indistinguishable  11  pages  501.0KB
RGS,20/03/2024  9:22 AM,,Optimisation of Progenza Patent Portfolio  2  pages  137.3KB
NRX,20/03/2024  9:22 AM,,Application for quotation of securities - NRX  6  pages  18.4KB
IR1,20/03/2024  9:22 AM,,Board Resignations  2  pages  116.6KB
URF,20/03/2024  9:21 AM,,Update - Notification of buy-back - URF  6  pages  18.3KB
MTH,20/03/2024  9:21 AM,,Notice of Annual General Meeting/Proxy Form  51  pages  1.5MB
LSX,20/03/2024  9:19 AM,,Half Year Accounts  20  pages  2.8MB
A2M,20/03/2024  9:19 AM,,Becoming a substantial holder  24  pages  1.5MB
AHX,20/03/2024  9:18 AM,,Update - Dividend/Distribution - AHX  5  pages  19.1KB
RMX,20/03/2024  9:16 AM,,Trading Halt  2  pages  570.4KB
GTI,20/03/2024  9:15 AM,,Gratifii signs new agreements with EML  2  pages  77.9KB
FPP,20/03/2024  9:15 AM,,Update - Notification of buy-back - FPP  6  pages  18.3KB
ARC,20/03/2024  9:15 AM,,Change of Director's Interest Notice - Harley Grosser  2  pages  137.2KB
SLC,20/03/2024  9:14 AM,,Cleansing Notice  2  pages  228.3KB
MEC,20/03/2024  9:14 AM,,Update - Notification of buy-back - MEC  6  pages  18.5KB
SFG,20/03/2024  9:12 AM,,SFG PSD Update  1  page  78.0KB
URW,20/03/2024  9:12 AM,,Holding conditions for the Combined General Meeting of URW S  2  pages  202.7KB
PYC,20/03/2024  9:11 AM,,Despatch of Notice to Ineligible Retail Shareholders  5  pages  492.3KB
URW,20/03/2024  9:11 AM,,URW NV 2023 Annual Report  141  pages  4.1MB
ALA,20/03/2024  9:11 AM,,NWR Virtual Healthcare Conference Presentation  33  pages  4.4MB
URW,20/03/2024  9:11 AM,,2023 Universal Registration Document URW SE  528  pages  10.3MB
GTN,20/03/2024  9:10 AM,,Update - Notification of buy-back - GTN  6  pages  18.5KB
MFG,20/03/2024  9:10 AM,,Update - Notification of buy-back - MFG  5  pages  15.8KB
ADA,20/03/2024  9:10 AM,,ADA receives new order from existing customer  2  pages  161.8KB
PBL,20/03/2024  9:09 AM,,High Grade Near Surface Ni-Co Mineralisation at Miandetta  18  pages  2.2MB
DUI,20/03/2024  9:08 AM,,Update - Notification of buy-back - DUI  6  pages  18.5KB
DOC,20/03/2024  9:08 AM,,Launches diagnostic test partnership with Medichecks  2  pages  262.9KB
PYC,20/03/2024  9:08 AM,,Despatch of Retail Offer Document  2  pages  228.6KB
URW,20/03/2024  9:07 AM,,Notice of General Meeting/Proxy Form  40  pages  1.8MB
ORR,20/03/2024  9:07 AM,,"OreCorp receives conditional, increased offer from Perseus  3  pages  205.7KB"
PRU,20/03/2024  9:07 AM,,"ORR: OreCorp receives conditional, increased offer from Per.  3  pages  205.7KB"
B4P,20/03/2024  9:07 AM,,Cleansing Notice  1  page  262.4KB
AUI,20/03/2024  9:06 AM,,Update - Notification of buy-back - AUI  6  pages  18.5KB
CUV,20/03/2024  9:06 AM,,CLINUVEL Newsletter II - March 2024  6  pages  295.9KB
SHL,20/03/2024  9:06 AM,,Proposed issue of securities - SHL  5  pages  18.2KB
PYC,20/03/2024  9:06 AM,,Retail Entitlement Offer Booklet  84  pages  2.6MB
AKO,20/03/2024  9:04 AM,,10km Magnetic Strike at Satrokala Iron Ore Project  22  pages  2.6MB
TUA,20/03/2024  9:03 AM,,FY24 Half Year Investor Presentation  12  pages  1.1MB
SOV,20/03/2024  9:03 AM,,Institutional Entitlement Offer Completion Announcement  4  pages  484.3KB
TUA,20/03/2024  9:03 AM,,Appendix 4D and Interim Financial Report  21  pages  1.1MB
PPM,20/03/2024  8:56 AM,,Exercise of call option over shares in Stratton Finance  1  page  114.8KB
BLG,20/03/2024  8:55 AM,,BLG Hosts Expert Roundtable Event  1  page  265.4KB
SHL,20/03/2024  8:55 AM,,"Acquisition of Dr Risch Group, Switzerland  1  page  375.3KB"
CYP,20/03/2024  8:55 AM,,EU Approval for Phase 2 CYP-001 Trial in GvHD  1  page  161.5KB
PIA,20/03/2024  8:54 AM,,NTA at 15.03.24 Pre-tax 138.34 Post-tax 130.55  1  page  162.8KB
NBI,20/03/2024  8:53 AM,,Performance Update and Delisting Reminder Letter  2  pages  201.4KB
ALA,20/03/2024  8:52 AM,,ALA-101 and onCARlytics collaboration update  2  pages  211.7KB
CLV,20/03/2024  8:51 AM,,Clover 1H FY24 Investor Presentation  13  pages  715.5KB
ACW,20/03/2024  8:50 AM,,Actinogen corporate presentation March 2024  33  pages  3.5MB
5GN,20/03/2024  8:49 AM,,Update - Notification of buy-back - 5GN  6  pages  18.2KB
CLV,20/03/2024  8:49 AM,,Clover 1H FY24 Results Announcement  4  pages  268.2KB
3PL,20/03/2024  8:49 AM,,Update - Notification of buy-back - 3PL  6  pages  18.6KB
CLV,20/03/2024  8:49 AM,,Clover 1H FY24 Report and Accounts  19  pages  595.0KB
AZS,20/03/2024  8:48 AM,,Andover Lithium System Continues to Grow  25  pages  2.6MB
PPS,20/03/2024  8:45 AM,,Update - Notification of buy-back - PPS  6  pages  18.4KB
DXB,20/03/2024  8:44 AM,,Notification of upcoming expiry of Unlisted Options  1  page  284.4KB
ALL,20/03/2024  8:43 AM,,Update - Notification of buy-back - ALL  6  pages  18.3KB
PAI,20/03/2024  8:43 AM,,Update - Notification of buy-back - PAI  6  pages  18.5KB
LSF,20/03/2024  8:43 AM,,Net Tangible Asset Backing  1  page  219.1KB
RG8,20/03/2024  8:42 AM,,Update - Notification of buy-back - RG8  6  pages  18.7KB
PMC,20/03/2024  8:41 AM,,Update - Notification of buy-back - PMC  6  pages  18.5KB
VG1,20/03/2024  8:38 AM,,Update - Notification of buy-back - VG1  6  pages  18.8KB
SYR,20/03/2024  8:36 AM,,Notification to Ineligible Retail Shareholders  3  pages  216.8KB
GOL,20/03/2024  8:32 AM,,Full Year Statutory Accounts  23  pages  1.4MB
RWC,20/03/2024  8:32 AM,,Update - Notification of buy-back - RWC  6  pages  18.4KB
BMN,20/03/2024  8:32 AM,,Investor Presentation  24  pages  7.9MB
WBC,20/03/2024  8:31 AM,,Update - Notification of buy-back - WBC  6  pages  18.3KB
SYR,20/03/2024  8:30 AM,,Retail Offer Booklet  102  pages  6.0MB
LPE,20/03/2024  8:29 AM,,Notice of General Meeting/Proxy Form  17  pages  532.6KB
HZR,20/03/2024  8:29 AM,,Application for quotation of securities - HZR  6  pages  19.5KB
EGH,20/03/2024  8:28 AM,,Change in substantial holding  3  pages  286.4KB
IAG,20/03/2024  8:27 AM,,Update - Notification of buy-back - IAG  6  pages  18.3KB
AMC,20/03/2024  8:27 AM,,Form 8-K - CEO Retirement  5  pages  189.3KB
NAB,20/03/2024  8:26 AM,,Update - Notification of buy-back - NAB  6  pages  18.3KB
IBC,20/03/2024  8:26 AM,,Update - Notification of buy-back - IBC  6  pages  18.4KB
JLG,20/03/2024  8:26 AM,,Change of Company Secretary  1  page  162.4KB
EGG,20/03/2024  8:26 AM,,Update - Notification of buy-back - EGG  6  pages  18.5KB
FAU,20/03/2024  8:26 AM,,Initial Director's Interest Notice  2  pages  139.0KB
ZAG,20/03/2024  8:26 AM,,Company Secretary Appointment/Resignation  1  page  132.4KB
IIQ,20/03/2024  8:26 AM,,INOVIQ expands exosome IP  2  pages  218.8KB
ENV,20/03/2024  8:26 AM,,PROCEED WITH ACQUISITION OF HIGHLY PROSPECTIVE CODA PROJECT  5  pages  383.3KB
B4P,20/03/2024  8:25 AM,,Application for quotation of securities - B4P  6  pages  18.4KB
BSL,20/03/2024  8:25 AM,,Update - Notification of buy-back - BSL  6  pages  18.5KB
CGS,20/03/2024  8:25 AM,,Update - Notification of buy-back - CGS  6  pages  18.2KB
ABC,20/03/2024  8:25 AM,,Alcoa supply contract update  1  page  161.2KB
NEC,20/03/2024  8:25 AM,,Update - Notification of buy-back - NEC  6  pages  18.3KB
FAU,20/03/2024  8:25 AM,,Appointment of new director  1  page  173.5KB
STX,20/03/2024  8:25 AM,,Becoming a substantial holder  4  pages  330.3KB
HUM,20/03/2024  8:25 AM,,Update - Notification of buy-back - HUM  6  pages  18.3KB
HLI,20/03/2024  8:24 AM,,Update - Notification of buy-back - HLI  6  pages  18.4KB
RGN,20/03/2024  8:24 AM,,Change in substantial holding  106  pages  1.8MB
S32,20/03/2024  8:24 AM,,Australia Manganese Update  1  page  81.8KB
JHX,20/03/2024  8:24 AM,,Change in substantial holding  3  pages  266.4KB
1AD,20/03/2024  8:24 AM,,AdAlta presenting at ASX Gems conference  2  pages  181.5KB
CPU,20/03/2024  8:24 AM,,Update - Notification of buy-back - CPU  6  pages  18.4KB
JHX,20/03/2024  8:24 AM,,Update - Notification of buy-back - JHX  6  pages  18.6KB
AMC,20/03/2024  8:24 AM,,Form 4s  11  pages  433.1KB
DTM,20/03/2024  8:24 AM,,DTM Gold Prospectivity  14  pages  2.4MB
SRK,20/03/2024  8:24 AM,,Change of Substantial Shareholder Notice for LEL  2  pages  218.6KB
LEL,20/03/2024  8:24 AM,,Change of Substantial Shareholder Notice from SRK  2  pages  218.6KB
CAA,20/03/2024  8:24 AM,,Update - Notification of buy-back - CAA  6  pages  18.2KB
PFE,20/03/2024  8:24 AM,,Bolsters Board With Significant Lithium Brine Experience  5  pages  385.6KB
RUL,20/03/2024  8:24 AM,,Notification of cessation of securities - RUL  4  pages  14.9KB
RUL,20/03/2024  8:24 AM,,Update - Notification of buy-back - RUL  6  pages  18.6KB
OMX,20/03/2024  8:23 AM,,Eastern Goldfields Phase One Drill Results  16  pages  2.7MB
WHC,20/03/2024  8:23 AM,,Ceasing to be a substantial holder  3  pages  318.8KB
BRX,20/03/2024  8:23 AM,,Company Update  6  pages  1.2MB
NPR,20/03/2024  8:23 AM,,Notice of change of interests of substantial holder from BWP  26  pages  329.9KB
BWP,20/03/2024  8:23 AM,,Notice of change of interests of substantial holder for NPR  26  pages  329.9KB
TMG,20/03/2024  8:23 AM,,Multiple Drill Targets Identified at Drummond Basin Project  5  pages  4.0MB
MGX,20/03/2024  8:23 AM,,Global Iron Ore & Steel Forecast Conference Presentation  21  pages  5.4MB
PEK,20/03/2024  8:23 AM,,Major High-Grade Fluorspar Discovery  28  pages  1.7MB
BRK,20/03/2024  8:23 AM,,Flames-Maroons Development Multi-Well Drilling Update  4  pages  505.5KB
KFW,20/03/2024  8:22 AM,,Application for quotation of securities - KFW  5  pages  17.1KB
KFW,20/03/2024  8:22 AM,,Disclosure Document  5  pages  682.5KB
SVM,20/03/2024  8:22 AM,,Representative Bulk Sample Shipped  2  pages  946.8KB
IMD,20/03/2024  8:22 AM,,CFO Announcement  1  page  151.3KB
SPZ,20/03/2024  8:22 AM,,Notification of cessation of securities - SPZ  4  pages  14.6KB
SXE,20/03/2024  8:22 AM,,Data Centre and Resources awards over $70m  2  pages  194.5KB
PRU,20/03/2024  8:22 AM,,Change in substantial holding for ORR  6  pages  242.9KB
ORR,20/03/2024  8:22 AM,,Change in substantial holding from PRU  6  pages  242.9KB
ATC,20/03/2024  8:22 AM,,Altech - Excellent CERENERGY Battery Project DFS  40  pages  3.0MB
ICG,20/03/2024  8:21 AM,,Change in Substantial Holding - Adam Taylor  3  pages  190.3KB
NZM,20/03/2024  7:48 AM,,Update - Dividend/Distribution - NZM  5  pages  17.8KB
HGH,20/03/2024  7:30 AM,,Application for quotation of securities - HGH  5  pages  16.3KB
SKT,20/03/2024  7:30 AM,,Notification of cessation of securities - SKT  4  pages  14.8KB
SKT,20/03/2024  7:30 AM,,Update - Notification of buy-back - SKT  6  pages  18.6KB
CNU,20/03/2024  7:30 AM,,Chorus announces interim CFO and CCO  1  page  72.3KB
HGH,20/03/2024  7:30 AM,,Notification of Allotment of Securities  2  pages  170.9KB
NZM,20/03/2024  7:30 AM,,Foreign Exchange Rate for Dividend Payment  1  page  85.1KB
