ASX Code,Date,Price sens.,Headline
CRN,13/02/2024  2:19 PM,,FY23 Results Webcast Details  1  page  118.5KB
MXC,13/02/2024  2:16 PM,,Notice of General Meeting/Proxy Form  31  pages  877.6KB
MTS,13/02/2024  2:13 PM,,Notification of cessation of securities - MTS  4  pages  14.7KB
MVF,13/02/2024  2:12 PM,,Notification of release of restricted shares in escrow  1  page  200.7KB
BUR,13/02/2024  2:10 PM,,Investor Presentation  19  pages  3.9MB
FEC,13/02/2024  2:07 PM,,mFund - Monthly Redemption Report - FEC01  1  page  186.9KB
NVQ,13/02/2024  2:06 PM,,Notification of cessation of securities - NVQ  4  pages  14.9KB
AME,13/02/2024  2:06 PM,,RIU Explorers Conference Presentation  24  pages  7.7MB
PLC,13/02/2024  2:05 PM,,Cleansing Notice  2  pages  100.4KB
MGT,13/02/2024  1:59 PM,,Partnership Positions Port Pirie as Future Green Iron Hub  4  pages  556.2KB
BXB,13/02/2024  1:56 PM,,Application for quotation of securities - BXB  10  pages  32.2KB
BRN,13/02/2024  1:55 PM,,Response to ASX Price Query  4  pages  757.4KB
BML,13/02/2024  1:42 PM,,Investor Presentation  23  pages  4.9MB
TCL,13/02/2024  1:41 PM,,Application for quotation of securities - TCL  6  pages  17.8KB
LYK,13/02/2024  1:36 PM,,Entitlement Offer documents dispatched  5  pages  324.8KB
A2B,13/02/2024  1:32 PM,,Change in substantial holding from MUFG  2  pages  290.3KB
DCG,13/02/2024  1:31 PM,,HY FY24 Results Presentation - Webinar Notification  1  page  578.4KB
ING,13/02/2024  1:31 PM,,Becoming a substantial holder from MUFG  140  pages  1.7MB
HAS,13/02/2024  1:29 PM,,Becoming a substantial holder from MUFG  20  pages  834.1KB
VMC,13/02/2024  1:24 PM,,Change in substantial holding  5  pages  197.4KB
PAR,13/02/2024  1:21 PM,,Notification regarding unquoted securities - PAR  6  pages  20.3KB
HCL,13/02/2024  1:19 PM,,HighCom CEO Resignation  2  pages  140.4KB
ASG,13/02/2024  1:17 PM,,Director Appointment/Resignation  1  page  389.6KB
NVQ,13/02/2024  1:13 PM,,Notification of cessation of securities - NVQ  4  pages  14.9KB
HMX,13/02/2024  1:09 PM,,Trading Halt  2  pages  683.4KB
K2F,13/02/2024  1:01 PM,,Application for quotation of securities - K2F  6  pages  18.4KB
K2F,13/02/2024  12:59 PM,,Issue of Securities  2  pages  122.5KB
GCI,13/02/2024  12:55 PM,,Net Tangible Asset Backing  1  page  251.5KB
AZS,13/02/2024  12:54 PM,,RIU Explorers Presentation  17  pages  4.1MB
CAF,13/02/2024  12:47 PM,,H1 FY24 Results Webinar  1  page  127.3KB
HMX,13/02/2024  12:37 PM,,Pause in Trading  1  page  118.9KB
MCE,13/02/2024  12:30 PM,,Initial Director's Interest Notice - Alison Terry  2  pages  141.2KB
MCE,13/02/2024  12:29 PM,,Initial Director's Interest Notice - Brendan Cocks  2  pages  141.5KB
NVQ,13/02/2024  12:28 PM,,Notification of cessation of securities - NVQ  4  pages  14.9KB
OIL,13/02/2024  12:28 PM,,Optiscan receives $3 million CRC-P Industry Grant  2  pages  130.2KB
YRL,13/02/2024  12:28 PM,,Ceasing to be a substantial holder  2  pages  348.9KB
NVQ,13/02/2024  12:23 PM,,Notification of cessation of securities - NVQ  4  pages  14.9KB
MGU,13/02/2024  12:17 PM,,Company Webinar Update  1  page  221.8KB
FRX,13/02/2024  12:14 PM,,Letter to Ineligible Shareholders  1  page  119.5KB
HRZ,13/02/2024  12:14 PM,,Horizon & Greenstone Merger Presentation  27  pages  5.2MB
GSR,13/02/2024  12:14 PM,,Horizon and Greenstone Merger Presentation  27  pages  5.2MB
HRZ,13/02/2024  12:14 PM,,Horizon & Greenstone Merger Announcement  169  pages  3.8MB
FRX,13/02/2024  12:13 PM,,Despatch of Offer Document  1  page  129.7KB
GSR,13/02/2024  12:13 PM,,Horizon and Greenstone Merger Announcement  169  pages  3.8MB
PCI,13/02/2024  12:13 PM,,Daily Net Tangible Asset Statement  1  page  224.7KB
RIE,13/02/2024  12:13 PM,,Ceasing to be a substantial holder  15  pages  703.6KB
X2M,13/02/2024  12:12 PM,,Cleansing notice  2  pages  84.0KB
X2M,13/02/2024  12:10 PM,,Application for quotation of securities - X2M  8  pages  21.6KB
KM1,13/02/2024  12:05 PM,,RIU Investor Presentation  18  pages  4.4MB
SGR,13/02/2024  12:04 PM,,Initial Director's Interest Notice - Peter Hodgson  2  pages  280.1KB
RRL,13/02/2024  11:59 AM,,Half Year Results Conference Call  1  page  205.1KB
BWF,13/02/2024  11:57 AM,,Dividend/Distribution - BWF  4  pages  15.7KB
BWF,13/02/2024  11:52 AM,,Appendix 4D and Half-Year Financial Statements  26  pages  1.5MB
CGR,13/02/2024  11:47 AM,,Investor Presentation February 2024  14  pages  2.2MB
ANN,13/02/2024  11:42 AM,,Notification of cessation of securities - ANN  4  pages  14.8KB
RXM,13/02/2024  11:42 AM,,Application for quotation of securities - RXM  5  pages  16.5KB
G11,13/02/2024  11:33 AM,,G11 Resources February 2024 Investor Presentation  10  pages  2.8MB
TGM,13/02/2024  11:28 AM,,Suspension from Quotation  2  pages  570.3KB
GSN,13/02/2024  11:28 AM,,RIU Explorers Conference - Investor Presentation  13  pages  4.8MB
PMC,13/02/2024  11:27 AM,,Weekly Net Tangible Asset Backing  1  page  136.6KB
PAI,13/02/2024  11:26 AM,,Weekly Net Tangible Asset Backing  1  page  118.4KB
M2R,13/02/2024  11:24 AM,,Investor Presentation - Feb 2024  26  pages  5.6MB
IXR,13/02/2024  11:24 AM,,Notice of General Meeting/Proxy Form  40  pages  864.2KB
WQG,13/02/2024  11:22 AM,,Notification of cessation of securities - WQG  4  pages  14.7KB
IRI,13/02/2024  11:22 AM,,Notification of H1 FY24 Earnings Release & Conference Call  1  page  202.5KB
M2R,13/02/2024  11:22 AM,,Multiple EM Conductors Outlined at Mt Vernon  19  pages  2.8MB
QRI,13/02/2024  11:22 AM,,1H24 Investor Briefing Details  3  pages  239.7KB
LU7,13/02/2024  11:15 AM,,Test Program for Lithium Carbonate Refinery Underway  7  pages  2.0MB
VAL,13/02/2024  11:14 AM,,Purchase Option Agreement Signed - Frazer Lake Lithium  8  pages  1.4MB
RF1,13/02/2024  11:14 AM,,Notification of cessation of securities - RF1  5  pages  16.4KB
OCT,13/02/2024  11:12 AM,,Exploration Update Future Metals JV - East Kimberley  3  pages  311.6KB
IML,13/02/2024  11:10 AM,,MLC Update - January 2024  2  pages  451.8KB
CSL,13/02/2024  11:10 AM,,Update - Dividend/Distribution - CSL  5  pages  18.1KB
PE1,13/02/2024  11:09 AM,,Notification of cessation of securities - PE1  4  pages  14.8KB
SI6,13/02/2024  11:08 AM,,Investor Presentation  17  pages  2.0MB
PGM,13/02/2024  11:07 AM,,Investor Presentation - RIU Explorers Conference  22  pages  4.0MB
BCN,13/02/2024  11:04 AM,,RIU Explorers 2024 Presentation  19  pages  20.1MB
KAM,13/02/2024  11:02 AM,,Change in substantial holding  4  pages  379.9KB
VLS,13/02/2024  11:00 AM,,Change in substantial holding  2  pages  698.8KB
AVA,13/02/2024  10:59 AM,,Reinstatement to official quotation  1  page  427.3KB
AVA,13/02/2024  10:59 AM,,Response to ASX Query- Ramping  7  pages  984.0KB
NAC,13/02/2024  10:53 AM,,Application for quotation of securities - NAC  6  pages  18.2KB
WBE,13/02/2024  10:52 AM,,Management Appointments  2  pages  175.1KB
MRI,13/02/2024  10:49 AM,,Notification of Release of Shares from Escrow  1  page  89.7KB
PEN,13/02/2024  10:48 AM,,Application for quotation of securities - PEN  6  pages  18.2KB
NWS,13/02/2024  10:47 AM,,Appendix 3C  4  pages  75.7KB
NWS,13/02/2024  10:46 AM,,Appendix 3C  4  pages  75.7KB
VMS,13/02/2024  10:45 AM,,Investor Presentation - RIU Explorers Conference 2024  20  pages  3.4MB
NWC,13/02/2024  10:40 AM,,RIU Explorers Conference Presentation  34  pages  6.6MB
S3G,13/02/2024  10:39 AM,,January 2024 Investment Update  5  pages  1.3MB
STM,13/02/2024  10:33 AM,,Change of Director's Interest Notice x 4  8  pages  362.9KB
LRV,13/02/2024  10:31 AM,,Investor Presentation - February 2024  18  pages  5.2MB
R3D,13/02/2024  10:30 AM,,Update - Proposed issue of securities - R3D  11  pages  37.3KB
HCD,13/02/2024  10:29 AM,,Division Head Resignation  1  page  595.1KB
BCT,13/02/2024  10:23 AM,,Despatch of Non-Renounceable Entitlement Offer Documents  2  pages  200.5KB
BCT,13/02/2024  10:21 AM,,Letter to Ineligible Shareholders  2  pages  217.4KB
BCT,13/02/2024  10:20 AM,,Non-Renounceable Entitlement Offer Booklet  73  pages  3.1MB
KCN,13/02/2024  10:17 AM,,Significant Near Mine Gold Exploration Results in Thailand  15  pages  3.6MB
NVO,13/02/2024  10:16 AM,,2024 RIU Explorers Conference Presentation  14  pages  1.9MB
PE1,13/02/2024  10:15 AM,,Monthly Performance Report - January 2024  4  pages  271.2KB
RWC,13/02/2024  10:13 AM,,Holman Industries Acquisition Presentation  15  pages  1.7MB
RWC,13/02/2024  10:12 AM,,RWC to acquire Holman Industries  3  pages  213.4KB
CTW,13/02/2024  10:11 AM,,CitiFirst SCG Instalment MINIs Dividend Estimated Amount  1  page  100.4KB
NVO,13/02/2024  10:10 AM,,Significant drill results at Becher  14  pages  1.5MB
DEG,13/02/2024  10:10 AM,,NVO: Significant drill results at Becher  14  pages  1.5MB
CR9,13/02/2024  10:06 AM,,Characterisation of Tampu Kaolin Confirms Quality  17  pages  1.9MB
EPX,13/02/2024  10:04 AM,,Change of Directors Interest Notice V van Bommel  3  pages  254.5KB
UCM,13/02/2024  10:03 AM,,Rights issue offer document  22  pages  269.7KB
AHC,13/02/2024  10:03 AM,,Notification of cessation of securities - AHC  4  pages  14.8KB
EPX,13/02/2024  10:02 AM,,Change of Directors Interest Notice J Balassis  2  pages  253.6KB
OCL,13/02/2024  9:58 AM,,Application for quotation of securities - OCL  6  pages  18.4KB
DEG,13/02/2024  9:58 AM,,RIU Conference Fremantle - Investor Presentation  27  pages  3.6MB
PNR,13/02/2024  9:57 AM,,Investor Update Presentation  22  pages  6.2MB
ION,13/02/2024  9:57 AM,,Notification of cessation of securities - ION  4  pages  15.0KB
AIS,13/02/2024  9:56 AM,,INVESTOR PRESENTATION - BELL POTTER UNEARTHED CONFERENCE  20  pages  4.0MB
CTW,13/02/2024  9:54 AM,,CitiFirst JBH Instalment MINIs Dividend  1  page  100.8KB
RWC,13/02/2024  9:54 AM,,Pause in Trading  1  page  119.0KB
NVO,13/02/2024  9:53 AM,,DEG: Greater Hemi and Regional Exploration Update  24  pages  3.1MB
DEG,13/02/2024  9:53 AM,,Greater Hemi and Regional Exploration Update  24  pages  3.1MB
LTR,13/02/2024  9:50 AM,,Investor Presentation - Bell Potter Unearthed Conference  11  pages  1.2MB
KAU,13/02/2024  9:50 AM,,A1 Mine Production Update  4  pages  289.9KB
PTR,13/02/2024  9:48 AM,,RIU Fremantle Explorers Conference - Presentation  23  pages  7.9MB
PGO,13/02/2024  9:48 AM,,Significant extensions to Alice River fault zone defined  22  pages  1.8MB
DTR,13/02/2024  9:48 AM,,Wide intersection 70.1 metre @ 6.53g/t Gol at Colosseum Mine  16  pages  1.3MB
TTM,13/02/2024  9:48 AM,,Notification regarding unquoted securities - TTM  5  pages  16.8KB
MFD,13/02/2024  9:47 AM,,Shareholder Request for Meeting  1  page  211.6KB
CVB,13/02/2024  9:46 AM,,Securities released from escrow  1  page  725.0KB
FHS,13/02/2024  9:45 AM,,Secures New Purchase Order from Cementos Melon  2  pages  252.9KB
CTW,13/02/2024  9:45 AM,,CitiFirst CAR Instalment MINIs Dividend  1  page  100.3KB
ROC,13/02/2024  9:44 AM,,Notification regarding unquoted securities - ROC  6  pages  19.5KB
ADA,13/02/2024  9:44 AM,,Correction to date- Results Conference Call  1  page  186.1KB
GRE,13/02/2024  9:43 AM,,Response to ASX Price Query  5  pages  359.8KB
GRE,13/02/2024  9:43 AM,,Exploration Update Ruth Well and Osborne Joint Venture  20  pages  3.2MB
IMC,13/02/2024  9:43 AM,,Immuron achieves record Travelan sales  2  pages  278.7KB
ZNO,13/02/2024  9:42 AM,,Response to ASX Query Letter  5  pages  823.4KB
TOK,13/02/2024  9:42 AM,,Tolu Shares Commence Trading on OTC Market in the USA  3  pages  272.8KB
GLN,13/02/2024  9:42 AM,,Presentation - RIU Fremantle  21  pages  2.5MB
R3D,13/02/2024  9:41 AM,,Extension of Convertible Note Maturity Dates  2  pages  1.1MB
ZIP,13/02/2024  9:40 AM,,Application for quotation of securities - ZIP  10  pages  29.5KB
NEM,13/02/2024  9:39 AM,,NEM Annual Compliance Statement  1  page  137.2KB
MNB,13/02/2024  9:38 AM,,Capanda Green Ammonia Project Update  4  pages  191.7KB
ICG,13/02/2024  9:38 AM,,Despatch of Entitlement Issue Prospectus  1  page  219.5KB
FG1,13/02/2024  9:38 AM,,Investor Presentation  20  pages  3.3MB
COD,13/02/2024  9:38 AM,,RIU Explorers Conference Presentation - February 2024  23  pages  5.3MB
LRT,13/02/2024  9:36 AM,,LRT NAV Estimate - 9 February 2024  1  page  134.9KB
MXR,13/02/2024  9:36 AM,,RIU Explorers Conference presentation  22  pages  12.0MB
NIS,13/02/2024  9:35 AM,,Additional Priority Lithium Targets - North of the Quarry  15  pages  1.9MB
3DA,13/02/2024  9:35 AM,,Investor Update Presentation  14  pages  1.4MB
FME,13/02/2024  9:34 AM,,Multiple Drill Targets Identified Along 18km Corridor  17  pages  1.1MB
SVL,13/02/2024  9:34 AM,,SPP - Letter to Eligible Shareholders and SPP Booklet  30  pages  1.1MB
MGF,13/02/2024  9:34 AM,,Appendix 2A  20  pages  488.0KB
CTW,13/02/2024  9:33 AM,,CitiFirst AZJ Instalment MINIs Dividend  1  page  100.5KB
MAT,13/02/2024  9:33 AM,,Further High Grade Assay Results - Devon Pit Gold Mine  22  pages  2.6MB
KLI,13/02/2024  9:33 AM,,"Option to acquire copper-gold projects, Canada  10  pages  1.1MB"
BNZ,13/02/2024  9:32 AM,,RUBY HILL WEST 2023 DRILL RESULTS  19  pages  2.1MB
LT9,13/02/2024  9:31 AM,,General Security Deed  15  pages  490.4KB
ARV,13/02/2024  9:30 AM,,West Pilbara Exploration Update  17  pages  1.6MB
EIG,13/02/2024  9:30 AM,,Investor Update January 2024  2  pages  192.5KB
LT9,13/02/2024  9:30 AM,,Series Supplement  91  pages  872.6KB
FPR,13/02/2024  9:30 AM,,Update - Notification of buy-back - FPR  6  pages  18.5KB
RF1,13/02/2024  9:30 AM,,Update - Notification of buy-back - RF1  6  pages  18.3KB
CUE,13/02/2024  9:29 AM,,Gas Supply Agreement with Arafura  5  pages  506.2KB
LT9,13/02/2024  9:28 AM,,Master Trust Deed and Master Security Trust Deed as amended  283  pages  12.6MB
LT9,13/02/2024  9:28 AM,,Information Memorandum  223  pages  1.2MB
KGN,13/02/2024  9:28 AM,,Kogan.com 1HFY24 release date and investor call details  1  page  37.0KB
TMS,13/02/2024  9:28 AM,,Webinar Invitation - Bluebird Copper-Gold Discovery Update  1  page  299.2KB
ZEU,13/02/2024  9:28 AM,,Kalabity Tenement Application in SA Accepted  6  pages  812.5KB
LT9,13/02/2024  9:28 AM,,Appendix 1B and Information Form and Checklist  12  pages  150.4KB
PRX,13/02/2024  9:28 AM,,Presentation - Exploration Update February 2024  18  pages  2.5MB
SEK,13/02/2024  9:27 AM,,SEEK appoints Rachael Powell to the Board  2  pages  232.5KB
LT9,13/02/2024  9:26 AM,,Admission and Commencement as an ASX Debt Listing  1  page  127.0KB
FOR,13/02/2024  9:26 AM,,Indicative NAV COB 12 February 2024  1  page  163.6KB
BSN,13/02/2024  9:25 AM,,Mobilises For Phase 2 Drilling At Geikie Uranium Project  8  pages  1.6MB
CRR,13/02/2024  9:25 AM,,More Strong Assay Results Continue to Extend Mavis Lake  27  pages  2.4MB
SUV,13/02/2024  9:24 AM,,Trading Halt  2  pages  987.0KB
BLU,13/02/2024  9:24 AM,,HOA signed with AGL for supply of up to 300PJ of gas.  2  pages  284.2KB
KM1,13/02/2024  9:24 AM,,More High-Grade Lithium at Higginsville Lithium District  13  pages  1.6MB
STM,13/02/2024  9:23 AM,,Application for quotation of securities - STM  6  pages  18.3KB
LNR,13/02/2024  9:23 AM,,Investor Presentation - RIU Explorers Conference  20  pages  4.6MB
AZL,13/02/2024  9:22 AM,,Prairie Pilot in Final Phase of Operation (Updated)  68  pages  3.4MB
STM,13/02/2024  9:20 AM,,Notification regarding unquoted securities - STM  6  pages  18.4KB
CEH,13/02/2024  9:20 AM,,Update - Notification of buy-back - CEH  6  pages  18.3KB
SEK,13/02/2024  9:20 AM,,Dividend/Distribution - SEK  4  pages  15.7KB
RNO,13/02/2024  9:20 AM,,Change in substantial holding WG  2  pages  50.2KB
ICG,13/02/2024  9:19 AM,,Notice of General Meeting/Proxy Form  21  pages  783.7KB
UNT,13/02/2024  9:19 AM,,Successful Placement and Cleansing Notice  1  page  189.2KB
WZR,13/02/2024  9:19 AM,,WZR H1FY24 Results and Investor Conference Call Details  1  page  168.7KB
ALA,13/02/2024  9:18 AM,,Proposed issue of securities - ALA  5  pages  17.1KB
SEK,13/02/2024  9:18 AM,,FY2024 Half Year Results Presentation  64  pages  8.3MB
WCN,13/02/2024  9:18 AM,,Proposed issue of securities - WCN  5  pages  17.3KB
MSV,13/02/2024  9:18 AM,,Update - Notification of buy-back - MSV  6  pages  18.3KB
WCN,13/02/2024  9:18 AM,,$4.33M Funding Secured Through WCNOE Option Underwriting  4  pages  327.7KB
SWT,13/02/2024  9:18 AM,,Investment Update 31 January 2024  2  pages  150.3KB
FPR,13/02/2024  9:16 AM,,Update - Notification of buy-back - FPR  5  pages  16.0KB
STX,13/02/2024  9:15 AM,,South Erregulla Update  1  page  76.7KB
OCC,13/02/2024  9:14 AM,,Remplir Expansion Continues with Singapore Application  2  pages  230.1KB
SEK,13/02/2024  9:14 AM,,FY2024 Half Year Results Announcement  4  pages  295.3KB
SEK,13/02/2024  9:14 AM,,FY2024 Appendix 4D and Half Year Report  36  pages  2.2MB
MEC,13/02/2024  9:14 AM,,Update - Notification of buy-back - MEC  6  pages  18.5KB
AME,13/02/2024  9:13 AM,,Exploration Update  9  pages  1.1MB
AUE,13/02/2024  9:10 AM,,AUE Appoints Successful Exploration Manager in Cote d'Ivoire  1  page  152.0KB
WQG,13/02/2024  9:07 AM,,Weekly NTA 9 February 2024  1  page  206.6KB
GOW,13/02/2024  9:06 AM,,Update - Notification of buy-back - GOW  6  pages  18.2KB
WQG,13/02/2024  9:03 AM,,Update - Notification of buy-back - WQG  6  pages  18.3KB
A1M,13/02/2024  9:02 AM,,Change of Director's Interest Notice  3  pages  210.7KB
CXZ,13/02/2024  9:02 AM,,Application for quotation of securities - CXZ  6  pages  18.4KB
CTW,13/02/2024  9:02 AM,,CitiFirst MINIs Cash Amounts for Stop Loss Event 12 Feb 24  1  page  84.1KB
EVS,13/02/2024  9:01 AM,,Notification - Investor briefing H1 Results  1  page  56.0KB
AND,13/02/2024  9:01 AM,,Ansarada enters into Scheme Implementation Deed  105  pages  2.3MB
FCT,13/02/2024  9:01 AM,,Notice under ASX Listing Rule 3.10A  1  page  139.7KB
GML,13/02/2024  9:01 AM,,Investor Presentation - RIU Fremantle  20  pages  2.8MB
EBR,13/02/2024  9:00 AM,,Annual Meeting of Stockholders  1  page  149.1KB
VIT,13/02/2024  8:58 AM,,Initial Director's Interest Notice  2  pages  191.3KB
TEG,13/02/2024  8:58 AM,,Investor Presentation  17  pages  2.2MB
ARB,13/02/2024  8:58 AM,,Advance Notice of 1H FY2024 Half Year Results Presentation  1  page  211.7KB
ODY,13/02/2024  8:57 AM,,RC Drilling Recommences with Visible Gold Intersected  18  pages  1.8MB
OFX,13/02/2024  8:57 AM,,Notification of cessation of securities - OFX  4  pages  14.8KB
OFX,13/02/2024  8:57 AM,,Notification of cessation of securities - OFX  4  pages  14.8KB
VIT,13/02/2024  8:57 AM,,Appointment of Independent Chair  4  pages  221.2KB
RUL,13/02/2024  8:55 AM,,Notification of cessation of securities - RUL  4  pages  14.9KB
HLI,13/02/2024  8:55 AM,,Date of AGM and closing date for nomination of directors  1  page  75.4KB
BTR,13/02/2024  8:54 AM,,34m @ 7.9g/t Au Intersected at Cork Tree Well  27  pages  2.6MB
PAC,13/02/2024  8:54 AM,,Appointment of Non-Executive Director - Michael Clarke  2  pages  183.0KB
PRS,13/02/2024  8:54 AM,,Korsnas TSF - Drilling Commenced for Rare Earth Elements  4  pages  1.0MB
KPG,13/02/2024  8:53 AM,,Dividend/Distribution - KPG  4  pages  15.6KB
RUL,13/02/2024  8:53 AM,,Update - Notification of buy-back - RUL  6  pages  18.6KB
KPG,13/02/2024  8:52 AM,,February 24 Monthly Dividend for the 2024 Financial Year  3  pages  197.5KB
STO,13/02/2024  8:51 AM,,2023 Annual reserves and resources statement  6  pages  216.4KB
VEA,13/02/2024  8:48 AM,,Full Year 2023 results briefing  1  page  96.2KB
HUM,13/02/2024  8:47 AM,,Update - Notification of buy-back - HUM  6  pages  18.3KB
EXL,13/02/2024  8:47 AM,,Proposed issue of securities - EXL  8  pages  30.0KB
RKN,13/02/2024  8:43 AM,,FY23 Results Investor Presentation  20  pages  14.6MB
AZS,13/02/2024  8:41 AM,,More Very Impressive Lithium Results from Andover  17  pages  1.9MB
RKN,13/02/2024  8:39 AM,,FY23 Results Commentary  3  pages  215.7KB
HMG,13/02/2024  8:37 AM,,RIU Explorers Conference Presentation  13  pages  5.1MB
IVZ,13/02/2024  8:33 AM,,Hydrocarbon Samples from Mukuyu-2 Discovery at Laboratory  2  pages  435.1KB
WBC,13/02/2024  8:31 AM,,Update - Notification of buy-back - WBC  6  pages  18.3KB
CSL,13/02/2024  8:29 AM,,Half Year Results Investor Presentation  25  pages  2.6MB
CSL,13/02/2024  8:27 AM,,Dividend/Distribution - CSL  5  pages  17.9KB
PBH,13/02/2024  8:24 AM,,Details of H1 HY24 Results  1  page  116.1KB
CSL,13/02/2024  8:24 AM,,Half Year Results Announcement  7  pages  286.1KB
T88,13/02/2024  8:24 AM,,Appendix 3Y - Noel Ong  3  pages  185.0KB
CSL,13/02/2024  8:23 AM,,Statutory Accounts for the Half Year Ended 31 December 2023  27  pages  1.8MB
RG8,13/02/2024  8:23 AM,,Update - Notification of buy-back - RG8  6  pages  18.7KB
BCA,13/02/2024  8:23 AM,,Corporate Presentation RIU Conference  25  pages  5.2MB
LSF,13/02/2024  8:23 AM,,Net Tangible Asset Backing  1  page  219.3KB
HSN,13/02/2024  8:22 AM,,Hansen acquires powercloud  3  pages  214.7KB
VG1,13/02/2024  8:22 AM,,Update - Notification of buy-back - VG1  6  pages  18.8KB
NAB,13/02/2024  8:21 AM,,Notification of cessation of securities - NAB  4  pages  14.8KB
GAL,13/02/2024  8:21 AM,,Galileo Mining - Investor Presentation  21  pages  10.4MB
CGF,13/02/2024  8:21 AM,,1H24 Challenger Capital Notes Newsletter  2  pages  450.0KB
CGF,13/02/2024  8:20 AM,,1H24 Shareholder Newsletter  2  pages  453.3KB
OFX,13/02/2024  8:19 AM,,Update - Notification of buy-back - OFX  6  pages  18.3KB
ACQ,13/02/2024  8:19 AM,,ACQ Quarterly Review  23  pages  1.1MB
CGF,13/02/2024  8:18 AM,,1H24 Analyst Pack  65  pages  5.7MB
SWM,13/02/2024  8:17 AM,,Presentation of Half Year Results  20  pages  3.1MB
RVT,13/02/2024  8:17 AM,,Bell Potter Unearthed Conference Presentation February 24  23  pages  5.2MB
CGF,13/02/2024  8:16 AM,,1H24 Investor Presentation and Outlook  26  pages  1.4MB
CGF,13/02/2024  8:15 AM,,1H24 Market Release  7  pages  216.7KB
MKG,13/02/2024  8:15 AM,,New Large-Scale Manganese Zones Identified at Korhogo  17  pages  2.1MB
NSC,13/02/2024  8:15 AM,,NTA & Portfolio Update - January 2024  3  pages  745.2KB
CGF,13/02/2024  8:15 AM,,1H24 Financial Results  60  pages  7.2MB
NAC,13/02/2024  8:14 AM,,NTA & Portfolio Update - January 2024  3  pages  1.4MB
NAB,13/02/2024  8:14 AM,,Update - Notification of buy-back - NAB  6  pages  18.3KB
NCC,13/02/2024  8:13 AM,,NTA & Portfolio Update - January 2024  3  pages  658.1KB
CQE,13/02/2024  8:13 AM,,HY24 Results Presentation  30  pages  5.4MB
ACQ,13/02/2024  8:13 AM,,Net Tangible Asset Backing  2  pages  249.9KB
CGF,13/02/2024  8:13 AM,,Dividend/Distribution - CGF  5  pages  18.9KB
CGF,13/02/2024  8:12 AM,,Appendix 4D  3  pages  57.3KB
TTI,13/02/2024  8:11 AM,,Final Director's Interest Notice  2  pages  163.1KB
TTI,13/02/2024  8:10 AM,,Initial Director's Interest Notice  2  pages  158.5KB
CQE,13/02/2024  8:10 AM,,HY24 Results Announcement  3  pages  137.0KB
CQE,13/02/2024  8:09 AM,,Appendix 4D and HY24 Interim Financial Report  26  pages  1.5MB
TTI,13/02/2024  8:09 AM,,Appoints new Non-Executive Chairman  1  page  128.8KB
STG,13/02/2024  8:08 AM,,Update - Notification of buy-back - STG  6  pages  18.3KB
NYM,13/02/2024  8:08 AM,,Canadian Lithium Project Update  9  pages  2.5MB
SWM,13/02/2024  8:08 AM,,Interim Results Announcement  4  pages  182.6KB
ALI,13/02/2024  8:07 AM,,Weekly NTA estimate - Fri 9.2.24  1  page  212.0KB
MQG,13/02/2024  8:07 AM,,Macquarie Group 2024 Operational Briefing Presentation  59  pages  5.7MB
MBL,13/02/2024  8:07 AM,,Macquarie Group 2024 Operational Briefing Presentation  59  pages  5.7MB
BRG,13/02/2024  8:06 AM,,Half Year Ended 31 December 2023 - Investor Presentation  21  pages  3.1MB
BRG,13/02/2024  8:06 AM,,Half Year Ended 31 December 2023 - Results Announcement  6  pages  511.8KB
BRG,13/02/2024  8:06 AM,,Dividend/Distribution - BRG  4  pages  15.6KB
BRG,13/02/2024  8:06 AM,,Half Year Ended 31 December 2023 - Appendix 4D  24  pages  2.2MB
MQG,13/02/2024  8:06 AM,,Macquarie Group 2024 Operational Briefing Media Release  4  pages  100.2KB
MBL,13/02/2024  8:06 AM,,Macquarie Group 2024 Operational Briefing Media Release  4  pages  100.2KB
NOX,13/02/2024  8:06 AM,,Noxopharm extends Hudson Institute strategic partnership  3  pages  231.2KB
IBC,13/02/2024  8:05 AM,,Update - Notification of buy-back - IBC  6  pages  18.4KB
TPW,13/02/2024  8:05 AM,,Half Year Results Presentation  20  pages  1.4MB
TPW,13/02/2024  8:05 AM,,Half Year Results & Trading Update  3  pages  168.0KB
TPW,13/02/2024  8:05 AM,,Half Yearly Report and Accounts  24  pages  330.0KB
BMO,13/02/2024  8:05 AM,,RIU Explorers Conference Presentation  20  pages  6.1MB
HGO,13/02/2024  8:05 AM,,Fremantle Conference Presentation  25  pages  12.3MB
FPC,13/02/2024  8:04 AM,,Update - Notification of buy-back - FPC  6  pages  18.3KB
RKN,13/02/2024  8:04 AM,,Preliminary Final Report  56  pages  649.6KB
SBM,13/02/2024  8:04 AM,,31 December 2023 Mineral Resource and Ore Reserve Statement  31  pages  1.9MB
SLS,13/02/2024  8:04 AM,,Drilling Underway at New Gold Targets  22  pages  1.7MB
MTM,13/02/2024  8:04 AM,,RIU Explorers Conference Presentation  14  pages  1.8MB
CE1,13/02/2024  8:04 AM,,Change of Directors Interests  4  pages  208.3KB
ASQ,13/02/2024  8:04 AM,,Corporate Presentation - February 2024  31  pages  7.3MB
WSR,13/02/2024  8:04 AM,,"Multiple Lithium,Gold and Base Metal Targets at Opaline Well  10  pages  1.3MB"
ARL,13/02/2024  8:04 AM,,RIU Explorers Conference Presentation 2024  32  pages  12.4MB
MHK,13/02/2024  8:04 AM,,Investor Presentation - February 2024  13  pages  5.8MB
JHX,13/02/2024  8:03 AM,,Q3 FY24 Results Pack  69  pages  5.6MB
DRE,13/02/2024  8:03 AM,,$2.1M R&D Tax Incentive Underscores Mangaroon Rare Earths  3  pages  932.8KB
JHX,13/02/2024  8:03 AM,,Q3 FY24 Results Announcement  1  page  1.9MB
WA8,13/02/2024  8:03 AM,,RIU Explorers Conference - Investor Presentation  16  pages  2.5MB
ASR,13/02/2024  8:03 AM,,Large Lithium and REE Anomalies Defined at Kookynie West  34  pages  4.9MB
VTM,13/02/2024  8:03 AM,,Investor Presentation  25  pages  12.7MB
SWM,13/02/2024  8:02 AM,,Appendix 4D & Half Year Financial Report  31  pages  968.0KB
KGN,13/02/2024  8:02 AM,,Ceasing to be a substantial holder  3  pages  167.7KB
