ASX Code,Date,Price sens.,Headline
A30,06/08/2025  8:34 am,Â,PDS dated 25 July 2025  116  pages  3.7MB
ORI,06/08/2025  8:32 am,Â,Update - Notification of buy-back - ORI  6  pages  18.4KB
FFM,06/08/2025  8:32 am,Â,FireFly Diggers & Dealers Kalgoorlie Presentation  33  pages  3.2MB
ASX,06/08/2025  8:32 am,Â,ASX Group Monthly Activity Report - July 2025  7  pages  119.1KB
AL3,06/08/2025  8:31 am,,AML3D Extends European Distribution Capabilities  2  pages  249.0KB
ATX,06/08/2025  8:29 am,,Positive ACCENT Trial Topline Data Released  21  pages  6.1MB
ALK,06/08/2025  8:29 am,Â,Diggers & Dealers Mining Forum Presentation  28  pages  5.3MB
BGD,06/08/2025  8:29 am,,Wudinna Gold Project - Grant of New Tenements  3  pages  298.0KB
CAT,06/08/2025  8:27 am,Â,Change of Director's Interest Notice  3  pages  163.8KB
ARN,06/08/2025  8:25 am,,High-grade Niobium starting to emerge at Kameelburg  28  pages  1.6MB
GIB,06/08/2025  8:25 am,,Mining Permit Granted- Mobilisation at Edjudina Gold Project  5  pages  2.7MB
ALK,06/08/2025  8:25 am,Â,Application for quotation of securities - ALK  6  pages  18.3KB
NYR,06/08/2025  8:24 am,Â,BioShares Biotech Summit Presentation  12  pages  1.6MB
GBR,06/08/2025  8:23 am,,Hits up to 39.5g/t Au south of Ironbark  17  pages  2.4MB
RCM,06/08/2025  8:23 am,Â,Drilling Approved at Webbs Silver Project - Upside Potential  5  pages  864.4KB
ALK,06/08/2025  8:23 am,,Alkane and Mandalay Announce Closing of Merger  5  pages  180.1KB
AKN,06/08/2025  8:22 am,,Cloncurry Gold Project Update  4  pages  385.2KB
AAJ,06/08/2025  8:22 am,Â,Aruma Commences Maiden Drilling Program at Fiery Creek  6  pages  924.9KB
HRZ,06/08/2025  8:22 am,Â,Diggers and Dealers Invetsor Presentation  24  pages  8.0MB
MDR,06/08/2025  8:22 am,Â,MedAdvisor Quarterly Activities Report 4Q FY25 - Addendum  1  page  75.8KB
HLS,06/08/2025  8:22 am,Â,Updated Policy on Trading in Healius Securities  11  pages  251.7KB
KAR,06/08/2025  8:22 am,Â,Update - Notification of buy-back - KAR  6  pages  18.3KB
SEK,06/08/2025  8:22 am,Â,Becoming a substantial holder  23  pages  1.4MB
DNL,06/08/2025  8:22 am,Â,Update - Notification of buy-back - DNL  6  pages  18.4KB
NWS,06/08/2025  8:22 am,Â,Dividend/Distribution - NWS  4  pages  16.7KB
STK,06/08/2025  8:21 am,,Massive Gold Intercept at Kotlovi  19  pages  2.0MB
NWS,06/08/2025  8:21 am,Â,Dividend/Distribution - NWSLV  4  pages  16.7KB
NWS,06/08/2025  8:21 am,,FY2025 Fourth Quarter Earnings Release  26  pages  498.7KB
NVU,06/08/2025  8:21 am,,Nanoveu Accelerates 16nm ECS-DoT Chip Development  4  pages  316.9KB
XAM,06/08/2025  8:21 am,Â,Change in substantial holding - Ganbayar Lkhagvasuren  3  pages  157.8KB
XAM,06/08/2025  8:21 am,Â,Change in substantial holding (x2) - Bastion & Boroo Group  6  pages  442.2KB
RMS,06/08/2025  8:21 am,Â,Ceasing to be a substantial holder  8  pages  928.8KB
XYZ,06/08/2025  8:21 am,Â,Statement of Changes in Beneficial Ownership  1  page  283.1KB
ILU,06/08/2025  8:21 am,Â,Rare Earth Concentrate Supply Agreement - Lindian Resources  4  pages  306.9KB
LIN,06/08/2025  8:21 am,Â,ILU: Rare Earth Concentrate Supply Agreement - Lindian Res.  4  pages  306.9KB
BM1,06/08/2025  8:20 am,Â,Diggers & Dealers Presentation  25  pages  4.2MB
QOR,06/08/2025  8:20 am,Â,Ceasing to be a substantial holder  2  pages  525.7KB
BM1,06/08/2025  8:19 am,Â,Appointment of Auditor  1  page  282.5KB
PRU,06/08/2025  8:19 am,Â,Update - Notification of buy-back - PRU  6  pages  18.2KB
GED,06/08/2025  8:19 am,,Exceptional Otavi Copper Silver Zinc and Germanium Grades  38  pages  6.4MB
ALB,06/08/2025  8:19 am,,Phase 2 of RC Drilling Commences at Yandal West  2  pages  357.7KB
5EA,06/08/2025  8:19 am,Â,Statement of CDIs on issue - 5EA  4  pages  15.9KB
BIO,06/08/2025  8:19 am,Â,Ceasing to be a substantial holder  3  pages  185.9KB
STW,06/08/2025  8:18 am,Â,Month end units on issue  4  pages  387.2KB
SFY,06/08/2025  8:18 am,Â,Month end units on issue  4  pages  387.2KB
SLF,06/08/2025  8:18 am,Â,Month end units on issue  4  pages  387.2KB
SYI,06/08/2025  8:18 am,Â,Month end units on issue  4  pages  387.2KB
SSO,06/08/2025  8:18 am,Â,Month end units on issue  4  pages  387.2KB
OZR,06/08/2025  8:18 am,Â,Month end units on issue  4  pages  387.2KB
OZF,06/08/2025  8:18 am,Â,Month end units on issue  4  pages  387.2KB
GOV,06/08/2025  8:18 am,Â,Month end units on issue  4  pages  387.2KB
BON,06/08/2025  8:18 am,Â,Month end units on issue  4  pages  387.2KB
WXO,06/08/2025  8:18 am,Â,Month end units on issue  4  pages  387.2KB
WXH,06/08/2025  8:18 am,Â,Month end units on issue  4  pages  387.2KB
WDI,06/08/2025  8:18 am,Â,Month end units on issue  4  pages  387.2KB
DJR,06/08/2025  8:18 am,Â,Month end units on issue  4  pages  387.2KB
WEM,06/08/2025  8:18 am,Â,Month end units on issue  4  pages  387.2KB
SPY,06/08/2025  8:18 am,Â,Month end units on issue  4  pages  387.2KB
QMI,06/08/2025  8:18 am,Â,Month end units on issue  4  pages  387.2KB
E20,06/08/2025  8:18 am,Â,Month end units on issue  4  pages  387.2KB
LSF,06/08/2025  8:18 am,Â,Net Tangible Asset Backing  1  page  103.2KB
MIN,06/08/2025  8:18 am,Â,Becoming a substantial holder  5  pages  246.9KB
STW,06/08/2025  8:18 am,Â,Daily Fund Update  9  pages  180.4KB
NEM,06/08/2025  8:18 am,Â,Form 4 as filed - Peter Toth  2  pages  526.2KB
SLF,06/08/2025  8:18 am,Â,Daily Fund Update  4  pages  77.0KB
SFY,06/08/2025  8:18 am,Â,Daily Fund Update  4  pages  79.3KB
TOP,06/08/2025  8:18 am,Â,Update - Notification of buy-back - TOP  6  pages  18.5KB
DAL,06/08/2025  8:18 am,Â,Notice Under Section 708A(5)(e) of the Corporations Act  1  page  426.2KB
NEM,06/08/2025  8:18 am,Â,Form 4 as filed - Bruce Brook  2  pages  518.2KB
AFZ,06/08/2025  8:17 am,Â,mFund - Distribution - AFZ16  1  page  98.9KB
FLT,06/08/2025  8:17 am,Â,Update - Notification of buy-back - FLT  6  pages  18.4KB
CLW,06/08/2025  8:17 am,,CLW 2025 Full Year Results presentation  36  pages  15.3MB
BWP,06/08/2025  8:17 am,Â,Ceasing to be a substantial holder  55  pages  1.2MB
CLW,06/08/2025  8:17 am,,CLW 2025 Full Year Results  3  pages  161.8KB
CAT,06/08/2025  8:17 am,Â,Catapult AGM Results  2  pages  160.6KB
PER,06/08/2025  8:17 am,Â,New Preclinical Data Reported for HMBD-002 in Breast Cancer  3  pages  155.9KB
LAM,06/08/2025  8:17 am,Â,Change of Director's Interest Notice  3  pages  735.4KB
BWP,06/08/2025  8:17 am,Â,2025 Appendix 4G  12  pages  394.3KB
CLW,06/08/2025  8:17 am,,Full Year Statutory Accounts  58  pages  2.0MB
BWP,06/08/2025  8:17 am,Â,2025 BWP Group Corporate Governance Statement  19  pages  354.9KB
BWP,06/08/2025  8:16 am,Â,2025 Full-year results Investor Briefing Presentation  37  pages  5.6MB
BWP,06/08/2025  8:16 am,Â,Update - Dividend/Distribution - BWP  5  pages  18.0KB
BWP,06/08/2025  8:16 am,Â,2025 Annual Report  72  pages  4.2MB
BWP,06/08/2025  8:16 am,,Full-year results to 30 June 2025  10  pages  449.6KB
AGN,06/08/2025  8:15 am,Â,Argenica Appoints Vice President of Regulatory Affairs  2  pages  205.9KB
GED,06/08/2025  8:15 am,,Exceptional Otavi Copper Silver Zinc and Germanium Grades  38  pages  5.2MB
BC8,06/08/2025  8:15 am,,Kal East - Open Pit Mining Contract Awarded  5  pages  686.1KB
AI1,06/08/2025  8:15 am,,Graphene Interconnect Development Enters Next Phase  6  pages  291.1KB
REA,06/08/2025  8:12 am,Â,Appendix 4G and Corporate Governance Statement  29  pages  1.9MB
REA,06/08/2025  8:12 am,,REA Group Investor and Analyst Presentation FY25  52  pages  12.1MB
REA,06/08/2025  8:11 am,,REA Group FY25 Financial Information Released  8  pages  246.2KB
REA,06/08/2025  8:11 am,Â,Dividend/Distribution - REA  4  pages  15.5KB
REA,06/08/2025  8:10 am,,Appendix 4E and Annual Report  176  pages  8.1MB
TEE,06/08/2025  8:07 am,Â,North American Roadshow Presentation  18  pages  7.5MB
SLX,06/08/2025  8:04 am,Â,US NRC Accepts GLE's Licence Application for the PLEF  2  pages  183.1KB
SLX,06/08/2025  8:04 am,Â,Operational Update - 6 August 2025  12  pages  872.5KB
FBU,06/08/2025  8:03 am,Â,Fletcher Building FY25 Results Webcast Details  1  page  106.8KB
THL,06/08/2025  7:30 am,Â,FY25 Annual Results - Webcast Details  2  pages  150.9KB
