ASX Code,Date,Price sens.,Headline
NGY,04/10/2023  8:22 AM,,NGY secures Environmental Permit for Tanjung Enim PSC  2  pages  272.1KB
ALI,04/10/2023  8:22 AM,,Weekly NTA estimate - Fri 29.9.23  1  page  211.2KB
HUM,04/10/2023  8:22 AM,,Update - Notification of buy-back - HUM  6  pages  27.7KB
CLZ,04/10/2023  8:22 AM,,Annual General Meeting Date  1  page  237.7KB
HLI,04/10/2023  8:22 AM,,Update - Notification of buy-back - HLI  6  pages  27.9KB
SBM,04/10/2023  8:22 AM,,Ceasing to be a substantial holder  4  pages  677.2KB
MST,04/10/2023  8:22 AM,,Monthly redemptions and units on issue Sept 2023  1  page  149.8KB
GTN,04/10/2023  8:22 AM,,Update - Notification of buy-back - GTN  6  pages  27.8KB
NST,04/10/2023  8:22 AM,,Notification regarding unquoted securities - NST  6  pages  27.5KB
ANN,04/10/2023  8:21 AM,,Update - Notification of buy-back - ANN  6  pages  27.9KB
EMN,04/10/2023  8:21 AM,,Statement of CDIs on issue - EMN  4  pages  22.7KB
MIN,04/10/2023  8:21 AM,,Application for quotation of securities - MIN  6  pages  27.3KB
PPE,04/10/2023  8:21 AM,,Application for quotation of securities - PPE  6  pages  27.2KB
MIN,04/10/2023  8:21 AM,,Completion of US$1.1billion Senior Unsecured Notes Offering  1  page  184.5KB
PPE,04/10/2023  8:21 AM,,Notification regarding unquoted securities - PPE  7  pages  29.3KB
IGO,04/10/2023  8:21 AM,,Australian Nickel Conference Presentation  23  pages  6.4MB
LSF,04/10/2023  8:21 AM,,Net Tangible Asset Backing  1  page  219.3KB
REC,04/10/2023  8:21 AM,,Field Exploration Progress at Wapistan Lithium Project  6  pages  1.2MB
BSL,04/10/2023  8:21 AM,,Update - Notification of buy-back - BSL  6  pages  27.9KB
NC6,04/10/2023  8:21 AM,,European Patent Approval Secured for Jelli Grow Technology  2  pages  335.6KB
NEC,04/10/2023  8:20 AM,,Update - Notification of buy-back - NEC  6  pages  27.8KB
RNT,04/10/2023  8:20 AM,,AGM Date and Closing Date for Director Nominations  1  page  147.6KB
DRE,04/10/2023  8:20 AM,,Proposed issue of securities - DRE  5  pages  27.4KB
DRE,04/10/2023  8:20 AM,,Bresnahan (100%) Acquisition & Consolidation  4  pages  727.2KB
LCY,04/10/2023  8:20 AM,,Infrastructure Sharing Agreement Signed With Linden Gold  3  pages  357.7KB
PPT,04/10/2023  8:20 AM,,Notification of cessation of securities - PPT  4  pages  23.8KB
VR8,04/10/2023  8:20 AM,,Steelpoortdrift and Tweefontein Projects Update  10  pages  459.7KB
JHG,04/10/2023  8:20 AM,,Statement of CDIs on issue - JHG  2  pages  19.9KB
MPL,04/10/2023  8:20 AM,,Changes to executive leadership team  2  pages  173.1KB
ASO,04/10/2023  8:19 AM,,B2 assays extend nickel mineralisation 500m along strike  15  pages  1.0MB
HVY,04/10/2023  8:19 AM,,Port Gregory PFS Study Awarded - Revision  4  pages  619.7KB
BNL,04/10/2023  8:19 AM,,Voyager Helium Construction Update  3  pages  901.8KB
ARL,04/10/2023  8:19 AM,,Australian Nickel Conference Presentation  32  pages  12.7MB
PYC,04/10/2023  8:19 AM,,PYC-001 Effective In Both NHPs and Patient-Derived Models  6  pages  512.9KB
LCL,04/10/2023  8:19 AM,,Additional nickel sulphide targets identified - PNG  30  pages  3.3MB
LEX,04/10/2023  8:18 AM,,Change in substantial holding  3  pages  70.2KB
NMT,04/10/2023  8:18 AM,,Primobius - Outstanding New Lithium Flowsheet Results  3  pages  389.5KB
GSR,04/10/2023  8:18 AM,,Letter to Shareholders  4  pages  411.0KB
URW,04/10/2023  8:18 AM,,URW - Acquisition of shares - SB Chairman  3  pages  141.1KB
GTE,04/10/2023  8:18 AM,,Listing Rule 3.13.1 Notice  1  page  142.0KB
LEG,04/10/2023  8:18 AM,,Australian Nickel Conference presentation 4 October 2023  20  pages  3.8MB
OEC,04/10/2023  8:17 AM,,Change in substantial holding  6  pages  599.6KB
RMX,04/10/2023  8:17 AM,,Mustang drilling set to commence  2  pages  325.6KB
S32,04/10/2023  8:17 AM,,Daily share buy-back notice - Appendix 3E  2  pages  350.5KB
AUE,04/10/2023  8:17 AM,,Madien Drilling Program Completed At Ryans Find  19  pages  1.2MB
AZI,04/10/2023  8:17 AM,,Geothermal Lithium Project Presentation October 2023  12  pages  1.9MB
RGB,04/10/2023  8:16 AM,,Month end units on issue  1  page  33.0KB
RSM,04/10/2023  8:16 AM,,Month end units on issue  1  page  33.0KB
RCB,04/10/2023  8:16 AM,,Month end units on issue  1  page  33.0KB
RDV,04/10/2023  8:16 AM,,Monthly Units On Issue Announcement  1  page  30.7KB
RAR,04/10/2023  8:16 AM,,Monthly Units On Issue Announcement  1  page  29.6KB
CIA,04/10/2023  8:16 AM,,Technical Report - Resources & Reserves Bloom Lake Mine  264  pages  18.4MB
AZI,04/10/2023  8:16 AM,,Altamin Expanding Lithium Project Footprint 500%  13  pages  1.1MB
STW,04/10/2023  8:15 AM,,Daily Fund Update  9  pages  180.5KB
NSC,04/10/2023  8:15 AM,,Update - Notification of buy-back - NSC  6  pages  27.8KB
SLF,04/10/2023  8:15 AM,,Daily Fund Update  4  pages  77.4KB
SFY,04/10/2023  8:15 AM,,Daily Fund Update  4  pages  79.4KB
WBT,04/10/2023  8:15 AM,,Becoming a substantial holder from MUFG  270  pages  2.1MB
PCI,04/10/2023  8:15 AM,,Daily Net Tangible Asset Statement  1  page  71.1KB
AHN,04/10/2023  8:15 AM,,International Coal Preparation Congress  3  pages  744.3KB
TPD,04/10/2023  8:15 AM,,Change of Director's Interest Notice - D Casey  4  pages  274.8KB
SPK,04/10/2023  7:30 AM,,Notice of on-market share buyback  2  pages  59.7KB
