ASX Code,Date,Price sens.,Headline
EMU,09/09/2025  12:35 pm,Â,Withdrawal of Consent to Act as a Director  1  page  70.1KB
GQG,09/09/2025  12:32 pm,Â,Appendix 3Y - R Jain  2  pages  185.1KB
T3D,09/09/2025  12:30 pm,,Pause in Trading  1  page  114.3KB
PCI,09/09/2025  12:22 pm,Â,Daily Net Tangible Asset Statement  1  page  476.6KB
HCD,09/09/2025  12:21 pm,Â,Half Yearly Report and Accounts  17  pages  761.5KB
MYG,09/09/2025  12:19 pm,Â,Amended Initial Director's Interest Notice - Choquenot  2  pages  205.5KB
SYA,09/09/2025  12:17 pm,Â,Application for quotation of securities - SYA  6  pages  18.7KB
ARG,09/09/2025  12:13 pm,Â,App 3Y - Change of Director's Interests - J Beddow  2  pages  256.7KB
AMS,09/09/2025  12:10 pm,Â,Change of Director's Interest Notice  3  pages  291.9KB
E79,09/09/2025  11:59 am,Â,Ceasing to be a substantial holder - P Ironside  2  pages  107.9KB
TG1,09/09/2025  11:58 am,Â,TG1OA Top 20 Holder Report  1  page  145.8KB
TG1,09/09/2025  11:58 am,Â,Application for quotation of securities - TG1  6  pages  19.6KB
TG1,09/09/2025  11:58 am,Â,Completion of Non-Renounceable Entitlement Offer  6  pages  717.6KB
SRN,09/09/2025  11:57 am,,EM Conductor Identified at Copper Hill  6  pages  1.9MB
JHI,09/09/2025  11:57 am,Â,mFund - Distribution - JHI04  1  page  37.2KB
JHI,09/09/2025  11:56 am,Â,mFund - Monthly Redemption Report - JHI06  1  page  37.7KB
JHI,09/09/2025  11:54 am,Â,mFund - Monthly Redemption Report - JHI05  1  page  37.3KB
KLS,09/09/2025  11:54 am,Â,Change of Director's Interest Notice (Dodd)  3  pages  318.5KB
JHI,09/09/2025  11:54 am,Â,mFund - Monthly Redemption Report - JHI04  1  page  37.3KB
JHI,09/09/2025  11:53 am,Â,mFund - Monthly Redemption Report - JHI02  1  page  37.2KB
OSL,09/09/2025  11:52 am,Â,Application for quotation of securities - OSL  6  pages  18.3KB
NWG,09/09/2025  11:51 am,Â,mFund - Monthly Redemption Report - NWG01  1  page  37.5KB
ZMM,09/09/2025  11:50 am,Â,Results of General Meeting  2  pages  276.3KB
CIW,09/09/2025  11:46 am,Â,Notification of cessation of securities - CIW  4  pages  14.7KB
PGA,09/09/2025  11:45 am,Â,August 2025 Investment Update  4  pages  511.1KB
IME,09/09/2025  11:45 am,Â,Application for quotation of securities - IME  7  pages  21.3KB
TON,09/09/2025  11:45 am,,RECEIPT OF FUNDS AND ADJOURMENT OF LEGAL PROCEEDINGS  1  page  148.8KB
IME,09/09/2025  11:44 am,Â,Appendix 3Y - Carlos Palacio  2  pages  302.5KB
CAM,09/09/2025  11:41 am,Â,Notification of cessation of securities - CAM  4  pages  14.7KB
IME,09/09/2025  11:39 am,Â,Appendix 3Y - Douglas Lingard  3  pages  226.7KB
IME,09/09/2025  11:38 am,Â,Appendix 3Y - Damian Banks  2  pages  254.8KB
IEL,09/09/2025  11:36 am,Â,Change of Director's Interest Notice  2  pages  300.7KB
IME,09/09/2025  11:36 am,Â,Appendix 3Y - Douglas Flynn  2  pages  298.2KB
THB,09/09/2025  11:35 am,Â,Initial Director's Interest Notice  2  pages  241.8KB
IEL,09/09/2025  11:35 am,Â,Change of Director's Interest Notice  3  pages  310.9KB
THB,09/09/2025  11:35 am,Â,Final Director's Interest Notice  2  pages  219.8KB
PRS,09/09/2025  11:34 am,Â,Target Market Determination  4  pages  125.1KB
HCH,09/09/2025  11:31 am,Â,Application for quotation of securities - HCH  6  pages  18.4KB
PRS,09/09/2025  11:31 am,Â,Letter to Ineligible Shareholders  1  page  380.6KB
RMX,09/09/2025  11:31 am,Â,Application for quotation of securities - RMX  6  pages  18.2KB
PRS,09/09/2025  11:31 am,Â,Renounceable Rights Issue - Dispatch  1  page  134.0KB
RC1,09/09/2025  11:29 am,Â,Expiry of Listed Options  1  page  117.0KB
MML,09/09/2025  11:23 am,,High-grades continue from Northern Area  22  pages  1.9MB
360,09/09/2025  11:23 am,Â,SEC Form 4  3  pages  142.8KB
MAT,09/09/2025  11:21 am,Â,Secondary Trading Notice  1  page  214.5KB
FBR,09/09/2025  11:20 am,Â,Cleansing Notice  1  page  700.6KB
MIC,09/09/2025  11:17 am,Â,MICH Fund Update - August 2025  2  pages  254.7KB
VGL,09/09/2025  11:16 am,Â,Ceasing to be a substantial holder  3  pages  91.6KB
MHG,09/09/2025  11:14 am,Â,MHG Fund Update - August 2025  2  pages  330.0KB
MAT,09/09/2025  11:14 am,Â,Application for quotation of securities - MAT  8  pages  24.0KB
360,09/09/2025  11:11 am,Â,SEC Forms 4  5  pages  1.1MB
BCM,09/09/2025  11:08 am,Â,Cleansing Notice  1  page  210.2KB
LKO,09/09/2025  11:08 am,,"Wombat-5 Well, Gippsland Basin, Victoria, Drilling Update  1  page  408.8KB"
TMX,09/09/2025  11:06 am,Â,Partial Shortfall Issued (2nd) at $0.003 Balance Available  4  pages  240.3KB
EGL,09/09/2025  11:06 am,Â,Change in substantial holding x2  4  pages  268.5KB
REZ,09/09/2025  11:05 am,,Approval Granted for Full-Scale Gold Vat Leach Prod. Maranoa  4  pages  1.8MB
BCM,09/09/2025  11:05 am,Â,Application for quotation of securities - BCM  6  pages  18.3KB
CWP,09/09/2025  11:04 am,Â,Important dates for shareholders  1  page  207.8KB
PMC,09/09/2025  11:03 am,Â,Weekly Net Tangible Asset Backing  1  page  162.7KB
MGO,09/09/2025  10:59 am,Â,MGOC Fund Update - August 2025  2  pages  302.6KB
RZI,09/09/2025  10:56 am,Â,Ceasing to be a substantial holder  1  page  266.0KB
THL,09/09/2025  10:54 am,Â,Closing Date for Director Nominations  1  page  127.8KB
CTW,09/09/2025  10:50 am,Â,CitiFirst BHP SFI MINIs Dividend Final Amount  1  page  103.8KB
MEU,09/09/2025  10:49 am,,First Greenewood assays reveal outstanding high grade gold  20  pages  2.2MB
CNQ,09/09/2025  10:44 am,Â,Notification regarding unquoted securities - CNQ  6  pages  19.4KB
CTW,09/09/2025  10:43 am,Â,CitiFirst BXB SFIs Dividend  1  page  102.1KB
CTW,09/09/2025  10:42 am,Â,CitiFirst BHP SFIs Dividend Final Amount  1  page  104.1KB
DTM,09/09/2025  10:42 am,Â,Consolidation/Split - DTM  7  pages  24.5KB
NUC,09/09/2025  10:37 am,Â,Change of Share Registry  1  page  746.1KB
DTZ,09/09/2025  10:32 am,Â,Proposed issue of securities - DTZ  6  pages  22.8KB
RUL,09/09/2025  10:32 am,Â,Response to ASX Aware Query  10  pages  1.1MB
ADG,09/09/2025  10:23 am,Â,Proposed issue of securities - ADG  6  pages  20.7KB
STK,09/09/2025  10:20 am,Â,North America Conference Presentation  25  pages  3.5MB
PGF,09/09/2025  10:20 am,Â,Monthly Report - 31 August 2025  3  pages  250.1KB
NWS,09/09/2025  10:19 am,,Press Release - Pricing of Offering  3  pages  183.2KB
ADG,09/09/2025  10:19 am,Â,NVA: Nova Announces Strategic Investment in Adelong Gold  5  pages  224.7KB
NVA,09/09/2025  10:19 am,Â,Nova Announces Strategic Investment in Adelong Gold  5  pages  224.7KB
UBN,09/09/2025  10:17 am,Â,Application for quotation of securities - UBN  6  pages  19.3KB
ARA,09/09/2025  10:15 am,Â,Update - Notification of buy-back - ARA  6  pages  18.2KB
CTW,09/09/2025  10:15 am,Â,CitiFirst BHP Instalments Dividend Final Amount  1  page  101.0KB
CTW,09/09/2025  10:14 am,Â,CitiFirst BHP Instalment MINIs Dividend Final Amount  1  page  101.4KB
UBN,09/09/2025  10:14 am,Â,Notification of cessation of securities - UBN  4  pages  15.1KB
AOF,09/09/2025  10:11 am,,150 Charlotte Street termination of sale contract  1  page  74.5KB
GRL,09/09/2025  10:11 am,Â,Offer Booklet and Ineligible Shareholders Letters Despatched  2  pages  213.9KB
PCX,09/09/2025  10:09 am,Â,Update - Dividend/Distribution - PCX  6  pages  21.2KB
FPH,09/09/2025  10:08 am,Â,Application for quotation of securities - FPH  7  pages  19.8KB
FPH,09/09/2025  10:07 am,Â,Capital Change Notice - Issue of Ordinary Shares  2  pages  141.7KB
AKN,09/09/2025  10:06 am,Â,Proposed issue of securities - AKN  6  pages  20.8KB
SNC,09/09/2025  10:05 am,Â,Change of Director's Interest Notice - P Velez  2  pages  819.9KB
A11,09/09/2025  10:05 am,Â,Form 604 - Notice of Change in Substantial Holding  4  pages  602.0KB
W2V,09/09/2025  10:04 am,Â,Change of Director's Interest Notice - D Buckingham  3  pages  297.6KB
W2V,09/09/2025  10:02 am,Â,Change of Director's Interest Notice - R Edgley  3  pages  297.5KB
BAS,09/09/2025  10:02 am,,2025 Half Year Results  2  pages  319.9KB
SRL,09/09/2025  10:02 am,Â,Application for quotation of securities - SRL  6  pages  18.2KB
ADG,09/09/2025  10:02 am,,Adelong Secures Strategic Investment from Nova Minerals  8  pages  568.7KB
NVA,09/09/2025  10:02 am,Â,ADG: Adelong Secures Strategic Investment from Nova Minerals  8  pages  568.7KB
WAR,09/09/2025  10:02 am,Â,Geoff Wilson Appendix 3Y  2  pages  301.2KB
WNX,09/09/2025  10:00 am,Â,Appointment of Non-Executive Chair  2  pages  167.3KB
BAS,09/09/2025  10:00 am,Â,Half Year Report - 30 June 2025  31  pages  1.8MB
W2V,09/09/2025  10:00 am,Â,Notification of cessation of securities - W2V  5  pages  16.1KB
WAA,09/09/2025  10:00 am,Â,Geoff Wilson Appendix 3Y  2  pages  220.9KB
AKN,09/09/2025  9:58 am,Â,Proposed issue of securities - AKN  5  pages  17.3KB
AKN,09/09/2025  9:58 am,,Auking Completes A$5m Riverfort Facility  4  pages  244.9KB
MTH,09/09/2025  9:57 am,Â,Investor Presentation  21  pages  12.7MB
TLG,09/09/2025  9:57 am,,Talga enters US battery anode market  3  pages  94.2KB
SRL,09/09/2025  9:56 am,,Reinstatement to Quotation  1  page  110.3KB
SRL,09/09/2025  9:56 am,,Update to Scandium Mineral Resource  33  pages  1.2MB
CBO,09/09/2025  9:55 am,Â,Proposed issue of securities - CBO  5  pages  17.7KB
OCL,09/09/2025  9:55 am,Â,Application for quotation of securities - OCL  6  pages  18.4KB
CBO,09/09/2025  9:55 am,Â,Proposed issue of securities - CBO  6  pages  20.2KB
CBO,09/09/2025  9:55 am,,Investor Presentation  33  pages  3.1MB
CBO,09/09/2025  9:55 am,,$175m Placement and Share Purchase Plan  5  pages  170.2KB
WMA,09/09/2025  9:54 am,Â,Geoff Wilson Appendix 3Y  2  pages  231.5KB
OCL,09/09/2025  9:52 am,Â,Application for quotation of securities - OCL  6  pages  18.4KB
MAT,09/09/2025  9:50 am,,High Grade Visible Gold Seen at Devon Pit Gold Mine  11  pages  1.3MB
WMI,09/09/2025  9:50 am,Â,August 2025 Investment Update  4  pages  463.3KB
CHM,09/09/2025  9:49 am,Â,Presentation to investor webinar  18  pages  3.6MB
WQG,09/09/2025  9:48 am,Â,Important Reminder - One week left to participate in the DRP  1  page  176.8KB
PGF,09/09/2025  9:48 am,Â,PGF notes sale by PM Entities - Correction  1  page  240.2KB
AHL,09/09/2025  9:48 am,,Board Changes  1  page  80.6KB
AT1,09/09/2025  9:46 am,Â,Atomo Appoints Chair  1  page  69.7KB
BKT,09/09/2025  9:46 am,Â,Proposed issue of securities - BKT  5  pages  17.4KB
ODA,09/09/2025  9:45 am,Â,Change of Director's Interest Notice - Geoff Jamieson  3  pages  309.3KB
JBH,09/09/2025  9:45 am,Â,Court approves agreement between ACCC and The Good Guys  1  page  126.7KB
BKT,09/09/2025  9:44 am,Â,Cleansing Prospectus  41  pages  659.2KB
SNC,09/09/2025  9:44 am,Â,SNC Shareholder Presentation  18  pages  668.3KB
GBR,09/09/2025  9:42 am,,Visible gold in RC drilling at Eaglehawk  13  pages  2.0MB
BLU,09/09/2025  9:41 am,,PL 1034 Production Licence over Sapphire awarded to Blue  2  pages  455.9KB
DTZ,09/09/2025  9:41 am,,Unsecured Loan  3  pages  268.9KB
IVR,09/09/2025  9:41 am,,Strategic Growth Outlook  9  pages  720.6KB
BCN,09/09/2025  9:40 am,,Project Update - Iguana Deposit  4  pages  616.2KB
SHO,09/09/2025  9:40 am,,SHO expands Indosat Agreement to include mobile gaming  3  pages  277.3KB
DTM,09/09/2025  9:39 am,Â,Proposed issue of securities - DTM  6  pages  22.0KB
EBO,09/09/2025  9:37 am,Â,Notification of cessation of securities - EBO  4  pages  14.9KB
ARV,09/09/2025  9:37 am,Â,Cleansing Notice  1  page  233.7KB
DTM,09/09/2025  9:37 am,,Notice of General Meeting/Proxy Form  30  pages  1.1MB
HVN,09/09/2025  9:34 am,Â,Change of Director's Interest Notice  16  pages  551.8KB
AGR,09/09/2025  9:34 am,,Institutional investment  4  pages  298.2KB
AGR,09/09/2025  9:34 am,Â,Proposed issue of securities - AGR  6  pages  20.7KB
ARV,09/09/2025  9:34 am,Â,Change of Directors Interest Notice X 3  6  pages  344.2KB
BP8,09/09/2025  9:33 am,Â,Advisory Board to Support Rare Earth Element Research  4  pages  172.1KB
LRT,09/09/2025  9:33 am,Â,LRT NAV Estimate - 5 September 2025  1  page  137.1KB
GNM,09/09/2025  9:32 am,,Catalyst Ridge REE-Antimony Expansion in Mountain Pass USA  16  pages  2.1MB
VGL,09/09/2025  9:32 am,Â,Amended SPH Notice - Regal Funds Management  4  pages  217.9KB
MA1,09/09/2025  9:32 am,Â,MA1 - Entitlement Offer Booklet  71  pages  11.7MB
GT3,09/09/2025  9:30 am,Â,Low Carbon Concrete Noise Panel Wall Produced  4  pages  703.8KB
SSH,09/09/2025  9:30 am,,Site Works Commence - Stockpiles & Tailings Mt Fisher Gold  5  pages  1.3MB
HVN,09/09/2025  9:30 am,Â,Notification of cessation of securities - HVN  4  pages  14.7KB
JIN,09/09/2025  9:28 am,,Jumbo signs SaaS agreement with RSL Queensland  2  pages  167.8KB
PEN,09/09/2025  9:28 am,Â,Ceasing to be a substantial holder  4  pages  1.1MB
ITM,09/09/2025  9:27 am,Â,Cleansing Notice - Share Placement  1  page  283.0KB
CXZ,09/09/2025  9:27 am,Â,Update - Notification of buy-back - CXZ  6  pages  18.6KB
WOW,09/09/2025  9:27 am,Â,Response to ASX Aware Query  9  pages  543.5KB
PGF,09/09/2025  9:26 am,Â,PGF notes sale by PM Entities  1  page  248.3KB
OSL,09/09/2025  9:26 am,Â,OncoSil announces new Non-Executive Chairman  3  pages  201.9KB
DOW,09/09/2025  9:26 am,Â,Downer awarded new Water contract in Queensland  2  pages  136.1KB
RHY,09/09/2025  9:26 am,Â,AGM date and closing date for director nominations  1  page  249.6KB
T92,09/09/2025  9:25 am,,High grade silver up to 941 g/t Ag identified at Castle Rag  11  pages  2.6MB
CIP,09/09/2025  9:25 am,Â,Update - Notification of buy-back - CIP  6  pages  18.4KB
ASR,09/09/2025  9:25 am,,Review at Leonora North Provides Clear Focus for Future Work  9  pages  1.4MB
D2O,09/09/2025  9:25 am,Â,2025 Half-Year Results Presentation  24  pages  2.7MB
ITM,09/09/2025  9:24 am,Â,Application for quotation of securities - ITM  6  pages  18.3KB
IMI,09/09/2025  9:24 am,Â,Change of Director's Interest Notice - K Woodthorpe  3  pages  359.4KB
BTR,09/09/2025  9:24 am,,North American Mining Conferences Presentation  37  pages  7.2MB
ARV,09/09/2025  9:23 am,Â,Application for quotation of securities - ARV  6  pages  19.1KB
14D,09/09/2025  9:22 am,,Full SiBox Value Retained Following Woodside Collaboration  2  pages  129.6KB
PMC,09/09/2025  9:22 am,Â,Platinum Capital Limited - Buyback update  1  page  169.4KB
AD1,09/09/2025  9:21 am,,AdNeo acquires Aspire Learning Resources  4  pages  339.5KB
RTR,09/09/2025  9:21 am,,Capital Raising Prestation  35  pages  5.2MB
DRX,09/09/2025  9:21 am,,Bulk metallurgical testwork confirms NSP product quality  21  pages  2.7MB
MA1,09/09/2025  9:20 am,Â,Daily Estimate NTA for 05.09.2025  1  page  141.7KB
SRJ,09/09/2025  9:20 am,,Response to ASX Price Query  4  pages  658.0KB
RTR,09/09/2025  9:20 am,Â,Cleansing Notice  2  pages  277.5KB
AYA,09/09/2025  9:20 am,Â,Proposed issue of securities - AYA  9  pages  28.5KB
RTR,09/09/2025  9:20 am,Â,Proposed issue of securities - RTR  9  pages  29.9KB
AYA,09/09/2025  9:20 am,,Successful A$75 million placement and launch of SPP  3  pages  214.3KB
RTR,09/09/2025  9:19 am,,$9m Placement and Entitlement issue  3  pages  394.1KB
AFI,09/09/2025  9:18 am,Â,Update - Notification of buy-back - AFI  6  pages  18.3KB
ARV,09/09/2025  9:18 am,Â,Application for quotation of securities - ARV  6  pages  19.0KB
IMI,09/09/2025  9:17 am,Â,Change of Director's Interest Notice - C Petricevic  2  pages  354.3KB
LOV,09/09/2025  9:17 am,Â,Notification of cessation of securities - LOV  4  pages  14.8KB
RF1,09/09/2025  9:17 am,Â,Update - Notification of buy-back - RF1  6  pages  18.3KB
HRN,09/09/2025  9:15 am,,Commencement Drilling to Expand Gum Creek 2.14Moz Resource  4  pages  1.2MB
CPU,09/09/2025  9:15 am,Â,Update - Dividend/Distribution - CPU  5  pages  19.4KB
VBC,09/09/2025  9:14 am,,Trading Halt  2  pages  220.2KB
KAR,09/09/2025  9:13 am,Â,Bank of America 2025 Asia Pacific Conference  20  pages  2.2MB
AMH,09/09/2025  9:13 am,Â,Update - Notification of buy-back - AMH  6  pages  18.3KB
HAR,09/09/2025  9:11 am,Â,Ceasing to be a substantial holder  2  pages  154.0KB
TSO,09/09/2025  9:10 am,Â,Investor Presentation  17  pages  1.1MB
TD1,09/09/2025  9:09 am,Â,Notification of Date of 2025 AGM  1  page  167.6KB
DJW,09/09/2025  9:08 am,Â,Update - Notification of buy-back - DJW  6  pages  18.3KB
AIZ,09/09/2025  9:08 am,Â,Notice of share buyback  2  pages  188.4KB
AMU,09/09/2025  9:08 am,,Snow Lake Completes AMU Investment  2  pages  377.0KB
PAR,09/09/2025  9:06 am,Â,Evans and Partners Healthcare Conference Presentation  19  pages  8.6MB
JLL,09/09/2025  9:06 am,,Reinstatement to Official Quotation  1  page  112.3KB
JLL,09/09/2025  9:06 am,,JLL Signs Non-Binding LOI to List McDermitt on a US Exchange  5  pages  354.7KB
WQG,09/09/2025  9:06 am,Â,Weekly NTA 5 September 2025  1  page  207.7KB
AW1,09/09/2025  9:05 am,Â,Corporate Presentation  32  pages  5.0MB
ARV,09/09/2025  9:04 am,Â,Application for quotation of securities - ARV  6  pages  18.2KB
BGL,09/09/2025  9:03 am,Â,Colorado Gold Conferences Presentation  29  pages  5.0MB
RMX,09/09/2025  9:03 am,,Trading Halt  2  pages  376.3KB
ARV,09/09/2025  9:03 am,Â,Notification of cessation of securities - ARV  4  pages  14.7KB
BHP,09/09/2025  9:03 am,Â,Settlement of Samarco Australian Securities Class Action  2  pages  116.0KB
BBN,09/09/2025  9:01 am,Â,Change of Director's Interest Notice - Stephen Roche  2  pages  192.7KB
PLY,09/09/2025  8:59 am,Â,Notice of Annual General Meeting/Proxy Form  17  pages  641.6KB
TG6,09/09/2025  8:58 am,,Soil Assay Results Extend Gold Targets at Van Uden  16  pages  1.6MB
LFS,09/09/2025  8:56 am,Â,Update - Notification of buy-back - LFSPA  6  pages  18.3KB
AII,09/09/2025  8:55 am,Â,Delivery of Shareholder Meeting Materials  4  pages  178.0KB
DVL,09/09/2025  8:54 am,Â,Proposed issue of securities - DVL  5  pages  18.6KB
PIQ,09/09/2025  8:53 am,,Board and Management Transition  1  page  147.4KB
BTI,09/09/2025  8:53 am,Â,Net Tangible Asset Backing  8  pages  767.1KB
CTW,09/09/2025  8:51 am,Â,CitiFirst MINIs Cash Amounts for Stop Loss Event 8 Sep 25  1  page  76.5KB
DYL,09/09/2025  8:50 am,Â,Application for quotation of securities - DYL  6  pages  18.8KB
DYL,09/09/2025  8:49 am,Â,Notification regarding unquoted securities - DYL  6  pages  18.4KB
TMX,09/09/2025  8:48 am,,Geophysical (IP) Survey started over Wildflower Gold Targets  10  pages  1.3MB
EMN,09/09/2025  8:48 am,,Corporate Presentation  34  pages  2.6MB
PMC,09/09/2025  8:48 am,Â,Update - Notification of buy-back - PMC  6  pages  18.4KB
EMV,09/09/2025  8:47 am,Â,EMVision Webinar & E&P Healthcare Conference Presentation  32  pages  2.8MB
CTW,09/09/2025  8:47 am,Â,CitiFirst MINIs Stop Loss Event Trigger 8 Sep 25 Update  1  page  88.3KB
DYL,09/09/2025  8:46 am,Â,Issue of Securities  1  page  249.2KB
HM1,09/09/2025  8:46 am,Â,August Investment Update  5  pages  1.1MB
WHC,09/09/2025  8:45 am,Â,Update - Notification of buy-back - WHC  6  pages  18.3KB
DYL,09/09/2025  8:43 am,Â,Date of Annual General Meeting  1  page  222.9KB
GLA,09/09/2025  8:42 am,,Advanced Discussions Re Tanzanian Uranium Assets  1  page  126.3KB
ZIP,09/09/2025  8:42 am,Â,Change of Director's Interest Notice - A Stevens  2  pages  134.7KB
LIC,09/09/2025  8:41 am,Â,Ocean Grove Land Sale Unconditional  1  page  204.7KB
NGI,09/09/2025  8:41 am,Â,2025 Annual General Meeting Details  1  page  187.6KB
ZIP,09/09/2025  8:40 am,Â,Change of Director's Interest Notice - C Scott  4  pages  161.4KB
SNX,09/09/2025  8:39 am,,High grade gold returned from New Pass Project  24  pages  3.5MB
AOV,09/09/2025  8:38 am,Â,Update - Notification of buy-back - AOV  6  pages  18.2KB
LIT,09/09/2025  8:38 am,Â,REE Strategy Execution Presentation  11  pages  2.5MB
ALL,09/09/2025  8:38 am,Â,Update - Notification of buy-back - ALL  6  pages  18.2KB
ZIP,09/09/2025  8:37 am,Â,Change of Director's Interest Notice - K Moss  2  pages  212.0KB
OSX,09/09/2025  8:37 am,,OSX collaborates with TTSH to develop novel implant for AVN  5  pages  271.6KB
NWM,09/09/2025  8:37 am,Â,Bulgera Gold Project update  6  pages  881.5KB
BFL,09/09/2025  8:36 am,Â,Change of CEOs Interest Notice-Mark Robinson  2  pages  275.7KB
LRT,09/09/2025  8:36 am,Â,Update - Notification of buy-back - LRT  6  pages  18.2KB
G88,09/09/2025  8:36 am,Â,Notification of cessation of securities - G88  4  pages  14.9KB
TRJ,09/09/2025  8:36 am,Â,Board Update  1  page  215.7KB
DVL,09/09/2025  8:36 am,Â,Industry Veteran Edward Doller Appointed Strategic Adviser  4  pages  128.5KB
FPR,09/09/2025  8:35 am,Â,Update - Notification of buy-back - FPR  6  pages  18.4KB
GML,09/09/2025  8:35 am,,Gravity Inversion Defines Major Intrusions at Key Prospects  118  pages  10.9MB
SVR,09/09/2025  8:35 am,Â,Update - Notification of buy-back - SVR  6  pages  18.2KB
HMI,09/09/2025  8:35 am,Â,2025 Annual General Meeting - Key Dates  1  page  81.6KB
MTH,09/09/2025  8:35 am,Â,Annual General Meeting  1  page  144.1KB
AZJ,09/09/2025  8:34 am,Â,Update - Notification of buy-back - AZJ  6  pages  18.4KB
EMD,09/09/2025  8:34 am,Â,Notice to Eligible Shareholders of Loyalty Options Offer  2  pages  89.8KB
SNZ,09/09/2025  8:34 am,Â,Ongoing Disclosure Notice (Scott Scoullar)  4  pages  196.8KB
SKY,09/09/2025  8:33 am,,"New High-Grade Tin, Silver & Tungsten Zones at Tallebung  17  pages  1.6MB"
ATA,09/09/2025  8:33 am,Â,Update - Notification of buy-back - ATA  6  pages  18.2KB
BFL,09/09/2025  8:33 am,Â,Change of CEOs Interest Notice-Amendments to Appendix3Y  3  pages  478.5KB
TLX,09/09/2025  8:32 am,,Telix and FDA Agree Resubmission Pathway for Pixclara NDA  3  pages  214.4KB
OBM,09/09/2025  8:32 am,,Sand King - Drilling Expands Mineralisation  49  pages  8.7MB
CVW,09/09/2025  8:32 am,Â,Update - Notification of buy-back - CVW  6  pages  18.4KB
THB,09/09/2025  8:32 am,Â,Change of Executive Chairman  3  pages  435.3KB
TIP,09/09/2025  8:32 am,Â,Update - Notification of buy-back - TIP  6  pages  18.3KB
CMO,09/09/2025  8:32 am,,Approval received for maiden drilling program at Bingara  52  pages  2.3MB
THB,09/09/2025  8:31 am,Â,Appointment of Joint Company Secretary  1  page  319.6KB
ORI,09/09/2025  8:31 am,Â,Update - Notification of buy-back - ORI  6  pages  18.4KB
NAC,09/09/2025  8:31 am,Â,Update - Notification of buy-back - NAC  6  pages  18.2KB
LIT,09/09/2025  8:31 am,,Livium Signs Term Sheet for REE Extraction Technology  3  pages  192.9KB
CYL,09/09/2025  8:29 am,Â,Initial Director's Interest Notice  2  pages  216.5KB
CYL,09/09/2025  8:29 am,Â,Board appointment  1  page  217.5KB
ALI,09/09/2025  8:29 am,Â,Weekly NTA estimate - Fri 5.9.25  1  page  2.5MB
ILA,09/09/2025  8:29 am,Â,Cleansing Notice  1  page  202.0KB
WZR,09/09/2025  8:29 am,Â,Change of Director's Interest Notice - C Lyall  2  pages  314.0KB
ILA,09/09/2025  8:29 am,Â,Application for quotation of securities - ILA  6  pages  18.2KB
POL,09/09/2025  8:28 am,,Endeavor Silver Zinc Mine-September Update  5  pages  824.9KB
MI6,09/09/2025  8:28 am,,High-Grade Intercepts Expand Bullabulling Drill Program  40  pages  3.8MB
PPM,09/09/2025  8:28 am,Â,Application for quotation of securities - PPM  6  pages  18.2KB
FLT,09/09/2025  8:28 am,Â,Update - Notification of buy-back - FLT  6  pages  18.4KB
RWC,09/09/2025  8:28 am,Â,Update - Notification of buy-back - RWC  6  pages  18.3KB
29M,09/09/2025  8:28 am,,High-Grade Copper Drilling Results at Golden Grove  23  pages  2.3MB
CSL,09/09/2025  8:28 am,Â,Update - Notification of buy-back - CSL  6  pages  18.2KB
GSN,09/09/2025  8:27 am,Â,FY2025 - Appendix 4G  13  pages  646.0KB
GSN,09/09/2025  8:27 am,Â,FY2025 Corporate Governance Statement  18  pages  632.0KB
LSF,09/09/2025  8:27 am,Â,Net Tangible Asset Backing  1  page  103.2KB
GSN,09/09/2025  8:27 am,Â,2025 Annual Report  79  pages  3.9MB
MA1,09/09/2025  8:27 am,Â,MA1 Entitlement Offer - Completion of despatch  2  pages  147.0KB
SHJ,09/09/2025  8:27 am,Â,Update - Notification of buy-back - SHJ  6  pages  18.2KB
SNT,09/09/2025  8:27 am,Â,Investor Presentation E&P Small Cap Healthcare Conference  18  pages  1.3MB
CAA,09/09/2025  8:27 am,Â,Update - Notification of buy-back - CAA  6  pages  18.2KB
ART,09/09/2025  8:26 am,Â,Relief from ASX Quarterly Reporting  1  page  156.9KB
RXL,09/09/2025  8:26 am,Â,North American Roadshow Presentation  23  pages  7.7MB
AUI,09/09/2025  8:26 am,Â,Weekly NTA - 5 September 2025  1  page  50.7KB
DUI,09/09/2025  8:26 am,Â,Weekly NTA - 5 September 2025  1  page  51.0KB
DUI,09/09/2025  8:26 am,Â,Update - Notification of buy-back - DUI  6  pages  18.5KB
SMI,09/09/2025  8:26 am,Â,Presentation - Precious Metals Summit Beaver Creek  23  pages  6.9MB
PH2,09/09/2025  8:26 am,Â,Cleansing Notice  1  page  278.8KB
KAR,09/09/2025  8:25 am,Â,Update - Notification of buy-back - KAR  6  pages  17.8KB
NPM,09/09/2025  8:25 am,Â,Notice of Meeting/Proxy Form  35  pages  3.2MB
GWA,09/09/2025  8:25 am,Â,Update - Notification of buy-back - GWA  6  pages  18.4KB
DNL,09/09/2025  8:25 am,Â,Update - Notification of buy-back - DNL  6  pages  18.4KB
GBZ,09/09/2025  8:25 am,Â,Drilling Commences at Twin Hills Gold Project  13  pages  2.7MB
BOL,09/09/2025  8:25 am,Â,Update - Notification of buy-back - BOL  6  pages  18.2KB
5GN,09/09/2025  8:25 am,Â,Update - Notification of buy-back - 5GN  6  pages  18.3KB
RMD,09/09/2025  8:24 am,Â,144 Report of proposed sale of securities  3  pages  140.0KB
JHX,09/09/2025  8:24 am,Â,Notification regarding unquoted securities - JHX  7  pages  22.1KB
JHX,09/09/2025  8:24 am,Â,Notification regarding unquoted securities - JHX  5  pages  17.2KB
SKM,09/09/2025  8:24 am,Â,Citronen Project Update  1  page  109.0KB
APX,09/09/2025  8:24 am,Â,Change of Director's Interest Notice - Richard Freudenstein  2  pages  213.5KB
GW1,09/09/2025  8:24 am,Â,Change of Director's Interest Notice  2  pages  204.8KB
CCP,09/09/2025  8:23 am,Â,Change in substantial holding  12  pages  1.2MB
HTM,09/09/2025  8:23 am,,Site Works at Mt Fisher Gold Project Commences  5  pages  1.0MB
NVO,09/09/2025  8:23 am,Â,Novo Corporate Presentation - September  32  pages  4.5MB
