ASX Code,Date,Price sens.,Headline
COD,13/02/2024  8:02 AM,,MT Data Reinforces Evidence for Emmie Bluff Extension  25  pages  1.8MB
BUX,13/02/2024  8:02 AM,,Porphyry Drill Targets Identified at Sun Devil & Aztecs  28  pages  5.8MB
ENR,13/02/2024  8:02 AM,,RIU Explorers Conference Presentation  22  pages  6.4MB
NTI,13/02/2024  8:02 AM,,Neurotech Receives Additional HREC Approval in Autism  2  pages  127.0KB
AZY,13/02/2024  8:02 AM,,RIU Explorers Conference Presentation  32  pages  9.2MB
AHN,13/02/2024  8:02 AM,,Rare Earth Element and Nickel-Copper Anomalies a Byro  18  pages  4.8MB
EV1,13/02/2024  8:02 AM,,Corporate Presentation  24  pages  4.4MB
LEG,13/02/2024  8:01 AM,,Legend Mining RIU Explorers Conference presentation Feb 2024  18  pages  3.0MB
NOR,13/02/2024  8:01 AM,,Change of Director's Interest Notice  4  pages  287.4KB
AGY,13/02/2024  8:01 AM,,Investor Presentation - Bell Potter Unearthed Conference  24  pages  4.0MB
RWC,13/02/2024  8:01 AM,,Ceasing to be a substantial holder  5  pages  391.5KB
VSL,13/02/2024  7:31 AM,,Dividend/Distribution - VSL  5  pages  18.1KB
ARU,13/02/2024  7:31 AM,,NZO: SIGNS GAS SUPPLY AGREEMENT WITH ARAFURA RARE EARTHS  4  pages  338.8KB
CTP,13/02/2024  7:31 AM,,NZO: SIGNS GAS SUPPLY AGREEMENT WITH ARAFURA RARE EARTHS  4  pages  338.8KB
NZO,13/02/2024  7:31 AM,,NZO SIGNS GAS SUPPLY AGREEMENT WITH ARAFURA RARE EARTHS  4  pages  338.8KB
VSL,13/02/2024  7:31 AM,,FY24 Half Year results announcement  2  pages  390.0KB
VSL,13/02/2024  7:31 AM,,FY24 Half Year Investor Presentation  35  pages  6.3MB
VSL,13/02/2024  7:31 AM,,Half Yearly Report and Accounts  27  pages  3.2MB
HCW,13/02/2024  7:30 AM,,HY24 Results Presentation  32  pages  8.4MB
HCW,13/02/2024  7:30 AM,,HY24 Results Announcement  3  pages  191.3KB
HCW,13/02/2024  7:30 AM,,Appendix 4D and HY24 Financial Report  29  pages  1.8MB
