ASX Code,Date,Price sens.,Headline
TRU,08/03/2024  7:32 AM,,TruScreen Market Access Developments - Indonesia and Kenya  3  pages  209.6KB
SKT,08/03/2024  7:30 AM,,Notification of cessation of securities - SKT  4  pages  14.8KB
MOV,08/03/2024  7:30 AM,,Change of Directors March 2024  1  page  120.6KB
FPH,08/03/2024  7:30 AM,,FPH Board Chair Scott St John to retire in 2024  1  page  91.8KB
SNZ,08/03/2024  7:30 AM,,Notice of Allotment of Fixed Rate Bonds  2  pages  82.7KB
SKT,08/03/2024  7:30 AM,,Update - Notification of buy-back - SKT  6  pages  18.6KB
