ASX Code,Date,Price sens.,Headline
CEN,20/05/2026  7:32 am,Â,Change in substantial holding from IFT  14  pages  363.1KB
IFT,20/05/2026  7:32 am,Â,Change in substantial holding for CEN  14  pages  363.1KB
THL,20/05/2026  7:31 am,Â,Director Resignation and Appointment  2  pages  145.6KB
IFT,20/05/2026  7:31 am,Â,Infratil reduces Contact stake to support future growth  2  pages  118.2KB
CEN,20/05/2026  7:31 am,Â,IFT: Infratil reduces Contact stake to support future growth  2  pages  118.2KB
VGL,20/05/2026  7:30 am,,Cinepolis Mexico signs Vista Cloud Agreement  2  pages  150.9KB
JHX,20/05/2026  7:30 am,Â,2026 AGM Date  2  pages  172.8KB
SUN,20/05/2026  7:30 am,Â,Update - Notification of buy-back - SUN  6  pages  18.2KB
JHX,20/05/2026  7:30 am,,KPMG Actuarial Report 31 March 2026  117  pages  1.2MB
JHX,20/05/2026  7:30 am,,Q4 FY26 Results Pack  168  pages  7.8MB
SKO,20/05/2026  7:30 am,,Serko's Audited FY26 Financial Results  151  pages  12.0MB
