ASX Code,Date,Price sens.,Headline
PEB,04/08/2025  8:06 am,,Pacific Edge SPP Closes - $20.7m Of Total New Equity Pledged  2  pages  289.6KB
BGP,04/08/2025  7:31 am,,BGP - 2nd Quarter Sales to 27 July 2025  2  pages  184.0KB
A2M,04/08/2025  7:31 am,Â,Appointment of new independent NED - Grant Dempsey  2  pages  211.6KB
GNE,04/08/2025  7:31 am,,Agreements signed for Huntly capacity  2  pages  450.3KB
MEZ,04/08/2025  7:31 am,,Meridian signs Strategic Energy Reserve Agreement  1  page  97.6KB
THL,04/08/2025  7:30 am,,thl outlines its growth roadmap  10  pages  774.2KB
THL,04/08/2025  7:30 am,,"thl responds to NBIO, confirms uNPAT expectations  2  pages  153.8KB"
