ASX Code,Date,Price sens.,Headline
RNE,08/04/2024  1:10 PM,,Application for quotation of securities - RNE  6  pages  18.6KB
RNE,08/04/2024  1:07 PM,,Cleansing notice  1  page  105.1KB
IMR,08/04/2024  1:03 PM,,Cleansing Notice  3  pages  223.5KB
IMD,08/04/2024  1:00 PM,,Change in substantial holding  3  pages  712.7KB
PLS,08/04/2024  12:50 PM,,March 2024 Quarterly Report Advisory  1  page  582.9KB
BLG,08/04/2024  12:47 PM,,Listed Options Top 20 Holder Report & Distribution Schedule  4  pages  135.3KB
AWJ,08/04/2024  12:46 PM,,Ceasing to be a Substantial Holder  4  pages  213.3KB
ORR,08/04/2024  12:42 PM,,Notice of ceasing to be a substantial holder  1  page  50.6KB
EBR,08/04/2024  12:40 PM,,Notification regarding unquoted securities - EBR  6  pages  18.5KB
SOL,08/04/2024  12:39 PM,,Change of Director's Interest Notice  3  pages  317.3KB
PTX,08/04/2024  12:39 PM,,PTX100 Ph1b results to be presented at specialist congress  4  pages  264.5KB
TCG,08/04/2024  12:39 PM,,Ceasing to be a substantial holder  4  pages  863.1KB
LNW,08/04/2024  12:38 PM,,Statement of CDIs on issue - LNW  2  pages  11.1KB
MHJ,08/04/2024  12:33 PM,,Final Director's Interest Notice - Jacquie Naylor  2  pages  280.8KB
ORR,08/04/2024  12:28 PM,,Notice of ceasing to be a substantial holder  2  pages  172.5KB
PCI,08/04/2024  12:27 PM,,Daily Net Tangible Asset Statement  1  page  403.1KB
IMR,08/04/2024  12:22 PM,,Application for quotation of securities - IMR  6  pages  18.5KB
GBR,08/04/2024  12:21 PM,,Cleansing Notice  1  page  173.5KB
IME,08/04/2024  12:17 PM,,Appendix 3Y - Damian Banks  2  pages  232.7KB
GBR,08/04/2024  12:11 PM,,Application for quotation of securities - GBR  6  pages  19.4KB
FDR,08/04/2024  12:08 PM,,Application for quotation of securities - FDR  5  pages  16.7KB
MMI,08/04/2024  12:07 PM,,Notice of Initial Substantial Holder  20  pages  760.5KB
AEE,08/04/2024  12:05 PM,,Application for quotation of securities - AEE  6  pages  18.2KB
NSB,08/04/2024  12:04 PM,,Notification of cessation of securities - NSB  4  pages  14.8KB
PHL,08/04/2024  12:03 PM,,Notification regarding unquoted securities - PHL  8  pages  23.0KB
FDR,08/04/2024  12:03 PM,,Ceasing to be a substantial holder  11  pages  935.7KB
TGF,08/04/2024  12:02 PM,,Estimated Weekly NTA as of 05 April 2024  1  page  194.2KB
VNL,08/04/2024  11:55 AM,,Vinyl Launches Investor Hub for Investor Engagement  2  pages  164.7KB
PBP,08/04/2024  11:55 AM,,Distribution of Scheme Booklet  4  pages  236.1KB
SOL,08/04/2024  11:54 AM,,Change of Director's Interest Notice  2  pages  290.6KB
CSC,08/04/2024  11:40 AM,,Prospectus Supplement - Secondary Offering  57  pages  1.2MB
IPC,08/04/2024  11:32 AM,,Change of Director's Interest Notice  2  pages  157.0KB
ERL,08/04/2024  11:32 AM,,Trading Halt  2  pages  563.3KB
NGE,08/04/2024  11:30 AM,,Notification of cessation of securities - NGE  4  pages  14.7KB
WBC,08/04/2024  11:30 AM,,Westpac Self-Funding Instalments over securities in IOZ  1  page  80.5KB
WBC,08/04/2024  11:29 AM,,Westpac Self-Funding Instalments over securities in ILC  1  page  79.4KB
LSX,08/04/2024  11:27 AM,,Updated Corporate Presentation  16  pages  6.9MB
CMO,08/04/2024  11:25 AM,,Notification regarding unquoted securities - CMO  6  pages  20.2KB
ERL,08/04/2024  11:23 AM,,Pause in Trading  1  page  119.1KB
CMO,08/04/2024  11:20 AM,,Notification regarding unquoted securities - CMO  5  pages  16.9KB
CMO,08/04/2024  11:18 AM,,Application for quotation of securities - CMO  6  pages  18.1KB
SVW,08/04/2024  11:16 AM,,Application for quotation of securities - SVW  5  pages  17.1KB
LAU,08/04/2024  11:15 AM,,Update - Dividend/Distribution - LAU  5  pages  18.8KB
CTW,08/04/2024  11:08 AM,,CitiFirst IOZ SFIs Dividend Estimated Amount  1  page  108.0KB
CTW,08/04/2024  11:07 AM,,CitiFirst ILC SFIs Dividend Estimated Amount  1  page  105.1KB
NAC,08/04/2024  11:06 AM,,Change of Director's Interest Notice - W Evans  2  pages  288.0KB
CTW,08/04/2024  11:06 AM,,CitiFirst IHD SFIs Dividend Estimated Amount  1  page  105.2KB
NAC,08/04/2024  11:06 AM,,Change of Director's Interest Notice - D Rickards  2  pages  389.5KB
AZS,08/04/2024  11:05 AM,,EGM and Scheme Meeting - Chair's Address and Presentation  22  pages  1.8MB
CTW,08/04/2024  11:05 AM,,CitiFirst IOZ Instalment MINIs Dividend Estimated Amount  1  page  101.0KB
NAC,08/04/2024  11:04 AM,,Change of Director's Interest Notice - S Evans  2  pages  695.7KB
BWP,08/04/2024  11:03 AM,,Application for quotation of securities - BWP  5  pages  16.7KB
NAC,08/04/2024  11:03 AM,,Change of Director's Interest Notice - S Williams  2  pages  307.4KB
QVE,08/04/2024  11:02 AM,,Weekly Net Tangible Asset Backing  2  pages  643.4KB
CNQ,08/04/2024  11:00 AM,,Notification of cessation of securities - CNQ  4  pages  14.8KB
NSC,08/04/2024  11:00 AM,,Change of Director's Interest Notice - W Evans  2  pages  308.0KB
NSC,08/04/2024  10:59 AM,,Change of Director's Interest Notice - D Rickards  2  pages  273.5KB
NSC,08/04/2024  10:57 AM,,Change of Director's Interest Notice - S Williams  2  pages  269.5KB
BWP,08/04/2024  10:56 AM,,Notice of change of interests of substantial holder for NPR  18  pages  518.6KB
NPR,08/04/2024  10:56 AM,,Notice of change of interests of substantial holder from BWP  18  pages  518.6KB
CYC,08/04/2024  10:44 AM,,Application for quotation of securities - CYC  7  pages  20.4KB
LNU,08/04/2024  10:39 AM,,Invitation to Linius Market Update Webinar  2  pages  189.9KB
BHP,08/04/2024  10:35 AM,,Notification regarding unquoted securities - BHP  5  pages  16.8KB
HMD,08/04/2024  10:30 AM,,Supplemental Information - Voluntary Suspension  1  page  127.7KB
VEN,08/04/2024  10:26 AM,,Cleansing Notice  1  page  169.6KB
NXL,08/04/2024  10:26 AM,,ASIC Concludes Share Trading Investigation  1  page  181.6KB
ALD,08/04/2024  10:25 AM,,Notification of cessation of securities - ALD  4  pages  14.7KB
VEN,08/04/2024  10:24 AM,,Application for quotation of securities - VEN  7  pages  20.9KB
BKI,08/04/2024  10:23 AM,,BKI 5 April 2024 Weekly NTA  1  page  627.7KB
IXC,08/04/2024  10:17 AM,,Notification of cessation of securities - IXC  4  pages  14.7KB
KSN,08/04/2024  10:17 AM,,"Placement Completed,Retail Entitlement Offer Underwritten  4  pages  351.2KB"
ALD,08/04/2024  10:17 AM,,Notification regarding unquoted securities - ALD  6  pages  19.0KB
A11,08/04/2024  10:15 AM,,Change of Director's Interest Notice - N Herbert  6  pages  712.3KB
CDX,08/04/2024  10:14 AM,,Cardiex Corporate Update Webinar  1  page  113.9KB
PHO,08/04/2024  10:09 AM,,Ras Ghzir Permit Granted  6  pages  5.2MB
ALD,08/04/2024  10:08 AM,,Notification regarding unquoted securities - ALD  6  pages  18.1KB
ACF,08/04/2024  10:07 AM,,Notice of Extraordinary General Meeting/Proxy Form  22  pages  711.4KB
KSN,08/04/2024  10:06 AM,,Update - Proposed issue of securities - KSN  7  pages  25.9KB
WGB,08/04/2024  10:05 AM,,March 2024 Investment Update  4  pages  677.3KB
WMI,08/04/2024  10:05 AM,,March 2024 Investment Update  4  pages  669.3KB
WAR,08/04/2024  10:03 AM,,March 2024 Investment Update  3  pages  672.1KB
AL8,08/04/2024  10:03 AM,,Exploration Update - Copper-Gold in Utah & Lithium in Brazil  5  pages  1.3MB
HVY,08/04/2024  10:02 AM,,Change of Director's Interest Notice  3  pages  217.5KB
SPL,08/04/2024  10:02 AM,,Investor Webinar Notification SPL Medicxi Partnership  2  pages  153.4KB
IXU,08/04/2024  10:00 AM,,Cleansing Notice under Section 708A(5)(e) of the Corps Act  2  pages  123.0KB
KSN,08/04/2024  9:59 AM,,Retail Entitlement Offer Booklet  34  pages  575.9KB
FG1,08/04/2024  9:59 AM,,Commencement of Rights Trading on ASX  2  pages  325.5KB
ALD,08/04/2024  9:58 AM,,Appendix 3Y - Matthew Halliday  2  pages  263.5KB
KSN,08/04/2024  9:55 AM,,Letter to Eligible Shareholders  3  pages  165.3KB
PL3,08/04/2024  9:55 AM,,Exploration Application Granted for REE Project in Brazil  3  pages  580.4KB
BGT,08/04/2024  9:55 AM,,Appointment of CFO and Joint Company Secretary  1  page  653.7KB
FOR,08/04/2024  9:54 AM,,Indicative NAV COB 5 April 2024  1  page  163.3KB
BCB,08/04/2024  9:54 AM,,Initial Director's Interest Notice  2  pages  209.5KB
KSN,08/04/2024  9:53 AM,,Letter to Ineligible Shareholders  1  page  126.0KB
KKC,08/04/2024  9:52 AM,,Net Tangible Asset Backing  2  pages  184.3KB
BCB,08/04/2024  9:51 AM,,Appointment of Non-Executive Director  2  pages  305.8KB
GCX,08/04/2024  9:51 AM,,Expanded Drill Program and First Samples Despatched at Dante  3  pages  699.1KB
RPL,08/04/2024  9:51 AM,,"March 2024 Funds Under Management, FUM increases to $12.1bn  2  pages  57.0KB"
ME1,08/04/2024  9:49 AM,,Extension of Cleansing Offer Closing Date  1  page  72.9KB
BOA,08/04/2024  9:49 AM,,Letter to Shareholders  1  page  179.3KB
IXU,08/04/2024  9:49 AM,,Application for quotation of securities - IXU  6  pages  18.6KB
DEM,08/04/2024  9:48 AM,,Annual General Meeting - Date of Meeting  1  page  114.3KB
AVA,08/04/2024  9:48 AM,,CLEANSING NOTICE  1  page  239.1KB
DHO,08/04/2024  9:48 AM,,DHOF Tracking Error Announcement March  2  pages  88.6KB
MDI,08/04/2024  9:48 AM,,Exploration Update New Drill Targets Barkly CG Super Project  21  pages  4.4MB
ENN,08/04/2024  9:47 AM,,Healthcare Funds Management Initiative  2  pages  95.5KB
USL,08/04/2024  9:47 AM,,Change in substantial holding from AGD  3  pages  122.5KB
AGD,08/04/2024  9:47 AM,,Change in substantial holding for USL  3  pages  122.5KB
FL1,08/04/2024  9:47 AM,,Blakala assays identify further high grade Li2O  37  pages  3.5MB
AFL,08/04/2024  9:46 AM,,Becoming a substantial holder  2  pages  455.7KB
KSN,08/04/2024  9:45 AM,,Cleansing Notice - Placement  1  page  229.5KB
AVA,08/04/2024  9:43 AM,,Application for quotation of securities - AVA  6  pages  18.2KB
MCM,08/04/2024  9:42 AM,,Takeover - extension of offer period  5  pages  224.1KB
CVW,08/04/2024  9:42 AM,,Director Appointment/Resignation  2  pages  47.4KB
WEB,08/04/2024  9:40 AM,,Notification of cessation of securities - WEB  4  pages  14.8KB
GTG,08/04/2024  9:37 AM,,GTG announces launch of Know Your Risk event  2  pages  114.2KB
GW1,08/04/2024  9:36 AM,,Drilling Program Update - San Jorge Lithium Project  18  pages  1.5MB
KSN,08/04/2024  9:36 AM,,Application for quotation of securities - KSN  6  pages  18.4KB
LIN,08/04/2024  9:36 AM,,Final Infill Drilling Results for Kangankunde  42  pages  6.9MB
AUZ,08/04/2024  9:36 AM,,Remote sensing identifies & confirms Jequie REE/Nb targets  17  pages  1.3MB
NXG,08/04/2024  9:35 AM,,Notice of Meeting and Record Date  1  page  78.8KB
NNU,08/04/2024  9:35 AM,,Units on Issue & Monthly Redemptions - March 2024  1  page  213.9KB
KSN,08/04/2024  9:33 AM,,Application for quotation of securities - KSN  6  pages  18.4KB
ART,08/04/2024  9:33 AM,,Application for quotation of securities - ART  7  pages  20.5KB
IXU,08/04/2024  9:33 AM,,Application for quotation of securities - IXU  6  pages  18.5KB
AKO,08/04/2024  9:33 AM,,Appendix 4G and Corporate Governance Statement  37  pages  825.3KB
AVM,08/04/2024  9:32 AM,,Advance Metals Investor Presentation  11  pages  3.4MB
JAN,08/04/2024  9:31 AM,,Incoming CEO completes first tranche share purchase  2  pages  118.7KB
ART,08/04/2024  9:30 AM,,Notification of cessation of securities - ART  4  pages  14.7KB
AVM,08/04/2024  9:30 AM,,Placement  3  pages  323.7KB
TBN,08/04/2024  9:30 AM,,Change of Director's Interest Notice  3  pages  298.0KB
ART,08/04/2024  9:29 AM,,Notification regarding unquoted securities - ART  6  pages  19.8KB
LDX,08/04/2024  9:29 AM,,Lumos announces positive FebriDx paediatric study results  4  pages  374.9KB
QBE,08/04/2024  9:29 AM,,Notification of cessation of securities - QBE  4  pages  14.9KB
HYT,08/04/2024  9:29 AM,,Cleansing Statement  1  page  116.0KB
1AI,08/04/2024  9:28 AM,,Positive results from AI-116 in vitro studies  3  pages  259.4KB
RF1,08/04/2024  9:28 AM,,Notification of cessation of securities - RF1  5  pages  17.9KB
LU7,08/04/2024  9:28 AM,,Strategic Update - Closing the Lithium Conversion Gap  10  pages  1.5MB
MFO,08/04/2024  9:27 AM,,Units on Issue & Monthly Redemptions - March 2024  1  page  194.3KB
ART,08/04/2024  9:27 AM,,Change of Director's Interest Notice  3  pages  7.3KB
HYT,08/04/2024  9:26 AM,,Application for quotation of securities - HYT  6  pages  18.4KB
ART,08/04/2024  9:26 AM,,Change of Director's Interest Notice  2  pages  5.8KB
VRX,08/04/2024  9:25 AM,,Trading Halt  2  pages  203.6KB
SPL,08/04/2024  9:25 AM,,Starpharma and Medicxi Partnership Petalion Therapeutics  3  pages  200.5KB
CGF,08/04/2024  9:25 AM,,Indicative regulatory approval for sale of Challenger Bank  2  pages  147.8KB
HGH,08/04/2024  9:25 AM,,CGF: Indicative regulatory appr. for sale of Challenger Bank  2  pages  147.8KB
HGH,08/04/2024  9:25 AM,,Proposed issue of securities - HGH  10  pages  33.7KB
HGH,08/04/2024  9:24 AM,,HGH meets Challenger Bank milestone & NZ$210m equity raise  82  pages  4.2MB
CGF,08/04/2024  9:24 AM,,HGH:HGH meets Challenger Bank milestone&NZ$210m equity raise  82  pages  4.2MB
ART,08/04/2024  9:24 AM,,Change of Director's Interest Notice  2  pages  5.3KB
CTW,08/04/2024  9:23 AM,,CitiFirst MINIs Cash Amounts for Stop Loss Event 5 Apr 24  1  page  84.1KB
WGX,08/04/2024  9:22 AM,,A New 400kozpa Australian Gold Producer  45  pages  7.5MB
ART,08/04/2024  9:22 AM,,Change of Director's Interest Notice  2  pages  5.7KB
BTC,08/04/2024  9:22 AM,,BTC enters exclusive distribution agreement with Exstent  2  pages  237.5KB
MXT,08/04/2024  9:21 AM,,Update - Dividend/Distribution - MXT  6  pages  20.5KB
MOT,08/04/2024  9:21 AM,,Update - Dividend/Distribution - MOT  6  pages  20.5KB
VGL,08/04/2024  9:20 AM,,VGL - Capital Change Notice  2  pages  150.1KB
RF1,08/04/2024  9:17 AM,,Weekly Estimate NTA for 05.04.2024  1  page  121.7KB
PMC,08/04/2024  9:17 AM,,Update - Notification of buy-back - PMC  6  pages  18.5KB
ADO,08/04/2024  9:16 AM,,Proposed issue of securities - ADO  14  pages  46.4KB
VGL,08/04/2024  9:16 AM,,Notification regarding unquoted securities - VGL  6  pages  20.3KB
WGX,08/04/2024  9:16 AM,,Proposed issue of securities - WGX  5  pages  18.9KB
HGH,08/04/2024  9:16 AM,,Trading Halt  2  pages  181.7KB
RF1,08/04/2024  9:16 AM,,Update - Notification of buy-back - RF1  6  pages  18.3KB
CCE,08/04/2024  9:15 AM,,Spain Berth Reservation Secured  4  pages  350.7KB
DEM,08/04/2024  9:15 AM,,Proposed issue of securities - DEM  5  pages  17.7KB
TOE,08/04/2024  9:15 AM,,Toro to demerge Non-Core Assets  7  pages  926.7KB
ADX,08/04/2024  9:15 AM,,Anshof-3 Production Recommences  3  pages  654.1KB
CU6,08/04/2024  9:15 AM,,Cleansing Notice  1  page  243.4KB
EGH,08/04/2024  9:15 AM,,Release of Target's Statement  200  pages  8.6MB
APZ,08/04/2024  9:15 AM,,EGH: Release of Target's Statement  200  pages  8.6MB
PPE,08/04/2024  9:14 AM,,Application for quotation of securities - PPE  6  pages  17.8KB
ADO,08/04/2024  9:14 AM,,AnteoTech $6.4m Capital Raising  5  pages  327.1KB
FSF,08/04/2024  9:13 AM,,Update - Dividend/Distribution - FSF  5  pages  17.9KB
WGX,08/04/2024  9:13 AM,,Merger to Create 400 kozpa Australian Gold Miner  30  pages  505.9KB
PGH,08/04/2024  9:13 AM,,Takeover offer for PGH - Letter to shareholders  3  pages  241.0KB
AQX,08/04/2024  9:12 AM,,Proposed issue of securities - AQX  5  pages  17.4KB
AQX,08/04/2024  9:12 AM,,GAGE CAPITAL TO MAKE SIGNIFICANT FURTHER INVESTMENT  3  pages  369.4KB
WQG,08/04/2024  9:11 AM,,Update - Notification of buy-back - WQG  6  pages  18.3KB
SUV,08/04/2024  9:10 AM,,Geopolymer Concrete Update  3  pages  266.1KB
ALX,08/04/2024  9:09 AM,,Notices of 2024 Annual General Meeting  24  pages  1.1MB
ENV,08/04/2024  9:09 AM,,Proposed issue of securities - ENV  6  pages  21.8KB
ENV,08/04/2024  9:09 AM,,$1.5M placement completed to advance Charley Creek project  3  pages  268.3KB
APA,08/04/2024  9:07 AM,,Notification of cessation of securities - APA  4  pages  14.8KB
CUL,08/04/2024  9:06 AM,,Two IP Chargeability anomalies Wongan Hills  22  pages  2.0MB
BGD,08/04/2024  9:06 AM,,Drilling Restarts on Tarcoola Open Pit Floor  3  pages  405.9KB
CEH,08/04/2024  9:06 AM,,Update - Notification of buy-back - CEH  6  pages  18.3KB
MKR,08/04/2024  9:06 AM,,Taranaki Project invited to apply under NZ Fast Track Bill  4  pages  502.8KB
URF,08/04/2024  9:05 AM,,Update - Notification of buy-back - URF  6  pages  18.3KB
NWS,08/04/2024  9:05 AM,,Appendix 3C  4  pages  75.7KB
ILT,08/04/2024  9:05 AM,,"ILT to restart drilling at Orient Silver-Indium Project, QLD  6  pages  967.7KB"
NWS,08/04/2024  9:05 AM,,Appendix 3C  4  pages  75.7KB
MRI,08/04/2024  9:05 AM,,Further update on iGoDirect Group $1million loan.  1  page  101.8KB
ETM,08/04/2024  9:05 AM,,Closing Date for Director Nominations  1  page  166.2KB
RYD,08/04/2024  9:04 AM,,Update - Notification of buy-back - RYD  6  pages  18.2KB
EV1,08/04/2024  9:04 AM,,Corporate Presentation  34  pages  4.5MB
MNB,08/04/2024  9:04 AM,,Continuation of Suspension  1  page  88.7KB
GSR,08/04/2024  9:04 AM,,Riverina Dispute With Ora Banda Resolved  2  pages  272.4KB
PGF,08/04/2024  9:03 AM,,Net Tangible Asset Backing - 5 April 2024  1  page  175.7KB
1AD,08/04/2024  9:03 AM,,Webinar to discuss SYNthesis BioVentures partnership  2  pages  199.2KB
PXA,08/04/2024  9:03 AM,,Resignation of Company Secretary  1  page  157.1KB
APM,08/04/2024  9:03 AM,,Reinstatement to Official Quotation  1  page  430.1KB
OCC,08/04/2024  9:03 AM,,Quarterly Activity Report & Appendix 4C  9  pages  750.0KB
APM,08/04/2024  9:02 AM,,Non-Binding Acquisition Proposal and Business Update  4  pages  188.7KB
APA,08/04/2024  9:02 AM,,Notification regarding unquoted securities - APA  6  pages  18.7KB
MSV,08/04/2024  9:02 AM,,Update - Notification of buy-back - MSV  6  pages  18.3KB
TIE,08/04/2024  9:02 AM,,"Tietto Delivers Record Quarterly Gold Production of 37,111oz  8  pages  555.1KB"
CSE,08/04/2024  9:01 AM,,Return of Capital - CSE  4  pages  15.1KB
ELD,08/04/2024  9:01 AM,,FY24 Trading Update  1  page  159.3KB
BEL,08/04/2024  9:01 AM,,Request for Extension of Voluntary Suspension  1  page  216.8KB
CPM,08/04/2024  9:00 AM,,Drilling update for Brumby Ridge Mt Isa East Project  18  pages  4.8MB
IMU,08/04/2024  9:00 AM,,VAXINIA and HER-Vaxx featured at the AACR Annual Meeting  5  pages  195.8KB
CAJ,08/04/2024  8:59 AM,,Notification of cessation of securities - CAJ  5  pages  17.2KB
TMS,08/04/2024  8:59 AM,,Proposed issue of securities - TMS  7  pages  26.7KB
TMS,08/04/2024  8:59 AM,,Tennant Completes Successful $4.8M Capital Raising  6  pages  1.3MB
RG8,08/04/2024  8:59 AM,,Weekly NTA Update  1  page  30.5KB
HUM,08/04/2024  8:58 AM,,Update - Notification of buy-back - HUM  6  pages  18.3KB
VG1,08/04/2024  8:58 AM,,Weekly NTA Update  1  page  86.0KB
CYP,08/04/2024  8:58 AM,,DFU Clinical Trial Enrolment Complete  1  page  150.1KB
1AD,08/04/2024  8:57 AM,,SYNThesis BioVentures MoU for cellular immunotherapies  6  pages  239.7KB
EV1,08/04/2024  8:57 AM,,Appointment of Non-Executive Chair  2  pages  388.1KB
RPM,08/04/2024  8:57 AM,,Introduction of New SAAS product Suites - Partnership WHG  4  pages  520.9KB
MKR,08/04/2024  8:56 AM,,"Appendix 3Y - D Karp, J Seton, A McPaul  8  pages  805.5KB"
A2B,08/04/2024  8:55 AM,,Change in substantial holding from MQG  20  pages  181.0KB
MQG,08/04/2024  8:55 AM,,Change in substantial holding for A2B  20  pages  181.0KB
AL3,08/04/2024  8:54 AM,,ARCEMY Online at US Navy's Center of Excellence  2  pages  241.8KB
BCI,08/04/2024  8:53 AM,,Mardie Project Update - Approvals  3  pages  268.0KB
EVG,08/04/2024  8:52 AM,,Production commences at Evion's JV Expandable Graphite site  7  pages  1.6MB
OPH,08/04/2024  8:52 AM,,Weekly NTA 05.04.2024  1  page  138.8KB
PNN,08/04/2024  8:48 AM,,Power identifies new copper targets at Musgrave Project SA  4  pages  501.6KB
PRU,08/04/2024  8:48 AM,,European Gold Forum Presentation  29  pages  4.0MB
PEC,08/04/2024  8:48 AM,,Exploration Commences at New Project Areas in Brazil  5  pages  650.6KB
BPT,08/04/2024  8:47 AM,,Waitsia Stage 2 update  2  pages  114.9KB
NDO,08/04/2024  8:47 AM,,Application for quotation of securities - NDO  6  pages  18.4KB
DTZ,08/04/2024  8:47 AM,,Date of AGM and Director Nominations  1  page  205.3KB
BSL,08/04/2024  8:46 AM,,Update - Notification of buy-back - BSL  6  pages  18.5KB
EGH,08/04/2024  8:46 AM,,FY24 Earnings Guidance  2  pages  494.4KB
VAR,08/04/2024  8:46 AM,,New Licences Awarded Increase Size of Novales-Udias Project  19  pages  3.3MB
LSF,08/04/2024  8:45 AM,,Net Tangible Asset Backing  1  page  219.3KB
IAG,08/04/2024  8:45 AM,,Update - Notification of buy-back - IAG  6  pages  18.3KB
PRU,08/04/2024  8:45 AM,,Perseus's Offer for OreCorp unconditional and best and final  2  pages  280.1KB
ORR,08/04/2024  8:45 AM,,PRU: PRU's Offer for ORR unconditional and best and final  2  pages  280.1KB
WOA,08/04/2024  8:44 AM,,WOA's Lupin Fibre Product Ready For Commercialisation  4  pages  287.7KB
A3D,08/04/2024  8:43 AM,,Successful Manufacture of Gas Turbine Engine  4  pages  394.6KB
FLT,08/04/2024  8:43 AM,,Application for quotation of securities - FLT  7  pages  21.4KB
ANN,08/04/2024  8:41 AM,,Proposed issue of securities - ANN  9  pages  28.6KB
RCE,08/04/2024  8:41 AM,,Recce Pharmaceuticals - Business Update  8  pages  612.6KB
ANN,08/04/2024  8:41 AM,,Ansell Investor Presentation 8 April 2024  52  pages  3.9MB
ANN,08/04/2024  8:41 AM,,Ansell to acquire Kimberly Clark's Personal PPE Business  7  pages  296.9KB
WCN,08/04/2024  8:40 AM,,Multiple Work Programs Underway in Canada and Western Aust  7  pages  871.7KB
E25,08/04/2024  8:39 AM,,NAIF Completes Butcherbird Strategic Assessment  2  pages  720.5KB
QOR,08/04/2024  8:39 AM,,Qoria rejects unsolicited non-binding proposal from K1  2  pages  317.6KB
360,08/04/2024  8:39 AM,,Market Update  2  pages  115.6KB
SPQ,08/04/2024  8:38 AM,,Superior awarded CEI grant for Bottletree drilling  9  pages  4.9MB
M7T,08/04/2024  8:37 AM,,Notice of Q3 FY24 Result & Investor Webinar  1  page  152.6KB
VVA,08/04/2024  8:37 AM,,Viva Leisure enters NT market with acquisition  2  pages  212.2KB
CRN,08/04/2024  8:35 AM,,Change of Director's Interest Notice  3  pages  298.6KB
EGG,08/04/2024  8:35 AM,,Update - Notification of buy-back - EGG  6  pages  18.5KB
XPN,08/04/2024  8:34 AM,,Change of Registered Office and Principal Place of Business  1  page  116.7KB
KGN,08/04/2024  8:34 AM,,Mighty Ape CEO appointment - April 2024  1  page  46.6KB
CUP,08/04/2024  8:34 AM,,Count expands Gold Coast client base  1  page  203.1KB
SYR,08/04/2024  8:34 AM,,Syrah natural graphite sales and market update  3  pages  184.9KB
WMG,08/04/2024  8:34 AM,,Completion of Phase 2 RC Drilling Commencement of EIS3  6  pages  1.5MB
GLO,08/04/2024  8:34 AM,,Monthly Units on Issue and Redemptions - March 2024  1  page  96.2KB
GIV,08/04/2024  8:34 AM,,Monthly Units on Issue and Redemptions - March 2024  1  page  96.2KB
SVL,08/04/2024  8:34 AM,,Investor Presentation - Gold Forum Europe  33  pages  8.0MB
ARV,08/04/2024  8:34 AM,,Options ARVOC Holdings Range Report  1  page  56.9KB
WPR,08/04/2024  8:34 AM,,Appendix 3Y - Hadyn Stephens  3  pages  328.9KB
I88,08/04/2024  8:34 AM,,Yeelirrie North Uranium Project Expanded by 368%  11  pages  768.4KB
KNI,08/04/2024  8:34 AM,,Ertelien 23Mt MRE Unveils Sustainable Ni/Cu Potential  26  pages  2.5MB
RIO,08/04/2024  8:34 AM,,Bold Baatar appointed as Chief Commercial Officer  3  pages  111.7KB
AMP,08/04/2024  8:33 AM,,Update - Notification of buy-back - AMP  6  pages  18.5KB
MTM,08/04/2024  8:33 AM,,REE-Nb Geochem Anomalies at Montviel South  13  pages  1.3MB
QFE,08/04/2024  8:33 AM,,Notification of cessation of securities - QFE  10  pages  29.4KB
OD6,08/04/2024  8:33 AM,,Cleansing Statement  2  pages  148.9KB
CSL,08/04/2024  8:33 AM,,Publication of AEGIS II Trial Data  1  page  159.3KB
ARV,08/04/2024  8:33 AM,,Top Twenty Listed Option Holders ARVOC  1  page  59.8KB
DVL,08/04/2024  8:33 AM,,dorsaVi releases video AI for upper limb tracking  3  pages  248.0KB
AUI,08/04/2024  8:33 AM,,Update - Notification of buy-back - AUI  6  pages  18.5KB
ARV,08/04/2024  8:32 AM,,Application for quotation of securities - ARV  6  pages  19.2KB
OD6,08/04/2024  8:32 AM,,Application for quotation of securities - OD6  6  pages  18.4KB
BOQ,08/04/2024  8:32 AM,,1H24 Results Webcast  1  page  80.0KB
AME,08/04/2024  8:32 AM,,Drilling underway at Sandstone Gold Project  5  pages  1.8MB
CGS,08/04/2024  8:32 AM,,Update - Notification of buy-back - CGS  6  pages  18.2KB
AR9,08/04/2024  8:32 AM,,archTIS Appoints Andrew Burns as Chief Financial Officer  2  pages  109.5KB
HLI,08/04/2024  8:32 AM,,Update - Notification of buy-back - HLI  6  pages  18.4KB
PPS,08/04/2024  8:32 AM,,Notification of cessation of securities - PPS  4  pages  14.9KB
DUI,08/04/2024  8:32 AM,,Update - Notification of buy-back - DUI  6  pages  18.5KB
ORR,08/04/2024  8:32 AM,,Change in substantial holding from PRU  6  pages  242.6KB
PRU,08/04/2024  8:32 AM,,Change in substantial holding for ORR  6  pages  242.6KB
EGH,08/04/2024  8:32 AM,,Change in substantial holding  8  pages  544.5KB
GQG,08/04/2024  8:31 AM,,Transfer of shares  1  page  79.2KB
RUL,08/04/2024  8:31 AM,,Notification of cessation of securities - RUL  4  pages  14.9KB
RUL,08/04/2024  8:31 AM,,Update - Notification of buy-back - RUL  6  pages  18.6KB
FEG,08/04/2024  8:31 AM,,Aloe Rek dleivers High Grade Assays  18  pages  1.6MB
MCM,08/04/2024  8:31 AM,,Change in substantial holding  8  pages  295.0KB
NEC,08/04/2024  8:31 AM,,Update - Notification of buy-back - NEC  6  pages  18.3KB
RG8,08/04/2024  8:31 AM,,Update - Notification of buy-back - RG8  6  pages  18.7KB
VG1,08/04/2024  8:31 AM,,Update - Notification of buy-back - VG1  6  pages  18.8KB
CPU,08/04/2024  8:31 AM,,Update - Notification of buy-back - CPU  6  pages  18.4KB
TRS,08/04/2024  8:30 AM,,Update - Notification of buy-back - TRS  6  pages  18.3KB
WR1,08/04/2024  8:30 AM,,Court approves option to acquire Renard Project  2  pages  1.3MB
HM1,08/04/2024  8:30 AM,,Weekly NTA Estimate  1  page  75.8KB
FGR,08/04/2024  8:30 AM,,Graphene enhanced concrete continues to excel in field trial  4  pages  414.5KB
