ASX Code,Date,Price sens.,Headline
REP,09/07/2024  9:46 AM,,Change of Director's Interest Notice  4  pages  399.3KB
GL1,09/07/2024  9:40 AM,,Trading Halt  3  pages  795.1KB
MOM,09/07/2024  9:39 AM,,Notification regarding unquoted securities - MOM  5  pages  16.8KB
MOM,09/07/2024  9:39 AM,,Notification regarding unquoted securities - MOM  7  pages  21.6KB
MOM,09/07/2024  9:39 AM,,Application for quotation of securities - MOM  6  pages  18.4KB
MOM,09/07/2024  9:39 AM,,Completion of Acquisition of Advanced Uranium Assets  7  pages  604.3KB
MEC,09/07/2024  9:38 AM,,NTA at 28.06.2024 Pre-tax 1.0716 Post-tax 1.0792  1  page  279.9KB
PGM,09/07/2024  9:38 AM,,PGM accelerates exploration at its WA gold projects  7  pages  1.5MB
SUV,09/07/2024  9:37 AM,,Binding Joint Development Agreement Signed with PERMAcast  7  pages  889.6KB
NAB,09/07/2024  9:37 AM,,Notification of cessation of securities - NAB  4  pages  14.8KB
ID8,09/07/2024  9:36 AM,,Rights Issue Closure and Shortfall Notification  3  pages  430.0KB
GTG,09/07/2024  9:34 AM,,GeneType to Enter Canadian and New Zealand Markets  2  pages  112.8KB
NAB,09/07/2024  9:34 AM,,Application for quotation of securities - NAB  6  pages  18.1KB
LRT,09/07/2024  9:32 AM,,LRT NAV Estimate - 5 July 2024  1  page  135.0KB
APC,09/07/2024  9:31 AM,,West Arunta Project Update  2  pages  3.9MB
RMC,09/07/2024  9:31 AM,,Resignation of Chief Executive Officer (CEO)  2  pages  152.5KB
MGT,09/07/2024  9:31 AM,,Extension of Entitlement Offer closing date to 19 July 2024  3  pages  162.1KB
KLI,09/07/2024  9:28 AM,,Confirmed high-grade gold-copper at Kaa  10  pages  1.8MB
ASR,09/07/2024  9:27 AM,,Management Changes  1  page  196.9KB
WNX,09/07/2024  9:27 AM,,Investor Presentation  20  pages  5.7MB
HAS,09/07/2024  9:24 AM,,Proposed issue of securities - HAS  5  pages  17.2KB
MXR,09/07/2024  9:24 AM,,Drilling commences at the Hilditch Gold Project  5  pages  809.5KB
HAS,09/07/2024  9:24 AM,,JL MAG to Become 9.8% Strategic Investor in Hastings  4  pages  293.7KB
XRF,09/07/2024  9:22 AM,,XRF Exercises Orbis Call Option  2  pages  287.2KB
ADG,09/07/2024  9:22 AM,,Notification of cessation of securities - ADG  4  pages  15.0KB
DCC,09/07/2024  9:21 AM,,Trading Halt  3  pages  1.0MB
MLM,09/07/2024  9:19 AM,,Chairman and MD appointments at Metallica Minerals  2  pages  242.0KB
DRX,09/07/2024  9:19 AM,,DRX: Chairman and MD appointments at Metallica Minerals  2  pages  242.0KB
WQG,09/07/2024  9:19 AM,,Weekly NTA 5 July 2024  1  page  206.4KB
MQG,09/07/2024  9:18 AM,,Update - Notification of buy-back - MQG  6  pages  18.4KB
ORN,09/07/2024  9:18 AM,,Okiep Copper Project Continues to Deliver  21  pages  2.5MB
DCC,09/07/2024  9:17 AM,,DigitalX Spot Bitcoin ETF to be Quoted on the ASX  3  pages  102.5KB
PE1,09/07/2024  9:16 AM,,NAV 30 June2024  1  page  173.0KB
NWS,09/07/2024  9:15 AM,,Appendix 3C  4  pages  75.7KB
AIA,09/07/2024  9:15 AM,,AIA - Auckland Airport new board nomination  1  page  40.9KB
NWS,09/07/2024  9:14 AM,,Appendix 3C  4  pages  75.7KB
WCM,09/07/2024  9:14 AM,,DRP Price - Distribution year ending 30 June 2024  1  page  174.1KB
WCM,09/07/2024  9:14 AM,,Actual distribution for year ending 30 June 2024  1  page  181.0KB
TVN,09/07/2024  9:13 AM,,Proposed issue of securities - TVN  5  pages  17.5KB
CGR,09/07/2024  9:13 AM,,Webb Exploration Update-Gravity Survey to Commence  4  pages  574.4KB
AII,09/07/2024  9:12 AM,,Governor of Gangwon Visits Sangdong Tungsten Mine Site  5  pages  668.7KB
MIO,09/07/2024  9:11 AM,,Trading Halt  2  pages  611.1KB
IBC,09/07/2024  9:11 AM,,Update - Notification of buy-back - IBC  6  pages  18.4KB
FGH,09/07/2024  9:09 AM,,Foresta Receives OIO Approval for Kawerau Site Lease  2  pages  55.9KB
SMI,09/07/2024  9:09 AM,,Application for quotation of securities - Updated  20  pages  431.8KB
IMC,09/07/2024  9:08 AM,,Immuron CEO Steven Lydeamore presentation to Sharewise  15  pages  4.5MB
CMD,09/07/2024  9:08 AM,,Soalara Limestone Valuation Update  2  pages  1.3MB
LRV,09/07/2024  9:08 AM,,Share Purchase Plan Letter and Offer Booklet  15  pages  503.6KB
TVN,09/07/2024  9:06 AM,,Tivan Target Market Determination  6  pages  94.7KB
TVN,09/07/2024  9:06 AM,,Tivan Prospectus  51  pages  725.2KB
SEC,09/07/2024  9:06 AM,,Net Tangible Asset Backing  1  page  116.8KB
SWT,09/07/2024  9:05 AM,,DRP Price - Distribution month ending 30 June 2024  1  page  154.4KB
VMM,09/07/2024  9:05 AM,,Brazil Virtual Resources Conference Presentation  16  pages  5.1MB
OCC,09/07/2024  9:05 AM,,Record Quarterly and Yearly Revenue Show Outstanding Growth  3  pages  265.9KB
TRE,09/07/2024  9:04 AM,,Mali adopts of Mining Code in regulatory stability move  2  pages  860.0KB
SWT,09/07/2024  9:02 AM,,Actual distribution for month ending 30 June 2024  1  page  180.5KB
GNC,09/07/2024  9:02 AM,,Update - Notification of buy-back - GNC  6  pages  18.3KB
LRV,09/07/2024  9:02 AM,,Cleansing Notice  1  page  233.0KB
TAN,09/07/2024  9:00 AM,,Estimated Annual Distribution Component Information  2  pages  228.0KB
BRN,09/07/2024  9:00 AM,,Planned Retirement of Senior Executive  2  pages  194.3KB
BAP,09/07/2024  9:00 AM,,Rejection of non-binding indicative proposal  1  page  173.6KB
MEC,09/07/2024  9:00 AM,,NTA at 21.06.2024 Pre-tax 1.0702 Post-tax 1.0781  1  page  208.1KB
DRX,09/07/2024  9:00 AM,,Change in substantial holding for MLM  3  pages  123.2KB
MLM,09/07/2024  9:00 AM,,Change in substantial holding from DRX  3  pages  123.2KB
SLM,09/07/2024  8:58 AM,,High Grade Copper Samples Identified at Cinto  16  pages  2.3MB
TOR,09/07/2024  8:54 AM,,Equity Agreement Initiated For Drill Campaign At Paris Gold  4  pages  482.1KB
AGL,09/07/2024  8:53 AM,,Notification of cessation of securities - AGL  4  pages  14.7KB
URF,09/07/2024  8:53 AM,,Update - Notification of buy-back - URF  6  pages  18.6KB
CAJ,09/07/2024  8:51 AM,,Notification regarding unquoted securities - CAJ  6  pages  19.1KB
TOR,09/07/2024  8:50 AM,,Proposed issue of securities - TOR  5  pages  18.1KB
NAM,09/07/2024  8:49 AM,,Extension of Olam Agri Takeover Bid  6  pages  712.1KB
CHR,09/07/2024  8:48 AM,,Drilling Commences at Lake Johnston  6  pages  2.6MB
PCI,09/07/2024  8:47 AM,,Trading Halt  2  pages  221.5KB
BAP,09/07/2024  8:47 AM,,Bapcor appoints Executive Chair and Chief Executive Officer  3  pages  259.5KB
MAY,09/07/2024  8:45 AM,,Webinar - Block 9 Field Development Plan  1  page  143.5KB
HCH,09/07/2024  8:45 AM,,Hot Chili Corporate Presentation Rule Symposium 2024  40  pages  10.9MB
MTM,09/07/2024  8:44 AM,,Positive Lithium Extraction Results from Flash Joule Heating  7  pages  6.2MB
TOR,09/07/2024  8:43 AM,,Cancel - Proposed issue of securities - TOR  5  pages  18.0KB
AMH,09/07/2024  8:41 AM,,Invitation to Results Webcast  1  page  88.0KB
SRL,09/07/2024  8:38 AM,,Scandium Feasibility Study Update Commenced  5  pages  394.4KB
NTI,09/07/2024  8:37 AM,,US FDA orphan drug designation requested for PANDAS/PANS  2  pages  113.1KB
LDX,09/07/2024  8:36 AM,,Lumos Expands Henry Schein FebriDx Distribution Partnership  3  pages  273.1KB
BUX,09/07/2024  8:34 AM,,Drilling Program Commences at Graphite Bull Project  6  pages  789.7KB
FBM,09/07/2024  8:34 AM,,Drilling Extends Big Red Pegmatite  14  pages  1.4MB
IIQ,09/07/2024  8:33 AM,,IIQ Options Distribution Schedule and Top 20 Holders  3  pages  113.5KB
CVB,09/07/2024  8:32 AM,,Sales Update for Q4 FY2024  2  pages  734.9KB
WBC,09/07/2024  8:30 AM,,Update - Notification of buy-back - WBC  6  pages  18.4KB
IIQ,09/07/2024  8:29 AM,,Application for quotation of securities - IIQ  6  pages  18.4KB
LIN,09/07/2024  8:29 AM,,Corporate Presentation  49  pages  3.9MB
CCX,09/07/2024  8:24 AM,,Successful Completion of the Sale of Avenue  1  page  110.2KB
SKO,09/07/2024  8:22 AM,,Capital Change Notice  2  pages  88.3KB
NAB,09/07/2024  8:18 AM,,Update - Notification of buy-back - NAB  6  pages  18.4KB
OAR,09/07/2024  8:17 AM,,GBA Capital - Brazilian Resources Conference Presentation  27  pages  5.9MB
TLS,09/07/2024  8:16 AM,,Telstra Announces Mobile Pricing Update  2  pages  176.5KB
TL1,09/07/2024  8:16 AM,,Telstra Announces Mobile Pricing Update  2  pages  176.5KB
PVL,09/07/2024  8:16 AM,,ACCI Investment  3  pages  190.2KB
IPX,09/07/2024  8:16 AM,,Change of Director's Interest Notice x2  4  pages  462.5KB
CPU,09/07/2024  8:16 AM,,Update - Notification of buy-back - CPU  6  pages  18.4KB
IPX,09/07/2024  8:16 AM,,Notice under Section 708A  1  page  137.0KB
SPR,09/07/2024  8:16 AM,,Never Never and Pepper deliver exceptional assays  17  pages  1.8MB
PPS,09/07/2024  8:16 AM,,Notification of cessation of securities - PPS  4  pages  14.9KB
CTQ,09/07/2024  8:16 AM,,CEO Resignation  3  pages  186.7KB
IPX,09/07/2024  8:15 AM,,Application for quotation of securities - IPX  8  pages  20.7KB
IPX,09/07/2024  8:15 AM,,Application for quotation of securities - IPX  8  pages  20.7KB
RUL,09/07/2024  8:15 AM,,Notification of cessation of securities - RUL  4  pages  14.9KB
5EA,09/07/2024  8:15 AM,,5EA - Appendix 3Y (x1)  3  pages  150.6KB
RUL,09/07/2024  8:15 AM,,Update - Notification of buy-back - RUL  6  pages  18.6KB
EXR,09/07/2024  8:15 AM,,Webinar Presentation  23  pages  2.8MB
FPR,09/07/2024  8:15 AM,,Update - Notification of buy-back - FPR  6  pages  18.5KB
SQ2,09/07/2024  8:15 AM,,NOTICE OF PROPOSED SALE OF SECURITIES  3  pages  110.3KB
TSK,09/07/2024  8:14 AM,,Becoming a substantial holder  3  pages  520.6KB
RNT,09/07/2024  8:14 AM,,Update - Proposed issue of securities - RNT  7  pages  26.1KB
RNT,09/07/2024  8:14 AM,,Rights Issue Offer Closing Date Extended  2  pages  366.4KB
MEU,09/07/2024  8:13 AM,,Drilling program update  5  pages  1.3MB
ANZ,09/07/2024  8:13 AM,,Proclamation of Queensland legislation  1  page  97.6KB
AN3,09/07/2024  8:13 AM,,Proclamation of Queensland legislation  1  page  97.6KB
SUN,09/07/2024  8:13 AM,,ANZ: Proclamation of Queensland legislation  1  page  97.6KB
SB2,09/07/2024  8:13 AM,,Change in substantial holding  3  pages  403.1KB
STX,09/07/2024  8:12 AM,,West Erregulla receives EPA Approval  1  page  97.2KB
ALI,09/07/2024  8:12 AM,,Weekly NTA estimate - Fri 5.7.24  1  page  239.1KB
VG1,09/07/2024  8:12 AM,,Update - Notification of buy-back - VG1  6  pages  18.8KB
IPX,09/07/2024  8:12 AM,,Change in substantial holding  4  pages  581.5KB
LSF,09/07/2024  8:11 AM,,Net Tangible Asset Backing  1  page  219.9KB
MAU,09/07/2024  8:11 AM,,Investor Presentation  33  pages  2.1MB
EM2,09/07/2024  8:11 AM,,Copper Porphyry-Style Targets Confirmed at Silver Mountain  16  pages  2.2MB
WGX,09/07/2024  8:11 AM,,ISS Recommends Karora Shareholders Vote For Merger  3  pages  138.5KB
TTT,09/07/2024  8:10 AM,,Notice Under Section 708A (5) Of The Corporations Act  1  page  58.4KB
TTT,09/07/2024  8:10 AM,,Application for quotation of securities - TTT  6  pages  19.1KB
GNP,09/07/2024  8:10 AM,,Genus Awarded Long Term Western Power Maintenance Works  2  pages  370.0KB
TRM,09/07/2024  8:10 AM,,Change of Director's Interest Notice - EE Smith  3  pages  87.8KB
NTL,09/07/2024  7:33 AM,,NTL Rights Issue Ineligible Shareholder Notice  1  page  180.4KB
NTL,09/07/2024  7:32 AM,,NTL Rights Offer  16  pages  4.5MB
AFP,09/07/2024  7:30 AM,,AFT agrees distribution for Crystaderm in China  2  pages  122.0KB
CNU,09/07/2024  7:30 AM,,Chorus full year results date  1  page  135.5KB
CNU,09/07/2024  7:30 AM,,Q4 FY24 Connections Update  14  pages  566.8KB
MOV,09/07/2024  7:30 AM,,SPH Notice - NAOS  2  pages  198.2KB
SKO,09/07/2024  7:30 AM,,Notification regarding unquoted securities - SKO  6  pages  20.0KB
