ASX Code,Date,Price sens.,Headline
GQG,15/05/2026  8:43 am,,2026 AGM Presentations  21  pages  717.5KB
PAC,15/05/2026  8:42 am,Â,Update - Notification of buy-back - PAC  6  pages  18.4KB
FPC,15/05/2026  8:40 am,Â,Weekly NAV  1  page  223.9KB
CGS,15/05/2026  8:39 am,Â,Update - Notification of buy-back - CGS  6  pages  18.2KB
AAR,15/05/2026  8:38 am,,Gold Mineralisation at Theia Extended 210 Vertical Metres  23  pages  3.5MB
EMN,15/05/2026  8:37 am,Â,EMN Corporate Presentation May 2026  35  pages  2.4MB
CBY,15/05/2026  8:34 am,Â,Application for quotation of securities - CBY  6  pages  18.4KB
LNW,15/05/2026  8:33 am,Â,Update - Notification of buy-back - LNW  6  pages  18.5KB
OSL,15/05/2026  8:31 am,Â,OSPREY Interim Results Presented at ESGE Days 2026  4  pages  422.6KB
TRE,15/05/2026  8:31 am,,Execution of Binding Senior Debt with Coris Bank  2  pages  379.1KB
EMN,15/05/2026  8:29 am,,"Half Yearly Report, Interim FS, MD&A for quarter 31/03/26  45  pages  1.4MB"
CBY,15/05/2026  8:28 am,,Completion of the Monto Project Acquisition  7  pages  2.5MB
MEC,15/05/2026  8:28 am,Â,Update - Notification of buy-back - MEC  6  pages  18.4KB
3DA,15/05/2026  8:28 am,Â,Amaero Comments on Incident at Factory  2  pages  166.1KB
NH3,15/05/2026  8:27 am,,NH3 Participates in Ammonia Certification System  3  pages  402.7KB
ALK,15/05/2026  8:26 am,,Q3 FY2026 Management's Discussion & Analysis  25  pages  1.4MB
ASP,15/05/2026  8:26 am,Â,Q2 FY26 Investor Update - Webinar link and transcript  4  pages  199.5KB
ALK,15/05/2026  8:26 am,,Q3 FY2026 Interim Financial Report  21  pages  1.2MB
ALK,15/05/2026  8:26 am,,Alkane Delivers Record Q3 Profit of $93 million  9  pages  437.9KB
LSF,15/05/2026  8:26 am,Â,Net Tangible Asset Backing  1  page  131.1KB
AMP,15/05/2026  8:26 am,Â,Update - Notification of buy-back - AMP  6  pages  18.3KB
TWE,15/05/2026  8:26 am,Â,Change in substantial holding  3  pages  246.6KB
XRG,15/05/2026  8:26 am,,Successful completion of DoD project  2  pages  402.4KB
CYL,15/05/2026  8:25 am,,Drilling at Old Highway confirms resource growth potential  14  pages  1.6MB
BXN,15/05/2026  8:25 am,Â,Change of Director's Interest Notice  2  pages  212.8KB
JNS,15/05/2026  8:25 am,Â,Application for quotation of securities - JNS  5  pages  16.7KB
ZIP,15/05/2026  8:25 am,Â,Update - Notification of buy-back - ZIP  6  pages  18.3KB
MME,15/05/2026  8:25 am,Â,MONEYME Executes $365.4m Personal Loan ABS Transaction  1  page  176.9KB
FPC,15/05/2026  8:25 am,Â,Net Tangible Asset Backing  6  pages  410.3KB
HPG,15/05/2026  8:25 am,Â,Update - Notification of buy-back - HPG  6  pages  18.3KB
MPL,15/05/2026  8:25 am,Â,FY26 Full Year - Key Dates  1  page  202.8KB
DTR,15/05/2026  8:25 am,,Underground Gold Potential Grows at Colosseum  14  pages  1.4MB
M79,15/05/2026  8:25 am,,Nevada Gold and Silver results highlight growth potential  30  pages  1.8MB
ANN,15/05/2026  8:25 am,Â,Update - Notification of buy-back - ANN  6  pages  18.4KB
ARG,15/05/2026  8:25 am,Â,Update - Notification of buy-back - ARG  6  pages  18.3KB
JHX,15/05/2026  8:24 am,Â,APPENDIX 3Z - P LISBOA  2  pages  239.2KB
BOL,15/05/2026  8:24 am,Â,Update - Notification of buy-back - BOL  6  pages  18.2KB
REA,15/05/2026  8:24 am,Â,Update - Notification of buy-back - REA  6  pages  18.3KB
JHX,15/05/2026  8:24 am,Â,Appointment of New Non-Executive Director  2  pages  148.8KB
BVS,15/05/2026  8:24 am,Â,Initial Director's Interest Notice  2  pages  212.3KB
PPE,15/05/2026  8:24 am,Â,Update - Notification of buy-back - PPE  6  pages  18.3KB
NVA,15/05/2026  8:24 am,Â,Cleansing Statement  2  pages  157.6KB
NVA,15/05/2026  8:24 am,Â,Application for quotation of securities - NVA  6  pages  18.3KB
CAA,15/05/2026  8:23 am,Â,Update - Notification of buy-back - CAA  6  pages  18.2KB
AVH,15/05/2026  8:23 am,,Financial Results for Quarter Ending 31 March 2026  35  pages  1.1MB
AVH,15/05/2026  8:23 am,,AVITA Medical Q1 2026 Earnings Presentation  8  pages  663.3KB
AVH,15/05/2026  8:23 am,,AVITA Medical Reports First Quarter 2026 Financial Results  5  pages  335.2KB
OML,15/05/2026  8:23 am,Â,Ceasing to be a substantial holder  9  pages  1.1MB
VVA,15/05/2026  8:23 am,Â,Update - Notification of buy-back - VVA  6  pages  18.2KB
ONE,15/05/2026  8:23 am,Â,Oneview's New Revenue Channel  1  page  188.4KB
ERL,15/05/2026  8:22 am,Â,Change of Director's Interest Notice  2  pages  162.8KB
NVA,15/05/2026  8:22 am,Â,Change in substantial holding  6  pages  327.2KB
TR2,15/05/2026  8:22 am,Â,Change in substantial holding  2  pages  79.0KB
AMN,15/05/2026  8:22 am,Â,Change in substantial holding for TR2  2  pages  442.4KB
TR2,15/05/2026  8:22 am,Â,Change in substantial holding from AMN  2  pages  442.4KB
TR2,15/05/2026  8:21 am,Â,Cleansing Notice  1  page  116.2KB
FWD,15/05/2026  8:21 am,Â,Update - Notification of buy-back - FWD  6  pages  18.4KB
TR2,15/05/2026  8:21 am,Â,Application for quotation of securities - TR2  6  pages  18.2KB
CCE,15/05/2026  8:21 am,,EuropeWave Milestone Completed and Payment Received  3  pages  664.9KB
AOK,15/05/2026  8:21 am,,Surat Basin Development and Exploration Initiatives  5  pages  1.2MB
AUV,15/05/2026  8:20 am,,Additional Drill Targets Identified at Nuckulla Hill  8  pages  1.6MB
WCN,15/05/2026  8:20 am,Â,Updated Appendix 3A.5  12  pages  359.4KB
NVA,15/05/2026  8:20 am,Â,Invitation to Nova Quarterly Update Webinar  3  pages  182.2KB
VBS,15/05/2026  8:20 am,Â,Updated Corporate Presentation  21  pages  1.0MB
RMS,15/05/2026  8:20 am,Â,Update - Notification of buy-back - RMS  6  pages  18.2KB
PC2,15/05/2026  8:20 am,Â,Notice of Extraordinary General Meeting/Proxy Form  34  pages  1.2MB
MIN,15/05/2026  8:19 am,Â,Appendix 3Y Notification  4  pages  582.8KB
ERM,15/05/2026  8:19 am,Â,Becoming a substantial holder  4  pages  358.3KB
ELV,15/05/2026  8:19 am,Â,Becoming a substantial holder  31  pages  1.9MB
CVL,15/05/2026  8:18 am,Â,Appendix 03Z Final Directors Interest Notice  2  pages  213.8KB
CVL,15/05/2026  8:18 am,,Q3 FY26 Investor Presentation  10  pages  9.1MB
CVL,15/05/2026  8:18 am,,Civmec Delivers Strong Q3 FY26 - A$1.3 Billion Order Book  3  pages  277.6KB
STW,15/05/2026  8:18 am,Â,Daily Fund Update  9  pages  182.7KB
SLF,15/05/2026  8:18 am,Â,Daily Fund Update  4  pages  77.1KB
SFY,15/05/2026  8:17 am,Â,Daily Fund Update  4  pages  79.9KB
PWH,15/05/2026  8:17 am,Â,Becoming a substantial holder  29  pages  2.2MB
VEA,15/05/2026  8:17 am,Â,Ceasing to be a substantial holder  104  pages  8.4MB
VAU,15/05/2026  8:17 am,Â,Change in substantial holding  18  pages  1.1MB
FRS,15/05/2026  8:16 am,Â,Forrestania Appoints Highly Experienced GM Operations  3  pages  286.4KB
SSM,15/05/2026  8:16 am,Â,Becoming a substantial holder  78  pages  1.4MB
GGP,15/05/2026  8:16 am,Â,Becoming a substantial holder  100  pages  1.6MB
EOS,15/05/2026  8:16 am,Â,Ceasing to be a substantial holder  6  pages  1.0MB
APE,15/05/2026  8:15 am,Â,Ceasing to be a substantial holder  6  pages  1.0MB
BGA,15/05/2026  8:15 am,Â,Becoming a substantial holder  67  pages  1.4MB
PRU,15/05/2026  8:15 am,Â,Update - Notification of buy-back - PRU  6  pages  18.3KB
AOV,15/05/2026  8:15 am,Â,Change in substantial holding  36  pages  1.2MB
SUN,15/05/2026  8:04 am,Â,Update - Notification of buy-back - SUN  6  pages  18.2KB
DOW,15/05/2026  8:00 am,Â,Update - Notification of buy-back - DOW  6  pages  18.2KB
WBC,15/05/2026  7:45 am,Â,Change in substantial holding  10  pages  1.1MB
PEB,15/05/2026  7:30 am,,Draft LCD Proposes Medicare Coverage for Triage and Triage  4  pages  184.0KB
MEZ,15/05/2026  7:30 am,Â,Meridian secures consent for Bunnythorpe Solar Farm  1  page  206.9KB
FBU,15/05/2026  7:30 am,Â,Sale of South Australian property  1  page  84.1KB
AIA,15/05/2026  7:30 am,Â,April 2026 Monthly traffic update  1  page  704.4KB
MEZ,15/05/2026  7:30 am,,Meridian Energy monthly operating report for April 2026  14  pages  512.4KB
