ASX Code,Date,Price sens.,Headline
FSF,01/09/2023  7:31 AM,,Monthly Allotment / Redemption Notice  1  page  49.3KB
SNZ,01/09/2023  7:30 AM,,Notice of Allotment of Securities  2  pages  128.9KB
SNZ,01/09/2023  7:30 AM,,Application for quotation of securities - SNZ  6  pages  28.5KB
AIA,01/09/2023  7:30 AM,,AIA - Annual meeting and director nomination  2  pages  72.6KB
FSF,01/09/2023  7:30 AM,,Communication to Fonterra farmers  3  pages  183.1KB
RBD,01/09/2023  7:30 AM,,RBD announces permanent appointment of Group CEO  1  page  79.6KB
