ASX Code,Date,Price sens.,Headline
BOQ,17/03/2026  3:08 pm,Â,Dividend/Distribution - BOQPG  5  pages  18.6KB
BWN,17/03/2026  3:03 pm,Â,Investor Presentation to Euroz Hartleys Conference  19  pages  5.0MB
MXT,17/03/2026  3:01 pm,Â,Daily Fund Update  1  page  629.1KB
MAT,17/03/2026  3:00 pm,,Pause in Trading  1  page  115.6KB
RCE,17/03/2026  3:00 pm,Â,RCE Investor Webinar Presentation  1  page  257.3KB
MOT,17/03/2026  2:59 pm,Â,Daily Fund Update  1  page  621.5KB
EIQ,17/03/2026  2:57 pm,Â,Cleansing Notice  1  page  115.9KB
WAK,17/03/2026  2:56 pm,Â,Change in substantial holding  3  pages  694.6KB
EIQ,17/03/2026  2:55 pm,Â,Application for quotation of securities - EIQ  8  pages  20.7KB
CHI,17/03/2026  2:51 pm,Â,Dividend Reinvestment Plan Strike Price  2  pages  104.2KB
NWS,17/03/2026  2:43 pm,Â,Appendix 3C  4  pages  76.2KB
NWS,17/03/2026  2:42 pm,Â,Appendix 3C  4  pages  76.2KB
NOV,17/03/2026  2:41 pm,Â,Application for quotation of securities - NOV  8  pages  20.7KB
MA1,17/03/2026  2:41 pm,Â,Daily Estimate NTA for 16.03.2026  1  page  134.4KB
FPH,17/03/2026  2:35 pm,Â,Ceasing to be a substantial holder  7  pages  369.9KB
MRC,17/03/2026  2:31 pm,Â,Company Secretary Resignation  1  page  83.5KB
CVC,17/03/2026  2:30 pm,,Dividend Announcement  1  page  142.8KB
ABX,17/03/2026  2:29 pm,Â,Notification regarding unquoted securities - ABX  7  pages  21.4KB
CVC,17/03/2026  2:28 pm,,Dividend/Distribution - CVC  4  pages  15.2KB
LSG,17/03/2026  2:27 pm,Â,LSGE Update - February 2026  2  pages  377.4KB
GLF,17/03/2026  2:21 pm,Â,AGM and closing date for nomination of Directors  1  page  149.3KB
HIQ,17/03/2026  2:21 pm,Â,Change of Registered Office Address  2  pages  228.7KB
BNZ,17/03/2026  2:11 pm,Â,Benz Mining Investor Presentation Euroz Hartleys Conference  22  pages  8.5MB
TOR,17/03/2026  2:02 pm,Â,Torque Investor Presentation - Euroz Hartleys Conference  27  pages  6.6MB
QOR,17/03/2026  2:00 pm,Â,Change of Director's Interest Notice  3  pages  171.4KB
SNZ,17/03/2026  1:59 pm,Â,Ongoing disclosure notices  6  pages  595.5KB
QOR,17/03/2026  1:55 pm,Â,Notification regarding unquoted securities - QOR  7  pages  21.4KB
MML,17/03/2026  1:50 pm,,Major drilling campaign commences at McLaren project  4  pages  769.8KB
QGR,17/03/2026  1:48 pm,,Lifting of Trading Pause  1  page  345.9KB
DBF,17/03/2026  1:41 pm,Â,Change of Director's Interest Notice  3  pages  265.6KB
PNI,17/03/2026  1:41 pm,Â,Update - Dividend/Distribution - PNI  5  pages  21.2KB
BXB,17/03/2026  1:38 pm,Â,Change of Director's Interest Notice  4  pages  398.7KB
WAF,17/03/2026  1:36 pm,Â,Investor Presentation March 2026  32  pages  14.7MB
CRS,17/03/2026  1:33 pm,Â,Cleansing Notice  1  page  180.1KB
LEL,17/03/2026  1:32 pm,,Letter to Shareholders - Reinstatement to Quotation on ASX  2  pages  273.4KB
KGN,17/03/2026  1:25 pm,Â,Change of Director's Interest Notice - FE  2  pages  312.3KB
CRS,17/03/2026  1:20 pm,Â,Application for quotation of securities - CRS  6  pages  18.2KB
CNI,17/03/2026  1:13 pm,Â,Appendix 3Y - Kristie Brown  3  pages  252.4KB
GG1,17/03/2026  1:08 pm,Â,Notice of General Meeting/Proxy Form  13  pages  443.8KB
GCI,17/03/2026  1:06 pm,Â,Net Tangible Asset Backing  1  page  255.0KB
DGL,17/03/2026  1:06 pm,Â,Notification of cessation of securities - DGL  4  pages  14.6KB
BM1,17/03/2026  1:06 pm,Â,Notification of cessation of securities - BM1  4  pages  14.9KB
ORE,17/03/2026  1:05 pm,Â,Change in substantial holding  5  pages  388.8KB
A3D,17/03/2026  1:04 pm,Â,Change of Director's Interest Notice  2  pages  994.3KB
ANV,17/03/2026  1:03 pm,Â,Next Interest Payment Date - HKD610M Notes due 2034  1  page  123.1KB
TZN,17/03/2026  1:02 pm,Â,Terramin Australia Limited 2025 Annual Report  49  pages  2.4MB
TZN,17/03/2026  12:58 pm,Â,Appendix 4G and Corporate Governance Statement  22  pages  582.7KB
MEC,17/03/2026  12:44 pm,Â,MEC Monthly Performance Report February 2026  4  pages  312.9KB
REV,17/03/2026  12:41 pm,Â,Application for quotation of securities - REV  6  pages  17.6KB
AEU,17/03/2026  12:37 pm,Â,Ceasing to be a substantial holder  2  pages  130.6KB
ZEO,17/03/2026  12:30 pm,Â,Shareholder Webinar Invitation  2  pages  150.9KB
QGR,17/03/2026  12:24 pm,,Pause in Trading  1  page  136.1KB
PCI,17/03/2026  12:23 pm,Â,Daily Net Tangible Asset Statement  1  page  509.7KB
SHE,17/03/2026  12:21 pm,,Production & Wells Update for the Drumheller Development  3  pages  472.2KB
STM,17/03/2026  12:16 pm,Â,Change of Director's Interest Notice x3  8  pages  325.4KB
OSL,17/03/2026  12:03 pm,Â,Notice Under Section 708A  2  pages  348.0KB
IRI,17/03/2026  12:02 pm,Â,Notice of Investor Event  1  page  94.6KB
OSL,17/03/2026  12:01 pm,Â,Top 20 Holders and Range of Units for Attaching Options  3  pages  233.0KB
WB1,17/03/2026  11:55 am,Â,Series 2020-1 WST Trust - Class A Notes  1  page  288.3KB
OSL,17/03/2026  11:55 am,Â,Application for quotation of securities - OSL  6  pages  19.7KB
BFL,17/03/2026  11:45 am,Â,Change of CEO's Interest Notice - Mark Timothy Robinson  2  pages  252.5KB
FWD,17/03/2026  11:44 am,Â,EUROZ HARTLEY INVESTOR PRESENTATION  27  pages  4.7MB
OSL,17/03/2026  11:44 am,Â,Application for quotation of securities - OSL  6  pages  18.6KB
OSL,17/03/2026  11:40 am,Â,Application for quotation of securities - OSL  6  pages  18.6KB
OSL,17/03/2026  11:40 am,Â,Application for quotation of securities - OSL  7  pages  21.2KB
BFL,17/03/2026  11:33 am,Â,Change of CEO's Interest Notice - Mark Timothy Robinson  2  pages  254.2KB
ABX,17/03/2026  11:31 am,Â,Notification regarding unquoted securities - ABX  5  pages  16.9KB
ABX,17/03/2026  11:28 am,Â,Notification regarding unquoted securities - ABX  5  pages  16.9KB
ARC,17/03/2026  11:28 am,,Reinstatement to Quotation  1  page  202.1KB
ML2,17/03/2026  11:11 am,Â,Information Form and Checklist - Annual FY Date Correction  1  page  117.8KB
FXG,17/03/2026  11:06 am,Â,Notification regarding unquoted securities - FXG  11  pages  30.5KB
ASB,17/03/2026  11:05 am,Â,Euroz Hartleys Rottnest Island Conference 2026  13  pages  3.3MB
JNS,17/03/2026  11:04 am,Â,Correction to Receipt of ATO Tax Refund Announcement  2  pages  176.2KB
ARC,17/03/2026  10:43 am,Â,Initial Director's Interest Notice - P Hasrouni  2  pages  343.4KB
ARC,17/03/2026  10:41 am,Â,Non-Executive Director Appointment  1  page  250.4KB
RNV,17/03/2026  10:38 am,Â,Half Year Investor Presentation  14  pages  1.3MB
PNV,17/03/2026  10:35 am,Â,Change of Director's Interest Notice - Robert Douglas  2  pages  203.8KB
ASK,17/03/2026  10:35 am,Â,Notification regarding unquoted securities - ASK  6  pages  18.2KB
ABG,17/03/2026  10:35 am,Â,Change of Director Interest Notice - S Sewell  3  pages  225.2KB
EBR,17/03/2026  10:33 am,Â,Notification of cessation of securities - EBR  4  pages  14.8KB
A11,17/03/2026  10:33 am,Â,Proposed issue of securities - A11  6  pages  21.2KB
ABG,17/03/2026  10:32 am,Â,Notification regarding unquoted securities - ABG  7  pages  22.1KB
A11,17/03/2026  10:30 am,Â,Proposed issue of securities - A11  6  pages  20.3KB
A11,17/03/2026  10:18 am,Â,Proposed issue of securities - A11  5  pages  17.6KB
AKN,17/03/2026  10:15 am,Â,Change in substantial holding  3  pages  202.9KB
VUL,17/03/2026  10:15 am,,Vulcan secures lithium production licence for Lionheart  4  pages  283.2KB
SVY,17/03/2026  10:13 am,,MAJOR INCREASE IN MINERAL RESOURCE ESTIMATE TO 60Mt  62  pages  2.2MB
SFG,17/03/2026  10:07 am,,Continuation of Suspension from Quotation  1  page  229.7KB
CPO,17/03/2026  10:06 am,Â,Annual General Meeting Information  2  pages  401.5KB
CTW,17/03/2026  10:02 am,Â,CitiFirst WTC Instalment MINIs Dividend Final Amount  1  page  103.6KB
A11,17/03/2026  10:01 am,,Corporate Funding Update  6  pages  3.7MB
MRQ,17/03/2026  10:00 am,,Garies Rare Earth Drill Results Update  33  pages  2.3MB
C7A,17/03/2026  9:58 am,Â,Clara Expands Mareeba Gold Project  6  pages  498.4KB
ERE,17/03/2026  9:57 am,Â,Presentation to Investors  21  pages  6.2MB
VEN,17/03/2026  9:57 am,Â,Proposed issue of securities - VEN  8  pages  28.1KB
JHG,17/03/2026  9:56 am,Â,Distribution Notice  2  pages  279.9KB
JEG,17/03/2026  9:56 am,Â,Distribution Notice  2  pages  279.9KB
AGR,17/03/2026  9:53 am,Â,Aguia Officially Launches Pampafos Natural Phosphate Product  4  pages  678.3KB
GPT,17/03/2026  9:53 am,Â,Change of Director's Interest Notice - Tony Osmond  3  pages  354.4KB
VKA,17/03/2026  9:52 am,Â,VKA ENGAGES MINERAL TECHNOLOGIES FOR LINKA TUNGSTEN  3  pages  165.9KB
VEN,17/03/2026  9:52 am,,Capital raising  4  pages  280.8KB
AMD,17/03/2026  9:52 am,Â,Annual General Meeting Information  1  page  160.2KB
MCY,17/03/2026  9:51 am,Â,Mercury opens $220m geothermal expansion  2  pages  198.2KB
AHK,17/03/2026  9:51 am,,Sandy Mitchell Rare Earths Mining Licence Granted  2  pages  333.6KB
DVL,17/03/2026  9:51 am,,dorsaVi Advances Ultra-Edge Intelligence in Sport & Clinics  6  pages  460.4KB
PCL,17/03/2026  9:51 am,,Trading Halt  2  pages  394.9KB
PPM,17/03/2026  9:50 am,,CGF: Revised non-binding offer for Pepper Money  1  page  101.2KB
CGF,17/03/2026  9:50 am,,Revised non-binding offer for Pepper Money  1  page  101.2KB
AKN,17/03/2026  9:50 am,Â,Becoming a substantial holder  3  pages  606.1KB
GIB,17/03/2026  9:47 am,,$7m to GIB. Drilling early April - Edjudina Gold Project  6  pages  2.0MB
BNZ,17/03/2026  9:46 am,,NEW ULTRA HIGH GRADE GOLD DISCOVERY AT MT EGERTON  15  pages  1.4MB
C79,17/03/2026  9:45 am,Â,Application for quotation of securities - C79  6  pages  18.7KB
NMR,17/03/2026  9:43 am,,NMR secures exclusive mining rights at Podosky gold deposit  4  pages  503.4KB
VRC,17/03/2026  9:42 am,Â,Successful HPG Production Campaign & Customer Order  4  pages  419.6KB
CBO,17/03/2026  9:42 am,Â,Application for quotation of securities - CBO  6  pages  18.4KB
AII,17/03/2026  9:40 am,,Almonty Completes Phase 1 of Sangdong Tungsten Mine  4  pages  322.8KB
CU6,17/03/2026  9:40 am,,Co-PSMA data presented  6  pages  642.9KB
CGF,17/03/2026  9:40 am,,PPM: Receipt of revised non-binding offer for Pepper Money  1  page  195.7KB
PPM,17/03/2026  9:40 am,,Receipt of revised non-binding offer for Pepper Money  1  page  195.7KB
C79,17/03/2026  9:40 am,Â,Change of Director's Interest Notice  3  pages  317.5KB
ML2,17/03/2026  9:39 am,Â,"Schedule of Interest Payment Dates - ML2HA, ML2HB, and ML2HC  23  pages  1.8MB"
SNG,17/03/2026  9:39 am,,Mineralisation Confirmed Outside Main Zone at Sams Creek  27  pages  2.0MB
JHX,17/03/2026  9:39 am,Â,Chief Accounting Officer Transition  1  page  184.4KB
BCN,17/03/2026  9:38 am,,Continued Drilling Success at Iguana  64  pages  4.7MB
CMB,17/03/2026  9:38 am,Â,Cleansing Notice  1  page  131.7KB
NSB,17/03/2026  9:38 am,Â,StemSmart Manufacturing Scale-Up Transfer Advances  5  pages  453.6KB
GSC,17/03/2026  9:36 am,Â,Disclosure of portfolio holdings - December 2025  3  pages  246.2KB
GSC,17/03/2026  9:36 am,Â,Disclosure of portfolio holdings - January 2026  3  pages  247.2KB
EOS,17/03/2026  9:36 am,Â,Notification regarding unquoted securities - EOS  6  pages  19.3KB
ARI,17/03/2026  9:35 am,,Pennyweight Point Continues to Grow with Strong Results  30  pages  3.8MB
TMK,17/03/2026  9:35 am,,Trading Halt  2  pages  444.2KB
THR,17/03/2026  9:34 am,Â,Completion of HY-Range Hydrogen & Helium Geochemical Survey  2  pages  458.0KB
VIT,17/03/2026  9:34 am,,VIT enters distribution agreement with MedReleaf Australia  4  pages  293.9KB
PE1,17/03/2026  9:34 am,Â,Update - Notification of buy-back - PE1  6  pages  18.2KB
HIQ,17/03/2026  9:34 am,Â,Continued Suspension of Class from Quotation - HIQOA Only  1  page  242.6KB
CTW,17/03/2026  9:33 am,Â,CitiFirst MINIs Cash Amounts Trigger 16 March 26  1  page  83.9KB
ALI,17/03/2026  9:32 am,Â,Weekly NTA estimate - Fri 13.3.26  1  page  1.2MB
LRT,17/03/2026  9:32 am,Â,LRT NAV Estimate - 13 March 2026  1  page  223.9KB
NTI,17/03/2026  9:32 am,,NTI initiates First Clinical Site for Phase 3 ASD Trial  2  pages  257.5KB
TEG,17/03/2026  9:31 am,,Triangle to Spin-out Philippines Assets  4  pages  324.5KB
GHI,17/03/2026  9:31 am,Â,Disclosure of portfolio holdings - January 2026  2  pages  223.1KB
AAU,17/03/2026  9:31 am,Â,Cleansing Notice - Options Exercised  1  page  193.3KB
GHI,17/03/2026  9:30 am,Â,Disclosure of portfolio holdings - December 2025  2  pages  223.3KB
BFL,17/03/2026  9:30 am,Â,BFL - Announcement of Management Changes at BSP  1  page  131.4KB
GSU,17/03/2026  9:30 am,Â,Disclosure of portfolio holdings - January 2026  5  pages  311.0KB
KME,17/03/2026  9:30 am,Â,Update - Notification of buy-back - KME  6  pages  18.3KB
GSU,17/03/2026  9:30 am,Â,Disclosure of portfolio holdings - December 2025  5  pages  308.7KB
AV1,17/03/2026  9:28 am,Â,Application for quotation of securities - AV1  6  pages  18.8KB
BP8,17/03/2026  9:28 am,,Seaweed Biomass Expands Biofuel Opportunity  3  pages  135.5KB
ACL,17/03/2026  9:27 am,Â,Update - Notification of buy-back - ACL  6  pages  18.5KB
DSM,17/03/2026  9:27 am,Â,Drilling Preparations Underway for Scotty Lithium Project  5  pages  867.4KB
LSR,17/03/2026  9:27 am,,Trading Halt  2  pages  389.3KB
FL1,17/03/2026  9:27 am,,Suspension from Quotation  1  page  87.6KB
DXC,17/03/2026  9:26 am,Â,Update - Notification of buy-back - DXC  6  pages  18.6KB
IPH,17/03/2026  9:26 am,Â,Update - Notification of buy-back - IPH  6  pages  18.3KB
WGX,17/03/2026  9:25 am,Â,Update - Notification of buy-back - WGX  6  pages  18.3KB
AAU,17/03/2026  9:25 am,Â,Application for quotation of securities - AAU  6  pages  18.1KB
DTM,17/03/2026  9:25 am,,$7m Non-Binding Term Sheet for Sale of Victorian Projects  2  pages  354.5KB
OCL,17/03/2026  9:24 am,Â,Update - Notification of buy-back - OCL  6  pages  18.2KB
CMB,17/03/2026  9:21 am,Â,Application for quotation of securities - CMB  6  pages  18.1KB
SRL,17/03/2026  9:21 am,Â,Application for quotation of securities - SRL  6  pages  18.2KB
BP8,17/03/2026  9:20 am,Â,Investor Presentation  19  pages  1.9MB
AZY,17/03/2026  9:19 am,Â,Euroz Hartleys Investor Conference Presentation  50  pages  17.4MB
BXB,17/03/2026  9:17 am,Â,Notification of cessation of securities - BXB  4  pages  15.0KB
MGT,17/03/2026  9:17 am,,High-Grade Silver and Copper Identified at Mutooroo Ridge  37  pages  4.1MB
SRL,17/03/2026  9:15 am,Â,Section 708A Cleansing Notice  2  pages  190.1KB
WOT,17/03/2026  9:15 am,Â,Update - Notification of buy-back - WOT  6  pages  18.3KB
WC8,17/03/2026  9:15 am,Â,Euroz Hartleys Rottnest Conference Presentation  35  pages  15.4MB
RG8,17/03/2026  9:14 am,Â,Update - Notification of buy-back - RG8  6  pages  18.3KB
ANG,17/03/2026  9:14 am,Â,Change of Director's Interest Notice  2  pages  321.4KB
USL,17/03/2026  9:13 am,Â,Euroz Hartleys Conference Investor Presentation  24  pages  4.3MB
RG1,17/03/2026  9:13 am,Â,Update - Notification of buy-back - RG1  6  pages  18.3KB
ADR,17/03/2026  9:12 am,Â,Results of Retail Entitlement Offer  2  pages  141.3KB
RF1,17/03/2026  9:12 am,Â,Update - Notification of buy-back - RF1  6  pages  18.4KB
ERE,17/03/2026  9:12 am,Â,Proposed issue of securities - ERE  7  pages  25.9KB
PCX,17/03/2026  9:12 am,Â,Update - Notification of buy-back - PCX  6  pages  18.4KB
USL,17/03/2026  9:12 am,,Joaquin MRE increases to 167 Moz AgEq  39  pages  1.9MB
TAH,17/03/2026  9:12 am,Â,Becoming a substantial holder - Macquarie Group  1  page  127.4KB
RPL,17/03/2026  9:11 am,Â,Update - Notification of buy-back - RPL  6  pages  18.3KB
BBT,17/03/2026  9:11 am,Â,Update - Notification of buy-back - BBT  6  pages  18.3KB
RGN,17/03/2026  9:11 am,Â,Update - Notification of buy-back - RGN  6  pages  18.5KB
MCP,17/03/2026  9:10 am,Â,Update - Notification of buy-back - MCP  7  pages  330.4KB
CIN,17/03/2026  9:10 am,Â,Update - Notification of buy-back - CIN  6  pages  18.3KB
RM1,17/03/2026  9:09 am,Â,NRMBS Trust 2024-1 (RM1) - (February) Investor Report  15  pages  417.3KB
IAG,17/03/2026  9:09 am,Â,Update - Notification of buy-back - IAG  6  pages  18.2KB
WQG,17/03/2026  9:08 am,Â,Weekly NTA 13 March 2026  1  page  87.0KB
TNE,17/03/2026  9:07 am,Â,Notification of cessation of securities - TNE  4  pages  15.3KB
AAU,17/03/2026  9:07 am,Â,Two Gold Royalty Agreements Signed for Nueva Sabana Mine  3  pages  434.5KB
SNM,17/03/2026  9:06 am,Â,Euroz Hartleys Rottnest Conference Presentation  22  pages  3.9MB
NRP,17/03/2026  9:06 am,Â,NRMBS Trust 2022 -1 (NRP) - (February) Investor Report  15  pages  378.6KB
VVA,17/03/2026  9:05 am,Â,Update - Notification of buy-back - VVA  6  pages  18.2KB
ERE,17/03/2026  9:05 am,,Prospectus  44  pages  640.1KB
ECT,17/03/2026  9:05 am,Â,Appointment of Jefferson Harcourt as Non-executive Director  3  pages  374.2KB
JNS,17/03/2026  9:04 am,,Receipt of FY24 Tax Refund from the ATO  1  page  157.2KB
ERE,17/03/2026  9:04 am,,Renounceable Rights Issue to raise up to $4.3 million  3  pages  521.0KB
CAM,17/03/2026  9:03 am,Â,Update - Notification of buy-back - CAM  6  pages  18.2KB
PXA,17/03/2026  9:03 am,Â,PEXA enters into binding agreement to divest .id  1  page  165.9KB
NRO,17/03/2026  9:03 am,Â,NRMBS Trust 2018-1 (NRO) - (February) Investor Report  17  pages  424.9KB
KNB,17/03/2026  9:02 am,,KNB hits high-grade shallow gold & extends Sunnyside system  34  pages  5.5MB
SLS,17/03/2026  9:02 am,,Significant Copper-Gold Growth Potential at Nanadie Project  26  pages  2.9MB
MYX,17/03/2026  9:00 am,Â,Mayne Pharma to present at ASX SMIDcaps Conference  2  pages  142.9KB
BOL,17/03/2026  8:59 am,Â,Update - Notification of buy-back - BOL  6  pages  18.2KB
AL3,17/03/2026  8:58 am,,$9.9M ARCEMY X ORDER FROM US MILITARY SHIPBUILDER  2  pages  177.4KB
EBR,17/03/2026  8:57 am,Â,Update on Preparation of Preliminary Proxy Statement  2  pages  242.5KB
M2R,17/03/2026  8:56 am,Â,Change in substantial holding  2  pages  48.3KB
CUL,17/03/2026  8:56 am,Â,Heritage Survey completed at Yardilla Gold Project  5  pages  768.1KB
GCR,17/03/2026  8:55 am,Â,Half Yearly Report and Accounts  30  pages  2.2MB
IFN,17/03/2026  8:55 am,Â,Investor Briefing  1  page  269.6KB
AXW,17/03/2026  8:54 am,Â,mFund - Monthly Redemption Report - AXW07  1  page  414.1KB
AXW,17/03/2026  8:54 am,Â,mFund - Monthly Redemption Report - AXW05  1  page  417.4KB
AXW,17/03/2026  8:53 am,Â,mFund - Monthly Redemption Report - AXW04  1  page  414.9KB
AKN,17/03/2026  8:53 am,Â,Notification regarding unquoted securities - AKN  8  pages  25.5KB
AXW,17/03/2026  8:52 am,Â,mFund - Monthly Redemption Report - AXW02  1  page  413.0KB
AXW,17/03/2026  8:52 am,Â,mFund - Monthly Redemption Report - AXW01  1  page  417.3KB
HCH,17/03/2026  8:52 am,Â,Application for quotation of securities - HCH  7  pages  21.4KB
AXW,17/03/2026  8:51 am,Â,mFund - Monthly Redemption Report - AXW14  1  page  414.5KB
AXW,17/03/2026  8:51 am,Â,mFund - Monthly Redemption Report - AXW13  1  page  418.2KB
OSL,17/03/2026  8:51 am,Â,Results of Entitlement Offer  2  pages  293.2KB
AXW,17/03/2026  8:51 am,Â,mFund - Monthly Redemption Report - AXW12  1  page  414.7KB
AXW,17/03/2026  8:50 am,Â,mFund - Monthly Redemption Report - AXW10  1  page  417.8KB
AXW,17/03/2026  8:50 am,Â,mFund - Monthly Redemption Report - AXW08  1  page  418.5KB
EPY,17/03/2026  8:49 am,Â,Update - Notification of buy-back - EPY  6  pages  18.2KB
TNC,17/03/2026  8:49 am,,Wynberg Gold Resource Highlights Regional Cu-Au Targets  33  pages  3.3MB
IOV,17/03/2026  8:48 am,Â,Freedom to Operate Clears Path for New Patent  19  pages  4.8MB
DTM,17/03/2026  8:46 am,,Binding Agreement to Sell Buckland Gold Project  2  pages  360.1KB
MLG,17/03/2026  8:44 am,Â,Euroz Hartleys Rottnest Conference Presentation  18  pages  9.5MB
IGL,17/03/2026  8:44 am,Â,Update - Notification of buy-back - IGL  6  pages  18.1KB
FLT,17/03/2026  8:44 am,Â,Update - Notification of buy-back - FLT  6  pages  18.4KB
GYG,17/03/2026  8:41 am,Â,Update - Notification of buy-back - GYG  6  pages  18.4KB
AKN,17/03/2026  8:40 am,Â,Notification regarding unquoted securities - AKN  8  pages  24.9KB
NAE,17/03/2026  8:39 am,,High-Grade Gold Intercepts at Wagyu  17  pages  1.8MB
VNT,17/03/2026  8:38 am,Â,Update - Notification of buy-back - VNT  6  pages  18.3KB
NEM,17/03/2026  8:37 am,Â,Form 144 as filed - David Fry  2  pages  108.1KB
LMS,17/03/2026  8:37 am,,Operational & Drilling Update  5  pages  471.5KB
FSA,17/03/2026  8:34 am,Â,Update - Notification of buy-back - FSA  6  pages  18.2KB
LDR,17/03/2026  8:31 am,,High Grade Silver and Antimony Identified at Silver Hills  13  pages  1.8MB
FEX,17/03/2026  8:31 am,Â,Haulage Milestone Achievement and Leadership Update  3  pages  324.8KB
PAC,17/03/2026  8:31 am,Â,Update - Notification of buy-back - PAC  6  pages  18.4KB
KGN,17/03/2026  8:30 am,Â,Update - Notification of buy-back - KGN  6  pages  18.6KB
TTX,17/03/2026  8:30 am,Â,Tetratherix March Investor Presentation  35  pages  10.3MB
ALL,17/03/2026  8:30 am,Â,Update - Notification of buy-back - ALL  6  pages  18.3KB
29M,17/03/2026  8:28 am,Â,Corporate Presentation - March 2026  28  pages  3.6MB
FEX,17/03/2026  8:26 am,Â,Application for quotation of securities - FEX  6  pages  18.3KB
WTC,17/03/2026  8:25 am,Â,Update - Dividend/Distribution - WTC  6  pages  22.0KB
FEG,17/03/2026  8:24 am,,IDENBURG PROJECT- UKLUPL (ENVIRONMENTAL) APPROVAL GRANTED  4  pages  793.2KB
EBR,17/03/2026  8:24 am,Â,Appointment of U.S. Corporate Secretary  2  pages  382.0KB
FRE,17/03/2026  8:22 am,Â,FRE appoints Head of Business Development and Licensing  2  pages  152.0KB
SUN,17/03/2026  8:21 am,Â,Update - Notification of buy-back - SUN  6  pages  18.2KB
LSF,17/03/2026  8:21 am,Â,Net Tangible Asset Backing  1  page  131.2KB
AIH,17/03/2026  8:21 am,Â,Completion of Imenco Aqua Acquisition  2  pages  191.7KB
X2M,17/03/2026  8:21 am,Â,Notice of General Meeting/Proxy Form  19  pages  582.9KB
NHC,17/03/2026  8:21 am,,Half Year Results Presentation  19  pages  3.8MB
ZIP,17/03/2026  8:21 am,Â,Update - Notification of buy-back - ZIP  6  pages  18.3KB
NHC,17/03/2026  8:21 am,,FY26 Half Year Results  3  pages  257.9KB
EDU,17/03/2026  8:21 am,Â,Update - Notification of buy-back - EDU  6  pages  18.2KB
PKP,17/03/2026  8:20 am,,Ops Update - Q4 Production Expected to Reach 1.4M Units  6  pages  662.5KB
TOP,17/03/2026  8:20 am,Â,Update - Notification of buy-back - TOP  6  pages  18.5KB
CQR,17/03/2026  8:20 am,Â,Change in substantial holding  22  pages  1.4MB
PPE,17/03/2026  8:20 am,Â,Update - Notification of buy-back - PPE  6  pages  18.3KB
ANN,17/03/2026  8:20 am,Â,Update - Notification of buy-back - ANN  6  pages  18.4KB
RWC,17/03/2026  8:20 am,Â,Update - Notification of buy-back - RWC  6  pages  18.4KB
NHC,17/03/2026  8:20 am,Â,Dividend/Distribution - NHC  5  pages  19.0KB
CAA,17/03/2026  8:20 am,Â,Update - Notification of buy-back - CAA  6  pages  18.2KB
IMM,17/03/2026  8:20 am,Â,Change in substantial holding  6  pages  331.1KB
ATA,17/03/2026  8:20 am,Â,Update - Notification of buy-back - ATA  6  pages  18.2KB
OML,17/03/2026  8:20 am,Â,Update - Notification of buy-back - OML  6  pages  18.2KB
NHC,17/03/2026  8:20 am,,Appendix 4D and Half Year Financial Report  40  pages  5.4MB
GEM,17/03/2026  8:20 am,Â,Becoming a substantial holder  4  pages  307.4KB
DTR,17/03/2026  8:20 am,,Music Valley Survey Complete as Exploration Advances  13  pages  1.3MB
BRK,17/03/2026  8:20 am,Â,Update - Notification of buy-back - BRK  6  pages  18.2KB
WOR,17/03/2026  8:20 am,Â,Update - Notification of buy-back - WOR  6  pages  18.2KB
RXL,17/03/2026  8:19 am,Â,Euroz Hartleys Conference Presentation  22  pages  3.8MB
CGS,17/03/2026  8:19 am,Â,Update - Notification of buy-back - CGS  6  pages  18.2KB
RXL,17/03/2026  8:19 am,,Final Investment Decision Approved for Youanmi  3  pages  247.6KB
CSL,17/03/2026  8:19 am,Â,Update - Notification of buy-back - CSL  6  pages  18.2KB
AGN,17/03/2026  8:19 am,,Argenica Receives $3.97m R&D Tax Incentive Cash Rebate  1  page  219.5KB
DNL,17/03/2026  8:19 am,Â,Update - Notification of buy-back - DNL  6  pages  18.4KB
PGO,17/03/2026  8:19 am,,White Dam Continues to Deliver Promising Drill Results  25  pages  2.6MB
KAR,17/03/2026  8:19 am,Â,Update - Notification of buy-back - KAR  6  pages  18.2KB
TWE,17/03/2026  8:19 am,Â,Becoming a substantial holder  55  pages  5.2MB
PNN,17/03/2026  8:19 am,,POWER APPOINTS REE SPECIALIST ALISTAIR STEPHENS AS CEO  5  pages  383.0KB
ORA,17/03/2026  8:19 am,Â,Update - Notification of buy-back - ORA  6  pages  18.4KB
MEK,17/03/2026  8:19 am,,Processing Upgrade to 800ktpa Underway  8  pages  1.0MB
BXB,17/03/2026  8:19 am,Â,Update - Notification of buy-back - BXB  6  pages  18.5KB
FWD,17/03/2026  8:19 am,Â,Update - Notification of buy-back - FWD  6  pages  18.4KB
EVG,17/03/2026  8:19 am,Â,PGT upgrades to meet future demand in Europe and USA  7  pages  1.1MB
DUI,17/03/2026  8:18 am,Â,Weekly NTA - 13 March 2026  1  page  45.0KB
EXR,17/03/2026  8:18 am,,EXR Euroz Rottnest Conference  14  pages  2.8MB
AUI,17/03/2026  8:18 am,Â,Weekly NTA - 13 March 2026  1  page  44.9KB
NWS,17/03/2026  8:18 am,Â,Dow Jones Investor Briefing Presentation  100  pages  13.7MB
MOM,17/03/2026  8:18 am,Â,Moab to Acquire Additional Tenements at Manyoni Project  5  pages  759.2KB
AKN,17/03/2026  8:18 am,Â,MOM: Moab to Acquire Additional Tenements at Manyoni Project  5  pages  759.2KB
BGL,17/03/2026  8:18 am,Â,Change in substantial holding  11  pages  980.4KB
CAE,17/03/2026  8:18 am,,Resource Expansion Drilling Delivers 94m@1.11% CuEq  17  pages  1.3MB
HRZ,17/03/2026  8:18 am,,Results of Share Purchase Plan  2  pages  277.9KB
PC2,17/03/2026  8:17 am,,Multiple Thick High-Grade AU Zones Recorded at Spring Hill  21  pages  1.5MB
LSA,17/03/2026  8:17 am,,Visible Gold and More High-Grade Results at New Waverley  22  pages  2.9MB
WCE,17/03/2026  8:17 am,,2026 Geophysics Programs Commence at Elizabeth Hill  4  pages  624.9KB
WAF,17/03/2026  8:17 am,Â,Appendix 4G & Corporate Governance Statement  29  pages  918.4KB
WAF,17/03/2026  8:16 am,,WAF Delivers $567 Million NPAT for 2025  2  pages  203.9KB
