ASX Code,Date,Price sens.,Headline
MSV,05/01/2024  8:24 AM,,Update - Notification of buy-back - MSV  6  pages  27.8KB
SQ2,05/01/2024  8:24 AM,,Statement of CDIs on issue - SQ2  3  pages  21.4KB
REP,05/01/2024  8:24 AM,,Update - Notification of buy-back - REP  6  pages  27.8KB
1AI,05/01/2024  8:24 AM,,Notification of cessation of securities - 1AI  4  pages  23.9KB
TLX,05/01/2024  8:24 AM,,Telix Plans U.S. Registered Public Offering and Listing  2  pages  127.9KB
OFX,05/01/2024  8:24 AM,,Update - Notification of buy-back - OFX  6  pages  27.8KB
SLR,05/01/2024  8:24 AM,,Ceasing to be a substantial holder  3  pages  159.5KB
CPU,05/01/2024  8:23 AM,,Update - Notification of buy-back - CPU  6  pages  27.8KB
EMN,05/01/2024  8:23 AM,,Final Director's Interest Notice  2  pages  204.8KB
URW,05/01/2024  8:23 AM,,Statement of CDIs on issue - URW  4  pages  23.6KB
DYM,05/01/2024  8:22 AM,,Release of Securities from Escrow  2  pages  906.1KB
NVO,05/01/2024  8:22 AM,,Notification regarding unquoted securities - NVO  7  pages  29.4KB
NVO,05/01/2024  8:22 AM,,Cleansing Notice - Liatam investment  1  page  72.0KB
COE,05/01/2024  8:22 AM,,Orbost Improvement Project Update  1  page  160.7KB
DAF,05/01/2024  8:21 AM,,Transformational Vinasale Gold Project MLA Executed  32  pages  2.1MB
KGN,05/01/2024  8:20 AM,,Update - Notification of buy-back - KGN  6  pages  28.2KB
