ASX Code,Date,Price sens.,Headline
ANZ,27/02/2024  7:37 AM,,Changes to ANZ Boards  1  page  128.1KB
AN3,27/02/2024  7:37 AM,,Changes to ANZ Boards  1  page  128.1KB
FBU,27/02/2024  7:34 AM,,Fletcher Building Announces Executive Appointment  1  page  82.1KB
MEZ,27/02/2024  7:31 AM,,Meridian & NZAS sign peak demand response agreement-amended  1  page  176.9KB
CNU,27/02/2024  7:30 AM,,Dividend/Distribution - CNU  5  pages  18.1KB
CNU,27/02/2024  7:30 AM,,Chorus half year results & CEO transition  66  pages  3.5MB
MEZ,27/02/2024  7:30 AM,,Meridian and NZAS sign peak demand response agreement  1  page  201.3KB
