ASX Code,Date,Price sens.,Headline
DTL,23/10/2023  8:10 AM,,Becoming a substantial holder  5  pages  357.0KB
ZER,23/10/2023  8:10 AM,,Daily share buy-back notice - Appendix 3E  2  pages  316.1KB
BCI,23/10/2023  8:10 AM,,Notification regarding unquoted securities - BCI  7  pages  33.5KB
TMG,23/10/2023  8:10 AM,,Results of General Meeting  2  pages  793.5KB
TMG,23/10/2023  8:10 AM,,Update on Proposed Acquisitions  2  pages  751.9KB
JDO,23/10/2023  8:01 AM,,Capital Notes Investor Presentation  37  pages  6.3MB
JDO,23/10/2023  8:00 AM,,Capital Notes Prospectus  172  pages  1.5MB
JDO,23/10/2023  8:00 AM,,Judo launches inaugural Capital Notes offer  5  pages  1.3MB
IMM,23/10/2023  7:48 AM,,Webcast slides for new Efti clinical data in 1st line NSCLC  25  pages  4.8MB
IMM,23/10/2023  7:48 AM,,Excellent Overall Survival in Non-Small Cell Lung Cancer  4  pages  379.7KB
SM1,23/10/2023  7:30 AM,,Announcement Resignation of Synlait Chair  2  pages  51.6KB
