ASX Code,Date,Price sens.,Headline
LSF,27/12/2023  8:27 AM,,Net Tangible Asset Backing  1  page  219.7KB
LFG,27/12/2023  8:27 AM,,Change of Director's Interest Notice  3  pages  271.4KB
LFG,27/12/2023  8:27 AM,,Change of Director's Interest Notice  3  pages  334.3KB
OBL,27/12/2023  8:27 AM,,Second series of Funds 4 and 5 - First Closing  2  pages  172.6KB
CAA,27/12/2023  8:27 AM,,Update - Notification of buy-back - CAA  6  pages  27.7KB
RG8,27/12/2023  8:26 AM,,Weekly NTA Update  1  page  44.0KB
VG1,27/12/2023  8:26 AM,,Weekly NTA Update  1  page  158.3KB
CQR,27/12/2023  8:26 AM,,Change in substantial holding  20  pages  1.3MB
SCN,27/12/2023  8:26 AM,,Change of Director's Interest Notice - BB  2  pages  318.0KB
SCN,27/12/2023  8:26 AM,,Notification of cessation of securities - SCN  5  pages  25.4KB
COS,27/12/2023  8:26 AM,,COSOL Ok Tedi engagement to cease  1  page  179.2KB
BC8,27/12/2023  8:26 AM,,Proposed issue of securities - BC8  6  pages  30.8KB
BC8,27/12/2023  8:25 AM,,$9m of Funding to Accelerate Paulsens Restart  8  pages  2.4MB
MLS,27/12/2023  8:25 AM,,Change of Director's Interest Notice - R Domansky  2  pages  178.9KB
DXN,27/12/2023  8:25 AM,,Consolidation of capital - key dates correction  1  page  105.6KB
CAI,27/12/2023  8:25 AM,,Operations Update  1  page  157.8KB
GPR,27/12/2023  8:25 AM,,Bond Repayment Deferred to 29 March 2024  1  page  232.0KB
GDA,27/12/2023  8:25 AM,,Good Drinks opens Matso's Sunshine Coast  3  pages  6.0MB
AZL,27/12/2023  8:25 AM,,Release from Voluntary Escrow  1  page  197.2KB
RUL,27/12/2023  8:25 AM,,Notification of cessation of securities - RUL  4  pages  23.9KB
RUL,27/12/2023  8:24 AM,,Update - Notification of buy-back - RUL  6  pages  28.1KB
ORG,27/12/2023  8:24 AM,,Ceasing to be a substantial holder  7  pages  696.5KB
HLS,27/12/2023  8:24 AM,,Change in substantial holding  7  pages  636.4KB
AKE,27/12/2023  8:24 AM,,Ceasing to be a substantial holder  9  pages  1.0MB
S2R,27/12/2023  8:24 AM,,Greater Fosterville Exploration Update  18  pages  1.4MB
EHL,27/12/2023  8:24 AM,,Update - Notification of buy-back - EHL  6  pages  27.8KB
ABC,27/12/2023  8:24 AM,,Adbri enters interim arrangement with ICL  1  page  175.6KB
GRV,27/12/2023  8:23 AM,,Alpha Torbanite Project Update - Test Program Four  16  pages  721.2KB
GLA,27/12/2023  8:23 AM,,Uranium Grades exceeding 4245ppm U3O8 in SWC trench assays  20  pages  2.6MB
CEH,27/12/2023  8:23 AM,,Update - Notification of buy-back - CEH  6  pages  27.8KB
GLA,27/12/2023  8:22 AM,,Change of Director's Interest Notice - all directors  10  pages  374.0KB
CCG,27/12/2023  8:22 AM,,Change of Director's Interest Notice PMcG  3  pages  176.1KB
CCO,27/12/2023  8:22 AM,,Notification of cessation of securities - CCO  4  pages  23.8KB
NET,27/12/2023  8:22 AM,,Notification of cessation of securities - NET  4  pages  23.8KB
BKY,27/12/2023  8:21 AM,,Permitting update  1  page  102.1KB
STG,27/12/2023  8:21 AM,,Update - Notification of buy-back - STG  6  pages  27.8KB
ACE,27/12/2023  8:21 AM,,Ceasing to be a substantial holder  3  pages  474.9KB
LTM,27/12/2023  8:21 AM,,Livent Corporation - Form 8-K Change of Directors  3  pages  160.7KB
LTM,27/12/2023  8:21 AM,,Director Appointment/Resignation  4  pages  184.9KB
KIL,27/12/2023  8:21 AM,,Update - Notification of buy-back - KIL  6  pages  27.8KB
TMR,27/12/2023  8:21 AM,,Tempus Delists from the TSX Venture Exchange  3  pages  198.3KB
DXN,27/12/2023  8:20 AM,,"Design, supply and delivery of modular data centre contract  3  pages  167.1KB"
FPC,27/12/2023  8:20 AM,,Update - Notification of buy-back - FPC  6  pages  27.8KB
KPG,27/12/2023  8:20 AM,,Brookvale firm chooses Kelly Partners  3  pages  193.4KB
TNE,27/12/2023  8:20 AM,,Appendix 4G  14  pages  516.4KB
PSL,27/12/2023  8:20 AM,,Change of Director's Interest Notice  3  pages  224.2KB
PSL,27/12/2023  8:20 AM,,Notification regarding unquoted securities - PSL  5  pages  26.2KB
PSL,27/12/2023  8:19 AM,,Cleansing Statement  1  page  225.2KB
PSL,27/12/2023  8:19 AM,,Application for quotation of securities - PSL  6  pages  27.7KB
SQ2,27/12/2023  8:19 AM,,Statement of Changes in Beneficial Ownership  1  page  285.5KB
EGG,27/12/2023  8:19 AM,,Notification of cessation of securities - EGG  4  pages  23.8KB
OSM,27/12/2023  8:19 AM,,Change in Director's Interest Notice x 3  9  pages  274.4KB
SZL,27/12/2023  8:19 AM,,Sezzle Board Authorises US$5M Stock Repurchase Program  3  pages  108.4KB
ATM,27/12/2023  8:18 AM,,Information Disclosure Report on Material Transaction Series  16  pages  2.6MB
VNT,27/12/2023  8:18 AM,,Ceasing to be a substantial holder  7  pages  1.0MB
RIO,27/12/2023  8:18 AM,,Shareholdings of KMP/PDMR  2  pages  134.1KB
RIO,27/12/2023  8:18 AM,,Rio Tinto Board changes  2  pages  133.1KB
ACS,27/12/2023  8:18 AM,,Notification regarding unquoted securities - ACS  7  pages  30.8KB
M24,27/12/2023  8:18 AM,,Proposed issue of securities - M24  12  pages  49.9KB
M24,27/12/2023  8:17 AM,,Acquisition of Canary Uranium Asset Athabasca Basin Canada  17  pages  2.3MB
WSP,27/12/2023  8:17 AM,,Fifth Supplementary Bidder's Statement  4  pages  249.5KB
BLY,27/12/2023  8:17 AM,,Boart Longyear enters into Arrangement Agreement  6  pages  184.8KB
