ASX Code,Date,Price sens.,Headline
A2M,20/07/2026  7:31 am,Â,FY26 Results Announcement Date and Webcast Notification  1  page  100.2KB
TRA,20/07/2026  7:30 am,Â,Update - Dividend/Distribution - TRA  5  pages  19.9KB
TRA,20/07/2026  7:30 am,Â,Dividend Reinvestment Plan Strike Price  1  page  248.5KB
VGL,20/07/2026  7:30 am,Â,Director Appointment/Resignation  1  page  118.5KB
FBU,20/07/2026  7:30 am,,"Fletcher Building, Govt to secure NZ cement manufacturing  3  pages  176.4KB"
IFT,20/07/2026  7:30 am,Â,Infratil Limited's Notice of Meeting and Proxy Form  27  pages  8.5MB
