ASX Code,Date,Price sens.,Headline
OFX,08/01/2024  8:27 AM,,Update - Notification of buy-back - OFX  6  pages  27.8KB
BIO,08/01/2024  8:27 AM,,FY24 Revenue Guidance Upgrade to $12.5M  3  pages  337.2KB
ACE,08/01/2024  8:26 AM,,New mobile phone detection contract in South Australia  2  pages  442.5KB
WOA,08/01/2024  8:26 AM,,Letter from CEO providing business update  6  pages  248.5KB
OPH,08/01/2024  8:26 AM,,Weekly NTA 05.01.2024  1  page  139.4KB
MTS,08/01/2024  8:26 AM,,Management Appointments  2  pages  154.2KB
IBB,08/01/2024  8:26 AM,,mFund - Monthly Redemption Report - IBB13  1  page  309.7KB
IBB,08/01/2024  8:26 AM,,mFund - Monthly Redemption Report - IBB12  1  page  309.7KB
IBB,08/01/2024  8:25 AM,,mFund - Monthly Redemption Report - IBB11  1  page  309.7KB
IBB,08/01/2024  8:25 AM,,mFund - Monthly Redemption Report - IBB10  1  page  309.7KB
PLU,08/01/2024  8:25 AM,,Final Dividend/Distribution for period ending 8 Jan 2024  2  pages  147.5KB
FLO,08/01/2024  8:25 AM,,Final Dividend/Distribution for period ending 8 Jan 2024  2  pages  147.5KB
SUB,08/01/2024  8:25 AM,,Final Dividend/Distribution for period ending 8 Jan 2024  2  pages  147.5KB
1GO,08/01/2024  8:25 AM,,Final Dividend/Distribution for period ending 8 Jan 2024  2  pages  147.5KB
5GO,08/01/2024  8:25 AM,,Final Dividend/Distribution for period ending 8 Jan 2024  2  pages  147.5KB
XGO,08/01/2024  8:25 AM,,Final Dividend/Distribution for period ending 8 Jan 2024  2  pages  147.5KB
GCA,08/01/2024  8:25 AM,,Final Dividend/Distribution for period ending 8 Jan 2024  2  pages  147.5KB
IBB,08/01/2024  8:25 AM,,mFund - Monthly Redemption Report - IBB09  1  page  309.7KB
IBB,08/01/2024  8:25 AM,,mFund - Monthly Redemption Report - IBB04  1  page  310.1KB
IBB,08/01/2024  8:25 AM,,mFund - Monthly Redemption Report - IBB01  1  page  310.1KB
CPU,08/01/2024  8:25 AM,,Update - Notification of buy-back - CPU  6  pages  27.8KB
NSC,08/01/2024  8:25 AM,,Invitation to NAOS Q2 FY24 Investor Update and Q&A  1  page  102.2KB
NAC,08/01/2024  8:25 AM,,Invitation to NAOS Q2 FY24 Investor Update and Q&A  1  page  80.1KB
NCC,08/01/2024  8:25 AM,,Invitation to NAOS Q2 FY24 Investor Update and Q&A  1  page  68.0KB
TLX,08/01/2024  8:25 AM,,Notification regarding unquoted securities - TLX  7  pages  32.0KB
REP,08/01/2024  8:24 AM,,Update - Notification of buy-back - REP  6  pages  27.8KB
MSV,08/01/2024  8:24 AM,,Update - Notification of buy-back - MSV  6  pages  27.8KB
TLX,08/01/2024  8:24 AM,,Notification of cessation of securities - TLX  4  pages  24.6KB
PV1,08/01/2024  8:24 AM,,DNV Engaged for Class Approval  3  pages  506.7KB
ZLD,08/01/2024  8:24 AM,,"HOPE SPV receives US$819,000 second tranche of funding  2  pages  1.9MB"
JHX,08/01/2024  8:24 AM,,Q3 FY24 Results Notification  1  page  177.0KB
NWS,08/01/2024  8:24 AM,,Notification of cessation of securities - NWS  4  pages  23.7KB
NWS,08/01/2024  8:24 AM,,Notification of cessation of securities - NWS  4  pages  23.7KB
ADT,08/01/2024  8:23 AM,,Appointment of Chief Sustainability Officer  2  pages  230.1KB
A8G,08/01/2024  8:23 AM,,Polymetallic Epithermal Veining Identified at Nanya Prospect  13  pages  1.8MB
CC9,08/01/2024  8:23 AM,,Black Mountain Drilling Update  6  pages  1.3MB
TX3,08/01/2024  8:23 AM,,High Grade Lithium Confirmed at Ross Lake  17  pages  2.5MB
SLR,08/01/2024  8:23 AM,,December Quarter Sales Results  1  page  143.5KB
SRI,08/01/2024  8:23 AM,,Paterson North Update  12  pages  1.1MB
FIN,08/01/2024  8:22 AM,,Investor Presentation - January 2024  15  pages  2.9MB
ADD,08/01/2024  8:22 AM,,Change of Director's Interest Notice  3  pages  227.8KB
BRX,08/01/2024  8:22 AM,,Appoints Dr Steve Garwin as Chief Technical Advisor  4  pages  269.0KB
WAF,08/01/2024  8:22 AM,,Notification of cessation of securities - WAF  4  pages  23.8KB
IMM,08/01/2024  8:22 AM,,Immutep Corporate Presentation  50  pages  6.2MB
RMS,08/01/2024  8:22 AM,,Application for quotation of securities - RMS  7  pages  29.7KB
SFX,08/01/2024  8:21 AM,,Maiden Shipment of Thunderbird Product  3  pages  377.3KB
RED,08/01/2024  8:21 AM,,December Qtr Positions Red 5 to Achieve Top End of Guidance  2  pages  600.4KB
NGI,08/01/2024  8:21 AM,,Ceasing to be a substantial holder  3  pages  224.5KB
AHI,08/01/2024  8:21 AM,,Change in substantial holding  6  pages  1.6MB
QAN,08/01/2024  8:20 AM,,Becoming a substantial holder  30  pages  2.4MB
AMP,08/01/2024  8:20 AM,,Becoming a substantial holder  13  pages  1.3MB
ALX,08/01/2024  8:20 AM,,Becoming a substantial holder  13  pages  1.3MB
DXB,08/01/2024  8:20 AM,,Application for quotation of securities - DXB  6  pages  27.9KB
