ASX Code,Date,Price sens.,Headline
IKE,23/04/2026  7:53 am,,ikeGPS Q4 FY26 Investor Presentation  41  pages  5.7MB
IKE,23/04/2026  7:53 am,,ikeGPS Q4 FY26 Performance Update  8  pages  1.1MB
DOW,23/04/2026  7:31 am,Â,A$400 MILLION MEDIUM TERM NOTE ISSUE  1  page  337.2KB
HGH,23/04/2026  7:30 am,,Heartland trading update  17  pages  1.5MB
A2M,23/04/2026  7:30 am,Â,Ceasing to be a substantial holder  13  pages  1.2MB
GNE,23/04/2026  7:30 am,,FY26 Q3 Performance Report and Updated Guidance  19  pages  1.8MB
