ASX Code,Date,Price sens.,Headline
LKO,09/12/2024  9:09 am,Â,AGM Presentation  14  pages  1.7MB
TCG,09/12/2024  9:09 am,Â,Proposed issue of securities - TCG  5  pages  17.4KB
IFG,09/12/2024  9:09 am,Â,Notification of cessation of securities - IFG  4  pages  14.7KB
LGM,09/12/2024  9:07 am,,Securities Purchase Plan Prospectus  58  pages  1.2MB
TGH,09/12/2024  9:06 am,,TGH Equity Raising Results  7  pages  151.1KB
EQR,09/12/2024  9:06 am,,Trading Halt  2  pages  256.6KB
TCG,09/12/2024  9:06 am,,Turaco Expands Afema Project Area  6  pages  1.6MB
BGD,09/12/2024  9:06 am,Â,Change of Director's Interest Notice  12  pages  540.8KB
DTM,09/12/2024  9:05 am,Â,Change in substantial holding  2  pages  414.1KB
RCE,09/12/2024  9:05 am,,Regulatory Approval for Registrational Phase 3 R327G Trial  3  pages  278.4KB
BML,09/12/2024  9:04 am,,Trading Halt  2  pages  613.1KB
ION,09/12/2024  9:04 am,Â,Change of Company Address  1  page  154.7KB
WAM,09/12/2024  9:02 am,Â,Geoff Wilson Appendix 3Y  2  pages  95.3KB
EIQ,09/12/2024  9:01 am,,The First Step in EIQs US Market Commercialisation Strategy  3  pages  132.8KB
GML,09/12/2024  9:00 am,,GML Prepares for 2025 Targeted Exploration & BD Programs  29  pages  1.5MB
BGD,09/12/2024  9:00 am,Â,Notification regarding unquoted securities - BGD  9  pages  24.4KB
OFX,09/12/2024  9:00 am,Â,Update - Notification of buy-back - OFX  6  pages  18.3KB
SHN,09/12/2024  9:00 am,Â,Initial Director's Interest Notice  2  pages  274.6KB
ALP,09/12/2024  9:00 am,Â,Admission and Commencement of Trading - ALPH  2  pages  486.4KB
CYC,09/12/2024  8:59 am,,US Clinical Paper - Technegas for Lung Transplant Evaluation  3  pages  196.0KB
EP1,09/12/2024  8:59 am,Â,Update - Notification of buy-back - EP1  7  pages  21.7KB
IXR,09/12/2024  8:58 am,Â,VIRIDION BACKED TO BUILD BRAZILIAN MAGNET SUPPLY CHAIN  7  pages  639.3KB
SHN,09/12/2024  8:57 am,Â,Appointment of Non-Executive Director  3  pages  1.2MB
KLS,09/12/2024  8:56 am,Â,Notification of cessation of securities - KLS  4  pages  14.7KB
BRE,09/12/2024  8:55 am,Â,Release from Escrow  1  page  119.1KB
VMC,09/12/2024  8:55 am,,High Grade Gold Assays from Hilltop Target  8  pages  4.2MB
SLC,09/12/2024  8:55 am,,Superloop acquires fibre assets  2  pages  146.4KB
ERA,09/12/2024  8:54 am,,Executive Leadership Updates  3  pages  175.6KB
GCM,09/12/2024  8:54 am,Â,Asia Roadshow - Advancing our Downstream Strategy  28  pages  7.8MB
SHN,09/12/2024  8:53 am,Â,Notification regarding unquoted securities - SHN  7  pages  20.7KB
KLS,09/12/2024  8:52 am,Â,Notification regarding unquoted securities - KLS  5  pages  16.7KB
HCW,09/12/2024  8:52 am,Â,Update - Notification of buy-back - HCW  6  pages  18.6KB
VUL,09/12/2024  8:52 am,,EFA conditionally approves $196m commitment  3  pages  162.8KB
ODY,09/12/2024  8:51 am,,Drilling Success Extends Highway Zone  18  pages  1.9MB
SWP,09/12/2024  8:50 am,Â,Change of Director's Interest Notice  3  pages  253.4KB
AFL,09/12/2024  8:48 am,Â,Board Changes  1  page  168.6KB
AQD,09/12/2024  8:48 am,,Drilling to commence at Moora Ni-Cu-PGE Project  2  pages  461.0KB
REC,09/12/2024  8:47 am,,Completion of High-Grade Carter Uranium Project Acquisition  3  pages  305.3KB
EWC,09/12/2024  8:47 am,Â,Initial Director's Interest Notice - Sean Gardiner  2  pages  226.4KB
EWC,09/12/2024  8:46 am,Â,Initial Director's Interest Notice - Alan Jowell  2  pages  271.6KB
PTM,09/12/2024  8:46 am,,"End of Regal discussions, special dividend & turnaround  2  pages  120.9KB"
COS,09/12/2024  8:43 am,Â,COSOL Completes Acquisition of Data Analytics Group Toustone  2  pages  237.6KB
WA1,09/12/2024  8:43 am,,West Arunta Project - Luni Metallurgical Results  12  pages  687.0KB
REC,09/12/2024  8:41 am,Â,Cleansing Statement  1  page  176.2KB
RMY,09/12/2024  8:40 am,Â,Change of Director's Interest Notice  5  pages  1.1MB
TVN,09/12/2024  8:40 am,,Speewah Fluorite Project awarded Major Project Status  3  pages  273.3KB
GQG,09/12/2024  8:39 am,,Termination of CDI buyback  1  page  116.6KB
ALL,09/12/2024  8:37 am,Â,Update - Notification of buy-back - ALL  6  pages  18.3KB
BTN,09/12/2024  8:37 am,,Butn enters the crypto-backed lending market in Asia Pacific  2  pages  113.6KB
IBC,09/12/2024  8:37 am,Â,Update - Notification of buy-back - IBC  6  pages  18.3KB
REC,09/12/2024  8:37 am,Â,Notification of cessation of securities - REC  4  pages  14.7KB
NEU,09/12/2024  8:36 am,Â,Update - Notification of buy-back - NEU  6  pages  18.1KB
REC,09/12/2024  8:36 am,Â,Notification regarding unquoted securities - REC  7  pages  24.0KB
HM1,09/12/2024  8:35 am,Â,Weekly NTA Estimate  1  page  111.3KB
GSS,09/12/2024  8:35 am,Â,Notification regarding unquoted securities - GSS  6  pages  18.7KB
PUR,09/12/2024  8:35 am,,Rio Grande Sur JORC Resource Upgrade  27  pages  2.9MB
GQG,09/12/2024  8:35 am,,FUM as at 30 November 2024  1  page  132.8KB
PGY,09/12/2024  8:34 am,Â,Corporate Update regarding Board renewal  3  pages  217.5KB
REC,09/12/2024  8:34 am,Â,Notification regarding unquoted securities - REC  10  pages  36.7KB
CXM,09/12/2024  8:33 am,Â,Ardmore Operations Update - Record Shipment Completed  2  pages  741.3KB
TOP,09/12/2024  8:32 am,Â,Update - Notification of buy-back - TOP  6  pages  18.5KB
SB2,09/12/2024  8:30 am,Â,Update - Notification of buy-back - SB2  6  pages  18.2KB
REC,09/12/2024  8:30 am,Â,Application for quotation of securities - REC  7  pages  20.8KB
WBC,09/12/2024  8:29 am,Â,Update - Notification of buy-back - WBC  6  pages  18.3KB
DES,09/12/2024  8:29 am,Â,Notice of Release of Escrowed Securities  1  page  156.1KB
AIM,09/12/2024  8:26 am,Â,Change of Director's Interest Notice- Abrahams  3  pages  153.6KB
VNL,09/12/2024  8:26 am,,VINYL COMPLETES FUNKIFIED ACQUISITION  2  pages  168.9KB
LAT,09/12/2024  8:25 am,,CMM: Acquisition of Sylvania Project  3  pages  541.3KB
CMM,09/12/2024  8:25 am,,Acquisition of Sylvania Project  3  pages  541.3KB
OPH,09/12/2024  8:24 am,Â,Weekly NTA 06.12.2024  1  page  142.6KB
M7T,09/12/2024  8:24 am,Â,Change of Director's Interest Notice - RB  2  pages  242.0KB
BOQ,09/12/2024  8:23 am,Â,Response to Media Speculation  1  page  125.7KB
SHL,09/12/2024  8:23 am,Â,Proposed issue of securities - SHL  5  pages  18.9KB
AOV,09/12/2024  8:23 am,Â,Update - Notification of buy-back - AOV  6  pages  18.2KB
SHL,09/12/2024  8:23 am,,Acquisition of the LADR Laboratory Group in Germany  2  pages  242.2KB
FPR,09/12/2024  8:23 am,Â,Update - Notification of buy-back - FPR  6  pages  18.4KB
NAB,09/12/2024  8:23 am,Â,Update - Notification of buy-back - NAB  6  pages  18.4KB
TWE,09/12/2024  8:23 am,Â,Shares to be released from voluntary escrow  1  page  122.4KB
ALQ,09/12/2024  8:23 am,Â,DRP Price for Interim Dividend HY25  1  page  119.6KB
LSF,09/12/2024  8:23 am,Â,Net Tangible Asset Backing  1  page  103.6KB
TEK,09/12/2024  8:23 am,Â,Update - Notification of buy-back - TEK  6  pages  18.4KB
DCL,09/12/2024  8:23 am,Â,Becoming a substantial holder  2  pages  124.8KB
AEE,09/12/2024  8:23 am,Â,Change in substantial holding - MMAM  3  pages  112.3KB
HUB,09/12/2024  8:22 am,Â,HUB24 Change of Share Registry Details  2  pages  92.5KB
BMN,09/12/2024  8:22 am,Â,Change in substantial holding - MMAM  4  pages  115.2KB
CGS,09/12/2024  8:22 am,Â,Update - Notification of buy-back - CGS  6  pages  18.2KB
NEM,09/12/2024  8:22 am,Â,Form 3 as filed - Brian Tabolt  2  pages  862.9KB
AMH,09/12/2024  8:22 am,Â,Update - Notification of buy-back - AMH  6  pages  18.3KB
HLI,09/12/2024  8:22 am,Â,Update - Notification of buy-back - HLI  6  pages  18.5KB
AZJ,09/12/2024  8:22 am,Â,Update - Notification of buy-back - AZJ  6  pages  18.4KB
CPU,09/12/2024  8:22 am,Â,Update - Notification of buy-back - CPU  6  pages  18.4KB
HYT,09/12/2024  8:22 am,Â,Update on HyTerra Projects  3  pages  301.3KB
BMM,09/12/2024  8:22 am,,Outstanding Gallium and Lithium Grades at Tango Project  12  pages  1.1MB
NEM,09/12/2024  8:22 am,Â,Agreement Reached to Sell Cripple Creek & Victor  5  pages  184.0KB
JAV,09/12/2024  8:22 am,Â,Notification regarding unquoted securities - JAV  6  pages  19.0KB
JAV,09/12/2024  8:22 am,Â,Notification regarding unquoted securities - JAV  6  pages  20.4KB
JAV,09/12/2024  8:22 am,Â,Application for quotation of securities - JAV  6  pages  19.1KB
JAV,09/12/2024  8:22 am,Â,Application for quotation of securities - JAV  6  pages  18.5KB
JAV,09/12/2024  8:21 am,Â,Application for quotation of securities - JAV  7  pages  21.0KB
VAR,09/12/2024  8:21 am,,Three Fold Increase in High Grade Mineral Resource to 3.4Mt  58  pages  3.9MB
LAT,09/12/2024  8:21 am,,Sale of Sylvania Project to Capricorn Metals Limited  4  pages  388.1KB
CMM,09/12/2024  8:21 am,,LAT: Sale of Sylvania Project to Capricorn Metals Limited  4  pages  388.1KB
FWD,09/12/2024  8:21 am,Â,Update - Notification of buy-back - FWD  6  pages  18.4KB
ALM,09/12/2024  8:21 am,Â,Asia Roadshow - Presentation  17  pages  12.8MB
AUN,09/12/2024  8:21 am,Â,Drilling to Commence at Sandstone Gold Projects  9  pages  2.3MB
QPM,09/12/2024  8:21 am,,Moranbah Power Station Acquisition  3  pages  763.0KB
NST,09/12/2024  8:21 am,Â,Update - Notification of buy-back - NST  6  pages  18.4KB
ACM,09/12/2024  8:20 am,,High Grade up to 65% Iron Identified At Shaw  16  pages  1.6MB
ENV,09/12/2024  8:20 am,,CODA North emerging as a critical mineralised zone  34  pages  3.2MB
MML,09/12/2024  8:20 am,,Tenement Transfer Finalised & Heritage Survey Scheduled  1  page  191.1KB
SGA,09/12/2024  8:20 am,,Synthetic Industrial Diamonds  7  pages  891.7KB
CZN,09/12/2024  8:20 am,Â,Entitlement Offer Information  4  pages  233.9KB
ASR,09/12/2024  8:20 am,,Appointment of Highly Experienced CEO  4  pages  517.0KB
SRI,09/12/2024  8:20 am,,Drilling Underway at Paterson North  6  pages  1.2MB
RTR,09/12/2024  8:20 am,,High-Grade Tungsten Assays Highlights Resource Potential-WQ  18  pages  3.9MB
MPK,09/12/2024  8:20 am,,Drilling Commences at Odienne Gold Project  4  pages  824.0KB
SB2,09/12/2024  8:19 am,Â,Change in substantial holding  3  pages  474.7KB
EVR,09/12/2024  8:19 am,Â,Application for quotation of securities - EVR  5  pages  16.6KB
EVR,09/12/2024  8:19 am,,Pro-Rata Non-Renounceable Rights Issue Offer Closes  2  pages  220.0KB
EL8,09/12/2024  8:19 am,,Company Update  43  pages  8.9MB
OMA,09/12/2024  8:19 am,Â,Change of Director's Interest Notice - TB  3  pages  7.5KB
OMA,09/12/2024  8:19 am,Â,Change of Director's Interest Notice - AH  3  pages  6.9KB
TMX,09/12/2024  8:19 am,,EM Survey Lort River testing 4 Bedrock Sulphide Conductors  16  pages  1.1MB
ACE,09/12/2024  8:19 am,Â,Acusensus Share Purchase Plan opens  21  pages  957.7KB
TON,09/12/2024  8:19 am,,TON - ASX announcement - EXECUTION OF SSAP WITH SHANDONG YUL  6  pages  225.9KB
ACE,09/12/2024  8:18 am,Â,Share Purchase Plan Cleansing Notice  2  pages  361.6KB
VSR,09/12/2024  8:18 am,Â,Board Changes  2  pages  331.9KB
KEY,09/12/2024  8:18 am,,Consolidation of Capital  1  page  201.9KB
GSM,09/12/2024  8:18 am,,Gold Drill Programs Commencing Q1 25  17  pages  5.1MB
MOM,09/12/2024  8:18 am,Â,Manyoni Uranium Project - Validation Drilling Completed  16  pages  1.4MB
TAR,09/12/2024  8:18 am,Â,Notification of cessation of securities - TAR  4  pages  14.7KB
LRL,09/12/2024  8:18 am,,Comet Vale Drilling Update  14  pages  1.4MB
BPH,09/12/2024  8:18 am,Â,Notification regarding unquoted securities - BPH  6  pages  19.6KB
CCM,09/12/2024  8:18 am,Â,Notification regarding unquoted securities - CCM  9  pages  28.0KB
SMS,09/12/2024  8:17 am,Â,Results of General Meeting  2  pages  1.7MB
SHJ,09/12/2024  8:17 am,Â,Update - Notification of buy-back - SHJ  6  pages  18.2KB
MIN,09/12/2024  8:17 am,Â,Becoming a substantial holder  62  pages  3.8MB
IDX,09/12/2024  8:17 am,Â,Becoming a substantial holder  23  pages  1.1MB
BOE,09/12/2024  8:17 am,Â,Change in substantial holding  27  pages  1.3MB
LAM,09/12/2024  8:17 am,Â,Laramide closes option agreement on Kazakhstan exploration  6  pages  507.3KB
IDA,09/12/2024  8:17 am,Â,Appendices 3Y x3 (Option Exercises)  9  pages  263.7KB
PPT,09/12/2024  8:17 am,Â,Becoming a substantial holder  3  pages  350.2KB
ALP,09/12/2024  8:16 am,Â,NAV and Units on Issue of ALPH on 9 December 2024  1  page  181.2KB
ALP,09/12/2024  8:16 am,Â,SCHRODER GLOBAL EQUITY ALPHA FUND - ACTIVE ETF PDS  35  pages  827.2KB
STW,09/12/2024  8:15 am,Â,Daily Fund Update  9  pages  180.4KB
SLF,09/12/2024  8:15 am,Â,Daily Fund Update  4  pages  77.1KB
SFY,09/12/2024  8:15 am,Â,Daily Fund Update  4  pages  79.3KB
KLR,09/12/2024  8:15 am,Â,Initial Director's Interest Notice  4  pages  159.2KB
KLR,09/12/2024  8:15 am,Â,Final Director's Interest Notice  4  pages  170.2KB
IFT,09/12/2024  7:30 am,Â,Update - Dividend/Distribution - IFT  6  pages  22.8KB
SKT,09/12/2024  7:30 am,Â,Sky addresses media speculation  1  page  110.3KB
ANZ,09/12/2024  7:30 am,,Nuno Matos to succeed Shayne Elliott as ANZ CEO  5  pages  115.9KB
AN3,09/12/2024  7:30 am,,Nuno Matos to succeed Shayne Elliott as ANZ CEO  5  pages  115.9KB
