ASX Code,Date,Price sens.,Headline
AMH,21/07/2025  9:49 am,Â,Weekly Estimated NTA as at 18 July 2025  1  page  208.3KB
CC9,21/07/2025  9:49 am,Â,Application for quotation of securities - CC9  7  pages  19.7KB
AIV,21/07/2025  9:49 am,,Maiden Gold Mineral Resource Estimate  44  pages  4.8MB
AIS,21/07/2025  9:48 am,,QUARTERLY ACTIVITIES REPORT - JUNE 2025  76  pages  2.9MB
WNX,21/07/2025  9:48 am,Â,Notification of cessation of securities - WNX  4  pages  14.7KB
MIR,21/07/2025  9:48 am,Â,Weekly Estimated NTA as at 18 July 2025  1  page  152.9KB
AQZ,21/07/2025  9:48 am,Â,Webcast of FY25 Results Briefing  1  page  543.9KB
AEL,21/07/2025  9:46 am,Â,Change of Address  1  page  156.3KB
WBE,21/07/2025  9:46 am,,Completion of Cultural Heritage Survey for Soil Geochemistry  2  pages  313.4KB
NWS,21/07/2025  9:46 am,Â,Appendix 3C  4  pages  76.3KB
JHG,21/07/2025  9:46 am,Â,Distribution Tax Estimates  2  pages  577.1KB
CDM,21/07/2025  9:45 am,Â,Change of Director's Interest Notice  2  pages  282.7KB
NWS,21/07/2025  9:45 am,Â,Appendix 3C  4  pages  76.3KB
DJW,21/07/2025  9:45 am,Â,Weekly Estimated NTA as at 18 July 2025  1  page  275.1KB
EBR,21/07/2025  9:43 am,Â,Notification of cessation of securities - EBR  4  pages  14.7KB
JEG,21/07/2025  9:43 am,Â,Distribution Tax Estimates  2  pages  575.4KB
SKO,21/07/2025  9:43 am,Â,Ongoing Disclosure Notice - Darrin Grafton  3  pages  179.1KB
ADE,21/07/2025  9:43 am,Â,Monthly Factsheet - June 2025  3  pages  262.1KB
AL3,21/07/2025  9:42 am,,AML3D Receives $1.2M Portable Arcemy System Order  2  pages  178.2KB
STX,21/07/2025  9:41 am,,Trading Halt  2  pages  565.3KB
FGG,21/07/2025  9:38 am,Â,Geoff Wilson Appendix 3Y  2  pages  97.5KB
CVN,21/07/2025  9:35 am,,Trading Halt  2  pages  263.1KB
GUE,21/07/2025  9:35 am,,Exploration Commences at Pine Ridge Uranium Project  4  pages  756.4KB
ARV,21/07/2025  9:35 am,Â,Proposed issue of securities - ARV  5  pages  17.8KB
ARV,21/07/2025  9:34 am,Â,Proposed issue of securities - ARV  5  pages  17.6KB
ARV,21/07/2025  9:34 am,,Artemis Receives Firm Commitments to Raise $4.75 million  5  pages  340.9KB
AFI,21/07/2025  9:33 am,Â,Weekly Estimated NTA as at 18 July 2025  1  page  178.5KB
BTR,21/07/2025  9:33 am,,Brightstar-Aurumin Sandstone Consolidation Presentation  53  pages  9.1MB
AUN,21/07/2025  9:33 am,,BTR: Brightstar-Aurumin Sandstone Consolidation Presentation  53  pages  9.1MB
BTR,21/07/2025  9:33 am,Â,Proposed issue of securities - BTR  5  pages  18.2KB
BTR,21/07/2025  9:33 am,Â,Proposed issue of securities - BTR  13  pages  44.6KB
AUN,21/07/2025  9:33 am,,Strategic Acquisition of Aurumin Consolidates Sandstone  100  pages  1.7MB
BTR,21/07/2025  9:33 am,,Strategic Acquisition of Aurumin Consolidates Sandstone  100  pages  1.7MB
IPH,21/07/2025  9:31 am,Â,Advance Notice of 2025 Full Year Results Release  1  page  169.6KB
GVF,21/07/2025  9:31 am,Â,Application for quotation of securities - GVF  6  pages  18.0KB
SNZ,21/07/2025  9:30 am,Â,Ongoing Disclosure Notices  6  pages  274.3KB
RLF,21/07/2025  9:30 am,Â,Becoming a substantial holder  3  pages  565.8KB
GHY,21/07/2025  9:29 am,Â,Final Settlement of Strategic Investment  2  pages  600.3KB
LRV,21/07/2025  9:29 am,,Successful Completion of US$105 Senior Secured Bond  4  pages  214.5KB
MHC,21/07/2025  9:28 am,,Field Activities to Commence at Hook Lake  15  pages  2.0MB
AVJ,21/07/2025  9:27 am,,Declaration of Special Dividend  1  page  117.6KB
EVE,21/07/2025  9:27 am,,Aust Regulatory Path Cleared for ED & Dysmenorrhea Products  2  pages  182.0KB
REC,21/07/2025  9:26 am,Â,NWR Virtual Uranium Conference - Investor Presentation  17  pages  2.3MB
YAR,21/07/2025  9:25 am,Â,Cleansing Notice  2  pages  342.5KB
AVJ,21/07/2025  9:25 am,Â,Dividend/Distribution - AVJ  4  pages  16.1KB
AMD,21/07/2025  9:24 am,Â,Amendment to Agreement - Niagara Bauxite Project  3  pages  284.7KB
HRN,21/07/2025  9:23 am,Â,Notification under Section 708AA(2)(F) of the Corps Act  2  pages  207.9KB
HRN,21/07/2025  9:23 am,Â,Proposed issue of securities - HRN  6  pages  22.1KB
HRN,21/07/2025  9:23 am,Â,Proposed issue of securities - HRN  5  pages  17.7KB
HRN,21/07/2025  9:23 am,,Letter to Ineligible Shareholders  2  pages  147.9KB
HRN,21/07/2025  9:23 am,,Investor Presentation  19  pages  3.5MB
CAZ,21/07/2025  9:23 am,,High-grade gold intercepts identify new target at Goongarrie  19  pages  1.9MB
HRN,21/07/2025  9:23 am,,Non-Renounceable Issue  33  pages  513.9KB
HRN,21/07/2025  9:22 am,,$12M Equity Raise Undertaken  6  pages  870.3KB
BGT,21/07/2025  9:22 am,Â,Change of Director's Interest Notice AG  2  pages  228.7KB
TLC,21/07/2025  9:22 am,Â,FY25 Results Key Dates and Webcast Details  1  page  258.2KB
BLZ,21/07/2025  9:22 am,,Acquisition Update  3  pages  1.4MB
MEI,21/07/2025  9:22 am,,Trading Halt  2  pages  251.8KB
RF1,21/07/2025  9:21 am,Â,Update - Notification of buy-back - RF1  6  pages  18.3KB
BGT,21/07/2025  9:21 am,Â,Change of Director's Interest Notice AD  2  pages  240.9KB
KKC,21/07/2025  9:21 am,Â,Net Tangible Asset Backing  2  pages  186.3KB
AKO,21/07/2025  9:21 am,Â,Noosa Presentation - Corporate Update  24  pages  3.3MB
COY,21/07/2025  9:20 am,Â,Drilling Commenced at Fox Tail in EPM 27835  20  pages  6.9MB
ELS,21/07/2025  9:20 am,,Quarterly Activity Report and Appendix 4C  10  pages  1.0MB
ADO,21/07/2025  9:20 am,,Agreement for combined Anteo X product in the USA  4  pages  523.2KB
3DA,21/07/2025  9:19 am,,Quarterly Activities Report and Appendix 4C  11  pages  610.9KB
BGT,21/07/2025  9:19 am,Â,Change of Director's Interest Notice PM  2  pages  228.4KB
TMB,21/07/2025  9:18 am,Â,Tambourah Drilling Update RC Program Extended  11  pages  1.8MB
DUN,21/07/2025  9:18 am,Â,TMB: Tambourah Drilling Update RC Program Extended  11  pages  1.8MB
BCN,21/07/2025  9:17 am,Â,Notification of buy-back - BCN  5  pages  15.2KB
BCN,21/07/2025  9:17 am,,Beacon Announces On Market Share Buy-Back  2  pages  126.6KB
IPX,21/07/2025  9:17 am,,Trading Halt  2  pages  190.4KB
BGT,21/07/2025  9:17 am,Â,Change of Director's Interest Notice TG  2  pages  228.0KB
AM5,21/07/2025  9:16 am,,Extensional Targets Confirmed by Assays at Surprise  14  pages  1.3MB
PGF,21/07/2025  9:16 am,Â,Net Tangible Asset Backing - 18 July 2025  1  page  174.8KB
RNX,21/07/2025  9:16 am,Â,Proposed issue of securities - RNX  8  pages  28.5KB
RNX,21/07/2025  9:16 am,,"Equity Raising of up to $2,290,000  3  pages  295.6KB"
PE1,21/07/2025  9:15 am,Â,Update - Notification of buy-back - PE1  6  pages  18.2KB
EPM,21/07/2025  9:15 am,Â,Investor Presentation  30  pages  6.2MB
ATX,21/07/2025  9:13 am,,Trading Halt  2  pages  186.0KB
RBR,21/07/2025  9:13 am,,RBR Positions for Mozambique LNG Growth  2  pages  339.2KB
BKI,21/07/2025  9:12 am,,BKI Investor Presentation - 2025 Full Year Results  26  pages  1.9MB
REE,21/07/2025  9:11 am,Â,Proposed issue of securities - REE  7  pages  24.8KB
REE,21/07/2025  9:11 am,Â,Proposed issue of securities - REE  5  pages  17.9KB
REE,21/07/2025  9:11 am,,RareX Raises $2 Million  3  pages  247.6KB
BKI,21/07/2025  9:11 am,,BKI Announces 2025 Full Year Results  5  pages  270.3KB
BKI,21/07/2025  9:09 am,Â,BKI 2025 Corporate Governance Statement  11  pages  189.1KB
MEC,21/07/2025  9:09 am,Â,Update - Notification of buy-back - MEC  6  pages  18.4KB
BKI,21/07/2025  9:09 am,Â,BKI Appendix 4G for the year ended 30 June 2025  12  pages  258.7KB
SB2,21/07/2025  9:09 am,Â,Update - Notification of buy-back - SB2  6  pages  18.3KB
BKI,21/07/2025  9:09 am,Â,Dividend/Distribution - BKI  5  pages  19.1KB
TVN,21/07/2025  9:09 am,,Tivan and Sumitomo agree development pathway at Sandover  5  pages  360.5KB
TVN,21/07/2025  9:09 am,,JOGMEC joins Speewah Fluorite Project joint venture  3  pages  281.7KB
COV,21/07/2025  9:09 am,,Quarterly activities and cashflow report  10  pages  799.2KB
BKI,21/07/2025  9:08 am,,BKI FY25 Preliminary Final Report & Annual Report  57  pages  2.4MB
SRL,21/07/2025  9:08 am,Â,Change in substantial holding  3  pages  112.3KB
ARI,21/07/2025  9:08 am,Â,Change of Director's Interest Notice  11  pages  321.9KB
VRS,21/07/2025  9:08 am,,Veris Awarded $16-$20m Suburban Rail Loop Contract  2  pages  549.5KB
DUN,21/07/2025  9:07 am,Â,Proposed issue of securities - DUN  5  pages  18.9KB
SRZ,21/07/2025  9:07 am,,June 2025 Quarterly Activities Report & Cashflow Report  21  pages  2.4MB
DAI,21/07/2025  9:07 am,Â,Notification of Expiry of Listed Options  5  pages  480.7KB
ARI,21/07/2025  9:07 am,Â,Cleansing Notice  1  page  118.8KB
ILT,21/07/2025  9:06 am,,High-grade silver results received from resource drilling  32  pages  4.4MB
ELS,21/07/2025  9:05 am,,Trading halt  3  pages  504.1KB
LGI,21/07/2025  9:05 am,Â,FY25 Results Webinar Notification & 2025 AGM Date  2  pages  218.2KB
SUL,21/07/2025  9:03 am,Â,Update on director relevant interest  4  pages  380.6KB
EXR,21/07/2025  9:02 am,,Quarterly Activities Report and Appendix 5B Jun 25  14  pages  1.2MB
DUN,21/07/2025  9:02 am,Â,Proposed issue of securities - DUN  5  pages  18.7KB
RF1,21/07/2025  9:01 am,Â,Weekly Estimate NTA for 18.07.2025  1  page  122.1KB
PCK,21/07/2025  9:01 am,,Final US FDA De Novo Clearance Submission Completed  3  pages  214.4KB
HTG,21/07/2025  9:01 am,Â,Investor Webinar  1  page  176.3KB
CTW,21/07/2025  9:01 am,Â,CitiFirst MINIs Cash Amounts for Stop Loss Event 18 Jul 25  1  page  85.1KB
HE8,21/07/2025  9:00 am,,Oil Production Restart and US Appointments  3  pages  740.7KB
CAM,21/07/2025  9:00 am,Â,Update - Notification of buy-back - CAM  6  pages  18.2KB
LDR,21/07/2025  8:59 am,,Tin Enhances High-Grade Antimony and Silver Intercepts  20  pages  1.8MB
TOU,21/07/2025  8:59 am,Â,Board Changes and Appointment of Non-Executive Director  2  pages  295.7KB
TMB,21/07/2025  8:59 am,,DUN:Dundas secures large 612km2 of Gerry Well Greenstone ELs  5  pages  748.1KB
DUN,21/07/2025  8:59 am,,Dundas secures large 612km2 of Gerry Well Greenstone ELs  5  pages  748.1KB
NOR,21/07/2025  8:59 am,,Quarterly Activities/Appendix 4C Cash Flow Report  9  pages  804.2KB
LDX,21/07/2025  8:58 am,Â,Q4 FY25 Results Investor Briefing  30  pages  3.4MB
ARC,21/07/2025  8:58 am,Â,Change in substantial holding  3  pages  291.5KB
OPH,21/07/2025  8:57 am,Â,Weekly NTA 18.07.2025  1  page  175.3KB
SHN,21/07/2025  8:57 am,,High-Grade Au in Rock Chips at Sybil  25  pages  5.5MB
LDX,21/07/2025  8:56 am,,Quarterly Activities/Appendix 4C Cash Flow Report  13  pages  591.0KB
IRE,21/07/2025  8:56 am,Â,Iress 2025 Half Year Investor Conference Call Details  1  page  240.5KB
BGD,21/07/2025  8:55 am,,Central Gawler Mill Refurbishment Estimated at A$26m  6  pages  573.3KB
AQD,21/07/2025  8:55 am,,Cangallo Drilling Progress Report  22  pages  1.9MB
MEI,21/07/2025  8:55 am,,Caldeira Project PFS Presentation  33  pages  3.1MB
CUS,21/07/2025  8:54 am,,Copper Search Quarterly Activities and Cashflow Report  21  pages  2.1MB
SKY,21/07/2025  8:54 am,,High-Grade Silver-Tin Zone Discovered at Tallebung  14  pages  1.1MB
RG8,21/07/2025  8:54 am,Â,Weekly NTA Update  1  page  27.7KB
RG8,21/07/2025  8:52 am,Â,Update - Notification of buy-back - RG8  6  pages  18.4KB
BGT,21/07/2025  8:52 am,Â,Notification regarding unquoted securities - BGT  6  pages  19.5KB
CPO,21/07/2025  8:52 am,,High-Grade Surface Results at La Florida  16  pages  1.8MB
PMT,21/07/2025  8:52 am,,Worlds Largest Pollucite-Hosted Caesium Pegmatite Deposit  48  pages  3.2MB
MEI,21/07/2025  8:51 am,,"PFS Confirms Caldeira as a Strategic, Long-life REE Project  89  pages  8.5MB"
NHE,21/07/2025  8:51 am,,Dennis Donald transitions to Executive Chairman  7  pages  453.5KB
IFT,21/07/2025  8:50 am,Â,Infratil Limited's Notice of Meeting and Proxy Form  31  pages  4.9MB
BGT,21/07/2025  8:50 am,Â,Notification regarding unquoted securities - BGT  6  pages  19.4KB
VG1,21/07/2025  8:49 am,Â,Weekly NTA Update  1  page  27.3KB
FPR,21/07/2025  8:48 am,Â,Update - Notification of buy-back - FPR  6  pages  18.4KB
FMR,21/07/2025  8:48 am,Â,Strategic Appointment to FMR Board  2  pages  301.8KB
VG1,21/07/2025  8:47 am,Â,Update - Notification of buy-back - VG1  6  pages  18.5KB
ASL,21/07/2025  8:47 am,Â,Andean Shares Tradable on OTCQX Market  2  pages  429.2KB
AEE,21/07/2025  8:46 am,,Quarterly Activities/Appendix 5B Cash Flow Report  9  pages  425.5KB
REY,21/07/2025  8:46 am,Â,Notice of change of interests of substantial holder  2  pages  118.1KB
RML,21/07/2025  8:45 am,Â,Proposed issue of securities - RML  5  pages  19.3KB
FMR,21/07/2025  8:43 am,Â,Initial Director's Interest Notice  2  pages  217.9KB
RML,21/07/2025  8:43 am,Â,Steve Promnitz and Brett Lynch to join RML  4  pages  306.4KB
PYC,21/07/2025  8:42 am,,Quarterly Activities/Appendix 4C Cash Flow Report  11  pages  690.8KB
SMR,21/07/2025  8:42 am,Â,Investor Call Details  1  page  130.2KB
ATA,21/07/2025  8:42 am,Â,Update - Notification of buy-back - ATA  6  pages  18.2KB
FMR,21/07/2025  8:41 am,Â,Proposed issue of securities - FMR  5  pages  18.7KB
ALL,21/07/2025  8:39 am,Â,Update - Notification of buy-back - ALL  6  pages  18.3KB
HM1,21/07/2025  8:38 am,Â,Weekly NTA Estimate  1  page  684.4KB
IFL,21/07/2025  8:33 am,Â,Update on status of discussions with CC Capital Partners  1  page  105.1KB
AMP,21/07/2025  8:32 am,,AMP Limited provides 2Q 25 cashflows  6  pages  589.0KB
OSX,21/07/2025  8:32 am,Â,"Jaw recon trial approved, first patient to be recruited  3  pages  384.3KB"
S32,21/07/2025  8:31 am,,Quarterly Report June 2025  12  pages  139.2KB
CAF,21/07/2025  8:29 am,,FY25 Unaudited Results  2  pages  151.6KB
NSC,21/07/2025  8:29 am,Â,Update - Notification of buy-back - NSC  6  pages  18.2KB
NAC,21/07/2025  8:28 am,Â,Update - Notification of buy-back - NAC  6  pages  18.2KB
EQS,21/07/2025  8:28 am,,Transformational Acquisition of Baker Young  5  pages  279.6KB
NWC,21/07/2025  8:27 am,,NWC RECOMMENDS SHAREHOLDERS ACCEPT KINTERRA OFFER  2  pages  1.6MB
AMI,21/07/2025  8:27 am,,Quarterly Update and Outlook - June 2025  13  pages  5.1MB
NVA,21/07/2025  8:27 am,,Drilling Programs Ramp Up at RPM  14  pages  1.4MB
ORI,21/07/2025  8:27 am,Â,Update - Notification of buy-back - ORI  6  pages  18.4KB
PLY,21/07/2025  8:27 am,,Unaudited FY25 Result  2  pages  664.0KB
LLM,21/07/2025  8:26 am,,Loyal and Dr. Simon Beams to Unlock Highway Reward Potential  9  pages  588.5KB
BGT,21/07/2025  8:26 am,Â,Application for quotation of securities - BGT  6  pages  18.1KB
AMI,21/07/2025  8:26 am,,Quarterly Activities Report - June 2025  16  pages  1.1MB
BHM,21/07/2025  8:26 am,Â,Completion of BHM Listing & Drilling Underway at Pinnacles  5  pages  1.4MB
M3M,21/07/2025  8:26 am,,Quarterly Activities/Appendix 5B Cash Flow Report  11  pages  1.1MB
BGT,21/07/2025  8:26 am,Â,Notification of cessation of securities - BGT  4  pages  14.5KB
TYP,21/07/2025  8:26 am,,Patient recruitment for world first TRP-8803 trial underway  3  pages  299.5KB
NPM,21/07/2025  8:26 am,,Quarterly Activities and Cashflow Reports  14  pages  1.2MB
TOP,21/07/2025  8:26 am,Â,Update - Notification of buy-back - TOP  6  pages  18.5KB
ASM,21/07/2025  8:26 am,,Share Purchase Plan closes substantially oversubscribed  2  pages  204.8KB
NYR,21/07/2025  8:26 am,,Final Phase I Clinical Trial Patients Dosed and Discharged  4  pages  306.4KB
A1M,21/07/2025  8:26 am,,June Quarterly Report  31  pages  5.2MB
OMA,21/07/2025  8:26 am,,$7.3 Million Boost to Balance Sheet as FY23 R&D Refund Rec'd  2  pages  233.0KB
DES,21/07/2025  8:25 am,,8m @ 18g/t Au from surface at Tole  40  pages  3.9MB
FTL,21/07/2025  8:25 am,,Exploration Commences at High-Grade Excelsior Gold Project  8  pages  1.3MB
ASK,21/07/2025  8:25 am,,Revised Non-binding Indicative Proposal  1  page  111.7KB
THB,21/07/2025  8:25 am,,More Stand-Out High Grade Gold Results At Kookabookra  19  pages  2.4MB
LM8,21/07/2025  8:25 am,,Lunnon Metals' Nickel Scoping Study Results  115  pages  8.3MB
CRS,21/07/2025  8:25 am,,Exceptional High-Grade Intercepts at Island Gold Project  22  pages  2.6MB
PRN,21/07/2025  8:25 am,,FY25 free cash flow exceeds guidance  1  page  235.6KB
DMG,21/07/2025  8:25 am,,Board Changes and Update on Loans  1  page  288.7KB
SRI,21/07/2025  8:24 am,,RC Gold Drilling Program Completed in South Australia  5  pages  542.0KB
AYU,21/07/2025  8:24 am,,Australian Unity agrees to buy Plena Healthcare  2  pages  95.8KB
DYL,21/07/2025  8:24 am,Â,Tumas Project Development Update - Positive Progress  12  pages  1.6MB
NFL,21/07/2025  8:24 am,,Carmen Copper Project Drilling Permit Granted  3  pages  318.7KB
PTN,21/07/2025  8:24 am,,Highgrade Uranium Mineralisation Confirmed at Thunderball  36  pages  4.5MB
GMN,21/07/2025  8:24 am,,Exploration Target defined at Irajuba  27  pages  2.9MB
LKO,21/07/2025  8:24 am,Â,Rig Establishment Underway for On-time Drilling of Wombat-5  5  pages  1.0MB
WC8,21/07/2025  8:24 am,,METALLURGICAL DRILLING RETURNS 87M AT 1.32% Li2O  17  pages  1.3MB
WA8,21/07/2025  8:24 am,,"Further Wide, High-Grade Gold Intervals at Ricciardo  17  pages  4.7MB"
KOB,21/07/2025  8:24 am,Â,Virtual Uranium Conference Presentation  27  pages  8.5MB
PNR,21/07/2025  8:24 am,,Quarterly Activities/Appendix 5B Cash Flow Report  31  pages  6.4MB
RRL,21/07/2025  8:23 am,Â,Corporate Presentation July 2025  34  pages  8.7MB
RRL,21/07/2025  8:23 am,,Quarterly Activities Report  13  pages  1.5MB
GSN,21/07/2025  8:23 am,,SALE OF MINING LICENCE FOR UP TO A$9M  4  pages  994.2KB
RRL,21/07/2025  8:23 am,,GSN: SALE OF MINING LICENCE FOR UP TO A$9M  4  pages  994.2KB
WGX,21/07/2025  8:23 am,Â,Investor Update Webcast - June 2025 Quarter  1  page  286.6KB
TRM,21/07/2025  8:23 am,,Quarterly Activities/Appendix 5B Cash Flow Report  17  pages  2.7MB
RXL,21/07/2025  8:23 am,,Underground Resources Increased to 2.1Moz  30  pages  2.1MB
IMC,21/07/2025  8:23 am,Â,Notice under section 708A  1  page  191.9KB
IMC,21/07/2025  8:22 am,Â,Application for quotation of securities - IMC  5  pages  16.5KB
DY6,21/07/2025  8:22 am,,Further Expansion of Central Rutile Project  5  pages  1.0MB
NVU,21/07/2025  8:22 am,Â,Application for quotation of securities - NVU  5  pages  16.9KB
NVU,21/07/2025  8:22 am,Â,Application for quotation of securities - NVU  6  pages  18.4KB
NVU,21/07/2025  8:22 am,Â,"Strategic Capital Raise, Options Exercise & Cleansing  2  pages  216.1KB"
NWS,21/07/2025  8:22 am,Â,Notification of cessation of securities - NWS  4  pages  14.6KB
NWS,21/07/2025  8:22 am,Â,Notification of cessation of securities - NWS  4  pages  14.6KB
NVA,21/07/2025  8:22 am,Â,Change in substantial holding  6  pages  495.3KB
LSF,21/07/2025  8:22 am,Â,Net Tangible Asset Backing  1  page  103.4KB
RIO,21/07/2025  8:22 am,Â,Becoming a substantial holder  23  pages  2.4MB
TCL,21/07/2025  8:21 am,Â,Change in substantial holding  95  pages  1.8MB
NDO,21/07/2025  8:21 am,Â,Update - Notification of buy-back - NDO  6  pages  18.2KB
TNE,21/07/2025  8:21 am,Â,Becoming a substantial holder  20  pages  1.3MB
DNL,21/07/2025  8:21 am,Â,Update - Notification of buy-back - DNL  6  pages  18.4KB
MSB,21/07/2025  8:21 am,Â,Ceasing to be a substantial holder  28  pages  1.8MB
LIC,21/07/2025  8:21 am,Â,Change in substantial holding  28  pages  1.8MB
FRB,21/07/2025  8:21 am,,Firebird Secures Key LMFP Patents Strengthening Global IP  7  pages  478.6KB
NWC,21/07/2025  8:21 am,Â,Completion of Despatch of CAML Bidder's Statement  2  pages  263.4KB
TR2,21/07/2025  8:21 am,Â,Commencement of ASX Trading  4  pages  508.1KB
ARI,21/07/2025  8:21 am,Â,Application for quotation of securities - ARI  6  pages  19.0KB
ARI,21/07/2025  8:21 am,Â,Application for quotation of securities - ARI  6  pages  18.3KB
GC1,21/07/2025  8:21 am,Â,NTA Estimate - 17 July 2025  1  page  118.0KB
KGD,21/07/2025  8:20 am,,Exploration Commences in Malawi - Critical Minerals Project  4  pages  1.3MB
AUC,21/07/2025  8:19 am,,Quarterly Activities/Appendix 5B Cash Flow Report  42  pages  4.7MB
PGD,21/07/2025  8:19 am,,High Grade Channel Iron Ore Discovery  14  pages  2.1MB
KNB,21/07/2025  8:19 am,,Quarterly Activities/Appendix 5B Cash Flow Report  22  pages  3.7MB
KI1,21/07/2025  8:15 am,Â,Kingfisher Trust 2019-1 Investor Report  13  pages  479.2KB
IKE,21/07/2025  7:49 am,Â,Application for quotation of securities - IKE  5  pages  16.9KB
CEN,21/07/2025  7:30 am,,June Operating Report  9  pages  1.5MB
