ASX Code,Date,Price sens.,Headline
MWY,01/03/2024  8:27 AM,,Initial Director's Interest - Andrew Preece  2  pages  182.6KB
NEM,01/03/2024  8:27 AM,,NEM - 2023 Annual Report  1  page  48.6KB
AMP,01/03/2024  8:26 AM,,Redemption of Internal Notes issued by AMP Bank to AMP Ltd  1  page  153.6KB
NXD,01/03/2024  8:26 AM,,Ceasing to be a substantial holder - Jencay  2  pages  191.3KB
ARA,01/03/2024  8:26 AM,,Update - Notification of buy-back - ARA  5  pages  16.0KB
SUL,01/03/2024  8:26 AM,,Change of Auditor  1  page  192.2KB
CEH,01/03/2024  8:26 AM,,Update - Notification of buy-back - CEH  6  pages  18.3KB
OFX,01/03/2024  8:26 AM,,Update - Notification of buy-back - OFX  6  pages  18.3KB
NXD,01/03/2024  8:26 AM,,Change of Director's Interest Notice - C O'Connor  3  pages  156.2KB
KSN,01/03/2024  8:26 AM,,Half Yearly Report and Accounts  28  pages  4.1MB
TRS,01/03/2024  8:26 AM,,Update - Notification of buy-back - TRS  6  pages  18.3KB
EMM,01/03/2024  8:26 AM,,Quarterly Portfolio Disclosure  1  page  179.9KB
NEC,01/03/2024  8:26 AM,,Update - Notification of buy-back - NEC  6  pages  18.3KB
EMN,01/03/2024  8:25 AM,,Results of Annual General & Special Meeting of Shareholders  4  pages  182.8KB
LSF,01/03/2024  8:25 AM,,Net Tangible Asset Backing  1  page  219.1KB
VR8,01/03/2024  8:25 AM,,Formalisation of Executive Chairman employment contract  2  pages  291.5KB
WBC,01/03/2024  8:25 AM,,Update - Notification of buy-back - WBC  6  pages  18.3KB
UCM,01/03/2024  8:25 AM,,Results of Rights Issue  1  page  97.3KB
TOP,01/03/2024  8:25 AM,,Update - Notification of buy-back - TOP  6  pages  18.5KB
BC8,01/03/2024  8:25 AM,,Belvedere Lookalike at Grey Goose  16  pages  15.5MB
FPC,01/03/2024  8:25 AM,,Update - Notification of buy-back - FPC  6  pages  18.3KB
ADT,01/03/2024  8:24 AM,,Notification of cessation of securities - ADT  4  pages  14.9KB
FPC,01/03/2024  8:24 AM,,Half Year Results Commentary  1  page  150.2KB
COS,01/03/2024  8:24 AM,,Change of Company Secretary  1  page  186.4KB
WZR,01/03/2024  8:24 AM,,WZR Appoints Chief Financial Officer  2  pages  204.0KB
PRN,01/03/2024  8:24 AM,,Update - Notification of buy-back - PRN  6  pages  18.5KB
JGH,01/03/2024  8:23 AM,,Change of Share Registry Details  1  page  105.3KB
GPT,01/03/2024  8:23 AM,,Change in substantial holding  67  pages  1.8MB
FIN,01/03/2024  8:23 AM,,Change of Share Registry Details  1  page  232.6KB
ABE,01/03/2024  8:23 AM,,Half Yearly Report and Accounts  30  pages  1.2MB
MPK,01/03/2024  8:23 AM,,Release of Securities from Escrow  1  page  185.8KB
AMN,01/03/2024  8:23 AM,,Mackay Potash Project Process Engineering Update - Amended  10  pages  566.4KB
PPS,01/03/2024  8:22 AM,,Update - Notification of buy-back - PPS  6  pages  18.4KB
HBR,01/03/2024  8:22 AM,,Quarterly Portfolio Disclosure  2  pages  166.9KB
WBT,01/03/2024  8:22 AM,,Weebit Nano retail investor briefings  2  pages  240.7KB
ARA,01/03/2024  8:22 AM,,On-Market Buy-Back Facility Extended  1  page  147.7KB
DXB,01/03/2024  8:22 AM,,Application for quotation of securities - DXB  6  pages  18.4KB
PGC,01/03/2024  8:22 AM,,Appendix 4D and Half Year Report  33  pages  2.1MB
TSK,01/03/2024  8:22 AM,,Change of Company Secretary  1  page  183.0KB
IMC,01/03/2024  8:22 AM,,Change in substantial holding  5  pages  1.6MB
RIN,01/03/2024  8:22 AM,,Quarterly Portfolio Disclosure  1  page  179.4KB
EMN,01/03/2024  8:22 AM,,Notification of cessation of securities - EMN  4  pages  14.8KB
TIE,01/03/2024  8:22 AM,,Ceasing to be a substantial holder from MUFG  7  pages  830.7KB
HXG,01/03/2024  8:22 AM,,WAH2 Key Terms Agreement  2  pages  225.4KB
EIN,01/03/2024  8:22 AM,,Quarterly Portfolio Disclosure  1  page  179.8KB
FPR,01/03/2024  8:22 AM,,Update - Notification of buy-back - FPR  6  pages  18.5KB
SML,01/03/2024  8:21 AM,,Quarterly Portfolio Disclosure  1  page  158.1KB
MWY,01/03/2024  8:21 AM,,Appointment of Non-Executive Director  1  page  87.7KB
LM8,01/03/2024  8:21 AM,,Half Yearly Financial Report - 31 December 2023  31  pages  3.9MB
AQD,01/03/2024  8:21 AM,,Change of Share Registry Details  1  page  137.5KB
EMV,01/03/2024  8:21 AM,,Cleansing Notice  1  page  164.7KB
PFP,01/03/2024  8:21 AM,,Share Purchase Plan  2  pages  194.6KB
AVH,01/03/2024  8:21 AM,,AVITA Medical Announces FDA Resumes Review of RECELL GO  2  pages  146.7KB
EMV,01/03/2024  8:21 AM,,Notification of cessation of securities - EMV  4  pages  14.9KB
MLS,01/03/2024  8:21 AM,,"Investor Presentation for PDAC Convention, Toronto, Canada  18  pages  2.2MB"
ENV,01/03/2024  8:21 AM,,Enova commences due diligence at CODA project Brazil  6  pages  1.0MB
EMV,01/03/2024  8:21 AM,,Application for quotation of securities - EMV  7  pages  21.7KB
NIB,01/03/2024  8:20 AM,,Annual Report to shareholders 2023  194  pages  10.8MB
BFC,01/03/2024  8:20 AM,,H1 FY24 Results  3  pages  303.6KB
NKL,01/03/2024  8:20 AM,,Half Yearly Report and Accounts  18  pages  763.0KB
ALU,01/03/2024  8:20 AM,,Becoming a substantial holder  42  pages  411.2KB
ACL,01/03/2024  8:20 AM,,Ceasing to be a substantial holder  3  pages  178.2KB
CC9,01/03/2024  8:20 AM,,Black Mountain Project Land Position Expanded  5  pages  997.2KB
BFC,01/03/2024  8:20 AM,,Appendix 4D and FY24 Half-Year Financial Statements  27  pages  2.0MB
OXT,01/03/2024  8:20 AM,,Final directors interest notice  3  pages  226.7KB
OXT,01/03/2024  8:19 AM,,Resignation of director and Strategic Review update  2  pages  189.3KB
EMV,01/03/2024  8:19 AM,,Application for quotation of securities - EMV  6  pages  18.4KB
MSG,01/03/2024  8:19 AM,,Half Year Report and Appendix 4D to 31 December 2023  32  pages  6.5MB
NTL,01/03/2024  8:00 AM,,Change in substantial holding - H Brown  1  page  74.6KB
FSF,01/03/2024  7:51 AM,,Monthly Allotment / Redemption Notice  1  page  169.9KB
SKT,01/03/2024  7:42 AM,,Ongoing Disclosure Notice - Sophie Moloney  2  pages  181.1KB
CNU,01/03/2024  7:31 AM,,Ongoing Disclosure Notice - Mark Cross  2  pages  167.5KB
SM1,01/03/2024  7:30 AM,,Independent Director appointed  1  page  74.8KB
CNU,01/03/2024  7:30 AM,,Ongoing Disclosure Notice - Will Irving  2  pages  169.4KB
NZK,01/03/2024  7:30 AM,,NZK - Blue Endeavours - salmon farming in the open ocean  2  pages  190.1KB
BGP,01/03/2024  7:30 AM,,BGP Director Nomination Closing Date  1  page  70.5KB
SKT,01/03/2024  7:30 AM,,Notification of cessation of securities - SKT  4  pages  14.8KB
SKT,01/03/2024  7:30 AM,,Update - Notification of buy-back - SKT  6  pages  18.6KB
