ASX Code,Date,Price sens.,Headline
WR1,05/11/2025  8:30 am,,Adjoining Prospective Claims to Expand Adina Footprint  3  pages  1.4MB
AIZ,05/11/2025  8:30 am,Â,Notice of share buyback  2  pages  193.7KB
LGP,05/11/2025  8:30 am,Â,Investor Webinar Invitation  2  pages  399.5KB
GMG,05/11/2025  8:30 am,,Q1 FY26 Operational Update  7  pages  1.9MB
MI6,05/11/2025  8:30 am,,Drilling Extends Mineralisation at Depth & Along Strike  41  pages  3.7MB
TGF,05/11/2025  8:30 am,Â,Update - Notification of buy-back - TGF  6  pages  18.2KB
FPC,05/11/2025  8:30 am,Â,AGM Presentation  23  pages  1.1MB
LFS,05/11/2025  8:30 am,Â,Update - Notification of buy-back - LFSPA  6  pages  18.4KB
ANG,05/11/2025  8:30 am,,Revised FY26 Guidance and Business Update  3  pages  219.4KB
NWS,05/11/2025  8:30 am,Â,Definitive Additional Materials  5  pages  367.3KB
AGC,05/11/2025  8:30 am,,South Cobar Acquisition Completed - Exploration Underway  3  pages  431.3KB
BCN,05/11/2025  8:30 am,Â,Sale of Timor Leste Concessions  3  pages  591.9KB
TVN,05/11/2025  8:30 am,Â,BCN: Sale of Timor Leste Concessions  3  pages  591.9KB
AUI,05/11/2025  8:30 am,Â,Update - Notification of buy-back - AUI  6  pages  18.5KB
DUI,05/11/2025  8:30 am,Â,Update - Notification of buy-back - DUI  6  pages  18.5KB
BSL,05/11/2025  8:30 am,,Tania Archibald appointed to succeed Mark Vassella as MD&CEO  5  pages  142.1KB
CGF,05/11/2025  8:29 am,,APRA's proposed capital standards - market update  15  pages  460.8KB
PPE,05/11/2025  8:29 am,Â,Update - Notification of buy-back - PPE  6  pages  18.3KB
GEM,05/11/2025  8:29 am,Â,Update - Notification of buy-back - GEM  6  pages  18.2KB
CAA,05/11/2025  8:29 am,Â,Update - Notification of buy-back - CAA  6  pages  18.2KB
ANN,05/11/2025  8:29 am,Â,Update - Notification of buy-back - ANN  6  pages  18.3KB
ODY,05/11/2025  8:29 am,,Further Excellent Results from Drilling at Tuckanarra  15  pages  2.6MB
TYR,05/11/2025  8:29 am,,Appointment of Chief Executive Officer  4  pages  135.3KB
BXB,05/11/2025  8:29 am,Â,Update - Notification of buy-back - BXB  6  pages  18.5KB
CSC,05/11/2025  8:29 am,Â,Statement of CDIs on issue - CSC  3  pages  12.6KB
MDI,05/11/2025  8:29 am,Â,Update - Proposed issue of securities - MDI  9  pages  31.0KB
MDI,05/11/2025  8:28 am,Â,Update - Proposed issue of securities - MDI  5  pages  17.8KB
IMC,05/11/2025  8:28 am,Â,Change in substantial holding  5  pages  326.8KB
NGI,05/11/2025  8:28 am,Â,Ceasing to be a substantial holder  2  pages  310.0KB
SP3,05/11/2025  8:28 am,Â,Change in substantial holding - APPWAM Pty Ltd  3  pages  159.0KB
AM5,05/11/2025  8:28 am,,Drilling to commence at the Queens Gift Uranium project  5  pages  758.8KB
WCE,05/11/2025  8:28 am,,Native Silver Intercepted at Elizabeth Hill Silver Project  28  pages  16.1MB
BSN,05/11/2025  8:28 am,,Drilling contractors engaged for Sybella-Barkly targets  9  pages  1.8MB
GEN,05/11/2025  8:28 am,,Greg Lilleyman transitions to Executive Chair  3  pages  293.8KB
WDS,05/11/2025  8:27 am,,2025 Capital Markets Day  94  pages  7.6MB
OCT,05/11/2025  8:27 am,,High Grade Rock Chips Pre Drill Program at Sweeneys  11  pages  1.1MB
VAR,05/11/2025  8:27 am,Â,November Investor Presentation  42  pages  6.0MB
SUM,05/11/2025  8:27 am,Â,Application for quotation of securities - SUM  6  pages  18.3KB
SUM,05/11/2025  8:27 am,,Entitlement Offer Results and Notification of Shortfall  3  pages  568.2KB
SLA,05/11/2025  8:27 am,,Solara executes Bryah Basin Heritage Agreement  3  pages  535.1KB
SQX,05/11/2025  8:27 am,,High-Grade Gold up to 49.2g/t Confirmed at Red Bird Project  18  pages  2.0MB
SMM,05/11/2025  8:27 am,,"Multiple high-grade intercepts, including 18.3m @ 3.14% Cu  19  pages  1.6MB"
JLL,05/11/2025  8:27 am,,Drilling Underway at McDermitt Lithium Project  3  pages  518.7KB
SUN,05/11/2025  8:27 am,Â,Update - Notification of buy-back - SUN  6  pages  18.2KB
BMM,05/11/2025  8:26 am,,Plan of Operations Approved for Desert Star Project  5  pages  443.6KB
PTN,05/11/2025  8:26 am,,HG Gold Extensions Confirm Growth Potential at Mertondale  24  pages  3.4MB
THB,05/11/2025  8:26 am,Â,Exploration Commences at Rockvale Gold - Antimony Project  3  pages  1.0MB
KZR,05/11/2025  8:26 am,Â,Investor Presentation  19  pages  3.5MB
LEX,05/11/2025  8:26 am,,Lucky Strike Mine Approved Clearing Pathway for Operations  7  pages  1.2MB
KZR,05/11/2025  8:26 am,,Compelling Mt Olympus Scoping Study  105  pages  6.5MB
BC8,05/11/2025  8:26 am,,Upper Main Zone Continues to Deliver - Paulsens  13  pages  8.5MB
AWJ,05/11/2025  8:25 am,,"First Munda Gold Mine Sales at average A$6,130 an ounce  3  pages  569.9KB"
AUV,05/11/2025  8:25 am,,New Priority Gold Target Identified at Sheoak East  21  pages  1.3MB
WIN,05/11/2025  8:25 am,,Outstanding First Drill Results at Radio Gold Project  22  pages  3.1MB
5GG,05/11/2025  8:25 am,Â,Change of Director's Interest Notice - S.Cornish  3  pages  301.8KB
ALB,05/11/2025  8:25 am,,Gradient Array IP Survey Commences at Yandal West  2  pages  531.8KB
AQN,05/11/2025  8:25 am,Â,Non-Executive Director Appointment  2  pages  86.3KB
RXL,05/11/2025  8:24 am,,First Cut Scheduled at Youanmi  13  pages  2.8MB
VAU,05/11/2025  8:24 am,Â,Investor Presentation - Macquarie WA Forum  37  pages  5.1MB
VAU,05/11/2025  8:24 am,Â,KoTH Open Pit to transition to owner mining  2  pages  134.3KB
AEL,05/11/2025  8:24 am,Â,Becoming a substantial holder from MUFG  26  pages  1.2MB
LEG,05/11/2025  8:24 am,,Legend Expands Footprint at Pinnacle Well Project  5  pages  2.0MB
CU6,05/11/2025  8:24 am,Â,Change in substantial holding  18  pages  969.3KB
GSM,05/11/2025  8:23 am,Â,Appointment of Exploration Manager  1  page  175.2KB
STW,05/11/2025  8:23 am,Â,Daily Fund Update  9  pages  182.5KB
SLF,05/11/2025  8:23 am,Â,Daily Fund Update  4  pages  77.2KB
SFY,05/11/2025  8:23 am,Â,Daily Fund Update  4  pages  79.8KB
ASP,05/11/2025  8:23 am,,Aspermont partners with Timor-Leste  2  pages  257.6KB
MPL,05/11/2025  7:55 am,,Medibank to acquire Better Medical  2  pages  226.1KB
CNU,05/11/2025  7:51 am,Â,Chorus annual shareholders meeting  53  pages  7.8MB
DOW,05/11/2025  7:41 am,Â,Update - Notification of buy-back - DOW  6  pages  18.2KB
ERD,05/11/2025  7:30 am,Â,EROAD H1 FY26 Financial Results and Conference Call Date  1  page  69.6KB
